3295205725,345451341,三块木头头,紧赶慢赶总算是把《海底》的完整版给你们整出来了，要是不好听别骂我，毕竟是你们让我唱的，不好听哭着也得给我听完！（溜走）,52691,5月4日 04:17
3306608062,1963412494,-心悦君兮--君不知-,不嫁爸爸那样的男人不做妈妈那样的女人不养自己这样的儿女,38822,5月12日 12:39
3330469293,345451341,三块木头头,很多人不知道怎么听新版，清理一下缓存就可以啦，如果之前下载了就先删掉再清缓存，不用担心旧版本听不了，电台有～,19205,6月1日 18:45
3316361098,1863374087,和若曦吹晚风,怕遇到像爸爸这样的人怕过上妈妈这样的生活怕生个像我一样的孩子,13242,5月20日 10:23
3298432801,1306763842,我太可爱了ww,“长大真的很没意思，连快乐都裹着一层苦。”,13087,5月6日 11:15
3297508874,557696506,姜河的顾辛烈-20180616,像鲸沉于海底温柔呼吸，痴极嗔极。 像等了多年的老城门，茕茕孑立。 像鲸鱼缺氧于六千四百米的深海，乐此不疲。 像臣民等待王朝复辟，遥遥无期。 柳动蝉鸣，日落潮汐，不能自己。 像云漂泊九万里，不曾歇息。 像太阳升起后的灿烂，不曾停歇。 像江河奔流到海不复还，夜以继日。,9202,5月5日 17:41
3298658854,1394047735,夫银1803,一看到歌词就让我想到了南康白起，那个夜晚他奋不顾身的就跳下了湘江，尸身漂了十五天，从长沙到岳阳。他写下《等他到三十五岁》但自己却没有等到那一天，忘不了他说的那句：我不无辜，可是我也没有罪。我只不过是喜欢着一个人。,8157,5月6日 14:32
3400948505,568780783,不去德国不改昵称,现在歌手取名都这么随意了嘛？ 一支榴莲，三块木头，四只烤翅,5861,8月1日 14:47
3369574180,1691957861,世間胭儿,沉底大巴里的21位高考生，一路走好……,4866,7月8日 07:28
3404727247,419145830,---404---,一支榴莲其实是一直留恋啊…,3909,8月4日 00:12
3466886614,1890886698,chuya_da,我今年高一，但是我的好友却永远留在了初三。她是那时我们班的班长。高挑挑的个儿，成绩很好，长的好看，声音也好听，也爱笑，总看到她笑着跟我打招呼。但是，在中考还有12天的时候，我却再也看不到她的笑容，也听不见她轻轻地叫我的名字了。她呀，从5楼跳下来了，躺在地上，穿着校服，带着口罩。,2876,10月2日 09:23
3296802474,326565209,山夏穹清,你应该穿个隐形肩带的,2479,5月5日 08:51
3428803875,2099039042,柠柒会说相声,戴上耳机：人间不值得摘下耳机：妈中午吃啥,2343,8月21日 19:16
3447928032,3276562158,霸齊LoL,老师问一个男孩想做一个什么男孩说“我想当一个女孩子”全班哄堂大笑只有同桌的那个男孩子在一旁红了眼眶。,2314,9月8日 20:35
3314014340,2003197957,三无少女山山久,很奇怪 已经过去两天叻 仍然能在发梢闻到他的香水气怎么也洗不掉特有的石榴花味道不合时宜的问我“如果早点遇到我，你会不会喜欢上我” 明知道浮水相逢海浪清晰血迹，妄想温暖你,2175,5月18日 11:18
5179407283,1610413820,森森的阿良良,记好清楚梦里遇见的嘛,0,14分钟前
5179416932,3418427838,汽水真的很好喝ye,有的时候吧， 你会想主动靠近她， 给自己一个近距离的接触。 你渴望自习，你愿意早早地，或许，是傻傻地跑过去占到一个双人座， 可是她却在社交平台上说， “我喜欢独处的感觉” 那一刻， 我觉得我离她好远， 这最最最普通的朋友都能做到， 我为什么不行？ 又有一次， 我翻了她的朋友圈，,1,48分钟前
5179342704,3418427838,汽水真的很好喝ye,我不知道怎么说， 我会把她放在顶置， 把她想做的事情放在心头， 我想着她每一个想要，每一个计划， 我想陪她实现每一个小plan， 可有的时候我更清楚什么更值得先做， 我调整顺序，可我不会忘了她的小愿望,0,51分钟前
5179431770,3418427838,汽水真的很好喝ye,“所有值得期待的事，都是双向努力的结果” 遇见了不错的女孩， 这一次， 也打算拼尽全力， 我从未希望她活成我心里的模板， 我只希望她是有自己的灵魂的人。 那一刻， 我坠入了， 有一刻， 我犹豫了， 在最后一刻， 我带着不甘打算放弃了。 因为， 我觉得， 我所做的这些似乎没有拉近,1,54分钟前
5179343608,1545130091,气泡氧氧子,你很漂亮的。不要怀疑自己。笑一笑吧。,0,00:22
5179386132,1545130091,气泡氧氧子,我会一直一直想你。我以后会去海边，我会给你写信，我会想象你笑起来的样子。,0,00:22
5179416796,1545130091,气泡氧氧子,对不起。答应你不难过的。,0,00:21
5179329562,3378323195,Reidouhana,高风亮节,0,00:17
5179340214,1682275483,情深不寿181125,害,0,00:02
5179342998,1422288537,_有在好好生活,你不对劲,0,昨天23:39
5179259644,602378858,浅笑淡陌伤,兄弟，醒一醒，不要做梦,0,昨天23:32
5179255580,3945455659,余儿ta是撒野女孩,真的,1,昨天23:19
5179308019,3956726344,乐乐_G91,抱抱，没事的，还有我哦,1,昨天23:17
5179258492,1441872363,娇娇宝_,对没错我是被吓到了,0,昨天23:16
5179322869,1441872363,娇娇宝_,我刚听第一秒直接给我惊了一下，我听的歌单是温柔男声翻唱，，，我裂开了,0,昨天23:16
5179290905,133452067,爆胎小鲤鱼,我变得过于敏感 总是能从一些话中找到最刺痛我的字眼 然后无限放大 借此来让自己痛苦 割腕也好 吞咽药也好 咬自己打自己掐自己 对自己身体的折磨都是我内心痛苦和绝望的映射 我恨我自己 我恨不得下一秒就永远消失在这个世界上,1,昨天22:52
5179272967,1842752632,深拥不及永伴ai,跳楼一般都是容易头朝地吧,0,昨天22:49
5179214356,3876213292,不饱和键_,洗衣液溅到眼睛里（确信）,0,昨天22:12
5179214194,1660951432,桃笙姑娘,“宝贝记得打卡哦”“好的好的我会记得的”我赶紧拿出我的手机慌张的点开签到，心里暗自欢喜差点忘记。多亏她们提醒,0,昨天21:57
5179231803,1349821584,泠然出尘幽韵,我想要鲸鱼地球这个图片，有大佬么,0,昨天21:36
