5178861202,476211813,景晰晰晰晰晰晰晰晰,很微博的一句话[西西机智],1,昨天13:22
5178802247,317613361,圆圆的圆123,女性是被塑造的。把男人放在女性的立场，他就会变成女性。,2,昨天11:48
5178741526,517266219,慎FUG,还记得是高考那一年看的这个剧，现在已经是研究生啦，时间过得好快。,3,昨天10:59
5178638081,3399449273,和我开启心动模式_,留一个,0,昨天01:15
5178137404,290854837,金并X木X,太子妃升职记,0,12月9日 15:36
5177865054,356397872,饮雪_,我的也是,1,12月9日 00:45
5177887827,356397872,饮雪_,快五年了 高三那段日子的快乐,1,12月9日 00:44
5177557212,296336319,Vampire-LDF,我觉得崔子格的现场比金玟岐好呢,0,12月8日 19:43
5177539771,544156215,永安_念,嗯 确实是我当时自制力不好 其实就是有侥幸心理自我放纵 摔过一次后的那种痛我铭记于心 所以后来我一直警告自己 现在我也在一所非常不错的大学读书 哈哈没想到很多年以前写的评论还有人回复 嗯 总之谢谢你,0,12月8日 17:57
5177425800,1894182484,沈邶川,和这没关系，删了叭姐妹，去往生吟底下留言吧，别ky辽,0,12月8日 14:27
5177176974,571045582,Leo_meteor,太子妃升职记,0,12月8日 11:03
5176861281,3384214601,喜欢听音乐的_菲菲,苦乐喜悲，在这里尽致淋漓,1,12月7日 22:54
5176902053,3384214601,喜欢听音乐的_菲菲,想去看看将军在上，不知道要不要会员，我穷啊[多多大哭],0,12月7日 22:52
5176819598,3384214601,喜欢听音乐的_菲菲,没看过可是听过她们的故事，据说是隐晦的百合？,0,12月7日 22:51
5176866201,3384214601,喜欢听音乐的_菲菲,烂了吗？我不知道，本来觉得男的变女穿越跟另一个男的谈恋爱，这题材挺新颖的，反正我是第一次看到这种，就去看看，没想到还是老套路，后面就没有看了,0,12月7日 22:50
5176880065,3384214601,喜欢听音乐的_菲菲,太对了哈哈哈哈哈,0,12月7日 22:41
5176897927,3384214601,喜欢听音乐的_菲菲,我也是，刚开始知道的时候还惊呆了有木有,0,12月7日 22:39
5176599656,337546344,monogyna,韩版马上也要播了，回来回忆一下青春，当年还在上高中还是期末，一转眼大学都毕业了,2,12月7日 19:02
5176394759,418085349,Pinocehio,都想哭了,1,12月7日 09:47
5176113314,1711877782,天线宝宝的天线哦,五年了 时间过的太快了 当年我还是个无忧无虑的大二学生 现在我是个找不到工作的研究生[多多捂脸],3,12月6日 23:21
