5174031754,3961624550,劉磊ll_liu,留着蒙古族的血 却不会说蒙古话 最大的遗憾,1,12月4日 18:44
5173146735,1350529961,呼齐图巴尔-秦北汉,这是民族原生态风格，非常好的版本！简单而直接，直击心灵。原生态艺术品味远远高于流行音乐。,1,12月3日 16:54
3463451470,1882190418,五锁moon,我唯一的遗憾是只有一次生命可以献给我的祖国——黑豹、榴莲,1,9月27日 23:46
3402576056,612051721,名字你这么说,汉人？,0,8月2日 16:37
3228795191,1476919884,昭和丶,碰到另一个十年前的了！抱紧友军！,2,3月28日 02:39
3228808966,1476919884,昭和丶,这歌听了十年了。,4,3月28日 02:38
3167577300,296788336,无患小王子,不知道这首歌为什么没火，特别好听的一首蒙古歌曲！,6,2月22日 21:42
3159481001,87246443,-碓冰拓海-,十年过去了，现在听还是那么有味道,5,2月17日 22:21
2068854394,313043169,MMMandax,999+,2,1月1日 11:40
