3377918511,269503865,爱音乐的万人迷,爱了10年的女孩，经历了各种磨难，终于在一起了，希望这次也只是对我们的一个考验,63467,7月15日 10:35
3345434422,1479675252,未月十八_syn,原来王鹤棣的流星花园也是两年前的了啊,8000,6月16日 13:44
3369272736,1827277482,卍冇心卍,谁又知道魏奇奇是青你2的选手[多多难过],5147,7月7日 22:59
3382455148,1925500988,欣辞O,九年级上册语文书，134页 21行 最后四个字我想听 说给我听吧……,4248,7月18日 18:24
5179404962,1536760887,哲子奥奥利给,回来吧我还在等你,0,53分钟前
5179299649,551743446,_卷耳laina,真的不明白，为什么你一边说喜欢我期待和我在一起的那天，一边又不拒绝其他女孩子向你示好呢？难道是你温柔讲礼貌会做人么？这就是你说的喜欢？,0,00:01
5179310259,2108773390,扑小轩怀里,今年夏天@愿l_x,0,昨天23:46
5179301185,1467967575,Enemy--楊,希望我的男孩平平安安 万事顺意,0,昨天23:20
5179280920,3928849405,一头很肥很喜欢学习的猪,哦,0,昨天22:47
5179245129,3922996289,今天你看晚霞了么,等一个男生等了两年 却得不到任何回应。,0,昨天22:21
5179232182,2096417216,困死滴滴滴,奥利给！,0,昨天22:20
5179192419,1698832467,彭于晏未公开女友_GOWS,结束啦他拒绝我了！,0,昨天22:05
5179186271,2074248321,五歲慧,会更好的,0,昨天21:54
5179056136,1624970604,喆哥天下第一帅,男生说不可能就真的不可能了吗,0,昨天19:18
5179003475,3336607336,丹丹_Zq_,没官宣耶,0,昨天18:05
5178993234,476553649,你不是袁小鱼,没事，不着急，过两天再说嘛，,0,昨天17:22
5179005940,269747473,遇J秋天,那场秀我还看了好几遍,0,昨天16:40
5178901331,96129282,廾匸_ZyxW,沾沾喜气,0,昨天14:36
5178842364,1857509126,丨請人,会吧，至少我就是,0,昨天13:33
5178754580,1784769662,Unlashfdcd,哦哦开开心心喔喔哦哦哦粉我摸门禁卡与理论de,0,昨天11:41
5178806148,1784769662,Unlashfdcd,哦组图同学拉粑粑and得得得得粉嫩磨的粉末喇叭测得了旅途中。,0,昨天11:41
5178754185,443644751,一心只为赚钱,我才是最新的告诉你们个秘密：好没人看见吧,0,昨天10:18
5178512162,258667184,老阳不喝酒,圣诞节到了用计算器47000除以188，然后你会看到满屏的圣诞树圣诞快乐啊各位小朋友🤭,0,12月9日 23:07
5178437733,314986549,lallllalllooo,。,0,12月9日 22:54
