3123406326,1591117626,涵碧萝-,我纹身是想说，我脱下衣服都比你贵,10331,1月20日 11:32
3122294147,453891751,你从不会孤独,与其苟延残喘不如纵情燃烧,3098,1月19日 00:28
3190382734,1472373205,iDiGiH-99,你的压力来源于无法自律，只是假装努力，现状跟不上内心欲望，所以你焦虑又恐慌,2501,3月6日 20:55
3246456429,109192384,我斑称你为最强_,color than me? 比我色??,2456,4月6日 13:15
3242663856,1854921253,鸳沉,今天是清明节，有没有人因为游戏不能玩，视频全都是新闻才来听音乐🙃,2286,4月4日 08:16
3351530231,3332054777,是吴乌乌啊,她穿几千的匡威你叫她小姐姐，我戴几万的牙套你叫我钢牙妹？！,2204,6月22日 11:16
3289587336,529286579,Big_yaae,大家有没有注意到，gta5脱衣舞酒吧经常放这首歌,1252,4月30日 13:49
3240875927,418357668,阿橘同学,王者日记，3月24日，阴对方米莱狄生好多孩子，我方米莱狄像做了绝育,1077,4月3日 11:40
5179929985,380026987,Mandy廸,gta,0,5分钟前
5179388212,1513564813,MyGrand欧罗德公爵,什么也没有发生，只能这样了,0,00:43
5179384321,1513564813,MyGrand欧罗德公爵,今天是最后一天了，昨天下午匆匆对视笑了之后就没有交集了，我们是不是注定只有擦肩而过啊,0,00:42
5179372093,1505351130,韦德weda,感谢,0,00:11
5179336760,1407991804,飞奔的拉条子0991,我2天换一套衣服，一个月不重样子，你换纹身贴嘛？,0,昨天23:14
5179144567,2119409932,日向女孩,她宁愿听他恶意嘲讽，也不听我善意讲解,0,昨天21:34
5179055172,3422672932,MC阿祖拉_凹凸世界凯莉呀,尽管你们封住我的嘴，摧毁我的心灵！将我打入地狱！纵使这样我还是拿出我的笔！我坚信我的笔如刀！捅破你的谎言！纵使你有锁喉的毒药！将我的声音摧毁！我也不会停下我的笔！我将记录下这一切的不公！尽管我们身后已无莫斯科！但是我们还要继续战斗下去！心火不息创作不死！敬文学！敬热爱！敬自由！,1,昨天19:26
5179035813,3253772279,Parisml,高考、英语已交卷听力答案：cpdd cpdd cpdd多选答案：cpdd cpdd cpdd单选答案：cpdd cpdd cpdd完形答案：cpdd cpdd cpdd,0,昨天17:49
5178552388,1513564813,MyGrand欧罗德公爵,4天过去了，为什么总是感觉那么疏离呢，给自己定的期限要到了，要是再没办法靠近的话，我会尽量抽身断掉念想的,0,昨天00:04
5178422349,1654606181,pemethod,比我酷,1,12月9日 22:03
5178345435,354349739,陪cxl长大-,英语老师在厕所痛哭,0,12月9日 21:03
5178301010,400651221,IKEA的小鲨鱼,尊重先烈哦，适当严肃有必要的呀,0,12月9日 19:34
5178287217,400651221,IKEA的小鲨鱼,有点无聊了吧,0,12月9日 19:32
5178223457,255389699,LengChenyo,我知道你想看我纹在二弟上的四十二章经！别以为我会上当！除非你先给我看看你小妹妹上纹的四十二章经上半部,0,12月9日 18:22
5178061070,613381811,我也就没关系,了,0,12月9日 12:12
5178014538,613381811,我也就没关系,怎么样,0,12月9日 12:12
5177499328,1944376679,爱吃郭老c的猕猴桃,这就是个文案而已什么金贵不金贵，您这是杠什么呢,0,12月8日 18:59
5177555004,1944376679,爱吃郭老c的猕猴桃,说金贵了干嘛呢您这是？,1,12月8日 18:58
5177545993,468147926,幸运的好奇小姐,（你不 认真回答，等于浪费你自己的时间） 5。 在数字8，9，10的旁边各写出一个歌曲的题目 .. （凭第一感觉） 6。最后，许一个愿望ba... 最近最希望发生的愿望，奇迹什么的... 许了愿望让我们看看这个游戏的结果吧。 首先在数字3旁边的名字，是你爱的人。 在数字7旁写下的是你喜欢，但不能实,0,12月8日 18:47
5177502270,468147926,幸运的好奇小姐,出现在脑海里的答案。 一次阅读一行.. 如果你先看了答案就没什么意思了。 1。首先从上到下（垂直），写出从1到10的数字 2。在数字1和2的旁边各写出一个数字（从1到10之间的一位数） 3。其次在数字3和7的旁边各写出一名异性的名字。 4。在数字4，5，6的旁边各写出一个名字..朋友，家人都可以....,0,12月8日 18:47
