73111440,54651276,周昊是个少年,这是我觉得勿忘心安最好听的版本 怎么评论这么少,11252,2016年2月22日
122970162,62666008,绿杨烟外晓寒轻-,他已经开始学会把技巧踩在脚下了 他的情感非常的丰沛 他开始深深的打动你 他开始逃离大家给他的一个偶像的光环（至今我都忘不了最后乐评人对他的评价,7374,2016年2月23日
6099410,22922471,-南风的风-,命运到最后，记得勿忘心安,3790,2014年11月21日
64865146,2714634,茶杯里的咖啡-,这首歌，知道他经历的人听起来会更有感触的吧，当时真的听得心里揪着疼，现在一切都好了就好,2733,2016年1月25日
71862448,102143725,曹强i,这个版本我听了不下于百遍，百听不厌，每每听到那段高音就越喜欢张杰，真是太享受了。,2619,2016年2月18日
286541751,270714014,去吧比奇,毕业后，我按照专业签了一份工作，大公司下，我在自己不喜欢的部门，不契合个性的工作，但我一直知道我想要的是什么，我一直在等待，知道今天，我接到了领导的转岗升迁电话，我知道我一直在等待，我一直没有忘记自己的内心，勿忘心安,2536,2017年1月13日
371134352,50730588,我记得笑,张杰应该算是后歌手时代唱功极好的歌星了，希望你们对他的黑只是调侃。虽然我也不是张杰的粉，但是希望大家少点喧嚣和戾气。,1988,2017年5月1日
68464721,62909261,一去十里相逢,终于有钱买版权了 还以为只买了第四季,1499,2016年2月6日
130417263,253994908,818糯米糕,张杰的现场确实棒,1302,2016年3月16日
630699003,318528902,洛漓塔,记得大一歌手比赛唱的这个，结果输给一个五音不全但脸蛋好看的妹子……shit~但又如何，老娘唱得开心就好😏,1123,2017年12月2日
64399640,51187466,你家男丁,so I dont care,988,2016年1月23日
128287295,252039600,平凡旋律,看他现场的视屏，高音时他整个人身体都在飞翔一样，赞！,891,2016年3月11日
63399286,41542211,ypyww,虽然后面处理不够好，然而live就是比录音室有不一样的感觉,711,2016年1月20日
128645331,251781068,八一九二,这是我最喜欢的一首歌，特别喜欢他后面的高音。希望我也会有I don't care的时候，最喜欢张杰的歌，最爱这首歌，记得勿忘心安,679,2016年3月12日
1209609739,382846098,明舞Sophia,从初二时因为这首歌开始关注张杰，看着张杰被黑，被嘲笑数年，直到参加我是歌手，我就知道，杰哥是个实力派，他用自己的歌声证明了自己。他坚持自己最初的选择，专注的唱歌，提高自己的水平。杰哥，茫茫人海里，能够选择你作为我的偶像，从而成为星星的一员是我的幸运! 考研加油!,373,2018年8月9日
