23193417,64988172,An_温柔,初三毕业晚会 闺蜜唱了这首歌 唱的很深情很甜很好听 作为英语科代表的她 发音很准 唱完后全班掌声雷鸣 同桌对我说 我好像爱上她了 而我 暗恋了他三年 准备考完试跟他说的 回家 大哭了一场 后来高中 听说他们在一起了 后来 又听说 分手了 而我 再也没出现过他们的世界,69239,2015年6月22日
7336596,42702133,HIlouxetine-,我就是burning，我是大b神,38855,2014年12月19日
191838088,290584022,好大一个菠萝呀,这首歌是一个男生推荐给我的，一个月后我才知道他喜欢我。他是一个有责任心，善良的人，可惜我们最后连手都未碰过，因为当时我喜欢的人是班花。。,32250,2016年8月1日
5601381,34517847,只听女声,这个私人fm太牛，推荐的歌曲很多都是以前常听的！,20147,2014年11月9日
6653961,42458793,兴趣广泛的普通人,大家好我是前前男友,16142,2014年12月3日
62634638,89897405,帐号已注销,卧槽，我说这么耳熟……我叹服你的技巧？,15346,2016年1月17日
140766241,41358822,帐号已注销,女生污点才可爱，男生内涵点才可爱，这无关淫荡，只是风情,11592,2016年4月12日
5363741,7242312,永远的日常,能说这是我听的第一首英文歌么,9445,2014年11月1日
4960153,36921744,大钊兄弟,听一次 哭一次 回忆一次,4816,2014年10月17日
1088682057,569587275,Ailiya_,今年17岁，凌晨四点半了，爸爸妈妈还在不停的吵架，打架，从我开始记事起到现在他们打架的画面深深刻在我的脑子里，我现在在被窝里发抖，听着这首歌，音量放最大，装睡，我不敢去劝他们，因为我越劝就会越激烈，我总是在想，为什么当初如此相爱的两个如今会这样互相伤害，如果你真的爱一个人一定要珍惜,4141,2018年4月18日
5385050,9115613,遗失的美好时光,从高二就听，就设置手机铃声，到现在已经五年了,4096,2014年11月1日
1332380587,287367747,寡人已阅,信息量有点大,3630,2018年12月20日
164700101,125208578,你可以叫我PC,以前宿舍里有一哥们用他手机放了这首歌（诺基亚6120c）那时觉得可高级了 他说这歌是他初恋介绍给他听的 可前段时间他和我的初恋结婚了 人生有时候就这么狗血,3442,2016年6月4日
21762876,69760661,与城安_,好歌千万不要当作闹钟铃声，切记！切记！切记！,3258,2015年6月12日
51323863,49325925,杨半仙,虽然ti5崩盘，大B还能征战ti6，别担心,2559,2015年12月4日
