1320783315,1493657875,叫我彭彭就行,当一个人能够影响你心情的时候说明你在乎了。当一个人能赚到你眼泪的时候。说明你投入了。当一个人能驾驭你情绪的时候，说明你沦陷了。能让你笑的人，未必能让你哭。但让你哭的人，一定还能让你笑。哄你开心的人，未必能深入你的内心。惹你伤心的人，一定是占据你的心灵能让你放下尊严的一定是你最爱的,11342,2018年12月7日
1320865650,250884709,王德卷,好好吃饭 好好睡觉,5010,2018年12月7日
1564415800,381610303,Nove3ber,我也曾在夜深人静时猛然惊醒 流着泪告诉自己不要想你,4609,2019年7月22日
1320815467,52157021,我穿了三件,我不在你身边的话，冷了也要记得穿三件哦！,2724,2018年12月7日
1320797987,83158427,AdamLangxc,一个人在外读书打拼，今天很冷，告诉自己多穿点衣服。几个月前，我为了梦想来到新的城市，你告诉我你一定会陪我，可是由于种种原因，最终分道扬镳，你也去了自己梦想的地方，开始一段新的生活。我为你如今的获得成就而自豪，可总会在夜深人静的时候，想到我们之前的点点滴滴。你那里冷吗？注意保暖。,2082,2018年12月7日
1320890886,347854990,二三Ninosan,想评论 但是听着歌 想到过去 就什么都说不出来了。,1913,2018年12月7日
1320974196,633019062,s王盔盔,一个有趣的灵魂胜过一副好看的皮囊！,1569,2018年12月7日
1320850968,312426736,橙大蕾蕾,怎么可以这么好听~,1523,2018年12月7日
1320875208,580175416,janejanelu,两年前，陪当时的男盆友一起看的血哥，如今已经结婚啦，宝宝也快降临了，所以这次Live很可惜，没办法去参加，希望下次还有机会去看血哥的现场。没有悲伤的故事 但是真的喜欢血哥唱歌，血哥加油，一切都会更好的。,1135,2018年12月7日
1320792326,78731046,乔伊永远不和别人分享食物,过去是你，未来还是你加油💪,666,2018年12月7日
1321070396,113467651,徜若是梦,2016年斗鱼嘉年华想见你一次，很早就买了嘉年华的票，可惜就在嘉年华前一天被车撞了一下，也不是很严重，就是脚肿了，但是还是坚持去了嘉年华。可惜人太多了，网也不好，在里面走了一天也没能见到你，朋友们都叫我回学校休息，所以很遗憾没能见到你。现在也没有时间和勇气抛下工作去看你的演唱会了。,632,2018年12月8日
1666160064,339142213,原来网易云可以有这么长的名字,你试过一天偷偷看一个人的资料无数次吗？,620,2019年10月27日
1323549170,355350066,乔儿儿儿儿儿,我的姐姐加油啊！！！,516,2018年12月10日
