31440349,19061101,H_U_I-EDM,我传的居然不通知一下。。。。。。没动力了。。。。,8314,2015年8月17日
131734576,39223337,是个小傲娇吖,这音乐是网易云今日推荐我听的,2982,2016年3月20日
56473133,66355298,Upark,everybody fucking jump,1579,2015年12月25日
321953653,87088620,白夜行902,不是我吹，2015知道不？一颗直径十公里的陨石直接冲向地球，靠的是我每秒6666兆万次的抖腿速度，硬生生让地球偏离轨道数十公里，才躲开了陨石，你们所有人都是靠我抖腿才能活下来的！,1175,2017年3月3日
386264310,321710760,第八届花式抖腿参赛选手,这种歌千万不能听！会越来越兴奋，胆子会变大，在路上各种加速，各种超车，各种漂移！！就在刚刚，这歌害我自行车链子又掉了！！！,1070,2017年5月18日
387771378,331257319,salufaer_,刚刚来我店里的顾客 出门骑上摩托大喊一声黑喂狗 冲向了绿化带。。,1043,2017年5月20日
459363997,469875429,吧喳嘿丶,土嗨是不可能土嗨的，这辈子都不可能土嗨的，古典又不会听，其它的又听不进去，就只能电音这种东西，可以维持生活，在网易云感觉比在家好多了，里面的老哥说话又好听，个个都是人才，我很喜欢在这里面的感觉，感觉像家一样。,857,2017年7月3日
212133275,133263208,不言而喻_lsh,(•_•)<) )╯/ \ \(•_•)( (> / \ (•_•)<) )╯/ \ (•_•)<) )> / \,810,2016年9月9日
71584511,105003002,萌主来了,算我一个，顶上,592,2016年2月18日
381404015,345634893,XieFeng姐姐,这就是为什么我没有男朋友的原因，整天都在抖腿,557,2017年5月13日
600502882,336567541,怎么会哭的像个小孩,凡是被本姑娘撩中的曲，我都会用心留下一些印迹。我期待着，在某天的某个时分，有一个和我同样喜欢这支曲的你将在不经意之间留意到这段毫不起眼的文字，恍然之间......你不由自主的对我萌生出一种别样而又微妙的情愫，我说这是咱俩的缘分，你会信么？我说你一定还会再次遇见我，你会信么？,442,2017年10月30日
1319647512,529421310,头等男友William,突然来句七妹remix，我可能当场死亡,380,2018年12月6日
1360859341,1490291386,你缺爱吗那我们做吧,玩归玩闹归闹 别拿国难开玩笑,143,2019年1月18日
1362480719,411564058,BurningWings,勿以球难开玩笑,109,2019年1月19日
