6037581,6561938,不习惯学好,爱情公寓让大家喜欢那个小房子喜欢上那些歌曲，感谢爱情公寓全体工作人员,82341,2014年11月20日
6401208,40403621,_东Sir,前奏一起眼泪就流下来了…最好的朋友就在身边，喜欢的人就住对面…,70830,2014年11月28日
6400451,39853869,仙气儿,爱情公寓是我看过最棒的青春喜剧,62041,2014年11月28日
39489587,82114614,肆吾pencil,不管怎么黑陈赫，曾小贤一定不能黑,45028,2015年10月7日
10168255,20581474,厌世小瓜皮c,五年青春!我爱的那两间公寓，爱那里的人，萌贱的小贤，霸气的一菲，老是切腹的关谷，可爱的悠悠，大条的美嘉，风流却善良的子乔，没有存在感的张伟，傻傻的展博，还有宛瑜，羽墨，那个什么都会的楼下小黑……爱你们!,43875,2015年2月6日
72513679,136130303,我睡觉的时候不困辣,女生都想做一菲，男生却都喜欢诺澜。我们拼命坚强，却比不上那脆弱的一摔。,37807,2016年2月20日
10356917,50908619,HSP_6,花瓣飘来的方向就是 爱情公寓,29164,2015年2月8日
15898379,41338530,baaaaaddd,明明rap比较精彩，为什么歌手只写了戴爱玲。,27280,2015年4月21日
123760862,44700205,Ss121425382,现在才明白，喜欢的是里面的角色，不是演员,23665,2016年2月26日
23633869,67758423,NNNayuta,最好的朋友住在对面，最喜欢的人就在身边，人生就完美了,20229,2015年6月25日
73347254,38942511,外賣仔何金銀先生,这首歌配上展博跳过去的那一幕，high爆了,19347,2016年2月22日
131132281,125769377,懒猫JW3,很多人说爱情公寓抄袭生活大爆炸，我不否认，但是我不太会英语，它剧中的笑点在哪我不知道，不知道为什么有些人看字幕就能笑，爱情公寓对于我来说更有笑点。,18224,2016年3月18日
6400422,39853869,仙气儿,最后回头那一幕久久不能忘啊,12799,2014年11月28日
174355158,119158982,还好我不寻常,十年前一部武林外传，十年后一部爱情公寓。,12576,2016年6月26日
6268383,44010249,清减半夏时光,很好听，一边听，一边回忆爱情公寓，深爱,9205,2014年11月25日
