1074120063,529930485,Strawberryww,初听不知曲中意 再听已是付费曲,51915,2018年4月4日
1081576587,84627002,_凡宝,邓颖超怕他耽误时间，只提醒他注意身体 于是总理说： “你的信太过官方，都不说想我。” “总理是大忙人，哪有时间来想我。” “闲人怎么知道忙人多想闲人。” “我这一生都是坚定不移的唯物主义者，唯有你，我希望有来生。” 周恩来：“望你珍摄，吻你万千。” 邓颖超：“情长纸短，还吻万千,20641,2018年4月11日
705340940,340760983,颜小刀哇,十岁的时候，你可以为一只冰淇淋而跑遍大街小巷的商店 二十岁的时候 ，你可以为喜欢的人 一个人去陌生的城市 三十岁的时候，你可以只为了生活 而随便找个人 过一辈子 你说你越来越懒了 懒得去爱 也懒得被爱 嗯，就这样吧，挺好的🍃,15747,2018年2月14日
1067552888,622234643,记得做一个善良的人,总会有一天，有个女孩，我的床头有你随意翻看的书，洗漱室的漱口水旁是你的粉底液，更衣室的白衬衫里夹杂着你的白裙，车副座是你的专属位置，朋友无一不知道你的样子，连夜晚独自在客厅，等我归来都成了我们最幸福的小事。,14052,2018年3月28日
611835321,329005520,挽长,你忘了吧 我记得就好,9136,2017年11月11日
1108580418,1302325323,嘤菟,学生时代最遗憾的事大概就是书也没读好喜欢的人也没能在一起没能活出自己想要的样子吧,7756,2018年5月6日
506524730,101716836,帐号已注销,我也不会照顾人，但是我很想留你在身边,5171,2017年8月11日
1080082790,1424113566,用户不存在1234,这个世界上没有一个人懂我，大家都说我话少，我觉得只是没遇到那个能和我畅谈的人，从日出到黄昏，从巷尾的烧烤摊到深夜的路灯下，知己难遇，此生能有一人已无憾,3989,2018年4月9日
1081127276,298372169,久久从阳___,我希望明天是晴天 希望坚持的事情总能换来结果希望在我准备好的时候一切如期而至,3774,2018年4月10日
1215384028,39698020,烟把儿乐队,烟把儿乐队 #纸短情长# 秋季巡演@秀动app 全国16站已开票 九月 请在你的城市遇见我们不见不散 ,2793,2018年8月14日
1087805123,1431768053,ForeverChen0327,易，你来下雨天，你走下雨天，你注销了那份易，我却铭记在最深的心底，对不起，因自己的错而过了你，我爱你，在一个离你很远的城市里。,2388,2018年4月17日
1246837470,289785955,柚子味的抹茶,附近有只猫遇见它总买肠喂它看着小猫开玩笑说，你要有灵要佑我有钱 有天在马路中间安全岛等过斑马线突然脚被咬了口 下意识退几步，这几步刚好让我避开失控的车咬我的小猫却碾死在车轮下 晚上梦见小猫开口说话了我没钱但是我有九条命送你一条,1094,2018年9月16日
1219508037,88460621,Deer-c,“爸爸，一生是多久呢？” “一生啊...就是从我见到我的妈妈那一天起，到我再也见不到你的妈妈那一天为止。”,1093,2018年8月18日
1260587941,548281741,我逆流,怎么会爱上了他，还不是因为眼瞎，放弃了一片森林，却被根破草绊倒了，纸短情长啊，写不完你的鬼话,752,2018年10月1日
1269983649,1588794334,傲天翎羽,从前上课的时候 生物老师讲过 任何的肌肉太过用力 都会因为在分解释放能量时缺氧而形成乳酸 于是 就会有酸痛感 那么 内心的那些满满的酸楚 也是因为太过用力了吗,684,2018年10月11日
