15693105,9198197,孙愚Sicca,在迷茫得不知道所错的日子，那英果然如约似得带来了久违的声音，有些人好似忘记了，放手了，如一条鱼，沉默在深海，不在回头望。但阳光普照的海面，有谁知道深海的暗流涌动，透过深厚的海水，哪怕闭上眼，还是会看到你，周而复始，日复一日，结局还是，失去你。,73090,2015年4月19日
15708256,34150915,PSY小强,应该说这歌写得很衬那英的声线，还是应该说那英的声线完美地呈现这首歌的意境。,44366,2015年4月19日
46950955,15511120,jicky_echo,真是应了 烂片出好歌,38648,2015年11月15日
15701002,46487823,艾薇儿Music,比萨斜塔倾斜了几百年，你不累吗？我总想找个安静的地方好好的哭一场，可惜却没有那个勇气，觉得自己都那么卑微，就连自我的眼泪都不值得落下。假若就在选择的那一刻不要迟疑，错过的又是另一个世界，前面的稻草也将随风而去。看着别人的美丽暗自忧伤，仿佛世界都在和你作对，,25231,2015年4月19日
15657655,38486576,TaylorRyan,竟然真的好听QAQ,18241,2015年4月19日
126531901,136433442,Unique_语,"最难过的 莫过于当你遇上一个特别的人，却明白永远不可能在一起，或迟或早，你不得不放弃",17963,2016年3月6日
15701227,51725283,只能少吃点,老那这首唱得漂亮啊,17912,2015年4月19日
15694415,33469679,肯体恤我未,他们的爱情打动了一整座太平洋，海面平静如初，海底波涛汹涌，每一条长途跋涉的鱼都用珍贵的七秒记忆传递着这对恋人的思念。七年，喧嚣有时，沉睡有时，但每一刻爱都在沉默的心底呼喊。,14934,2015年4月19日
15663471,36976960,OwenWang93,失去你，生活就好像变成一部默片，漫无目的地游荡，挣扎在寂静的海里。,11143,2015年4月19日
39844439,3349538,桃er蛋,如果不是周杰伦，我可能一辈子都不会发现这首好听的歌。,11023,2015年10月9日
15670591,57806516,哈比happier,真棒，这样的雨夜配这样的一首歌，涌起很多回忆，一样电影会和歌曲一样出彩动人。,7933,2015年4月19日
710540923,376022092,wearebornthisway,我不主动找你，不是因为你不重要了，而是因为我知道，我不重要了，我也没有等你，只是我还是没有办法喜欢上别人...,5551,2018年2月19日
1328943013,432902000,富江泠鸢,“自古忠孝两难全”，在选择跟你的那一天起我从没有想过会离开你，三十三天宫离恨天最高，四百四十病相思病最苦。我只有离开，能保你我两家再不受流言蜚语，能换你未来幸福的婚姻人生，能让你的父母放心，能不再让任何人去戳你的脊梁骨。爱是不可言说的隐忍与沉默，是为换来最后的保全。我爱的，是你。,2840,2018年12月16日
34072643,52693950,夜空中藏匿的星,昨天初恋女朋友突然Q我，问我还在外地么？我说是的。然后就东扯西扯聊了好多，其实从朋友那听说她要结婚了，但她终究没有说出口，当然我也没提起这个话题。我怕你说了，我该怎么接下句。半个小时的对话，算一算这算是六年来交流的时间最长的一次了。你要结婚了，希望真的是因为爱情，祝你幸福……,1652,2015年9月1日
574669180,108268120,丶你依旧是我的软肋,快7点了，街边卖油条的还没来，我只能给他打电话。大哥在那边说：劳资卖了这么多年油条，从来都是自由自在，自从特么认识了你，居然让我有了上班的感觉！,1443,2017年10月3日
