5725054,38037825,BYbanyon,封面差评！,93447,2014年11月12日
5559235,1823270,涣音,《荆轲传奇》的片尾曲，千万别再说秦时明月的了当然秦时片头曲《月光》跟这个是一脉相承，胡哥虽然长相平平，音乐才华真不是盖的。《我为歌狂》的插曲《有梦好甜蜜》建议没听过的也去听听～,26647,2014年11月7日
5288353,25682021,Veije,当年就流行这样的发型装扮，在当时这不是非主流而是主流。评论里的不要乱说哦,25626,2014年10月29日
42887659,52028703,菲神,在那一个月10M流量的年代，我花了3M下这首歌,19861,2015年10月26日
6073189,35810334,春夢為樂,胡彦斌的歌有自己的风格，唱功确实太好了，内地不可多得的音乐人。,17476,2014年11月20日
25545781,37227493,若阎就是Ryan,当年买了磁带听这首歌，我不知道弟弟把它洗了，当我向同学炫耀，点开播放键时，传出了我弟弟背英语的声音。。。,16497,2015年7月8日
5023508,39762841,yyn74511940,看评论觉得还是孩子偏多，这个封面在现在是比较非，但是那个时候还是很不错的，毕竟这是那个时代流行的元素。,12174,2014年10月20日
6606266,35810334,春夢為樂,不好意思前天我还听了他的Live 红颜，唱功没的说，不知道你在哪听的。,9624,2014年12月2日
19515469,45762230,王-之为,我愿意来世做流氓也要与你天涯相随,8134,2015年5月25日
27569340,61097424,落俗Z,我记得当年有句话， 北有林俊杰 南有胡彦斌。 不过明显慕容复干不过乔峰啊,7467,2015年7月22日
27089390,58847278,冉谷,见猪就喂～饮一杯潲水～……腌制香味～能爱不能给～甜要多尝～盐要多放～～——微博上看到的2333333再也不记得原词是什么_(:з」∠)_,6254,2015年7月19日
9458454,47774029,胖了一整个盛夏,20岁就能写出这样的歌，胡彦斌也是挺屌的~~~,6129,2015年1月26日
7757635,46900447,国服第一提莫,小学的时候看荆轲刺秦知道的这首歌。。当时我就听呆了,4963,2014年12月27日
8071128,3485483,sunsnowing,整个中学时代的偶像，那时候怎么看他都是好帅好帅记得他宣传文武双全的时候，主持人姐姐问他你觉得70后跟80后不同在哪儿，他眯着眼回答80后不会想不同在哪里吧70后会想吧。那时候18岁？真是活力俏皮啊。,3359,2015年1月2日
7891122,39581412,solidflow,占坑，指不准第三季过后又火了,2343,2014年12月30日
