18813024,45711555,生长夏天,从灵魂摆渡过来的朋友举起你的手,2215,2015年5月19日
28386638,81937600,强哥号,百度上，搜了一下石进的百科介绍，原来这位钢琴大师，竟然是自学，2004年才开始自己谱写钢琴曲……终于明白了，许多事情，只要你用心去学，认真去学，下苦工，真心热爱，你也可以在这一领域有些成就的！,1182,2015年7月28日
14579093,61096177,喰迟,现在还是一听到这首曲子就会想起片尾冬青站在院子里看着前方，个人觉得灵魂摆渡op恐怖ed温柔的搭配实在太妙，每一个孤独的灵魂都并非孤独的存在，总是会有一段冗长而温暖的故事在他们身后。这首曲子实在太美,1038,2015年4月7日
14400407,57477041,帐号已注销,看了灵魂摆渡再听这首歌，觉得它包含了太多,574,2015年4月5日
2621692,5680936,帐号已注销,灵魂摆渡,453,2014年5月5日
5492762,40633803,乔安-1992,灵魂摆渡的你不是一个人！,395,2014年11月6日
5913009,35827659,Queen2song,灵魂摆渡，期待第二季,273,2014年11月17日
34597070,65102889,一语石桥-为你而等,我从石进谱写的《一个人的时光》到《夜的钢琴曲》，不得不说他是一个不错的钢琴家，没一首都那么另人产生共鸣,257,2015年9月4日
2569109,15463761,Lucifer1156,给不了你需要的爱，还不清我欠你的情。这支曲子像水，像诗，像梦，更像是一个奇迹；此时此刻，能让我知道，在世间的某一个角落，有一个人，数着来临的岁月和逝去的韶华，伤似乎是求之不得，忆起当年还是这首始终动听的歌。,215,2014年4月27日
62138545,7653993,帐号已注销,忘川之畔，与君长相憩，烂泥之中，与君发相缠，寸心无可表，唯有魂一缕，燃起灵犀一炉，枯骨生出曼陀罗。——《灵魂摆渡•鬼上床》,187,2016年1月16日
2413293,287718,不孤独的杂食动物,灵魂摆渡人！,175,2014年4月9日
201586454,289089713,黎哩哩的荔枝,生犀不敢烧，燃之有异香，沾衣带，人能与鬼通。 忘川之畔，与君长相憩，烂泥之中，与君发相缠，寸心无可表，唯有魅一缕，燃起灵犀一炉，枯骨生出曼陀罗。,159,2016年8月19日
130974726,70271550,七月的大海丶,没看过灵魂摆渡的举个手。。,132,2016年3月18日
250807163,88919823,LWY_,暖水濯我足，剪纸招我魂。 生犀不敢烧，燃之有异香，沾衣袋 ，人能与鬼通。忘川之畔，与君常相憩。烂泥之中，与君发相缠。存心无可表，唯有魂一缕。燃起灵犀一炉，枯骨生出曼陀罗。,125,2016年11月21日
53608270,94998220,先生好久不见呀,生犀不敢烧，燃之有异香，沾衣带，人能与鬼通,88,2015年12月14日
274013494,342761922,誰人与我立黄昏___,五公子前来捧场！,72,2016年12月27日
274017127,330178027,账号被注销一生,早晨，从一听到22。如此寂静的音符，结束了夜。心情平静如水,29,2016年12月27日
273773968,295039567,一切皆从缘开始,赵吏怎么死了😔我目前看完了第一季呢,19,2016年12月26日
273794293,385701211,宸荨c,赵吏死的那集真的好感人,27,2016年12月26日
273616496,322688213,Alexand3r,網易雲音樂是個有感情的player，日推很有愛，沒想到最後是你更懂我。你把我引向更孤單的路，而我卻心甘情願。一入網易深似海，從此歌詞是路人。,22,2016年12月26日
273565276,269986736,O_GENKI_DESUKA,可以考虑换来电铃声了,7,2016年12月26日
273295373,88919823,LWY_,不当你的世界 只作你肩膀,9,2016年12月26日
273046702,249825418,帐号已注销,夜的钢琴曲每一首都那么好听,17,2016年12月25日
273026779,249825418,帐号已注销,我看过《摆渡人》这本书，挺好看的,11,2016年12月25日
272910956,246287450,帐号已注销,应该是天赋,11,2016年12月25日
272742749,295039567,一切皆从缘开始,刚看完灵魂摆渡第一季，过来听片尾曲,12,2016年12月25日
272638518,285507129,曹县话事人,灵魂摆渡只有第一季能看，后面的太玄幻了，太能扯了,19,2016年12月25日
272542343,111128769,剃刀123456789,而且还是个程序员,10,2016年12月25日
272356672,385338427,北辰任然,我偶然间看了灵魂摆渡今年，片尾曲很走心！,12,2016年12月24日
272403226,287867518,俊妮呐,很喜欢,3,2016年12月24日
272354040,302404466,不复热情,你 有没有……在世界里（灵魂摆渡）,7,2016年12月24日
271707215,368339734,撒贝宁听了想杀乌鸡,你可以试着看看真的不错,2,2016年12月23日
271665304,368339734,撒贝宁听了想杀乌鸡,绝对有四,4,2016年12月23日
271310813,326767761,小猫到此一游,马上要999了,5,2016年12月23日
271350464,91822582,临安小雨渐沥,ZR i love you,0,2016年12月23日
