11182780,41856015,-SuNabE,第一次听时还以为是泰勒的safe and sound,725,2015年2月22日
29377304,51801366,爱笑的香芋卷,我就是把我听出来的传上去了。。有些地方可能不大对。。,362,2015年8月3日
8848036,7629556,墨_子陳,立马爱上的迷幻节奏,165,2015年1月16日
575145775,29951957,----藍----,每个人都有自己的烦恼吧鹤不想立鸡群鸡还不想同鸭讲,98,2017年10月4日
15483907,52420823,December的海角,前奏，歌声让人入耳即透，入心即暖！,96,2015年4月17日
10515032,3061785,愿梦想终将成为现实,@云音乐小秘书 求歌词,94,2015年2月11日
9345225,125622,阿勃勃,懒惰,81,2015年1月24日
1081906648,437707797,帐号已注销,这小姐姐的嗓音跟我今天讲了一天话后的效果差不多，有点沙哑又很迷人,37,2018年4月11日
1081921854,600543493,瑞雪花轻舞,好美的女声🌹🌹,34,2018年4月11日
1064747382,101763770,月见草-Mtrla,到底要怎么做，我才能走进你的心里。——失眠的陈先生,28,2018年3月25日
1081900052,380604418,冰岛小暖,黄昏之前，回听抒情～／别做陌生人。,19,2018年4月11日
1081924017,308435181,绿萼梅梅I,❤🌸🎀🌸❤,14,2018年4月11日
1081928234,323121407,___________________AIR_SURFACE,狂风暴雨⛈️用音乐🎵温暖内心！感谢分享！,11,2018年4月11日
385664909,59515620,张汐梁Zxl,恕我直言，我不是针对某一个人，我是说在座的各位都是有品位的人,10,2017年5月18日
300745438,102049665,花了个不爽,孤独这两个字拆开来看，有孩童，有瓜果，有小犬，有蚊蝇，足以撑起一个盛夏傍晚间的巷子口，人情味十足。稚儿擎瓜柳棚下，细犬逐蝶窄巷中，人间繁华多笑语，惟我空余两鬓风。——孩童水果猫狗飞蝇当然热闹，可都和你无关，这就叫孤独。——林语堂,10,2017年2月3日
