5923388,17770380,囿岛,小蚂蚁迷路找不到蚁窝，可着急了…恰巧看到它的朋友经过，于是大喊一声：＂哥们儿！＂ 马上爬过去问路：＂你…你都如何回蚁窝？＂ 它的朋友反问道：＂带…带着笑或是很沉默？＂,13667,2014年11月17日
13865676,61003338,粥不懂稀饭,你是住校生，我住家，每次都有很多理由不回家，和你一起去打球，然后去你寝室午休。你说累了就在你床上休息，我摇摇头。你说我嫌弃，却不知道我的苦衷。很多晚上，你骑着单车带我绕学校一大圈，你问我为什么对你这么好。我沉默，我不敢说真话。永远不会重来，有一个男孩，爱的是男孩。,9250,2015年3月30日
5705060,42020391,阿叨叨,啧啧，我也不是那个在街上听到这首歌就能哭出来的小少女啦ww,4440,2014年11月12日
12991035,19044835,不二先生的低俗趣味,参加过那个婚礼后，回去的车上在角落哭成狗，下车的时候我就彻底放下了，后来，我们都会幸福，,3463,2015年3月20日
43832825,34230605,Una七月,当你认真谈过一段感情，最后却分手了，后来你会很难再去喜欢别人，你不想花时间也不想去了解。就好比你写一篇文章快写完了，但老师说你字潦草把作业撕了让你重新写一遍。虽然你记得开头和内容但你也懒得写了，因为一篇文章花光了你所有精力，只差一个结尾，你却要从头来过。,2839,2015年10月30日
11765452,35492769,Newbag,那天我参加校园歌手大赛，唱这首歌，你就在不远处站着听，当时有好多人，有同学有舍友给我加油，但是唱歌时，我眼里只有你。,2415,2015年3月2日
20711251,39957919,烤面包黄的王小米,每一个不懂愛旳人。 都会遇到一个懂爱的人。 然后经历一场撕心裂肺旳爱情。 不懂爱的人慢慢懂了。 懂爱旳人，却不敢再爱了。 。。。。而我现在正爱着一个不懂爱的人，爱的好累，爱的好辛苦，却又难以割舍,2178,2015年6月4日
5873904,3755261,云中的音符,高三最后一天的下午，校园的石板凳,1874,2014年11月16日
11596575,37267877,苏秦AD,那些存在记忆中的初次相遇都极其美好，不掺杂一点污迹，一瞥一笑，干净纯粹。只叹时光易逝，一转身一次离别。好男人一直都有，只是女人不懂珍惜，被伤过的男人不敢在付出自己的爱了，他开始拼搏，有一天，男人成功了，他身边聚集的很多女人。。。,1144,2015年2月28日
44028319,101780554,小虎牙lynn,有些人一旦错过就不再,1114,2015年10月31日
43957901,61425699,火热的耐心,大家说的对，看评论就是对我这单身狗一次又一次的伤害！,794,2015年10月31日
7071920,628243,大推理家,她的记忆里，校园广播站的广播里，电视剧的插曲里，天空的彩虹里，雨后的南京西路上，千岛湖里，西域大漠里，月光下，地铁里，高速公路的车载音响里，时空穿越里，樱花大道里。这世界每一维，有你，有薇，有恩。属于“青春系”的恋情之歌，每个音符诠释在她的低吟浅唱里，我的歌声里，我们的梦里。,694,2014年12月13日
44039258,86320936,zz_Hug,这里是来自粉丝的强烈支持欢呼声~,409,2015年10月31日
43936833,42272768,疯子与天才的一步之遥,我以为总有一天，回忆往昔时会低头浅浅一笑。直到今天，大四即将毕业，再次回想起初二时的我们，转瞬即逝的幸福后竟是无穷尽的酸楚。午后的篮球场上被你一把抱起的日子真的，再也回不去了。,351,2015年10月31日
44001465,83383976,花酒流年,喜欢同一首歌就是缘分,235,2015年10月31日
