1074580572,129897027,Sxxxxxr,我说这歌迟早会火没人反驳吧,52062,2018年4月4日
1166900018,340860836,羏廿,男人要想稳，那得温柔中带着狠,42118,2018年7月2日
1134794241,504620160,你在心上呀w-,你说准备给我一个惊喜 但没想到赞会这么快我们现在异地 但我感觉现在更依靠你从初中到现在一路走来不容易 我积攒了好多的运气才遇见了你 从始至终我们都别放弃今年六月份实习明年六月毕业 我等你❤,17237,2018年6月1日
1212935507,636668240,内涵且段子68,外国人看不懂系列:结婚前:我就抱抱什么都不干 不行结婚后:我就抱抱什么都不干 不行,17142,2018年8月12日
1216626069,432424315,钱丨难有,365张假面，你喜欢的样子我都有,8702,2018年8月15日
1228414927,645759523,琪哥哥哥哥__,天天听这种鬼东西 越听越迷 搞得现在去KTV都不知道唱什么歌 打开手机歌单 整个懵在那里 曾经的麦霸就这样凉了,8543,2018年8月26日
1251528713,1430202373,Rock-刚子,我没碰过一个女生，是，我是个处男，难道处男就应该被嘲笑吗，我只是想给未来媳妇一个最完美的我，难道这样也是错吗,5459,2018年9月21日
1123607367,312437353,帐号已注销,Prisionera-（监狱） (Rino Aqua & MD DJ Remix Radio)—Otilia,4969,2018年5月21日
1172251576,405749934,叫我阿福就好_,你现在喜欢丑的，你让我怎么办啊！,4530,2018年7月7日
1211231670,312631660,6666666666666666666666666一,一枚硬币就可以帮你做出选择，当你期待落下的是哪一面，那你的心里已经作出了决定,3454,2018年8月10日
1123629723,313465414,帐号已注销,Prisionera (Rino Aqua & MD DJ Remix Radio)—Otilia,2257,2018年5月21日
1210980150,1471818203,RunawayMa,人皆有灵魂，但灵魂未必总是在场得.现代人得特点之一是灵魂得缺席.,1719,2018年8月10日
1336345422,432257739,xxlin520,婚前是真不行，婚后是真不行。,1276,2018年12月24日
1332844366,250395571,关于喜欢你-,看你头像我反手就是一个赞,1169,2018年12月21日
1332717261,1677178122,文魁6,男人要想混的好，头发必须往后倒,1122,2018年12月20日
