335198383,339116886,是三轮啊,或许两三年后，再听这首歌，会有更大的感触，谢谢你，在英国这一年的陪伴，虽然我们没有结果，但是过程真的美好。虽然我们也有吵架也有不高兴，但是我心里真的爱你，而且放不下你。总之，谢谢你，谢谢你给我带来的快乐，我不知道我们的路还剩多少，过好英国这里的每一天。你无可代替，当我听起这首歌。,52593,2017年3月20日
62663282,121965274,雯雯儿是我_,我哥哥总听这首歌，他和女朋友爱情长跑十年，分手。女朋友家里已死相逼分手，没办法，然后分手之后，女生仍然等我哥哥，我哥哥说我祝你幸福，我们永远不可能。我表哥家里做生意，女生高官子弟，看不上。然后女生火速相亲结婚，孩子如今一岁了。我哥哥仍然单身，现在30。现实总比故事好看。,28107,2016年1月17日
11308177,32171816,贰号,好怀念喜欢听这歌时候岁月，徐良，汪苏泷，许嵩，本兮…,18256,2015年2月24日
127208427,124266564,深藏身舆名,对一个男人来说，最无能为力的事儿就是“在最没有能力的年纪，碰见了，最想照顾一生的姑娘。”,13491,2016年3月8日
7452640,34392759,屿戏游走,高三喜欢一个女孩，现在大三了，听到这首歌还是会心酸,9714,2014年12月22日
68613898,99726601,点击关注从此不做单身狗,每天认真洗脸，多读书，按时睡，少食多餐。变得温柔，大度，继续善良，保持爱心。不在人前矫情，四处诉说以求宽慰，而是学会一个人静静面对，自己把道理想通。这样的你，单身也所谓啊，你在那么虔诚地做更好的自己，一定会遇到最好的，而那个人也一定值得你所有等待。,8793,2016年2月7日
8711610,41864335,柠檬味阿曜,三年后的我才来看你当初念念叨叨的歌词，然后哭的像个二货,8135,2015年1月14日
33892597,72390117,帐号已注销,只有我一个人看网上有人配的那个MV吗？一个老者去海边拍照，回忆起青春一路过来的回忆吗？我特意把这个MV给上一任看过，她很感动。我也很感动。现在我听到这首歌，看到这个歌词，心还会隐隐作痛！,7794,2015年8月31日
9997687,37875188,也如星火,愿天下有情人终成眷属，能和自己心目中最无法代替的那个某人相爱一生。。,5784,2015年2月3日
5288700,40241055,Pooooopeye,想她的时候听听，会过去的。,3742,2014年10月29日
64975848,119999621,孤独烈酒跟我走_,真的很爱就不要放手，怎么都不要放手，重新谈一场恋爱很容易，但要再那样去深爱一个人可能一辈子都不会了，四个多月我和她终于快复合了，从开始删了所有联系方式到现在挂上情侣项链作为约定，我觉得自己真的很幸运。在这祝我顺利升本带她去她想去的任何地方旅游。（也希望大家不要放弃自己真正爱的人）,3717,2016年1月25日
6670318,38835874,灰色魔法师,我又想起了远方的你，你还好吗？当我听起这首歌时，我泪流满面，满脑子都是想你。亲爱的，我忘不了你。你回来吧！,2960,2014年12月4日
5947175,39718434,不是我_0,王大锤？,2148,2014年11月18日
42247359,98803573,你们都是非主流,很喜欢宫崎骏说的一句话：“你住的城市下雨了，很想问你有没有带伞，可是我忍住了，因为我怕你说没带，而我又无能为力，就像是我爱你，却给不到你想要的陪伴。”,1252,2015年10月23日
279975850,338750922,只是近黄昏阿,女朋友去年六月十八号去世了 一直到上个月都是自己的灰暗期 最近玩一款app 上面很多情侣都在玩小恩爱 于是我又去下载下来了 上面显示我们相爱了665天 聊天记录16272条 日记32篇 创建纪念日3个 上传照片73张 就在前五分钟我默默的过来搜索了当我唱起这首歌,835,2017年1月4日
1054635621,599808749,布朗熊-OvO,说忘记其实并不容易，你说抛弃你一次的人，他（她）向你伸手，你丝毫不会犹豫的跟他（她）走。有时候你发在空间，朋友圈，微博的一条条消息，不为别的，只为他（她）看见。往事如烟你说你不亏欠，可是又有多少人真正放下了呢？,234,2018年3月15日
1054425626,1344008230,那我送你回家1,评论里都是情圣，现实里都是屌丝,232,2018年3月15日
1054378713,250952621,少糖少冰不要香菜,最扎心的就是这首歌 每次听都会被触动,47,2018年3月15日
1054299401,450614616,已然白头,咖喱 你当时再等我两个月……,25,2018年3月15日
1054262905,51296495,Largeblue,高考后每天早上6点坐上去木材厂的专车经常会听这首歌，然后感动了自己。,28,2018年3月15日
1054228803,273061058,_Jiudaozheba,现在你的另一半呢？,38,2018年3月15日
1054140321,130447897,大姜先生-,分开的时候抱着我在耳边你唱了这首,13,2018年3月15日
1054119832,555113969,万万深山,早点睡觉,13,2018年3月15日
1054032346,1394124818,汀州八百里,高四吗兄dei？你确定？,25,2018年3月15日
1053935836,250429990,_-楊静,那女生结婚的时候她自己是该有多难熬,31,2018年3月15日
1053897727,274874385,Rright-,距离不害怕 时间才是毒药,27,2018年3月14日
1053684293,576564769,陈佳啊陳,这个歌配了个视频真的很感动,12,2018年3月14日
1053694776,485865677,孤岛北屿,我越来越现实，请让我拿掉一会儿面具吧…,25,2018年3月14日
1053675125,434282422,霖雨-纷下,嗯。,5,2018年3月14日
1053656406,405024641,北北肉松,以前，专门学过这首歌，为了唱给那个男孩听。只为了最后一句，亲爱的，你是最无法代替的♡虽然，现在我们形同陌路，但是你曾喜欢我我曾喜欢你，也曾在一起过。但是，在我心里，你依旧是最无法代替的♡愿你一切安好！,126,2018年3月14日
1053623873,271609467,世人万千难遇你,太容易得到的，往往不被珍惜,10,2018年3月14日
1053629671,537425894,0973丶,我建一个失恋群，我们做个约定，如果找到另一半的就退群，看看最后谁会留下来怎么样？,23,2018年3月14日
1053591818,44778091,无声动物,为什么听了想跟他gay,19,2018年3月14日
1053521495,30394885,深情多余,我99的。。。高三,8,2018年3月14日
