12117467,54365375,SHareUU,成佛真的好么？我还是最喜欢那个无法无天的妖猴。虚心学艺的孙悟空，大闹天宫的齐天大圣最后终于变成了那个瞻前顾后的孙行者，无欲无求的斗战胜佛。这不是那只猴子，而是每一个屈服于现实的自己。,83160,2015年3月7日
66147140,128686032,易燃易爆林一默,大街上，有个小男孩吵着要买棉花糖。妈妈指着他手里的小糖人，说：“刚买的孙悟空还没吃呢，怎么还要？”小男孩不听，赖在原地，非要买棉花糖不可。妈妈没办法，只好同意了。小男孩终于拿到了棉花糖，开心地对小糖人说：“大圣你看，你的筋斗云来了！”—————看了莫名心酸~~,47067,2016年1月29日
136879990,48840269,背上书包炸学校,之前大圣归来出来时，外国人不懂为什么会有这么多成年人去看动画片。不知是谁说了一句:你们的英雄有很多，而我们，500年来就这一个,43535,2016年4月2日
14524881,45828377,Eureka-yz,人生，就是不停的错位，整个故事，充满了错位—当他是至尊宝时，他没有法力救回自己的娘子；当紫霞爱他的时候，他爱500年后的娘子白晶晶；当他开始爱紫霞的时候，紫霞却已经离开他被牛魔王所困；只有当他恢复法力有能力去救紫霞的瞬间，没有错位，他爱她，她也爱他，可是，他们却失去了相爱的权利。,39422,2015年4月7日
51535701,32645352,除夕i,“大圣，此去欲何？” “踏南天，碎凌霄” “如若一去不回……？” “便一去不回！” -这才是我心中的孙大圣。,36388,2015年12月5日
72427342,106367009,Jessica_蒲公英的约定,今天去看了大圣归来。 我旁边有个小孩儿问他妈妈 “这个不是动画片么？为什么有这么多大人来看？” 他妈妈回答： “因为他们一直在等大圣归来啊，等啊等啊，就长大了." ------泪目~,30978,2016年2月20日
64888661,65386142,声如夏蛙,其实西游处处透着讽刺，大闹天宫的齐天大圣五百年从五指山下出来被强迫去取经美其名曰修成正果。一路上的妖怪不是这个的坐骑就是那个的道童，而且几乎个个偷来威力无穷的法宝，孙大圣这一路求神拜佛还要忍受唐僧的唠叨和误解。最后呢，跪在当年封印他的仇人面前放下一切执念成了佛，这是多么讽刺啊。,24161,2016年1月25日
8276762,45150134,李宝咪,最喜欢“你笑了吗？你的笑在我心中”这句,17588,2015年1月6日
26590006,79803959,旋风菜菜子,我们中国有一个盖世英雄QAQ,16184,2015年7月16日
637324665,559551046,棱匀,“这傻和尚。”孙悟空笑着摇头，敲响了面前的山门。“你谁啊? “妖精开门，皱起眉头。“你孙爷爷。”孙悟空棒子一甩，顶住妖精头，“过会儿有个小和尚要来，你演出戏，让他觉得世界充满善意。”“不干就打死你。”,12809,2017年12月10日
7908043,44025951,佛杀,这首歌灵感应该源于《悟空传》，悟空和小松鼠紫霞,12225,2014年12月30日
630338619,255480915,自由如风_____,从来没有什么孙悟空，也没有什么西游记，师徒五人，其实只有唐僧，其他四个，都是唐僧的心魔。途中的磨难，都是唐僧内心的磨砺—— 定住心猿则悟空，拴住意马便化龙，戒贪戒色共八戒，戒杀戒嗔是悟净，身心纯净朝佛祖，心之所在即西天。,11568,2017年12月2日
1119078431,419543866,御坂美团QAQ,你说这石猴，美猴王时笑得恣意，孙悟空时笑得狂扬，齐天大圣时笑得乖戾，孙行者时笑得腼腆，怎么就到了斗战胜佛的时候，他就不会笑了呢。,10075,2018年5月16日
11210561,37974649,鏡子裡的魔術師,起初一听还以为是悟空和唐僧的故事…手动再见,8623,2015年2月22日
7148411,44993020,上官雪洛,倒是和大话西游挺合适的，腾云驾雾驭电驰风却来不及与你相逢,6597,2014年12月15日
