1328143654,353295075,我真是帅到二级残废,没有版权的日子全靠凡仔撑着,21183,2018年12月15日
1331572044,1326417471,Calicookie__,凡仔的翻唱太绝了啊啊啊，感觉还带了点声带模仿！相似度很高了,13779,2018年12月19日
1374421159,373400222,你眼泛星辰,能动的歌词是我换来的，夸我！！！！！,9196,2019年1月31日
1345124313,377602829,OO-HolyEgg,妈妈木的翻唱都是牛人，妈妈木的歌都挺难的，想当年一首星夜高的我怀疑人生[多多捂脸],7159,2019年1月2日
1362320082,626417177,林胜也我奈-,歌词你长大了 应该学会自己滚动了,4301,2019年1月19日
1371269977,1428039847,云村王嘉尔,崩那地 崩男 内撒浪 也gi呀很那地 很男 一表r里 不你鸭一米 爱给几吗no嗯能 动安吗你 为咯b扣 hin得r ki慢嘿搜no哇 一丝得 为逗 恰累句几 摸忒能几一切搜呀 带空慢 买得力 民逗能几秒崩 你呀咿 呀咿呀呼为慢 哈你 爱咿呀求 够得r慢 弄木也波 uh~,3996,2019年1月28日
1401021944,1349991908,不负江东,我真的会给每一个赞我的人认真的回一条私信,2233,2019年2月23日
1387705612,641257917,弓長1994,我尊重同性恋，我理解抑郁症，觉得有纹身的小姐姐超酷！我知道捐献造血干细胞不需要忍受很大疼痛在骨头上打洞，我会喂楼底下的流浪猫，会给老奶奶让座位，会对店员说谢谢……纵然，我平庸，长相普通，脾气不好，曾经失败痛苦、伤心绝望，吃尽生活的苦，但我依然，想努力地成为一个温柔善良的人。,1820,2019年2月12日
1326470511,424105619,人间小兔仙的圈外女友,道理我都懂，为什么要搞大哥,1743,2018年12月14日
1427737979,1402056754,WL范老驴,睡前太懒不想关灯，随口到:“有鬼吗，帮忙关一下灯，请你吃冰激凌。”啪的一声，灯灭了，我吓了一跳。黑暗中传来一个小小的声音。那个……冰激凌要草莓味的可以嘛?,1071,2019年3月22日
1455664874,544578638,杨字金金金金,每一句都唱出了网易云的贫穷,797,2019年4月18日
1370153362,344438723,XWOWEN,还是光头的最好听,757,2019年1月27日
1373889102,1620474121,长白山树神,在某音一个做饭的日常听到的,719,2019年1月30日
1397316722,38270690,然后我们吃着辣条一起听着歌_,我上传歌词成功了,460,2019年2月19日
