279269986,384046828,打个比方i,仙女豪啊仙女豪，你家真的在新疆乌鲁木齐吗？如果是的话，寒假一定要去玩，就算不能👀你，也能和你呼吸同一个地方的空气。还是非常开心的，可是我们距离好遥远。,2295,2017年1月3日
391814363,320546529,意境阿野青衫一笙,感觉你们的嗓子都是被天使吻过的，而我的嗓子是被狗啃过的,1916,2017年5月24日
301446004,404311816,C-诺,竟然推荐了罗之豪的歌给我？？？😂,1406,2017年2月4日
300055075,306996502,手残迟钝星人,围观结论，论各位如何因为这个声音产生想给他生猴子的想法，以此为题，鼓掌微笑,926,2017年2月2日
363717256,103447135,对你的微笑纯属礼貌S,罗之豪最酷！唱的每一首歌都很酷！最爱仙女豪！,577,2017年4月23日
454685095,390113266,Yin-yang-strange-gas,仙女豪不是仙女只是罗之豪，独一无二的罗之豪，无可替代的罗之豪，普通平凡的罗之豪，我们守护的罗之豪,471,2017年6月29日
461260572,384046828,打个比方i,仙女豪呀，话说我网易云的动态大多都是关于你的。不信的话你可以自己去看哦！👀,334,2017年7月5日
709823077,384046828,打个比方i,虽然我不够高，但我可以踮起脚来让你靠。日常想你,195,2018年2月18日
1077227727,311314825,_一笙-,我说我和罗子豪就差一个之字大家信嘛？而且我开始就叫罗之豪后面改的，为什么他的声音被上帝吻过，我的却被猪啃过呢？,182,2018年4月6日
1165386258,1357501353,抹茶味的红酒,厉害了我的哥，和justin唱的不分上下，我都不忍心说这是翻唱,158,2018年6月30日
1215458299,1481339712,快来抱抱奈奈叭,“你要珍惜那种主动跟你说话 跟你聊天 给你发短信 甚至在你说了一句‘嗯’之后依旧滔滔不绝的人 因为没有谁会吃饱了撑着来讨好一个自己不关心的人 不要让那些真正对你好的人 慢慢的从你的生活中消失 无论爱情还是友情 不去经营 都会变得形同陌路”,72,2018年8月14日
1285331191,596095332,L_W_R1804,你以为你很了解比伯？谁也没有说要比 . 不想听可以不听 . 又不是非要你听 . 酷豪很好 。 请你别总把别人说得那么不堪 . 礼貌是个好东西 . 希望你可以有。🙃,68,2018年10月29日
1289895704,1512475520,学习学习学习我的生命里只有-,尊重是个好东西，希望你可以有,44,2018年11月3日
1241574563,1487511058,我曾难自拔于世界之大o,罗之豪唱的是有不好的地方，同时也比不上原唱，但他一直很努力很努力，你在这儿把罗之豪和比伯攀比，你是想给你家比伯招黑还是怎的?,28,2018年9月9日
1225572980,539185048,臭成成,英文发音真不敢恭维。。。无非是模仿了比伯的唱歌发音技巧做理智粉，蟹蟹！,14,2018年8月23日
