1167763793,1368460273,晗晗呀毛毛,我的妈妈她有点世俗，有点贪小便宜，有点做作，甚至有时候有点虚假，但她却努力教我所有美好的品质，她想我成为好的人，一切的不堪她都一个人承受，只是因为我是她的女儿。,10.4万,2018年7月3日
1167702794,1356195628,说故事的未成年,你传的照片，是我离家时的床铺你说好久了，屋子都没人住我总有办法打断你的叮嘱多数是不耐烦，少数是想哭 我总说自己要减轻你的辛苦要自己去闯自己的路以为自己足够光彩夺目却被你一眼看穿艰辛苦楚 传说上帝无法亲力亲为所有守护派仙女下凡，做人间的公主从此，一切美好，在柴米油盐中驻足,96139,2018年7月3日
1167700738,268228555,__何妨__,海味山珍比不过一荤一素油盐酱醋是她细密的叮嘱她用双手编织你远行的路然后笑着送别，站成一棵树她知道你受万人瞩目也知道你多辛苦好好睡吧，让她亲亲你渗出的泪珠别不开心，她喜欢你嘴角上扬的弧度,44982,2018年7月3日
1274999060,559332138,agatha921,毛不易真是一个哲学家，《奇遇人生》里面说了好多经典语录：1.四十岁就是新的二十岁2.内向不是性格的缺陷只是性格的一种3.人的本质不是喜欢钱，而是钱予人的自由4.不想说的话我可以不说，但是我尽量保证说出的话都是真的5.快乐是赏赐，悲伤是考验，不快乐也不悲伤，是生活的常态,37018,2018年10月17日
1167764226,599900028,周期a,我慢慢地、慢慢地了解到，所谓父女母子一场，只不过意味着，你和他的缘分就是今生今世不断地在目送他的背影渐行渐远。你站在小路的这一端，看着他逐渐消失在小路转弯的地方，而且，他用背影默默告诉你：不必追。 ——龙应台 目送,36190,2018年7月3日
1167711560,350775809,钉子户户,一荤一素也真好代表了母亲这个角色吧。她可以为你变得世俗，但她想把这个世界最纯净的给你。,26530,2018年7月3日
1167702662,1461868135,是嘿嘿诶,一荤配一素，一汤配一饭平常日子里，不紧也不慢你给我港湾，我给你期盼走时抬头望天，忍住珠泪涟涟忘了回头看，他人形只影单远行，是孤寂的身影送别，是难耐的情绪他乡，是未知的故里忘了有多久没回到这个港湾，忘了她的期盼，就回去吧，停下远行的脚步，月儿正明，风儿正轻，吃一顿热腾腾的饭,17725,2018年7月3日
1167699792,350775809,钉子户户,我面前啊是高高的天，是长长的路，我不敢回头看啊，她有没有哭。,15897,2018年7月3日
1167719532,1461868135,是嘿嘿诶,这个世界上再没有任何人可以像父母一样爱你如命好好珍惜他们下辈子你也不会再遇见他们,13725,2018年7月3日
1167736350,438487656,俺是Jerry小黄,听着这首歌就会想到从前吃着学校饭堂菜时想念家里一荤一素的滋味。和奶奶两个人吃饭，奶奶是素食主义者，那整一碟肉都是我的，比外边再贵的饭馆都要好吃些，虽然我不曾对奶奶说过。留心中吧。,9806,2018年7月3日
1167697939,1459700805,翕翕我心,亲情之爱，厚重而深沉，细长而久远，如天空如大海，如泉水如空气，她带给我们力量，她温暖我们一生！,6859,2018年7月3日
1167821417,119430835,长风界,我曾无数次写过她的名字，在任何地方。我是她生命的延续，而她是我不可割舍的爱意。,6524,2018年7月3日
1167711640,1459700805,翕翕我心,用旋律温暖人生百态，用歌声唱尽世间温情，感谢这首感动内心的歌，让我们更懂爱，也更珍惜爱！妈妈，爱你……,5278,2018年7月3日
