1286156329,442551931,说句实话jet,再一次介绍一下我妻子谢娜：谢娜，女，已婚。有一对双胞胎女儿。生活幸福，工作顺利。婚前爱吃零食，爱熬夜，爱吃辣，爱忘事，爱我；婚后爱喝鸡汤，爱早睡，也爱吃辣，更爱忘事，更爱我。 ——《妻子的浪漫旅行》中张杰写的信,3664,2018年10月30日
71950444,17029023,小情绪Oo_,在路边无意听到的一首歌 刚开始没听懂歌词 完全是被旋律吸引了 表哥唱歌还是这么棒 加油哦！,1417,2016年2月19日
1062227205,1365813245,二9一十8,前几天看综艺欧阳娜娜给你讲她和娜姐录节目的时候总喜欢赖床 然后张含韵放了你的这首《老婆》 娜姐瞬间坐起来 说着又是美好的一天 你听了开心的笑 喜欢你们的第n年 杰哥娜姐你们一定要好好哒 我也多希望有那么一个人 就看那么一眼 都会让我觉的接下来便是美好的一天,1401,2018年3月23日
45884152,86415314,入我心者待如君王,曾经的那个人，我一直把她当成我的唯一，却只能在深夜一个人偷偷想念。,841,2015年11月9日
71814034,120691152,repugno,这首歌真的很好听呀,720,2016年2月18日
71376068,124873520,别鱿鱼,想起二炮手才来听得,525,2016年2月17日
71339208,82785204,粉墨走花路吧,老婆，我爱你！,332,2016年2月17日
70419374,90610972,MC萧涵,很好的一首歌，感动哭,257,2016年2月14日
1525644536,1706415988,黄歆_,我爸在看二炮手那时候，我说你听过主题曲吗，然后放给他听，父爱原来很坚强，我却看到了他最脆弱的一幕，所以现在，我妈更年期，我爸一直包容着他，因为，妈妈把青春给了爸爸，爸爸要用一辈子守护她,231,2019年6月16日
61319945,75234637,甜甜的嘴里抹了蜜,可是我没有，想想就好了,221,2016年1月13日
1489101429,1676342392,放輕松就當漫遊宇宙,很羡慕这种爱情啊,176,2019年5月14日
71350114,82785204,粉墨走花路吧,老婆，我爱你！,166,2016年2月17日
1516863530,1332879026,张杰家的小星星wzn,杰么娜💞💞,71,2019年6月9日
