4854498,7438011,草莓味的胖次,阿尔冯斯，等我！我一定来带你回去，一定！！！...............,12300,2014年10月12日
8360947,16102387,95號貨郎,钢炼，虽然不敢妄称是最好看的动画，但我想说这是一部能深深刻在心里面的动漫，无论是钢炼，钢炼香巴拉，还是钢炼FA。当然，我和我弟一致的观点是，钢炼原创的剧情以及后面的香巴拉真是太经典了。香巴拉的结局虽然离FA原作相去甚远，不过，经典就是要这么任性的结局！,6237,2015年1月8日
23446795,52014408,飒飒卡卡,“不敢妄称”真是最好的态度了，钢炼是部确实的神作粉丝却这样的谦卑。说明这是部成熟的作品，自然也是成熟的粉丝。那些天南地北喊神作的最后都被黑成翔了。,6000,2015年6月24日
10355566,47208649,Shouting呀,所有人都在刷26集。可我记得最深刻的却是22集温莉没有开枪击斯卡，在爱德怀里痛哭时这首歌的插入。还有27集，在爸爸梦里，妈妈牵着爸爸手，说：“因为脆弱，因为会死去，所以会挣扎着想要活下去，人就是这样变强大的。”时这首歌的插入。这首歌也听了不下百遍了，始终不厌，爱你一生，钢炼FA！,4491,2015年2月8日
24278204,55933653,麦田里的师爷,这个花式秀女友我给你打10分,2250,2015年6月30日
40356184,76608050,jiqirenjj,恨不得把喜欢这首歌的人都粉一遍，虽然互不相识，但是去感觉很亲近,2229,2015年10月12日
281759681,131245703,残酷天使的纲领,色欲死前对某人拥有了好感暴食被吃掉嫉妒最终承认自己嫉妒人类懒惰直至死亡都在不停战斗愤怒获得了平静祥和的死亡傲慢化为最纯真的婴儿贪婪舍弃自己的生命嗯，人造人死的，都很有意义,2127,2017年1月7日
6714988,15415613,Sunday-Red,最爱钢炼，不做作，现在的有些太做作了,1565,2014年12月5日
40346216,76608050,jiqirenjj,这究竟是一个什么样的故事，推荐给最亲近的几人却鲜有能认真看完的，每年都想重看一遍的心境是否有人能懂？,1558,2015年10月12日
32202229,54670582,岩石巨像,没有伴随着痛楚的教训，是毫无意义的。因为人若不牺牲些什么，是什么都无法得到的。但当忍受过这种痛楚，将其克服的时候，人就会得到不输给任何事的坚韧的心，没错，钢铁般坚韧的心。 -----《钢铁是怎样练成的》,1413,2015年8月21日
55147700,79354513,你一点也不差劲,不明白这番番有什么可腐的，兄弟情被曲解成真爱也是醉,1204,2015年12月20日
500077319,246957354,梦想天空i,战狼2里，吴京说道：你的手是救人的手，不是杀人的手。当时就想，这不是爱德华对温莉的原话吗,716,2017年8月6日
16680463,3678374,Kasitefy,神封面,632,2015年4月29日
220967864,19956215,红豆汤不要豆,iphone4你等着，爱豆啊，你知道吗，iphone7都出来了,554,2016年9月27日
71123916,7004245,那天与你邂逅的薇薇,很喜欢钢炼ED各种神插入,479,2016年2月16日
