1521631885,1416280626,万世舟,能找到这首歌的，不是一般人。,23855,2019年6月13日
1580568025,1761177264,感情的戏她是影帝,我姐姐分配到火车站做安检，我坐火车去学校，没想到是我姐姐负责检查，她摸到我口袋里的烟盒，（全家人不知道我吸烟，也不让我吸）姐姐:这个方方的盒子是什么？拿出来我看一下。我:烟，烟盒。啪！！！姐姐一巴掌拍在我的脸上。很疼很疼。后面等待安检的人群看到这一幕都惊了，纷纷掏出烟盒扔了。扔了。,12880,2019年8月3日
1593854273,1558156391,mdkklg2580,不怕新歌有多嗨，就怕老歌带dj[多多耍酷][多多耍酷],10161,2019年8月13日
1594222743,259820617,骨子里的我1126,真搞不懂这种音乐，动次打次的，听了让人觉都睡不好，下次有这种音乐早点告诉我，我不喜欢睡觉,6781,2019年8月13日
1626164276,429724492,Michael明仔,想蹦迪吗？却又不知道怎么蹦？我告诉你一个简单的方法：用头在空中写个“粪”字，并不断重复，眼睛微闭，一手或双手指天，即可。不谢。,4403,2019年9月12日
1584141474,1721657041,江亦吖吖吖,然后等没有人的时候那些烟全部进了弟弟的口袋,3567,2019年8月6日
1656511646,255223841,杀人诛心灬,看到这条消息的人祝男孩子：天天快乐万事如意诸事顺利心想事成天天开心幸福美满阖家欢乐福星高照喜上眉梢欢天喜地财运亨通吉祥如意工作顺利龙马精神寿比南山步步高升福如东海花好月圆神采奕奕飞黄腾达升官发财安居乐业龙凤呈祥四海增辉鹏程万里太平有象幸福无疆祝女孩子：多喝热水,3198,2019年10月16日
2034169369,1463833274,TT夏天l,1.买一套500w的房子（已完成）2.买一辆兰博基尼（已完成）3.开一家上市公司（已完成）4.年收入500万（已完成）5.有一次说走就走的旅行（已完成）6.改掉爱吹牛逼的习惯（未完成）,2908,2019年12月1日
2065784706,1337187375,龙Lon9,杨千嬅这辈子也没想到这首歌能蹦迪,2276,2019年12月29日
1637297081,1383209892,平淡为真-_,我觉得有钱没钱都无所谓，关键是要过得开心 （来自iPhone11 镶他妈10086颗钻版856G客户端） 1分钟前 位置•迪拜帆船酒店总统套房,1144,2019年9月25日
2064128652,385816620,愿我如你一般潇洒,狄仁杰看着怀里的妻子说到：这世道不仁，为什么我的名字里面要有仁字？我不甘心！妻子看着他说：你到底想说什么？狄仁杰望着妻子的眼睛温柔地说到：如果我是狄杰你会爱我吗？,1010,2019年12月28日
1586116904,1927110636,黑夜中的点点星,同九义汝何秀,998,2019年8月7日
1587503966,387185352,被自己熏哭的洋葱,虽然我不是第一次看见这个故事了，但我还是给你个赞,815,2019年8月8日
2053652342,410117632,_Mr__Huang_,以前觉得这种歌真的土，反感的一批，现在感觉这种歌真tm对胃，真是老了[多多大笑][多多捂脸],754,2019年12月18日
