10959584,16679495,旧梦情丝丶,央视春晚居然毙了这首歌，春晚你知道你损失了什么嘛,38279,2015年2月17日
10954753,463286,皎月归我轻随,张靓颖张杰两人极具辨识度的声音在这首歌上竟能如此协调统一，演唱深情而又细腻，宛如涓涓流水滋润心田，滋润人们因思乡而干涸的内心 另外不得不夸赞词曲作者的创作功力，曲子温暖柔美，歌词华丽却不显空洞，娓娓道来，意味深长 尤其“别来无恙你在心上”这句更是锦上添花,17129,2015年2月17日
10977214,2753110,格利克斯,毙得好 要不然还得到大年三十晚上才能听到 况且我又不看春晚,13496,2015年2月17日
72825553,66739015,猫熊妹妹L,作词：许嵩 作曲：许嵩,13200,2016年2月21日
54543052,93619118,嵩哥女票阿喆斯密哒,读《人间词话》，偶然看到梅尧臣的《苏幕遮·草》，其中有两句“乱碧萋萋，雨后江天晓。”“落尽梨花春又了。”我想说，嵩哥到底读过多少书才能写出这么好的词啊！！音乐纯粹，爱V绝对！！❤️,8250,2015年12月18日
149312595,72967698,逆月文刀,第一段每行的最后一个字韵角是“ao”， 第二段每行的最后一个字韵角都是“ang”....... 太她妈妈整齐了！佩服许嵩！,7283,2016年5月3日
11251166,37393633,从盛夏开始到初夏结束时,虽然许嵩没唱这首歌，但听起来就像他在唱一样,5979,2015年2月23日
68398409,78947965,天涯微角_,有多少是从许嵩那边到这串门的,5164,2016年2月6日
68625106,77068211,靈喪喪,这首歌许嵩终于还是自己唱了 感觉与这一般完全不一样 评论瞬间破万 就像之前的千古一样 自己的歌终究还是自己唱来最有感觉 许嵩的嗓音唱古风总有最贴耳的舒适感 就像轻柔的风像潺潺的水按摩着耳朵 舒服的不行,4031,2016年2月6日
164972397,267841083,海宝lula,好朋友喜欢许嵩，我喜欢张杰。然而我们互相被感染了。我把这首歌激动地分享给她，说这是你许嵩写的歌，她说因为这首歌是你家张杰唱的，所以已经听过。瞬间泪奔ing，祝远方的她工作顺心，永远正能量。,3935,2016年6月5日
10975772,32409447,翻起番茄汁,在准备回家过年的晚上听，喜悦激动和感动一起涌上,2872,2015年2月17日
33113616,52551606,青荾,听室友放的时候就很喜欢的调子和歌词，一看居然是果然是许嵩的作词作曲，总算是知道为什么听起来那么舒服了。,2075,2015年8月26日
68655649,97046906,紫谖66,安徽卫视春晚许嵩唱了这首歌！！！耳朵怀孕了，开口跪啊！！！我路转粉了！！！,786,2016年2月7日
49896980,61461099,吴越枫零,第一次给闺蜜听，问她，你猜这是谁作的曲？她仔细听了听，说：“许嵩。”他的歌真的很有自己的风格，这首更是有重惆怅和无奈的味道，越听越好听。,445,2015年11月28日
144524474,110605686,宁哥哥的小跟班,我是嵩的粉丝，我嵩确实不善唱功，他更适合作词作曲，理性的点评我们接受，恶意的诋毁我们反感，谢谢大家。,409,2016年4月21日
1341375478,378180084,都要成five了,这么久没人评论了啊,89,2018年12月29日
1256581394,43049990,斗战胜岚,评论呢,46,2018年9月26日
1159053938,349358645,秀丽兰花王,评论呢,59,2018年6月24日
1133226266,571973444,慕清如曦,小生不才，斗胆一问，不知姑娘是否心系别家公子，感情之事，在下不敢儿戏。如若姑娘早已心系他人，在下便不再打扰。如若有所唐突，还望姑娘多加体谅。若姑娘非我良人，那在下就不庸人自恼。在下亦是越陷越深，还望姑娘尽早告知，莫让我如此不堪，话已至此，我便再次，谢过。,119,2018年5月30日
1133197070,323287945,昵称已注销zxc,日推+1,18,2018年5月30日
1133167072,7145842,solo倾城,别来无恙你在心上,22,2018年5月30日
1133119691,407028151,我去我不信这也有人注册过,我们确实没看出来你喜欢梁敏,53,2018年5月30日
1133116679,394299217,拿茶杯的猫,许嵩不愧是许嵩,32,2018年5月30日
1133069606,565519823,xxhh晃晃头儿,中国的文字就是这么有魅力，燕归巢，三个字，就已经美不胜收。,101,2018年5月30日
1132940665,271337973,麻妈妈妈妈妈,之前听的一首同人歌，韵脚都是ang。越来越感觉许嵩才气溢出屏。,17,2018年5月30日
1132864452,41940936,嘘--闭上眼睛,别来无恙，你一直在心上,6,2018年5月30日
1132653148,283346066,是小李同学,太好听了！！！,1,2018年5月30日
1132616574,597629120,我说我不吃洋葱啊,本来心情特别不好，听到这歌感觉心情好多了，谢谢,4,2018年5月30日
1132343798,111596281,魅魃,的确是许嵩的风格，却又是不同的味道。,8,2018年5月29日
1132240425,563449902,Alce50,帮我朋友转发,1,2018年5月29日
1132258735,563449902,Alce50,帮我朋友转发,1,2018年5月29日
1132237265,548489068,MWX-梦九,那个转音真的学不来,7,2018年5月29日
1132214850,332019038,小桑小桑,,2,2018年5月29日
1132157800,337748849,一曲离骚人断肠,赏你一个,8,2018年5月29日
1132144509,562886435,你看这世间啊,四个了,4,2018年5月29日
