1364294005,314195021,唧唧_JIJI,名字只是代号，你是谁，取决你自己有多牛逼,769,2019年1月21日
1376360853,348869166,door长,今日私人FM第一首👌,499,2019年2月1日
1378444223,447294415,-在下白某人,当网易云不再给你推荐评论是999+的歌曲了说明你已经是个老村民了,391,2019年2月3日
1365119522,603526942,MichaelHuang0,Mixed by me. 变得更强。,173,2019年1月22日
1376562266,548593056,北玉爱兔叽,今天前男友找我他：“嗨，我是...”我：“滚蛋，老子管你是谁”💁,154,2019年2月1日
1377445830,561264144,卑微蛙蛙在线网抑云,再过3天，中国就会陷入西方媒体和悲观经济学家预测的那样：工厂停工，商店关门，股市无法交易，人们大都无所事事，成天酗酒，打牌，青少年儿童成群结队去讨钱，整个国家仿佛陷入了崩溃之中 那其实是我们在过春节,131,2019年2月2日
1430012837,115073103,绿山墙的安妮ni,找了四五首歌，开头都一样，同样的beat卖给了多少人呀，非常想要纯音的beat,27,2019年3月24日
1666402169,381965811,_憨批小张,好了我找到第五首同beat的歌了,11,2019年10月28日
