13703416,221847,小法Adam,麻痹 当年凭借这首歌！一举成为班级里的歌神。音乐老师动不动就让我给全班唱一遍。。。。童鞋们都听得腻腻的了。。。。 ,5728,2015年3月28日
7171652,35559803,百度云备胎,总觉得他的歌有一股豪气的感觉,3191,2014年12月16日
1133931876,84355677,远方其实不远,记得中学某天的课间操广播：XXX同学为自己的同桌点播歌曲祝愿他的感冒早日康复，下面请听歌曲《死不了》。。。,2367,2018年5月31日
5761252,674260,飞花逐月,2013小齐杭州演唱会，这首歌前奏一想起，眼泪就就出来了，太多记忆，关于小齐，第一次听的歌曲记忆深的就是这首歌，那是小学六年级。读了初中就买了单放机，拿着爸妈给的几十元一个星期节衣缩食，剩下几块钱，周末去买两元一盘的磁带，全是小齐，承载了太多我年少的记忆，太多太多好听的歌曲！,1739,2014年11月13日
6219703,41835644,马庆义,离别的酒容易醉，男人流血不流泪。,1329,2014年11月24日
15474037,2037898,无啦啦又听到一首好抑郁嘅音乐,想起了那个单曲循环这首歌的下午，外婆见我睡着了帮我关掉了音响。您在天堂还好吗？,1260,2015年4月17日
1177935706,324443632,空虚公子与四美,不听老歌是不可能的了，这辈子都不可能不听老歌，外文歌又不会听，新歌又不会唱，只有老听老歌才能维持生活这样子，有空的时候在“网易云音乐”里面听听老歌翻翻评论，里面的老哥，老姐们个个都是人才，故事又多，说话又好听，感觉像回家一样，装起逼来一个比一个像，诶～，我超喜欢这里的！,856,2018年7月12日
10637773,51059194,天才也堕落,许晴的任盈盈太美了！,709,2015年2月12日
42081105,7384951,Lee_仔,小学时听的…现在都快三十了，不开心,669,2015年10月22日
43885460,97660501,草帽影视,和发小最喜欢一起唱的歌，拜过把子的兄弟。初中毕业他就是参加军了，当兵一直是他梦想，一党就当了10年，直到我大学毕业。平时几乎每各几个月就会跟我打电话。现在他退伍了，我毕业三年了，近两年都没联系了，现在他在郑州定居结婚了，而我则在上海。不知道兄弟过的过得怎样...没怎么联系应该过得很好,635,2015年10月31日
1286775887,318629346,黄追声,金庸先生最大的价值，是他为几代中国人创造出一种独立于庙堂体系之外却又与民族精神高度契合的浪漫人格，这种在政治上有所追求又洒脱自由的“侠”的概念，在意识形态层面，让处于庙堂之远的江湖姿态达成精神上的完美自洽。,625,2018年10月31日
12522721,10115322,说好的下一首歌曲,现在的歌曲很少有这样的了，经典不会遗忘,456,2015年3月13日
14261770,58172132,雨渐渐_大到我看你不见,小时候《笑傲江湖》的片头曲，每天早上8点提前开电视听这片头曲，老爸再吵也挡不住，记忆深刻。,344,2015年4月4日
11003950,49727522,卫宫樱_,有小齐的地方就有我,265,2015年2月18日
1663466721,279859324,阮大怪,我以为我的青春是周杰伦，然而回忆最汹涌的是任贤齐,206,2019年10月24日
