6614211,29580362,cyan9826,昆凌的阳光宅男,23938,2014年12月2日
7942448,2979937,Vegas-Yi,在ktv的时候总会点mine mine 然后把我不配唱进去...(杰伦总喜欢耍宝..同样的编曲他非要玩两首歌..所以一点都不违和..) 有兴趣的童鞋还可以试试 阳光宅男和公主病 ， .....霍元甲和黄金甲....第一次听的观众绝对会嘴巴成o型呆呆瞄着你~~~那时候你就尽情耍帅就行了..,11366,2014年12月31日
8195885,30421254,大牛田里水南的一只鱼,搓澡必备，边洗边搓边忘情的来嗨！,9065,2015年1月5日
20597487,56735077,辰有礼,记得那年的夏天我在网吧听着阳光宅男，偷偷喜欢一个男孩 ，在烤肉店打着暑假工 他和我在一条街 ，那时候我胖乎乎的穿着背带裤 ，留着齐刘海，还问他要了电话号码 ，几年过去了5月30他将是她的新郎。新婚快乐💞,8273,2015年6月3日
9317889,40309674,CestLavienne,美特斯邦威終極代言曲。,5798,2015年1月24日
40423909,7508257,李同学j,周杰伦穿美邦像一万块一件 我穿像五十块一件心塞,4095,2015年10月12日
8124997,9740439,看-灰机灰走了,网易多买些杰伦的专辑呀，还有很多专辑都没有,3646,2015年1月4日
9033260,48059341,陈超级拉风,周董新婚快乐,2907,2015年1月19日
136287733,44828995,非礼啦啦啦,讲真 烤肉为什么不能自带水壶,2397,2016年3月31日
59931303,54442590,ChrisZJUNY,周董的歌总有一种很好唱的错觉,1859,2016年1月8日
160137326,37304513,乐坛话事人,听周杰伦的歌必须经历一个……这是什么鬼……这旋律不错……这旋律好听到逆天了……歌还能这样唱……这么吊……杰伦我给你跪了……的过程,1262,2016年5月26日
278194381,82135081,刘亮-L,真正的粉丝，就算他变成歌词，我们也能发现他,821,2017年1月2日
261633474,276213363,蛤啦咻,高高的kuyaodai 搭配着胸口领带黑框的眼镜有好几副 谈笑起来有风度他不在乎我却想哭有点无助现在的我确实有点乃异吾,741,2016年12月8日
1217937961,384608392,9-0-2-9,周董的歌就是灾难，KTV根本无人能驾驭，二十多年了，我从没有看到任何人没有跑过调,585,2018年8月16日
1537118242,103100152,老板来包这样,听这首歌想起来了小学的时候,520,2019年6月26日
1537118242,103100152,老板来包这样,听这首歌想起来了小学的时候,520,2019年6月26日
1274493475,75459944,想一个名字真麻烦呢,哈哈哈,246,2018年10月16日
1217937961,384608392,9-0-2-9,周董的歌就是灾难，KTV根本无人能驾驭，二十多年了，我从没有看到任何人没有跑过调,585,2018年8月16日
1214730335,283357125,真的是地瓜啊,还能评论吗,211,2018年8月13日
1195197645,87790209,带带古蕾娅,每次听不管再怎么不开心也会心情很好Σ>―(〃°ω°〃)♡→,147,2018年7月28日
1146879284,246149636,_MikuFans,有钱人的微笑,153,2018年6月12日
1071772251,391845169,噶头G-Dragon,那不得全买？,173,2018年4月1日
1071324816,121771224,KnMk,还是很喜欢你呢,73,2018年4月1日
1071317017,121771224,KnMk,ʕ•ﻌ•ʔ,52,2018年4月1日
1070984331,312620489,帐号已注销,睡你嘛逼起来嗨！,66,2018年4月1日
1070967065,392616618,Naughtybird,好听的都买,49,2018年4月1日
1070481609,419788231,我在断点等风来,我决定插手你的人生 当你的时尚顾问,60,2018年3月31日
1070446709,76583759,稻花听声,这个有点魔啊...,28,2018年3月31日
1070213880,564643558,熊大俺的午餐铃响了,刚听完麦芽糖接着就是阳光宅男，尼玛嗨起来,58,2018年3月31日
1068866017,305769226,小徐是研究生了吗,16年的时候高考完,14,2018年3月30日
1068823224,118220721,恋爱虽可耻但有用,太暴力,40,2018年3月30日
1068771613,440609311,燃期扬起,〈别当路人甲〉，这个调调似乎有歌模仿了,17,2018年3月30日
1068765628,440609311,燃期扬起,其实不然哈哈哈，比如这首，我就唱得很屎,16,2018年3月30日
1068418693,57275696,要很开心很开心,看了周杰伦女儿视频觉得好听,15,2018年3月29日
1068192717,283875441,TurnRed,哈哈一样的一样的,9,2018年3月29日
