11509354,49130324,AIRY_落尘,化妆师对她都干了什么！！！🙈🙈,2017,2015年2月27日
6944890,10024231,ellva_Lee不加V,网易真心秒杀其他播放器，好了，你们可以点赞了。,1538,2014年12月10日
8230820,16563796,处事不惊s,用来作车载音乐应该是很不错只不过还缺个车,1094,2015年1月5日
27600223,50488004,Zohar_Yo,你们千万不要点进歌手详情，切记切记切记切记,948,2015年7月22日
16269418,64266972,菠菜菠菜菠菜菠菜菠菜菠菜Top123,你们这群屌丝，我不仅有一台兰博基尼还有限量版的法拉利，我天天开着玩，好了不和你们说了，遥控器没电了，我去换个电池，继续开。。,622,2015年4月25日
27170276,52463527,清水煮尘0927,封面告诉我们的其实是不要相信侧重半脸的美照，但是歌的代入感很强 唱得也有气魄，就很棒。,465,2015年7月20日
353130251,115694710,我就是斗战胜佛-哈哈,记得小时候奶奶带我去算命，依稀记得算命先生摸着那灰白的胡须跟我奶奶说：此子命中贵不可言，学业有成，事业有成，一生衣食无忧。后来我用实际行动证明给我奶奶看，封建迷信是靠不住的。,217,2017年4月10日
7353872,2302511,生花生米,车载音乐第一首，每次你无法自拔点火和音乐同时响起的渐进感…让我一档5000转冲出去！,163,2014年12月20日
1186788061,283471469,若水若愚若愚若水,日推第一 聆听入境。。。...ℒℴѵℯ 💖 ℒℴѵℯ 💖 ℒℴѵℯ,20,2018年7月21日
