69123024,106936964,美菱格35657,前男友彩铃，祝他一辈子只有男朋友,16.9万,2016年2月9日
8815845,34316941,greenisland,开头好像what are words,87947,2015年1月16日
23872607,67495956,妙音惊扰心湖,每一位翻唱都能唱出不同的感觉，为毛我们大天朝的翻唱就像Q宠大乱斗呢，姐想不通。,41643,2015年6月27日
47800367,44625400,生某,和杨坤的版本比起来，田震的这一版别有风味,23898,2015年11月19日
15432931,41504959,假曙光,男声只是爱，女声一开嗓就坚定了我学会它的决心,18212,2015年4月17日
63297951,113900338,一条男狗,大学白上了，看到歌曲名我第一翻译竟然是让她滚~~~,16120,2016年1月20日
69533604,110685940,小馬奔腾灬,永远不要低估一个姑娘愿意跟你同甘共苦的决心，不要let her go，爱不是放手，爱是在一起。男人们你们要知道，她要的不是你们想让她去跟其他合适的人给的荣华富贵，而是你，无论是什么样的你她都不介意。没有山珍海味，和你一起喝粥也可以的。为什么要让我走。,11722,2016年2月11日
128939212,125126732,li小胖,对男人来说，最无能为力的事就是，在一个没有能力的年纪，遇到了想照顾一生的姑娘,10223,2016年3月13日
13412287,45852380,陆维luv_baker,我想我把你从我的世界放走时，我也会难过到唱不出歌吧。,8783,2015年3月25日
139692057,43097641,珠儿哇,等我瘦到90斤就去前男友面前唱这首歌,8140,2016年4月9日
1076496747,610999032,tuzzo,我假装无所谓，发现你真的不在乎。,5300,2018年4月6日
8572821,41704549,蓝兜兜的画笔,only know you love her when you let her go,5297,2015年1月11日
608319979,409970693,帐号已注销,异地恋真的很痛苦，对着手机屏幕，她每一次沉默都让我手足无措。她的去意我明白。敬我余生不悲欢，祝你岁月无波澜。,3694,2017年11月7日
1333373564,38075460,红日天涯,男朋友多的男人，女朋友只有一个人,2895,2018年12月21日
1077353978,408189617,孤毒精,闭上双眼，整个脑海都是你。,2107,2018年4月7日
