383097363,292365727,赵对酒,年少不听李宗盛，听懂已是不惑年。未到不惑已入味，是否沧桑早侵身。,307,2017年5月15日
558007300,331793681,李游多,我去，一堆不懂的人。这个是大哥在拍摄央视的一个关于留守儿童的纪录片，而写的一个给他们的歌。什么给那个金智娟的娃娃。什么都不知道就在那里瞎说,260,2017年9月16日
653111650,134052702,恁看俺这网名中不中,年少不听李宗盛，听懂已是不惑年，年少不听林忆莲，听懂已是泪满面，年少不听陈奕迅，听懂已不再少年，年少不听吴亦凡，听懂已是脑膜炎……,135,2017年12月27日
633461658,250474525,老豆腐乳,有些异性不能拿来做恋人，却也舍不得给别人。,106,2017年12月5日
1097210768,305566179,南立笙,274 还有几个月就要去支教了，其实还是很紧张的，在小村里教维吾尔族小朋友，害怕听不懂他们说的维语，怕讲得不好,91,2018年4月25日
1281533068,92695830,露米亚Lumia,为什么这首歌也有人刷年少不听李宗盛听懂已是xxx？？？这句话说多了真是故作姿态，矫揉造作,55,2018年10月25日
