1072518700,246330929,曲肖冰音乐工作室,繁华落幕难敢诉衷肠 昨夜又见当年弃我不归郎,32569,2018年4月2日
1073828145,1317500866,安陆市颜值担当,他说以后科举成名，一定会衣锦还乡，一定会给她捎带些这奇楠香木。还有一定会娶她然后，他千里迢迢来到了这座天下首善的太安城，在千军万马独木桥的科举中成功跳过了龙门。只是到最后，他成亲了，掀起了红盖头，可烛火中的那张娇艳脸孔。不是她他只给那家乡女子送去了“勿念勿等”四个字。,25424,2018年4月3日
1074548174,453428924,看见我请叫我去学习谢谢可爱的你,她熬过了枯叶花黄 眼看春色将近怎知心心念念少年郎不还少年郎嘱托捎信之人 已死于非命只留她一人 青丝变了白发梦中他已回乡 掀起红盖头 瞧见烛火中那张娇艳脸庞 只余一句 “让娘子好等.”,17880,2018年4月4日
1082093344,505353177,三号不见,“此阴司泉路，你寿未终，何故至此？” “适闻有一故人已死，遂寻访至此，不觉迷途。”“故人是谁？”“姑苏林黛玉.”,7444,2018年4月11日
1072528590,95715177,阿辉大表哥,那一刻你心里有场海啸 可你静静地 没有让任何人知道🌊,6692,2018年4月2日
1074625781,532691696,客官来套煎饼果子嘛_,后来发现凉白开喝下去更干净，半夜写出的文字也挺有味道，清晨那碗粥暖胃舒服，痛极后孤立无援的想法更成熟，一路走一路失去也一路拥有，去见你想见的人吧。趁自己还活着，趁她还活着，趁记忆还能将过往呈现，趁时光还没有吞噬你们的思念,6188,2018年4月4日
1087211929,393983599,夜观旭日,唐朝的离婚书是这样写的“ 愿娘子相离之后， 重梳婵鬓美扫峨眉 ，巧呈窈窕之姿 ，选聘高官之主 ，解怨释结更莫相憎 ，一别两宽各生欢喜 ”,5799,2018年4月16日
1073309785,395058536,退后我要卖萌,你的眼睛甚是好看 没有风也没有雨夜 没有星辰亦没有我……,5460,2018年4月3日
1087524450,62624752,老船长不开车只开船,网易云的评论不熟读四书五经都不敢回复了,5091,2018年4月16日
1085188726,397315079,Disquali,多少年后他听说她终身未嫁在那年的雪落时病逝院子里的那棵奇楠香树也被人伐了去几经辗转那树落到了他的手里却见树上刻着：忆君心似西江水，日夜东流无歇时 痛彻心扉,3857,2018年4月14日
1072530713,419175926,野生万仔w,每一个不甘的离开，都是为了最后的归来。,3347,2018年4月2日
1085771377,587801091,梦空悔,他进京赶考，她咽泪装欢。他说：若是我三年未归，你便不要再等她，不做声，看着他远去他依依不舍却也无可奈何……三年之期眼看见底，他终究还是在期限前赶到了。推开门，还是熟悉的场景，还是熟悉的背影。二人四目相对，相顾无言。他看着那微微隆起的小腹，对着她笑了笑，掩门离去，再也没回头,3013,2018年4月15日
1082388032,628656393,坏孩子171027,“希望你一直如少年干净、纯粹、心安看透不美好却相信美好见过不善良却依旧善良 ​​​ ​​​​”,2680,2018年4月12日
1081994392,104328964,有一天晚上你白发苍苍,请问，你是当年的不归郎吗？：（,2575,2018年4月11日
1080270700,340830247,裳柳,我一觉醒转 山河已非 华灯初上 你一定就在彼岸煮一壶茶 等一树桃花,2197,2018年4月9日
