198162401,109018582,黑田将稔,都仰慕少林寺，其实道教才是我们中原正统。历史比少林长多了,3399,2016年8月13日
1068432013,130812713,萨希卜利,冠个道教音乐的名字评论就一片道家仙者，殊不知原曲名菩提明镜，可见众生被表象迷惑太甚。音律表达的内容岂是换个标题能误导得了的？在这讨论细枝末节，未曾研读经典，了解其中奥秘，只逞一时口舌之利？道家也好，佛门也罢，都是修行之道路法门，钻研下去都奥妙无穷，得其一而善终生，何来孰更好一说？,2431,2018年3月29日
367455575,282951331,藤井树爱藤井树-,人道渺渺，仙道茫茫。当人生门，仙道贵生，鬼道贵终；仙道常自吉，鬼道常自凶；高上清灵美，悲歌朗太空；唯愿天道成，不欲人道穷。北都泉苗府，中有万鬼群。但欲遏人算，断绝人命门；阿人歌洞章，以摄北罗酆，束诵妖魔精，斩或六鬼锋。诸天气荡荡，我道日兴隆。,1295,2017年4月27日
129290707,94435237,白云深处有我家,此曲只有天上有，嫦娥也要抒广袖。,901,2016年3月14日
584234886,52317313,maomaocho-,在华山山上的道观听到的！当场用听歌识曲找到,661,2017年10月13日
666920115,87254520,疏雨微澜,生活就是修行的过程，修行，修的就是这颗心，心调柔了，一切就完美了，心清净了，周围无一不是菩萨。一念苦，一念乐，一念得，一念失，不要胡思乱想，一念放下，万般自在，没有谁能主宰你的情绪，要做自己的主人，做个智慧的主人，宽厚。仁爱。快乐。无忧。,624,2018年1月9日
631005324,355703851,有颗小白菜,“师父，此去何为”“荡平倭寇”“若一去不回”“那便一去不回！”,594,2017年12月3日
1338451967,97677492,落落7叶,是的，道观坑起钱来完全不输给寺庙,568,2018年12月26日
331427797,322685605,梦雨惊鸿2,寂寂至无宗，虚峙劫仞阿，豁落洞玄文，谁测此幽遐，一入大乘路，孰计年劫多，不生亦不灭，欲生因莲花，超凌三界途，慈心解世罗，真人无上德，世世为仙家。,453,2017年3月16日
1094580263,250954401,fall666,佛曰普度众生，可没见过渡了谁。 道曰独善其身，可偏偏苦难时出手相助乱世之年。 佛:封闭山门不问世事。 道:率众出山悬壶济世 太平盛世。 佛:普度众生度化世人。 道:归隐山林，参悟道法。,430,2018年4月23日
1079473629,124051901,白兰地__,贵为国教，是为道教。中国的道教已经日趋弱势，但它留给我们的道，依然在影响着我们。纵观华夏历史五千年，而道，又何止上下五千年呐……夏商西周之前的文明，早已伴随着最原始的道，消失在了历史的长河之中。道，本无需多言，修心养性，道法自然。,293,2018年4月9日
128809793,49127788,尽沙,非常赞的一首曲子,277,2016年3月12日
1376084268,622513267,刑天师,万里黄沙不见僧，狂风暴雨掩儒生。三教原本道为首，焉能平坐共齐名。原来这才是本意……,248,2019年2月1日
1336155755,1375747823,老哥180218,道教追求清心寡欲 与世无争 此曲应情应景 有何不可? 你道此评论又为何意? 难道众人皆醉 唯你独醒?,214,2018年12月24日
1298933721,100066204,拉大锯-扯大锯,今天才发现这首歌原来叫明镜菩提。。虽然更喜欢云海林风这个名字，但别人是原版。不过特别开心在原作者那里找到了很多这个风格的曲子～,149,2018年11月14日
