44503769,14281190,王菀青,这个APP确实是集结了一群原本孤独的人,660,2015年11月3日
39648774,36977786,千云_oo,悲催的时候 什么奇妙能力歌 再动次打次也拯救不了我 即便表面越来越开朗 坚强 骨子里还是不可抑制的越来越沉默了 就让一首温柔的歌从头覆盖到脚吧 love always cover us~,247,2015年10月8日
39792512,16493214,-oO龍舌蘭Oo-,我不知道我还能坚持多久，感觉好累了，也好疼，却还是舍不得放手，可能在别人眼里我就是个傻瓜吧，今晚我是留着泪睡着的，你永远也不会知道,179,2015年10月9日
39742792,54203517,山先生丨,这么好的歌应该有歌词,114,2015年10月8日
39764321,50534646,我裤兜旁边还有把枪,欧美国家本来都是能歌善舞的国家，随便来个牛逼的冷门歌手大有人在,107,2015年10月8日
39766346,39594955,睡醒的期待,不难听，但也没觉得有啥特色，要说声音，貌似欧美里面这种声线的好像也不少，具体一下列不出来,84,2015年10月8日
39746765,28686242,想念如果有声音-是否会震耳欲聋,她...她...姓泰勒但唱歌也像霉霉一样好听,70,2015年10月8日
39729789,96247804,大大加菲猫,开口心中箭了,51,2015年10月8日
45666978,102552455,李吉她,戴上耳机，全世界都是我的感谢家长哈尔滨的雪其实也没那么冷,50,2015年11月8日
1270063940,283471469,若水若愚若愚若水,༫日ૃី推ૃី第ૃី一ૃីཎ ℒℴѵℯ 💖 ℒℴѵℯ 💖 ℒℴѵℯ,16,2018年10月11日
1181953340,1498898110,谁会在意n,荆棘和蒺藜必长在他们的祭坛上；他们必对大山说，遮盖我们！,16,2018年7月16日
1222505435,29330164,臆丿,变质或进化 符合谁预期罢了,14,2018年8月20日
