156441359,119545756,拿着房东钥匙的猫,宿舍舍歌，很难想象八个爷们在那唱这首歌的样子,61730,2016年5月18日
17687635,61098410,樱井翼,记得当时微博上有个话题是你觉得哪个明星应该红却没有红起来？当时写了金莎，从蓝菲琳认识她的，觉得长相甜美声音甜美又没有绯闻炒作的这个女生为什么就是不红呀，她的很多歌词都写的很棒声音也好听,60715,2015年5月9日
61532078,110382655,不吐葡萄的葡萄皮,华语乐坛四位既有实力又有美貌，但却不火的女歌手-金沙，弦子，郭静，韩雪,37348,2016年1月13日
66746144,118512165,非常可爱真,“不见你会想你 在人群中找你 找到后又假装不看你” 哈哈哈哈哈哈这几句歌词简直写出了女同胞的心声呀哈哈哈哈哈哈哈,27995,2016年1月31日
6626698,3239387,秦小奋,多灵动的歌啊，你大爷的金坷垃,23243,2014年12月3日
131084522,48139953,Misukz,女生撩汉指南,23220,2016年3月18日
124215021,100686723,濛曦,初二考试之前，哼的就是这首歌，当时太投入，没注意到旁边的男生正在看着我，一转头脸瞬间就红了，可他却淡淡地说，接着唱啊！幸亏跟他还有点熟，不然就糗大了。😜,20717,2016年2月27日
8777446,44729037,卡农家啊,我尼玛。。。开头那两下感觉棒棒哒~~~啊啊啊啊啊啊啊啊啊~~,14390,2015年1月15日
718705772,116582162,-X-u-,还愿，荣幸之至拥有了小哥哥，给我点个小心心可以嘛，祝你们找到爱的人,12407,2018年2月26日
128782993,59482075,团子喵大战糯米喵,歌词其实写的很好，女孩恋爱时的小聪明好萌,10635,2016年3月12日
8170771,39768969,不熬夜不通宵早睡早起,金坷垃的够了？说说它的好处都有啥,7543,2015年1月4日
68783611,61026482,露馅的芝麻团子,特地为星途闪耀来听这首歌,7250,2016年2月7日
73398083,35388423,Jacarandaaa,歌词就是根本散人攻略蛋成仙儿的心路历程嘛,7116,2016年2月23日
71874858,76001423,紀湮,逆袭星途闪耀过来的就我一个吗？活脱脱散宝宝内心写照啊,7043,2016年2月19日
658113863,301711511,阙中玉,“你怎么突然来找我？”“不是突然。”“……那是什么？”“是蓄谋已久。”,5907,2018年1月1日
