2043101,509606,依米花,这世界爱情好多，结局未必有几个，这痛算什么，我在无人的街头，想念着某某，我能给的风度是微笑着默默放开手，我知道你的眼泪只是一种无奈，何必虚情假意的勾勒着未来，当爱已不存在，我又为谁等待，嘲笑命运这幽默的安排，我知道你的挽回只是一种习惯，也曾为难你有多么害怕孤单。,236,2014年2月8日
43577722,35276280,文艺青年爱失眠,我知道你的眼泪只是一种无奈何必虚情假意的勾勒着未来,139,2015年10月29日
39419593,68125298,紫域月,你对我保持距离，却对别人亲切温柔,96,2015年10月6日
38616094,95249276,伴良久久,这是风度的歌词并不是后会无期的,46,2015年10月1日
1684558387,128673338,A7ubo,这是八百万粉丝摇花手的那个汪苏泷？,23,2019年11月18日
16016172,17831568,那年微风中的叶子,相逢即是错过的开始，有的人会一直生活在我们的内心里，却永远消失在我们的生活里，是的，过客就是过客，永远也不可能转正，我们唯一还能做的也许就是在还可以的时光中默默的守候那注定要失去的温柔，待它成熟归来，只要说句:你还好吗？就可以了。只是没有当初的花前月下，何来今日的思君天涯,10,2015年4月23日
