5322471,39339537,Royale,这英语！！我醉了！！没想到岛国居民还有讲英语这么好的。。这歌也是很久以前的了吧。很赞！！,28468,2014年10月30日
22894348,36373547,Asterisk_,日本人读不好英语的原因是学渣们吧英语当成罗马拼音读了，学霸们寡不敌众也跟着这么读。所以读成这样都是学渣啊不，都是时辰的错,22696,2015年6月20日
8500285,40422595,iKaworu,我也想起霞光！精灵世纪好棒QAQ,17394,2015年1月10日
12020258,52584414,也罢YeBa也罢,这个外国人日语说的真不错,13637,2015年3月6日
33626914,45547344,Flower_Mio,有里知花＋花泽香菜＝有里知花择香菜,12126,2015年8月29日
7428883,33724213,帐号已注销,这英语发音在岛国人中绝对是中上,8752,2014年12月21日
8767328,20637161,普鲁士蓝的肖像,好熟悉的调调!忘记哪里听过。。,8099,2015年1月15日
124255849,104675957,鹤叟_,以前玩奥比岛的时候叮咚小溪是这个前奏,6616,2016年2月27日
8250160,34142479,东之火木,还有人记得霞光！,5378,2015年1月6日
8198635,33724213,帐号已注销,我觉得霞光和这个也很像。,4267,2015年1月5日
10488971,33330957,从圣托里尼游泳过来的酸奶大人,明明就是上！,2877,2015年2月10日
150276449,271976347,闻救酊,她的声音甜美而轻柔，被评价为“有忍不住让人驻足聆听的特质。”而幼年时在夏威夷的生活经历和大学所学的语言专业，也使她的英语发音毫无日本人的生涩。这首歌混合着英语和日语，浑然一体，切换间毫无违和。特别适合夜间闭目聆听，在舒缓的听觉氛围中安然睡去。,2676,2016年5月5日
59712532,94269398,淳朴哥谭镇的一天,海角7号。。,2129,2016年1月7日
124542676,74809062,春野日照雨,小的时候听到的这首歌，局限于当时的科技水平一直找不到，现在记忆都模糊了，若不是在网易与她再次邂逅，恐怕这段记忆就被封存了吧？,1845,2016年2月28日
1586237623,1340850566,帐号已注销,这是我在一个账号已注销的人那看到的歌，他的喜欢只有这一首歌，但这一首歌播放了71444次，也不知道他在生活中发生了什么困难，唉,842,2019年8月7日
