15089732,57137209,TiexuPushu,酒驾驾，酒酒驾？,2309,2015年4月13日
16812411,20542863,Dangerousmuse,没人觉得开头皮叔唱的tchu tchu tcha很萌吗,1640,2015年4月30日
27716788,74175833,你的拾贰啊,其实就是啪啪啪的意思,1036,2015年7月23日
7515085,25046461,骚墨骑士, 皮叔 安叔 是 好基友,554,2014年12月23日
14403730,42897238,哔哔啵哔啵哔,俩声音磁力发电站,352,2015年4月5日
9038142,45475330,Maykong,這首洗腦歌，第一次聽，是一個朋友在一個下雨夜晚車裡播放然後告訴我皮叔的存在...於是乎我這一年每一次力量訓練都播放皮叔的歌...激情無限啊...期待3月21日香港pitbull演唱會,302,2015年1月19日
12034413,37358868,徐某的目标是拯救地球,So let ’s take a sip of that Voli and unwind and let me fuck u blind那么我们喝着小酒，让我们闭上眼睛的操,228,2015年3月6日
434842758,17691798,看似星辰又若风,皮叔小火车来~~~~~~~~呜呜呜呜呜~~~~~~污污污污污污污~~~~~~污污污污污污污污~~~~别问我啥是SM 失眠你不造么？,223,2017年6月10日
592269877,287389626,卡尔-0416,pitbull 和 enri iglesias 的声音真是完全对接很好听😊,74,2017年10月21日
1390136589,432559431,808neverfind,宁愿酒驾，不要囧架(ノ๑`ȏ´๑)ノ︵⌨,10,2019年2月14日
