138910518,123000437,大福蝶v,杰哥，给我力量。我要考湖南大学～～～等我研究生复试结束，一定要去听你的演唱会。。。,2593,2016年4月7日
241497575,71418122,Ymiar,年轻一代心情不好的时候应该多听听张杰，而不是矫情的听唱什么都像唱自己的那些情歌,1231,2016年11月5日
246773143,309390976,紫色薇恋,2017年12.24我研究生考试，加油！！！！,1215,2016年11月14日
273451391,284085965,原来是杰哥乀,很多人说周杰伦是青春，对我来说张杰的歌声却是一辈子！,937,2016年12月26日
269522627,288308021,Aaron122,因为前女友，黄培育，喜欢上了张杰，陪你看歌手里的张杰，陪你看张杰的演唱会，陪你关注张杰的一切。如今你已不在，张杰的歌还在，谢谢你，也谢谢张杰。,729,2016年12月20日
221091674,302946303,Caiiiam,真的比原唱更有励志的感觉。杰哥的高音真心牛。个人观点。,592,2016年9月28日
258462195,305534639,史吉丰宇Puth,现场版能唱这么高这么好，每一次听都是一次震撼。,243,2016年12月3日
1474751763,1653234139,_approaching,♡不要允许一张试卷否定你十几年的努力与坚持.送自己一份最好的十八岁礼物♬,197,2019年5月2日
1546854991,571286033,Alittesweet,今早老爸送我去火车站，车里放着这首歌，听到高潮处我拿出手机来录了段视屏。老爸突然说他永远不会忘记这首歌，93年他只身外出打工时在火车上听到这首歌，当时并不知道这首歌的名字。我辛酸了，仿佛看到奋力拼搏的18岁少年（老爸），还有17分钟我也即将踏上追逐梦想的火车，我一定会如年轻的你一般拼搏,100,2019年7月6日
1617897791,426126132,晓dhe,我不高攀有钱人，因为我花不到他的钱，我不小瞧穷人，因为他不靠我生存，我不巴结有权人，因为他不会白给你帮忙，我不奉承得意的小人，因为他不入我眼我只相信，一是：跟我同甘共苦的人，二是：在我跌倒扶我起来的恩人，三是：在我一无所有依然对我，不离不弃的人，人生苦短哪有时间虚伪,93,2019年9月2日
2602903,13825643,小豪音乐,你是不是像我在太阳下低头，流着汗水默默辛苦的工作，也不放弃自己想要的生活，一次一次徘徊在十字街头，我认真的过每一分钟，我的心跟着希望在动。,93,2014年5月2日
1458356538,1393627921,司晔-y,距中考还有五十七天，最近成绩一直都不理想，但是我还是坚持每天努力，我相信最后的结果不会辜负我的，正去杰哥唱的，我的未来不是梦，我认真的过每一分钟。加油,92,2019年4月20日
1396462100,614843606,乘云之鹤荣德_骚气神父,这位星星 湖南大学考到了吧？,62,2019年2月19日
1371171535,311499774,XxXiaoBo,张雨生是一个时代的开启,58,2019年1月28日
