10232621,41133164,木子熙,听别人说你结婚了，日子过得不好也不坏，挣钱不多，忧愁不少，大风天依旧感冒。关于这些，梦里见我，你都没说。,5307,2015年2月7日
363837998,126214364,春风十里_EO7F,昨天结果出来被告知肝癌晚期，专家说最多还有八个月的时间。家人还不知道，一瞬间特别不甘心，也很无助，我不怕死。只是放不下太多，特别是她，分手有段日子了，昨天回答你的问候说不关你的事，从来不哭的人偷偷哭的撕心裂肺。你说分手的时候我说要我忘记你除非我死了，命中注定了，对不起我不能坚持了,3230,2017年4月23日
64539972,34418423,我不过是只肥硕可怜又无助的猫咪,今天捡了个华为手机 我把它还给了失主 其实 我爸爸还没用上智能手机 周围人都说自己留着用 又不是偷的 我犹豫了好久 还是觉得不要袖手旁观 我做的对吗,2671,2016年1月24日
145930234,3136692,TOHO,给某人的酒醉跑调版生生听哭了,879,2016年4月25日
7493186,45047963,朝九,我拿什么条件可以袖手旁观，除非你说 离开我你从不曾觉得遗憾。,764,2014年12月22日
168110590,522349,东瓜,不好意思，我听不了张宇的嘶哑苦情，听不了萧敬腾的含糊不清，也听不了李健的痛彻心扉。我只喜欢齐秦的平淡中的无奈！清亮的嗓音无人能敌！,737,2016年6月13日
365162588,35532724,LONER-----,真正的爱情不是一时好感，而是明明知道没结果，还想要坚持下去的冲动，我知道遇到你不容易，但是我更知道，错过了你，我会心碎，所以我想抱紧你，一刻都不想放开。,417,2017年4月25日
363438627,117578639,窦一波Vincent,张碧晨在舞台上唱这首歌，底下的萧敬腾和李健老师都翻唱这首歌，但是个人最爱的是张宇的那个版本，唱出来撕心裂肺的感觉！,395,2017年4月23日
147353509,102318256,颦儿-Babyface,人生就像心电图，必须折腾起来-by 🐳,316,2016年4月29日
10009098,3308154,-波普bobo,我秋裤男神这周唱这歌拿了第三！不用谢！我是雷锋。,242,2015年2月4日
145916094,101249445,xixi_sang,护鲸团团员前来报道，心疼鲸鱼大sa子,227,2016年4月25日
363065886,387558419,叶七_i,不知道为什么还是最喜欢张宇的版本,122,2017年4月22日
363986421,81941974,Hey伊小妞,真的不懂为什么有的人喜欢比较高低，明明是两个不同的歌手不同的嗓音不同的歌风却能说出个第一第二来。,104,2017年4月23日
145672206,117520373,懒羊羊迷路了,为🐳而来，，我不管🐳是为谁而唱为什么而唱，我只希望他不是带着哭腔唱的大sa子这么忙要注意身体要多一点开心。。(当然要是为了唱的我估计要上天💗),72,2016年4月24日
363315167,358150803,蓝瞳山海经,正在听歌手张碧晨版的,70,2017年4月22日
1166600705,300855223,你是梵高先生吗,砖家的话你也信,8,2018年7月1日
1166484825,1481613531,梨园扫地生,挺住，加油兄弟,3,2018年7月1日
1164917819,77396766,PINKpity,多希望你是骗子,12,2018年6月30日
1164853780,5676355,cherryhook,你最近好吗？我想你了。少抽点烟，你胃不好，熬夜了记得吃点东西再休息。你不是已经拉黑我了吗？为什么还来浏览我？是有什么话想说吗？我什么都不想要，甚至不想要你，我只希望你好好的。如果非要有一点私心，那就是我想你了。,3,2018年6月30日
1164831327,1404707645,小西几消失了,我觉得齐秦的声音意外的清亮啊,2,2018年6月30日
1163989049,443127464,Lynne1224,很多同道中人啊！被黄有人的醉后哭腔版感动后，跑来听原版。,4,2018年6月29日
1163975103,443127464,Lynne1224,B站有,1,2018年6月29日
1163973149,443127464,Lynne1224,那个人不会姓黄吧,2,2018年6月29日
1163623457,251575731,那越过山丘,有谁记得这首歌是唱给王祖贤的。,9,2018年6月29日
1163146031,38780437,Escapelonely,很想把这种情感表达出来，可自己唱得不好，表达不出来。就觉得辜负了这首歌，辜负了自己的情感,1,2018年6月28日
1161708240,610183546,来馹可期,兄弟 务必回我消息 告诉我你挺好的,3,2018年6月27日
1160940159,98980042,小Ma囧,只要你的世界还有我，你的好坏我怎能袖手旁观？自己过得好坏哪有你的幸福重要？但我对此却无能为力，所以，我们就消失在彼此的世界里吧，以免再心生涟漪。,1,2018年6月26日
1158426518,310226878,iwebber,兄弟加油,0,2018年6月23日
1158326231,134128206,还是别傻了,为什么只闭上一只眼哈哈哈,1,2018年6月23日
1158309752,408128709,青玉糖,b站,0,2018年6月23日
1158030182,1299431299,111yiye,想知道在哪儿能听黄老板唱的,1,2018年6月23日
1158051610,1299431299,111yiye,听说景瑜喜欢我来听听，有喜欢🐳的小可爱么,5,2018年6月23日
1157943158,109132349,0Nevada,你还好吗,0,2018年6月23日
1157064270,528307327,安苏小桂,遗憾,0,2018年6月22日
1156012081,334250232,是小咸鱼呀-,高中时喜欢听的歌，听着歌像是在听曾经的故事,0,2018年6月21日
