29582285,81188886,酬清茗,刚从B站花样虐狗团手下逃出,362,2015年8月4日
12110860,35719523,gallonyin,这首歌是不是非常好听，点赞上去,346,2015年3月7日
16378994,59801774,iris努力喵,相当悦耳的曲风，应该说歌曲本身的意境高于字面的理解。歌德说过，“道德纯洁的少男少女的初恋，“永远趋向崇高的目的”。”这是一种精神上亲近的需要，纯洁的爱。整首歌曲演绎出内心患得患失，越是思念越觉得痛苦，想要把满溢的思念传达给对方。初恋与真爱并不矛盾，只在于如何守住这份美好的情感。,256,2015年4月26日
29556323,54361955,狐狸的仲夏夜之梦,B站来找那个吻戏的BGM,153,2015年8月4日
29578517,56319959,滚滚本尊,B站观光团路过！,120,2015年8月5日
28857725,80702159,忧郁的怪物痷,还初恋呢，我们班同学特么都谈了 我还孤身一人，不是太丑，而是没喜欢的人（单身狗）狂哭,106,2015年7月31日
29607103,32552434,帐号已注销,av号：2673422 走好不送，请自带回血法师！！！,89,2015年8月5日
18061151,48153875,又想吃奥利奥,初恋啊，脑袋里瞬间出现了业君那张吊儿郎当且带着笑容的脸，果然我还是喜欢邪魅型的那种,79,2015年5月12日
33957137,41803157,是Kyle不是Kylie,B站吻戏虐狗的小伙伴们，让我看到你们的双手,55,2015年8月31日
30219559,49731961,迦勒底御主辉,刚从单身狗大屠杀逃脱(ಥ_ಥ) 据统计有30多万只单身狗身亡……,50,2015年8月8日
