1520361495,313477545,严书_,信仰不灭，灰烬重生,1006,2019年6月12日
1544718265,567147383,丞哥吖_,“各位同学，我希望你们从今往后能谨记，比金钱更珍贵是知识，比知识更珍贵的是无休止的好奇心，而比好奇心更珍贵的，是我们头上的星空。”――priest《残次品》,847,2019年7月4日
1520388052,313477545,严书_,提前祝p甜甜0613生日快乐，愿甜甜永远开心，笔下生花❤,694,2019年6月12日
1520416709,556578224,子无余,P大生快❤️ 制作组和女神们辛苦了！！,387,2019年6月12日
1520433760,97690617,池年_,滴！后排参唱卡！,278,2019年6月12日
1520536396,85221870,林斜阳,祝甜甜生日快乐~~~,254,2019年6月12日
1546627178,637311672,奈春生瑰丽,我到了淤泥深处，捡到了一颗星星。——《残次品》,242,2019年7月5日
1520548189,529049707,嫏华_,灰烬重生，信仰不朽信仰不灭，灰烬重生表白各位制作组的老师太棒辽,205,2019年6月12日
1520539243,313477545,严书_,感谢各位老师陪我造作，永远爱你们,199,2019年6月12日
1576686496,1383371832,北烁烁烁,晨光起于白塔尖顶，终将铺满阴霾之地。——priest《残次品》,191,2019年7月31日
1633942623,1514378740,独自恰柠檬的少女,我本可以容忍黑暗，如果我不曾见过太阳。然而阳光已使我的荒凉，成为更新的荒凉……我啜饮过生活的芳醇，付出了什么，告诉你吧，不多不少，整整一生。,182,2019年9月21日
1571800975,631874310,小韩源子_,又是站错攻受的一本书，为爱做零林静恒，爱死甜甜了,180,2019年7月27日
1568157202,417432096,拦鹤,我如此恨着温柔到残酷的人，可我又是这么深爱着他。……林静恒，我如此的热爱你。,152,2019年7月24日
