458351695,125335181,夜魅幻影,原歌曲下架，我再将我的原评论复制粘贴回来。。。恭喜摩尔多瓦夺得2017年欧洲歌唱大赛季军，这是摩多参加欧视以来的最佳成绩！10年跌倒了17年站起来😂PS：暑假期间我有时间的话会将SP的其他歌曲上传到曲库，毕竟近几年参加过多次欧视海选，作品还是蛮多的。,18426,2017年7月2日
1054247196,397307047,套套马-,说了多少次！晚自习不要放high歌！,13892,2018年3月15日
1052509756,61521426,陈晓迟Arvaniath,火车王双力代无面打得不错，巴内斯蓝龙双月火横扫为所欲为，沟渠潜伏者大螺丝我就是力量的化身、安薇娜王库恩巨型克苏恩听仔细了、火车王双冷血刺骨大范隐藏胜利属于兄弟会、放狗双杀戮你将成为我的猎物、芬杰领军冲锋鱼人乌拉乌拉、光耀元素翻倍心火一jio入魂，屈服于暗金教的真义吧，圣光背叛了我！,9007,2018年3月13日
595484657,61521426,陈晓迟Arvaniath,火车王力代无面，巴内斯蓝龙双月火横扫，沟渠潜伏者大螺丝我就是力量的化身、安薇娜王库恩克苏恩、火车王双冷血刺骨大范胜利属于兄弟会、放狗双杀戮谢谢你、魅影歹徒进化嗜血打得不错、芬杰领军冲锋鱼人乌拉乌拉、光耀元素生命翻倍翻倍心火一jio入魂，感受暗金教的真义吧，圣光背叛了我！！！！,4301,2017年10月25日
1050249147,391177176,幽梦被注册,并非所有流浪者都迷失了自己，维纶双震爆。我是！火车王！ 火车王力代无面。我就是魔法的化身！ 巴内斯蓝龙无面双月火。让火焰 净化一切！AV娜王库恩螺丝真菌无面大表哥。圣光会制裁你！光耀元素翻倍心火。圣光的正义失败了！小熊猫大富翁天启四骑。用鲜血与暗影铸造的假货！末日守卫魔块契约。,1636,2018年3月11日
1448446525,561693827,Nanycle,满脑子的RFB在那吹萨克斯,1430,2019年4月11日
1276139359,122374113,鹿岛祈明,力量本身并不可怕，可怕的是七费发明家十费AV娜和跳币上两费法力龙。（来自平衡修改前的怒吼💩）,942,2018年10月18日
1628805868,339455384,郭西西08,放啊 不然我就睡着了,691,2019年9月15日
