133245132,123048797,小龙女Fingerstyle,如果艾薇儿来中国开演唱会谁会是和我志同道合不惜一切赶过去的人单纯因为对薇薇的支持而不是为了陪伴我我不需要身体的陪伴我需要灵魂深深地孤独NO ONE,3673,2016年3月24日
8068008,31916020,米高积臣,我不知疲倦的奔跑着，只希望追回那个曾被妳寄予厚望的自己。,2503,2015年1月2日
449511699,63200797,shootthemoonnn,So many questions but I don't ask why 讲的是我学习的状态,1345,2017年6月24日
7366302,32345961,313元气柚,说句题外话：有木有和我一样觉得《绿箭侠》中奥利弗的妹妹 西亚 长得像艾薇儿，感觉声音都像呢,1098,2014年12月20日
11442086,41861865,错过的时光遇见你,一直很喜欢这首歌，不应该是爱到不行了！感觉他能诉说出无法用言语表达的心声！,1043,2015年2月26日
636053189,310987275,HJD25,有多少个和我一样喜欢艾薇儿的男生？？,899,2017年12月8日
22247275,30015077,Fiber_,沧海遗珠,875,2015年6月15日
14928403,19931432,深蔵功於名,永远的艾薇儿。,619,2015年4月11日
1091618298,388684079,我叫仙女飞_AL,这首歌是我听歌排行第一名。循环六百多遍。从开始的看歌词跟着学到现在闭着眼睛就能跟着唱。有人说你江郎才尽说你的时代已经过去。我不管格莱美欠你多少奖杯。也不管多少人因为你的歌入欧美坑现在又翻脸不认人。我只知道你一直是那个做自己喜欢的音乐做真实自己的艾薇儿。我的薇，我的女王！👑👑👑,496,2018年4月20日
16518997,44323073,帐号已注销,私人fm这么大图～让我看到好美的薇～,408,2015年4月28日
1362375425,282739413,侯九日_,其实这张专质量高的吓人,326,2019年1月19日
1088190732,330380600,游戏玩不好的少年,我是矮，我是丑，我是自卑到了骨子里，但那又怎样呢？从现在开始跟过去的一切说再见，重新开始，为自己活着。,302,2018年4月17日
7584169,9087797,128_,你一说就觉得好像～,248,2014年12月24日
9272459,39835716,突然想笑233,100,207,2015年1月23日
659439205,606330885,-avrillavigne,沦陷。听前奏就整个人融入其中的高潮部分更是不可言喻的美再配合上艾女士的声音美到不可方物♡不需要mv也那么动听,203,2018年1月2日
