11862630,41199645,有你在啊,集…你有读过《善良的国王》吗那个国王非常善良…]他把钱分给大家…还把土地分给大家结果，整个国家都不复存在…了虽然大家都责怪这个国王…可是我…非常喜欢这个国王大概…这就是我的初恋吧集… 很像那个国王…因为太善良…搞得自己走头无路 我觉得…集，一定能够成为一个好国王 所以…,20261,2015年3月4日
5820544,18158952,林克_酱,动画是部不错的音乐宣传片，这是肯定的,11600,2014年11月15日
24836676,55227348,结论鸽,其实这个动漫很真实，最初的懦弱，得到力量的迷惘，对自己喜欢人的误解，朋友的背叛，心灵的黑暗，最后的后悔，拿到主角会一直不变一直被人所喜爱吗，那样有和意思，好真实的动漫为什么不喜欢呢，结尾不一定完美才是最好的。。。,10663,2015年7月3日
6525310,33352402,刘玥灏特可怕,想起大学躺在床上，一个人一口气全看完，时光啊,3789,2014年12月1日
34149524,88068906,路明非爱绘梨衣,其实最后祈跟集交换交换了一切她来背负集逝去的性命与罪恶，集来承担祈的思念与没有光明的双眼…明白的有几个人呢…,3690,2015年9月1日
66949263,70741389,网抑云8号病床主任医师,番很烂吗，有一群人是这样的，大家说这个番很烂，那就很烂，我不能不合群不是，大家说这个番神作，经典，那就是经典，我不能特立独行，不然显得我很鱼唇，第一个人说很烂，没看懂，第二个说很烂，没看懂，第三个说还行，你们说烂也还好吧，第四个说大家说很烂，听大家的没错，那就是烂。,3257,2016年2月1日
5685779,197093,Joesn余志聪,这ed依然时常能够给我很揪心的感觉😢,3021,2014年11月12日
241662378,118050129,u9-13month,你能想象一个把王冠当做本命番的人看到一堆人说王冠不好是一种怎样的心情吗。这就好像别人在你面前指着你女朋友说她真丑一样的,2844,2016年11月5日
69303292,85393202,墓荒少年,_(:з」∠)_不认为是烂片，谁说结局不完美就是烂片了？人人都有自己的观点，我觉得有一个令人印象深刻的结局就是一部好番_(:з」∠)_,2283,2016年2月10日
6692870,45214144,green_day,陪伴我度过高三时光的声音。,1460,2014年12月4日
55568170,82635894,花花花花猫咪,我没觉得罪恶王冠烂尾。后面的剧情发展确实有点中二过头的莫名。但不至于遗憾。不可否认它带给我的感动。祈妹美如画，集王温柔如斯终会崩坏。官二代和小豆丁也好萌的说。,1428,2015年12月22日
1357188493,515635133,红烧猫猫头,集集国王哈哈哈,1229,2019年1月14日
6171328,7039645,toiletduck,歌好畫面好，劇情有點幼稚,1147,2014年11月23日
1338492021,1619607968,秋雨啡,所以集，也会走投无路对吧。,952,2018年12月26日
