127867522,45984914,陪你去巴黎Z,只有在我之下的人才会忌妒或憎恨我。 我从未被忌妒或憎恨过；我不在任何人之上。 只有在我之上的人才会表扬或贬低我。 我从未被表扬或贬低过；我不在任何人之下。——纪伯伦《沙与沫》,1254,2016年3月10日
61892898,109473567,泽zex,好想把这种甜蜜 轻盈又满足的感觉唱给她听😆,526,2016年1月15日
129973823,62809965,aminra,婚礼曲又get√,332,2016年3月15日
30331950,33805349,一个人的606,B站康诺党前来报道,201,2015年8月9日
11069985,55041832,鱼余鱼余鱼,很适合做起床铃声啊,197,2015年2月20日
1083116622,442907232,帐号已注销,我多想拥抱你可惜时光之中山南水北可惜你我之间人山人海,81,2018年4月12日
1341875631,496648877,土申m,连对象都没有开始操心婚礼用什么歌了,62,2018年12月30日
1427369957,44555646,Chhaya5241,我要结婚啦！👰,54,2019年3月22日
1164468374,254791601,星盡,為什麽是你？答案很長，我准備用一生來回答你。我會用一生愛你。,48,2018年6月29日
1250190903,480325002,今天早睡了吗Omg,我的马鸭真的是超甜没错了！！先悄悄攒着好了 等到有喜欢的男孩子了 就分享给他听嘻嘻嘻❤️❤️❤️,12,2018年9月20日
1067558810,376020575,zzzz_yl,早晨的阳光，叶脉上的露水，午后的咖啡，烈日下的雪碧，傍晚的夕阳，落日时的晚霞，夜晚的霓虹灯，深夜的圆月…世界真美好。,10,2018年3月28日
