1091161874,489720815,我不想逃离,他们的音乐，你可以不喜欢。但没必要抱着恶意去冷嘲热讽。音乐从来没有高低贵贱，却因为一群无聊的人，为了自己并不存在的逼格和优越感，生生划出了三六九等。 这种人，本来就从不懂音乐。,30633,2018年4月20日
1091119760,123573316,没有八年了呀,也许是趁酒壮胆独上青楼耍了风流也许是一眼望去为之惊艳囫囵吞酒也许是将错就错屈膝对拜褪下衣袖也许是一枉相思觥筹交错却没敢留也许是轻言承诺趁着酒意要带你走也许是独坐高楼粉黛渐淡不胜春秋一遍又一遍听的是爱情情仇忘不了的是那时风流,15506,2018年4月20日
1091147692,364083212,粉涩小王子,之前听过古风加嘻哈已经觉得非常惊艳，现在李良组合的戏腔加嘻哈啊啊啊啊啊真的可以说是精品了!两种元素组合的可以说是一个标本了吧话说玉刚的戏腔越来越御姐听我的莫名脸红是怎么肥四？？Σ(っ °Д °;),13371,2018年4月20日
1095837029,502447342,她说听他说她,希望我有生之年能看到心中的三行情书作词 许嵩作曲 徐良演唱 汪苏泷,12143,2018年4月24日
1091099275,493234185,可以吃柠檬吗,戏曲已终 姑娘为何还未卸下艳妆 他还没来,7334,2018年4月20日
1091829963,552514114,凉城以北是尾以无声的海,其实一直都挺喜欢徐良的音乐的，但是身边的人认为那很非主流，为了显得自己不落俗套，然后渐渐的我不敢明目张胆地去听他的音乐，只敢小心翼翼地在某个无人安静的角落里听。你看，谁说他人的眼光对人影响不大的？敢问没有人跟我一样，本来喜欢一个人，却因太在意他人的目光而只能把这份喜欢埋藏心底？,6923,2018年4月20日
1091338228,538372647,一腔孤勇XL,“听一遍是寻花问柳，听两遍是环肥燕瘦，若是听得多了，就只剩下爱恨情仇。”,4661,2018年4月20日
1094026580,356581312,莫名违规,戏剧与嘻哈、大俗与大雅，谦谦君子与嬉皮笑脸，一个美如玉，一个皮如狗，啧啧。歌词一分为二，戏曲一本正经，说唱放荡不羁。正经的要一板一眼有深浅，放荡的要不拘一格不要脸。那些写烂了的中国风措辞一个也不用，词得是别人没见过的。戏曲的尖团字和上口字都唱出来，曲得是别人没听过的。摘自徐良微博,4239,2018年4月22日
1091621526,317501467,我已无力战斗,从来没想到徐良会和玉先生合作。这个对我而言是很惊喜的。这首歌 讲诉了花魁与书生的故事。歌词很好 徐良在微博也有解释，而且 能和李玉刚合作 想必受到了李玉刚的认可。总之 对这首歌很喜欢。,4149,2018年4月20日
1092218779,355491181,赵大雄_,两个风格迥异的歌手，碰撞出了一首“花魁”。李玉刚的声音出来的一瞬间确实惊艳到了，这可能就是音乐的魔力！,4111,2018年4月21日
1096965674,469752738,刀错_,大家介绍徐良，那我来介绍一下李玉刚老师吧。李玉刚，中国歌剧舞剧院国家一级演员，曾在维也纳皇宫、悉尼歌剧院开过个人演唱会。主演作品大型歌舞诗剧《四美图》在国内外巡演近百场，自导自演舞台剧《昭君出塞》2015年在北京巡演四场，预计2018年重启。导演作品《般若号角》音乐会巡演中。,2868,2018年4月25日
1091888912,452056666,-晚安顾奈-,这首歌真的很惊艳，听第一遍也许觉得没有很好听，但是越听越觉得上瘾。,1939,2018年4月21日
1091843301,331478968,公子长畾畾畾,清风 锦绣 舒展 如常 闲愁 衣袖 欢羞 香叠 几秋 霜发 青楼，这些词李玉刚唱得太好了啊，口能吐花吧٩(˃̶͈̀௰˂̶͈́)و,1565,2018年4月21日
1105055656,647540305,Hail_Heroes,……这……贵妃又喝假酒了……？,1446,2018年5月2日
