13241226,42692328,VivaForever,想起在衡水高考的时光，当时的班歌，每天都要唱，唱出来声音都是哽咽的，为了未来而拼搏的时候，没有退路，就只能高飞，到那最高最耀眼的地方去。。。。,11802,2015年3月22日
13229414,34279051,爱睡觉的天然熊,在上考研班中间休息的时候，放的就是这首歌！好听，又振奋！本来很累，我又认真的听课下去！希望今年的12月！我也能到达没人能到达的绝对！我希望所有有梦想，并执着坚持的人，都能坚持下去！最终梦想成真！,5199,2015年3月22日
7075621,38648743,四川麻美,前奏是直接剪的《突然累了》么.,2505,2014年12月13日
17096120,63356737,会飞de猫,虽然已经大二了，但每年到高考的时候，心里总是莫名的激动，只是因为曾经也为之奋斗过，加油，即将高考的孩子们，高飞吧！,2293,2015年5月3日
9316034,38095155,帐号已注销,加油，考上大学,1620,2015年1月23日
8503882,33669430,鹿先森哈,每次倦了，累了，打开手机，单曲循环，顿时一切的不悦都随风而逝，满满的全是坚毅，感动，身上充满了力量，大爱（高飞）,1255,2015年1月10日
16342422,60702568,仲夏无梦,真的很赞啊，中考就是听着它考上了师大！诶……很难有一首歌能真正进入我的心灵，它算一首！,1165,2015年4月26日
17063443,65786196,菜菜_QAQ_,还有35天。加油！,934,2015年5月3日
11454177,54363197,梨涡二叁,军训那会儿，在塑胶跑道上天天放这歌，听到前奏就觉得不累了,731,2015年2月26日
129144563,8857763,Amen464,一看是文都的哇,661,2016年3月13日
127689149,111269098,阿程程程Sir,五年级第一次听这首歌，现在高一，我已知道我需要高飞,555,2016年3月9日
128010847,79069978,ABSmessi,2014年世界杯期间我们班的班歌。那时候觉得歌词好像是写给梅西的，可惜他一路飞，却在终点之前跌倒，我还是没听到你在灿烂瞬间的呐喊，只记得你那充满无奈与不甘的眼神,554,2016年3月10日
126431537,15912234,瑞希爱画画,文都考研课间休息听到的,352,2016年3月5日
