7276635,41541866,第丶二人称,曾经去下载这首歌，给那个老板说等一分钟，然后他等过了一分钟，问我下什么歌,1899,2014年12月18日
29240175,30590700,Rex-,我会向自己寄拖鞋.......一首歌被我听错五年.........,807,2015年8月2日
28844846,77427277,你还在就好,07年，这歌火的不行。那年16岁的我遇上18岁的你。每晚上网到凌晨三四点等你下班。时隔8年，当这首旋律响起，脑海就会浮现你玩劲舞团时天真的笑颜！你还好吗？上岸了吗？致我曾深爱的失足少女。。,763,2015年7月31日
1637452,2325068,飞飞飞飞啊呀,曾经是办公电脑里的唯一一首歌，不知是谁把它放在共享文件夹里的，偶尔在忙碌中停下来，播放它，耳机里便是另一个世界，这首连歌手都不认识的歌不觉在心里扎了根，听着莫名悸动。,417,2013年11月14日
31824666,85937325,荌寕,好听的话，就点一下赞,391,2015年8月19日
12321708,55670555,纷落驶过,真是够了。 太好听了。 听见这个歌都害怕，因为它让我迟到很多次，它曾经是我的闹钟铃声，起床时等了一分钟又等了一分钟，就是特么不起。。。,333,2015年3月10日
57383732,67241516,加块糖吧,徐誉滕的这首歌是写给任贤齐的，由于版权问题没有被经济公司选用，徐誉滕自己开唱～,309,2015年12月29日
25870690,52819891,遇见你是个美丽的意外,结婚那年流行的歌，和他同时用过做为手机铃声的一首歌。我已为人妻，他已为人夫了，一切都变了。,241,2015年7月10日
72063175,44173479,风蓝了,印象里好熟悉的调儿,222,2016年2月19日
66435194,62551908,白日和梦,这里不是掌盟，别带坏风气来.,148,2016年1月30日
19347887,10204290,桔梗芝麻,满满的空间日志感。,144,2015年5月24日
70528854,134077526,藏经书,一分钟一万年,117,2016年2月14日
71179026,90806700,解决各种电脑问题,回忆,93,2016年2月16日
12734175,34242573,我也来学北野武走步,怎么不火,79,2015年3月16日
12960796,38242804,美咯迪,调子非常优美,63,2015年3月19日
72063175,44173479,风蓝了,印象里好熟悉的调儿,222,2016年2月19日
71179026,90806700,解决各种电脑问题,回忆,93,2016年2月16日
70528854,134077526,藏经书,一分钟一万年,117,2016年2月14日
69914814,133830756,执着是傻,怀旧最爱,48,2016年2月12日
69922744,133830756,执着是傻,怀旧最爱,33,2016年2月12日
69557977,130673770,千山醉暮雪,你的听力实在太好了,55,2016年2月11日
69476004,103598778,鸢尾__,爱情是令人落泪的东西啊。,55,2016年2月10日
69403490,52813036,淡笑看风烟,是啊，一个让人误会的故事,40,2016年2月10日
69190970,51559451,如烟红尘,据说这首歌背后有一个忧伤的故事。,49,2016年2月9日
66435194,62551908,白日和梦,这里不是掌盟，别带坏风气来.,148,2016年1月30日
66018056,56364359,多希望从没遇见过你,我不送皮肤，不骗人，点我排位也未必十连胜，我也不黑exo，tfboys，我只是单纯的想上一次前排，点我全家幸福安康，不点也全家幸福安康，谢谢。,81,2016年1月29日
65741827,102034901,我不是妹妹子,一分钟里全是故事,34,2016年1月28日
65613423,54434961,咕咕清泉,我会像自己拖鞋，肯定是自己拖啦。。。。。,13,2016年1月28日
65318557,125204964,梦里泪水,每次听着这歌很伤感在也回不去了。你还好吗,19,2016年1月27日
65240764,55983629,小灵子90,这首歌是我读初中的时候出炉的，那时候很火，现在过去这么多年了，好怀念啊，以前的歌真的很经典，以前网络歌曲完爆现在的口水歌。,46,2016年1月26日
65140370,102773244,张砍,这封面好复古呀,15,2016年1月26日
64596034,109138716,第一批成年的00,怀旧感,8,2016年1月24日
63048391,6067682,阳光穿透迷惘,物是人非事事休，快失眠了,18,2016年1月19日
62538170,85933209,xjfzz,西安科技大学,10,2016年1月17日
62459056,124398855,花间悠闲,很喜欢听，想下载下来做铃声，等我一分钟吧,8,2016年1月16日
