9466042,627115,edward_lzh,我一直觉得不错，直到我想起小时候弹棉花的场景～～,3976,2015年1月26日
174670821,40887549,堂吉诃德三世,现在是16.6.27 ，还有一个半小时中考，各位祝福我吧！,1992,2016年6月27日
11337380,30056979,夜礼服假面的小兔,我是放广告的时候听歌识曲找到的,1735,2015年2月24日
345715445,131402990,毒牙咬耳丶,我女朋友最喜欢的一首歌，她说她听了这首歌心情就会特别明朗。有些事，想多了头疼，想通了心疼。所以，晓晓，愿你该睡就睡，该玩就玩。不必遗憾，若是美好，叫做精彩，若是糟糕，叫做经历。 笑看得失才会海阔天空，心有透明才会春暖花开。 Shmily。帮忙顶一下，我想她听时能看到,1560,2017年4月3日
17183926,10101403,德哥累死了,GIF转换成视频居然是如此清晰,1204,2015年5月4日
296639475,270351005,Yz-海格格吖,不管怎么样，这首歌给人的感觉便是——清晨时分，加州阳光洒在美国金门大桥上（我敢保证，金门大桥是最具代表最棒的背景），早早起来的美国乐团，拿着乐器，摇摇摆摆地在桥上边走边high，迎接散漫美国风情灿烂的一天,864,2017年1月28日
43521430,101009762,过期的凤梨灌头丶,13年一次听到这首歌当时手机都没流量了，硬是拿着话费下下来！,678,2015年10月29日
2317793,3309536,panto_mime,犯困的赶紧戳！实在困得不行 我要念咒了：上下上下 左右左右 BABA 我有三十条命！,650,2014年3月28日
566808755,573131781,__枭俞__,如果我开车听这首歌的话，只能给这首歌打88分，因为剩下的12分要留给交警。,529,2017年9月25日
20742658,67016054,别找了我藏起来了,gif转换成视频竟如此清晰,389,2015年6月4日
131803241,255760813,阳光明媚S岁月静好,没关系是爱情啊 里面的配乐 才知道这首歌,344,2016年3月20日
1514101341,40887549,堂吉诃德三世,是的，又是我。现在是19.6.7，还有一个半小时高考，各位祝福我吧！,181,2019年6月7日
1369447740,259678257,你们爱的大飞,现在准备高考了吧,168,2019年1月26日
