207856960,111089185,-海上三日无言卧听雨打舷,与许嵩以往一些较为“柔情”的中国风作品相比，《江湖》更偏于描摹“侠骨”，用词极简，旨意却更为深远。“敬属江上雨/寒舟里/我独饮”——作品以一句“我独饮”作结，人声从恢弘的伴奏中抽离出来，一如主角从纷乱的江湖中抽身一般，告别前尘往事，悠然归隐。,33379,2016年8月31日
207928053,96652556,--账号己注消,这中国风听着真爽，与许氏传统武侠风半城烟沙，宿敌相比，词还是一如既往的厉害，除了哀民生之多艰的老套路外，更多了一分江湖气息，是一首名副其实的江湖之作，曲，更加跌宕起伏，唱出了行走江湖的潇洒与无奈。我仿佛已经看到了《不良人》经常播到一半插播“孤雁飞去，红颜来相许”的美好场景,24808,2016年8月31日
207912075,113397811,梦瑶MVV,我只有一句话：你的江湖，多远我都来,23089,2016年8月31日
207924072,272553450,帐号已注销,我来科普一下吧……敬属江上雨的“属”应该读“zhǔ”通假字“嘱”意为“劝人饮酒” 取自苏东坡《赤壁赋》中“举酒属客 诵明月之诗 歌窈窕之章” 没办法老许就是这么有文化～同样的文言常识还有《燕归巢》里“远山见竹林芳草”里的“见”通“现”,21581,2016年8月31日
207896886,261216969,张菇凉爱着VVcn,虽然人到三十当起了老司机但许氏中国风依旧无人能敌哈哈哈哈哈。,13537,2016年8月31日
207938124,249643814,萝北太南了,《画江湖之不良人》主题曲《江湖》，《花千骨》主题曲《千古》。论一个懒癌患者的自我修养,12520,2016年8月31日
386942134,486820437,吾叫小刚,喜欢许嵩很没品位吗？他为小悦悦事件写《全球变冷》，为城管暴力执法写《违章动物》，强拆写《拆东墙》，呼吁人们不要宅在家里写《河山大好》，呼吁人们好好生活不要一直刷微博写《微博控》等等，我不知道喜欢这样一个能在俗世中静下心思考的人有什么好没品味的！许嵩就是我偶像！,9657,2017年5月19日
207920071,287506879,-v彼黍离离,你喝的酒，下了回忆的毒。往事便作一场宿醉。酒醒之后，清风琳琅，碧空如洗，只是不见她红袂舞影。光阴两岸，如何以一苇渡航？庄子曰：泉涸，鱼相与处于陆。相呴以湿，相濡以沫，不如相忘于江湖。那便是：“一如既往，孤蝉相伴。万千纷扰，与我何干”。,8997,2016年8月31日
210181915,311521748,宿命355,今天语文课上，老师问我们谁的古风歌写得很好，我不假思索的说了许嵩和方文山，老师说方文山还可以，不过许嵩还没资格来谈论，全班笑翻了，当时我就毛了，马上就怼了她。结果班主任知道了这事，今天站在外面上了一上午的课。妈的，如果以后她还这样说，我还怼她，直接不管她是不是老师。,5535,2016年9月5日
207926010,87446109,听出style,昔日风云都归去，空留独身对斜阳。对于江湖，我们只不过是过客。唢呐、锣等等极难在流行乐中中国元素的加入令人拍案,5304,2016年8月31日
207912076,111136476,幻瘦,江湖一曲殇歌 ，你在旧恨中徘徊。故地一袭孤影， 她在寂寞中等候良人。尘埃落定 ， 恩怨散去，你独饮 她无影。我希望她已身逝 徒留你一生孤寂,4723,2016年8月31日
207870924,294747071,va安之若素,江上 孤舟 独饮 是否太寂寞？我来陪你可好,4254,2016年8月31日
207950539,130465458,葛藟-,嵩式江湖没有腥风血雨 只有小龙虾剁椒鱼,4044,2016年8月31日
207911299,127821289,19万楼主在这里,许嵩，你是对江湖情有独钟吧，在《千百度》你唱“一漂江湖我沉浮”《宿敌》你唱“染指江湖结悲局”《千古》你唱“寥寥几笔绘江湖深浅”，这次直接将歌名叫《江湖》了， “恩怨散去，刀剑已归隐 ，敬属江上雨，寒舟里，我独饮”是对主人公星云最后放弃大业，只想和爱的人归隐江湖的最好注解吧,3349,2016年8月31日
207969062,66777973,情可倾even,终于又迎来许嵩的中国风！许嵩特意的在V+上说31号学生党们要开学了那就出首单曲吧，这样的开学礼物真是太美……粉上这样的偶像简直幸福(ღ˘⌣˘ღ)许嵩你的江湖里一直有我，许你一生，永不松手！,2205,2016年8月31日
