11120119,32397374,公交售票员,give me give me WiFi,28.4万,2015年2月20日
9763164,19238197,滴达达滴,又是今年全球女歌手爆火的黑人洗脑爵士风，从小牛的问题少女把这种风格带火之后，肥女新专也是走这个style，还有一大帮棒子女团跟欧美风跑，不信去听EXID热单，TTS全专都是这种编曲，估计15年一大波女歌手类似爵士舞曲还在制作路上,88449,2015年1月30日
14142300,36078352,GossipNeverEnds,这是我见过整体团颜水平最高的一个欧美女子团体了，而且每个人的美的风格都不尽相同，美出不同的领域。,54870,2015年4月2日
9609301,46171596,MooMoosee,talk dirty即视感,51504,2015年1月28日
19521132,12047862,帐号已注销,MV里的西装妹子真美阿，迷死我了,39410,2015年5月25日
15084512,24712053,LanaFatRey,巴黎欧莱雅印度版主题曲,27322,2015年4月13日
1087915670,363472631,那句晚安你有听过吗,美女宝贝今晚不让你入睡，哈哈哈哈，跟我们的音乐节奏，艾瑞巴蒂，康忙，扑桌喊捉 想你想你想你。,22486,2018年4月17日
16041298,2827482,药水哥的劳力士,中间有种冒险岛废弃都市的音乐。。嘟嘟那个,13135,2015年4月23日
16398374,45012576,Orlando007,旋律太魔性,12004,2015年4月26日
45096579,31066942,一直游到尽头,may j lee 跳的太帅太帅,9226,2015年11月6日
149983188,54536627,青森奈特,魔性的“啊哈”。。总想在前面接“娘子！”,8327,2016年5月5日
291562181,273032069,zzzzzyiiii,听这首歌总觉得自己是全世界最骚最浪的仙女,7920,2017年1月20日
654783260,590884423,Born-formore,我们学校今天晚上元旦表演有女生跳这个舞。。。想想就让我老脸一红,7299,2017年12月29日
135672093,110705070,咪咪0721,在网易听歌跟逛淘宝似的，还要看看评论。。,5778,2016年3月29日
274669867,109206864,我说_所有的酒都不如你,这是唯一一首，我家猫听了跟着节奏抖毛的歌,5619,2016年12月28日
