437244083,64236837,东皇落笙,大学室友推荐让我唱的一首歌，猴猴听，于是抽农药的空隙（并不）就录了，声音没有GEM的大气，只能唱个柔版谢谢火烧的后期么啾,1659,2017年6月12日
496809893,376748070,德羊不是羊,我问一个结婚35年的人：和人结婚什么感觉？他笑了笑：你喜欢听歌吗？我：很爱听。他抬头望着天笑了，笑得很幸福。“和人结婚的感觉就是，把你手机的歌全删了，留一首你最喜欢的。然后无限单曲循环。从喜欢到厌倦最后变成习惯。”,1024,2017年8月4日
508949206,363387634,超懒的谢必安,那年桃花纷飞间，她看见一身红衣的少年郎坐于石桌前，笑容张狂，不可一世，眸子里像落满了星光，她远远地看着，听见少年对面前的老人说：“爷爷，以后我一定会成为威风凛凛的将军，收复南夷，镇守边疆，平定天下……”风将少年的衣角吹得猎猎生风，她忍不住笑弯了眼睛，心里生了欢喜,587,2017年8月13日
437254969,39740617,糖火烧0622,好听好听好听好听！！！,410,2017年6月12日
1624150501,605871143,悠悠娅吖,翻唱最尴尬的莫过于，翻的差了，评论:“没有原唱好听”“更喜欢原唱”翻得好了:“这个比原唱好听！”“还是这个好，原唱不适合”。作为翻唱粉丝就更难受了，原本自己开开心心听自己喜欢的人唱歌，路人的评价却要自己背锅，祝那些所谓“不混粉圈，不是粉丝，所谓客观比较的路人原地爆炸好吗,396,2019年9月9日
1340539062,403849840,小文刁,这个声音适合古风，但是说实话，技巧还是邓紫棋好,195,2018年12月28日
584180152,366416312,不似寒芒,比原唱好听！邓紫棋不适合古风,150,2017年10月13日
1604781048,248966573,大么熊熊,评论她人作品时，如果是专业的，请具体指出哪里不好，哪里需要改进，具体怎么做。一句“和原唱差多了”或“唱的比原唱好”是什么鬼？嗓音、唱功技巧、歌曲理解等因素都不同，怎么比较？,124,2019年8月22日
1435149458,1753585862,被迫FA光的二极管,不和原唱比谁好谁差.但个人更喜欢这个翻唱.真的很棒棒了.,100,2019年3月30日
1334550060,536507715,不二字酱,是你不会欣赏,100,2018年12月22日
1380077449,1387228801,时骄,目光遂一转，再来，当初翩翩少年郎早已褪去青涩，当年豪言壮语坚定了他的心念，眉目褪去青涩，显露出俊秀的一面。依旧是那张石桌，他便随意靠着，也生出令人寒惧的煞气，宝剑别甲，刀鞘处染上烛火般的鲜血。＂爷爷，我如今已是将军，南夷小儿早已退避百万米开外，你……”和风扫过，吹皱他杯中酒水。,99,2019年2月5日
1423078584,472937314,举着火把的李若若,不跟原唱比,57,2019年3月17日
2050169436,125086227,入门采薇,之后，远方的南夷不再侵犯边疆，西域各国朝贡。她听到身边的人皆赞叹镇国大将军威武神勇，当年的红衣少年郎已成万千闺阁少女们心中的枕边情郎。桃花依旧，纷飞间过了几载。风吹拂过她的脸颊，眼眸流转间潋滟生波，衣袖像花瓣般随风起舞。当年的少女出落的亭亭玉立，少年，却再也没有回来过了。,42,2019年12月15日
1359613199,1529798229,笙音美妙,所以，我曾经喜欢过两首歌，但是，都删了😭😭,41,2019年1月17日
