5337173,36144601,一生痴绝处-听歌到白头,自从上了大学，就再也没有回过老家，再也没有和爷爷一起捕鱼，和奶奶一起包饺子。。。。在稻香里，突然很想你们。。。,12.7万,2014年10月31日
23569131,73922891,我是李讨嫌,小时候，暑假都要去农村外婆家，外婆背着我踏过麦田坎儿去一口浅井打水洗衣服，井里好多小虾，那水甜过农夫娃哈哈。20多年过去了，她80岁了，得了抑郁症和老年痴呆，再也背不动我了，还好，我能背得动她。,10.4万,2015年6月25日
6676283,44726557,小强的地盘,好喜欢这个软件，可以看到这么多的感触和分享，满满的都是回忆，大家趁年轻，别给自己留下太大的遗憾，共勉,78581,2014年12月4日
6134965,11562334,我跑我跑跑啊跑,我想起了夕阳下的奔跑，那是我逝去的青春,59676,2014年11月22日
40810048,2486120,心兰相随y,高中的时候，地理老师喜欢周杰伦的歌。高三还有100天时老师的父亲不幸去世了，为了我们的高考老师只休息了3天，全班同学学了稻香，唱给老师听，老师落泪我们也落泪了。高三老师与我们同甘共苦，但这份苦值得。稻香的味道高三的记忆，一辈子的记忆。,47007,2015年10月14日
5460128,30507922,世味成酒,快回家吧，趁大家还能盘膝而坐。,40897,2014年11月4日
130856922,54320550,歌颂无意义,总是趁我哥哥不注意的时候，把他的随身听偷走，慵懒的午后我就躺在爷爷的太师椅上摇摇晃晃，按着手旁的随身听，听着听着就睡着了，随身听又被哥哥藏起来了，有一天，一觉醒来，发现爷爷已经不在了，哥哥早已为人父，而自己身处异乡,39984,2016年3月17日
5392720,7457783,Jane-love,为什么以前觉得很欢乐 现在有点淡淡的忧桑呢,39330,2014年11月2日
51040335,60004939,与伊凡,大学的时候给女神听这首歌，听到停顿的时候以为没电了转过头疑惑的看着我，然后听到“笑一个吧”的时候，她的那个笑容我永生难忘。,34006,2015年12月3日
6091682,15535759,你现在在想什么呢,第一次听稻香实在赶赴中招考场的大巴车上，转眼已经大三，六年时光匆匆流去，再听这首歌，感觉像才发生一样，这是记忆的断层吗,28227,2014年11月21日
134867008,112535182,斑鸠哦,小时候被牛一脚踢飞在田里,26401,2016年3月27日
15480152,58099984,爱喝CocaCola的老孟,不知道这条评论还能看到吗，高三一模全市3000多名 什么概念，就是说二本都上不了。努力了大半年最后一下给我这样的打击，我有点茫然不知所措，怎么办！我不想学了我难道就这样堕落了，一路上哭着塞着耳机，跳到了 稻香这首歌，给我了鼓舞，如今我站在如愿的大学里，谢谢你，周杰伦！,20330,2015年4月17日
5475805,40267924,今天你逗比了么,后面的时间好好珍惜与奶奶的日子,16565,2014年11月5日
5623997,35695927,toofartoarrive,过去与现在 都流着泪听完这首歌,12586,2014年11月9日
5395660,2842215,裤头村的ChumBucket服务员,昨个看女神的新衣时看见杰伦，就突然开始想念他，我想下一张专辑我依旧会买～,11218,2014年11月2日
2058126444,321861390,呼哟哟呀,还记得你说家是唯一的城堡🏰,935,2019年12月22日
2042193564,346850314,能让我静静吗,小时候想当科学家，警察，这些纯真的梦想随着年龄增长而慢慢消减.到最后我们变得很物质.可至少我们每个人曾经都有个伟大的梦,799,2019年12月8日
2040407792,581385065,林C77,购买让我们相遇,686,2019年12月7日
1680109863,341677858,摇摇晃晃---,我去⊙∀⊙！,436,2019年11月12日
1660039335,414018967,网易云妇女之友,没,171,2019年10月20日
1658728232,86445177,天川银河,版权回来了？,631,2019年10月19日
1629991373,252934150,Young_DZH,就回家吧，回到最初的美好,637,2019年9月16日
1609879342,32330757,微生沐荼,好累，好想辞职，钱少事多没发展，听到这首初中时的歌，百感交集，歌里这些话，现在才慢慢开始懂。,730,2019年8月25日
1579214756,289739294,霊感_,购买让我们相遇,795,2019年8月2日
1572027001,440387192,小秋江,为自己的人生鲜艳上色，先把爱涂上喜欢的颜色，我喜欢五颜六色，你呢,462,2019年7月27日
1564411684,99187087,人活着就为了成为梓川咲太,这么优秀的歌为什么评论还没10万？？！,561,2019年7月22日
1547432458,419355233,_Wait-For-You,只要你心情不好，听这首歌就好了。,538,2019年7月6日
1539672502,440387192,小秋江,好听,275,2019年6月29日
1532692313,99187087,人活着就为了成为梓川咲太,在外面听到这首歌都会莫名的想家,78,2019年6月23日
1522071789,297594442,O半夏Oo,不要抱怨，一切靠自己！加油小乔,265,2019年6月14日
1502025328,121574903,人逢知己不亦悦乎,今天去音乐节了！杰伦哥！谢谢你陪伴我长大！,385,2019年5月27日
1498048055,16335939,嘿小hou的世界,好听！,226,2019年5月23日
1493833973,539935031,假白泽,您的头像也很好看呢,21,2019年5月19日
