683713180,605117104,泠九啊,私人FM来的抱紧我,839,2018年1月25日
1494538557,1435742527,迪奥布兰度日如年,现在这个曲子只有216的评论，我现在得想个办法说个段子让大家赞我，这样我就能是这个曲子999+的时候的大佬了，但是问题就出在这，我想不出段子啊啊啊啊！！！！【猛女落泪】,512,2019年5月19日
1657169924,497637616,重樱旗舰长门酱,缘兔在国内知名度还是太小，了解缘兔的基本上都是深度v厨，还有一些看了缘兔本子的路人（笑）,328,2019年10月17日
1492842142,308416969,吾王MrG,喜欢缘兔的小伙伴也可以去听听歯車仕掛けのダンスホール哦~这首歌的调教也很惊艳哦~~~,208,2019年5月18日
1526384441,1313841536,我爱刷题-题爱耍我,歌名翻译：公主病症候群 结月ゆかり凛性能不是一般的强,119,2019年6月17日
2060672886,540222129,I牛头人biss,缘兔涩图太真实了,45,2019年12月25日
664460595,93030905,四月的友人A-,啊，再补充下，是平行四界里的第二首Princess Syndrome~天依和阿绫的中文翻唱~刚刚去翻了下自己买的碟看了一眼，那会儿真的很喜欢啊~,11,2018年1月7日
1509327929,1435742527,迪奥布兰度日如年,您的好友【度娘】已将您屏蔽，并附带消息：【找度娘想段子的网友是屑】,10,2019年6月2日
