17913182,48397288,试探你是哪位司机,唱得了中国风 驾驭得了舞曲 现在玩起来弗朗明戈和funky 电子音乐 敢玩音乐 魏晨选择路让很多人不理解 但他诠释了一个艺人的可塑性 这一点才是他最值得可圈可点的,4108,2015年5月11日
8166118,31673378,韩焉_,如果他每一张专辑都有中国风就好了 不是说韩风不好 真的很喜欢他的中国风啊,2155,2015年1月4日
47194908,101622908,改撒名字撒好好的,他唱歌不是为了多么出名，他是真心爱音乐，不爱争抢，默默努力的做自己喜欢的音乐。他说了，他不是谁的偶像，我爱了他八年，继续爱，正能量男神,1805,2015年11月16日
9899031,40498659,泡泡儿Zhl,方文山的词就是不一样。,1315,2015年2月2日
28421119,61000371,F_多喝热水,“我想下笔重写”听成“我像shabi出现”…………我不是故意毁气氛,1074,2015年7月28日
47718205,106090293,淡柿嘞,总觉得魏晨40岁跳不动的时候可以再转型回到温情歌手的行列妈呀好好听,994,2015年11月18日
41838865,2279562,nunuya_,这么多年各种曲风都尝试过了，其实挺庆幸当初转型的，如果不是当初转型博了大众的目光 现在的魏晨会是什么样，可能更好可能没这么好 谁知道呢。但我总归是庆幸当初转型才得以走过那时的低谷。有叫好声有倒彩声 这个圈子总是这样的。好像这么多年的进步只能入粉丝的眼 自己的爱豆自己心疼,685,2015年10月20日
124011507,78454225,谁说起灵不无邪,我觉得他适合唱中国风歌曲……声音太温婉了……还记得他的少年游……好一个温柔少年,576,2016年2月27日
48840044,2682137,branches,又是一首被埋没的好歌,571,2015年11月23日
17081181,60594735,又见西棠,很好听啊，超级喜欢这种调调，声音也很适合这种风格，如果走这路线应该会比现在更火吧,487,2015年5月3日
70147446,93983257,--苏麻离青--,因为封面否定歌的那些人……你确定是来听歌的蛮？,454,2016年2月13日
124301078,173904,飞天小仓鼠儿,今天循环的第二首，太好听。。。而且看到歌手居然是魏晨唉，感觉有点意外！就是棒啊！,214,2016年2月27日
26316001,18193820,花花偏头痛,怎么没人说魏晨是才子 难道唱跳歌手不属于才子吗,189,2015年7月14日
5934674,38905317,艺潋美妖,关关雎鸠，在河之州,184,2014年11月17日
20977429,71648397,WinkyWing,翻了一下评论果然都是再吐槽封面的2333,155,2015年6月6日
