7343305,11731896,第N个Nadia,哥哥去世后一片怀念之声，可生前又有多少人骂过他不知羞耻基佬一个，杰克逊去世后直呼此后再无巨星，可生前又有多少人相信那莫须有的娈童案，吴清源去世后多少人感叹大师逝去，觉得他真是中国的骄傲，可生前又有多少人指着他的脊梁骂他汉奸骂他不是中国人。。。。我们的宽容和善良，永远留给死者吗,18243,2014年12月19日
8814229,3040436,用户3040436,我有不同的观点，骂人的可能是一群人，赞的可能又是另一群人。人已经去世了，骂他的人转移目标，而喜欢他的人还是会一如既往的喜欢。所以你犯了统计学上的一个错误，把两类人看成同一类才会得出你这样的观点。,11470,2015年1月15日
5061082,39762841,yyn74511940,虞姬自尽了，程蝶衣自尽了，张国荣自尽了，在某一刻，我甚至觉得这三个人彼此之间就是前世今生，终究逃不过一场覆灭，不过leslie是幸运的，因为他永远活在了自己人生中最璀璨的时刻。,7206,2014年10月21日
6705263,7777746,鲛妮座人-娜美,高二的时候和喜欢的男生一起演语文书上的项羽自刎 我演的项羽 他演的不是虞姬是乌江 我“自刎”完后同学们都起哄说 跳乌江 跳乌江。。。可是我们没有考到一个大学 你也不是我的虞姬,3293,2014年12月5日
7761381,39503528,鸡蛋酱德德玛,没赶上张国荣的时代 但这首歌真的很喜欢,3096,2014年12月27日
7160120,8030468,Desperado134,我们都是戏子，在别人的故事里流着自己的泪。,2500,2014年12月15日
5477699,6128311,夏天最love,听得想掉泪。他是假霸王，你是真虞姬。人生没有你并不会不同？错了！你走了，这个世界依旧很想你。,1969,2014年11月5日
7421862,16778884,八十客车,这首歌幸好遇见了张国荣，让他演绎的如此淋漓尽致,1334,2014年12月21日
7797892,35674223,wueiie,失恋以后看什么歌词都是自己的悲伤,1074,2014年12月28日
10576166,50813665,莫名其貌,如果网易云开辟一个音乐日志专区怎么样啊？可以由专门的人来写，也可以由听众自己发表，然后再弄一个排行榜之类的，会不会让云音乐更完美呢？哎写不下去了，越想越激动，不知大家觉得这个想法怎么样啊？,722,2015年2月11日
44030268,69392595,重复这旧调,你不曾真的离去,654,2015年10月31日
43911976,53680392,北方糙汉,我对你仍有爱意 我对自己无能为力,523,2015年10月31日
43956256,57858528,Tingyustar,骂的只是一小部分，却被人放大到全部。,404,2015年10月31日
1355114284,453159783,此账号以永久注销,假的，所谓的受害者的父亲后来承认了收了钱才黑mj,302,2019年1月12日
43983814,97925680,Rusen_xing,忘了你就没有痛，那我该如何忘记呢,256,2015年10月31日
