361284319,328377479,不吃药的未央子,近代论深情，只念金岳霖。徐志摩还有陆小曼，凌叔华，梁思成也娶了林洙，只有他终身未娶。“林徽因死后多年，一天金岳霖郑重其事地邀请一些至交好友到北京饭店赴宴，开席前他宣布说：‘今天是徽因的生日！’”只一句话，每每想起，总生心酸。在他心中，世界上已无人可取代她。,24637,2017年4月20日
375544925,480959128,月五明,一身诗意千寻瀑，万古人间四月天。“请问您认识林徽因吗？”“认识。”“那么能不能请您告诉我她在哪儿？”“她在山温水软的江南，被封存在那个四月里。”,14057,2017年5月6日
287471040,324808422,z十一st,先听的不才的版本 觉得好好听 又听到了二婶和东篱那版的 感觉男声好像更有感觉 看评论儿发现原唱就是二婶 最后来到这(灬°ω°灬) 只想说 好歌都是找来的 我骄傲,10457,2017年1月14日
278091208,128127015,飞飞飞飞飞天小猪,嗯 。。虽然我不是很懂 但是觉得这首歌男声唱更有感觉 因为 一身诗意千寻瀑 万古人间四月天 是金岳霖老先生写给林徽因的挽联 金岳霖老先生爱了林徽因一辈子 等了林徽因一辈子 感觉贰婶唱出了那份悲恸,9601,2017年1月2日
386728814,393409537,夺命骚鸡翅,写了一大段字，恩，删了，我没故事,8491,2017年5月19日
373372984,396481591,ccwh0832,不幸未生在那个大师和英雄辈出的年代，避过了硝烟也错过了风尘，还有无数参天的古树和飘零的身影；也有幸能够捧起书本，一字一顿的去回味那些曾经的爱恨缠绵。因为有你 历史才抖落 些许的沉重；因为有你 闪耀的星星们 才找到 属于他们的天空,5973,2017年5月4日
366863170,348981744,林玥篱,既然日推把你推给了我，那我便助你到999方送你离开,5858,2017年4月26日
390311337,375329382,青遇澈,时间真是自称包治百病的庸医。,5796,2017年5月23日
1326649350,89810987,-小鱼萝莉-,词作提前占个位子,5130,2018年12月14日
288816792,252158060,wwink_ing,贰婶的声线有一种娓娓道来的感觉，声音会讲故事，而且真的就像歌词说的万古不变，万古流芳，贰婶声线真的很适合民国风！,4574,2017年1月17日
454457708,453541672,帐号已注销,“何为孤寂？”“清风，艳日，无笑意。”“可否具体？”“左拥，右抱，无情欲。”“可否再具体？”“不得你。”,4409,2017年6月28日
574558206,284227109,傻二的天然呆,金岳霖和他女友是不婚主义者，只是不结婚而已，人家两个有孩子，过得很幸福，这些为了林徽因终身未娶的谣言都是梁思成的第二任妻子林洙编造出来诬陷林徽因的,3248,2017年10月3日
427120287,330961402,一见钟晴1,无论金先生后来又和差点走上红毯，林徽因都是他一生的遗憾。讽刺和赞美她的人都很多，但我们都回不去那个年代，没办法亲自感受的事情就不要随意揣测了。我更愿意相信这个加工过的美好故事。,3211,2017年6月3日
616722142,342735118,索抱z,孟婆汤是否分六口，一口出世甜、二口叛逆辣、三口珍惜酸、四口情责苦、五口身心麻，最后一口却为白水，淡了口中味，忘了前尘事，泯了爱恩仇，舒了川字眉,2431,2017年11月17日
371644637,348981744,林玥篱,要淋多少次雨，才记得带伞，要下多大的雨，才肯撑起伞（今天下雨了，独自淋雨从教室走回寝室）,2279,2017年5月2日
