133804035,128949951,轻狂的橙子,我最大的败笔在于为什么这么晚才用网易,46569,2016年3月25日
254300221,304652490,XXX7ENTAC1ON,以前听中文歌只知道听失恋 关于爱情的歌 自从来到网易我听的歌就是生命的力量 对生活的渴望 对世界的期待 我开始坚强 勇敢 这才是真正的人生 歌该传递给我们的就是这些 而不是离了爱情就没有了灵魂的颓废 这才是歌真正存在的意义 在这里才能体验人生应有的东西,19217,2016年11月27日
26402309,39973596,帐号已注销,完美人声,17799,2015年7月14日
1063729569,390838874,祥瑞_御免,音乐--网易云视频--哔哩哔哩游戏--taptap,14120,2018年3月24日
54459666,96208798,不想就不酸也不甜a,没用网易之前我不知道世界上有那么多我喜欢的歌。,11050,2015年12月17日
23593499,45778503,SOULECTION,Eclypse Records， New Release!,6082,2015年6月25日
26376694,11767783,T-double-j,有你的地方就有好音乐,5361,2015年7月14日
53332847,99155660,迦宝玉,冬天被窝里抖的一点暖和气都没有了,4754,2015年12月13日
599616304,369547284,召唤师回来吧,我可以等s8，我可以等下一年，我可以等一句恭喜lpl，可我最怕等不来的是uzi,3164,2017年10月29日
1275717347,1323158657,帅到隔壁村ii,从前有个农夫每天去山上砍柴，途中总会经过一座小桥，一天他的斧头不小心掉进了河里，他很无助，就祈求河神显灵，河神动心了，于是就在地上变了一把金斧头给他，并问这是你的斧头吗？农夫很感动，过去就捡起了金斧头，然后A接W在接A，接外圈Q，接E回拉，接A，接诺克萨斯之手断头台，一套带走河神,2322,2018年10月18日
1188160286,392553028,等风等雨也等你丶-,Blue sky 蓝...蓝翔？,1693,2018年7月22日
518137381,317687948,只想要安逸就好,如果有人认识卢本伟，请转告他，我爱他。我叫刘谋，如果评论把我淹没，就当我是个象拔蚌,1612,2017年8月21日
1272246905,1430202373,Rock-刚子,我没碰过一个女生，是，我是个处男，难道处男就应该被嘲笑吗，我只是想给未来媳妇一个最完美的我，难道这样也是错吗,1469,2018年10月14日
