58615582,45379232,_满_满,电视上偶然听到的，当时居然眼泪差点出来。歌里满满都是父母的关爱的点，怎么的都和别人不一样，特别是他们这种身份的孩子，唱着这样的歌，让人有种莫名的心疼。PS：并不是粉丝，但听到心里确实挺有感触。,23093,2016年1月3日
58619545,55609114,无人机飞行手册,觉得他们的歌都是他们年纪该唱的词 很好啊 不想有些团的话装酷装帅 本来做音乐就是做自己本来的样子才最有传达力 他们就这样真的很好 而且说实话实力上有不足但是更可贵是有进步 虽然我完全路人并没有一直关注但是歌都有听过 质量还不错 以后也要加油啦。[大,16104,2016年1月3日
58618558,60414515,杂烩菌种草,王源声音真的很有辨识度 要珍惜利用这个天赋,9725,2016年1月3日
58647320,82138940,噗噜viophile,平心而论，这首歌是真的很好听，无论是曲还是词都很用心。又有一首可以向路人安利他们的歌了！,8682,2016年1月3日
58621579,60982485,长路酒烛,听着听着眼泪都要出来了。“我不完美的歌，你却都会唱。”感谢你们的出现，点缀了我的时光。,7450,2016年1月3日
66124053,45512473,回忆似河,千玺的嗓音一如既往的苏,7041,2016年2月18日
58603636,119487586,屁屁控,王源跨年弹钢琴那段，真的好棒。歌手王源，钢琴小王子～,5363,2016年1月3日
71235963,121929227,flymushy,千玺的声音挺好听的,5119,2016年2月17日
58607584,51977498,奶窖,跨年因为这首歌错过茶蛋，但是路转粉，非常好听👍,4533,2016年1月3日
58632494,90070128,海盐风早,王源的声音真是太暖了💚,4483,2016年1月3日
58639515,46549580,樱桃草莓小公主,很适合作为毕业时大家一起唱的歌，唱给父母，唱给老师，唱给同学，唱给你,4031,2016年1月3日
71389061,109236724,送你一只狗i,虽然不怎么太喜欢tf，但是觉得很好听，都是一群小学生粉丝毁了他们一半的声誉吧，我这是平心而论。,3951,2016年2月17日
71402266,63998675,虾仁儿_,烊烊声音真温暖,3771,2016年2月17日
58606635,112109686,你穿过岁月星河,唯爱王源，王源的温柔音色是最美的月光。,3592,2016年1月3日
71587447,59607648,耿耿余淮KRJ,不管是小螃蟹、小汤圆还是千纸鹤，我们都有一个共同的名字：四叶草。唯粉们，爱屋及乌，还记得当年那期年代秀四大天王唱朋友的那道题吗？毕竟未来的路那么长，十年要一起走过，与家人们互相攻击，不是爱自家爱豆的方式。,3071,2016年2月18日
1149375854,261169761,荀寻询遇,好快啊，这首歌已经是两年前的了你们在慢慢长大，变得越来越优秀了呀,156,2018年6月15日
1086111404,110787560,陈不知是不知,四年了,53,2018年4月15日
1071346786,389971325,多汁小歪,最爱的歌。,38,2018年4月1日
671263702,353975131,无夜边境,你给我的爱也许不完美 但却最美我的易烊千玺啊,93,2018年1月13日
568419288,493109802,扣肉1705,而且既然作曲作词卖了权利，像我一样遇到好听的歌就会看看作词作曲的人并不少吧所以怎么了吗？作曲人的曲子被寄于的人唱火了，那大家也会关注作曲人好吗？,113,2017年9月27日
568409155,493109802,扣肉1705,你说的很没有道理，前辈怎么了？前辈没有同意他们用吗？？前辈都同意让他们用了，如果唱的很烂，前辈会同意他们咂自己的前途？？？不好意思前辈同意就是一种肯定,90,2017年9月27日
568210967,305430991,只是很爱你呢,易烊千玺,55,2017年9月27日
568207735,567496870,余生zzzzzzz,只是把小孩改成了女孩而已吧,7,2017年9月27日
568186175,116999436,隔壁的太一,千玺 不想催你长大 想把你捧在手掌呀,64,2017年9月27日
568141036,354343484,空白啦啦啦啊,越来越喜欢王俊凯了,29,2017年9月26日
568078232,342916103,爱你无因,不是他们的粉，听到这首歌，真的泪奔了，想到了许多……谢谢父母，谢谢爱我的人,30,2017年9月26日
567901984,312909510,JIANG33920,,3,2017年9月26日
567876607,248949437,Revernie,哈哈哈 观海日记里 雾霾梗的时候 源源那句“当做宝贝儿”原来在唱这首歌,11,2017年9月26日
567876238,401303315,wxidcoco,听着这首歌忽然就泪目了，小凯不过也才成年，二字弟弟和四字弟弟都是00后至今也没成年，却已经出道好几年。虽然说和其他人比起来他们的星路真的挺顺，可一路上也承担了好多压力，也辛苦到不行，也曾经被网上好多人恶意黑，还好未来只会越来越好❤,44,2017年9月26日
567861425,406323813,山河春秋皆是你,从仙儿的翻唱那边找过来的，都很好听啊,3,2017年9月26日
567753387,473917197,梦hmm儿,不能做铃声,1,2017年9月26日
567701852,547105357,Barthomy,总有一天，你的棱角会被世界磨平，你会拔掉身上的刺，你会学着对讨厌的人微笑，你会变成一个不动声色的人。总是觉得，还没有准备好就已经长大了。大人的世界蛮累的很难懂，有那么多字典里无法解释的字眼，还有那么多努力做好了也不会被所有人喜欢的事情，这些都要坦然面对,51,2017年9月26日
567664643,493791978,这个世界上不存在的歌,有人喜欢你的脸 有人喜欢你的声音 有人喜欢你的性格 有人喜欢你的生活 而我不一样 我不喜欢你,17,2017年9月26日
567622800,601923987,梨涡浅笑醉我心,好喜欢你啊，烊烊,10,2017年9月26日
567630478,601923987,梨涡浅笑醉我心,烊烊,5,2017年9月26日
