7415414,45791824,TR_ACE,难道只有我一个人觉得无论什么时候时候听都会把“COOL KIDS”听成“COOKIES”吗.....,10869,2014年12月21日
8036228,40347630,猪崽圆滚滚,在车里听电台听到，立刻开网易的听歌识曲找出来辣，姐就是如此机智,3701,2015年1月2日
6622581,40276975,囧神神,酷和真正快乐的自己 有些人为了装酷违背了自己的意愿也得不到快乐 奢华在质朴面前永远卑微,3051,2014年12月3日
7886133,44609001,水木与目,听起来像：我希望我变成饼干,2921,2014年12月30日
9874119,20272236,-XB在路上-,为啥你们都是饼干曲奇的，我看到这这首歌歌名脑袋里第一反应是冰冻小孩儿,2903,2015年2月2日
7755241,40505998,金鱼狗,评论里满满的🍪话说上次被洗脑的时候莫名其妙的变成了酱纸…could be like the cool kids~彼竭我盈故克之文言文背呆了的节奏麽,2181,2014年12月27日
11845889,55444259,Moree王,卧槽 我给看成 蒸小孩了。。。。,1685,2015年3月4日
22334419,39890651,后浪漫Petrichor,你霉和曲奇妹站在一起，简直是进击的巨霉,1433,2015年6月16日
69526445,115616207,Intro_intro,讲一个励志的故事吧，十年前，有一个人为了创业把北京的房子卖了，拿着50万房款开始创业，十年后，他拿着创业赚来的400万在北京交了套首付。,1430,2016年2月11日
35017988,2815790,默声人不说话的喧嚣,不知道为什么，就是不会交朋友。小学被全班孤立，半个班围殴。中学还好，至少有朋友不离不弃。现在出国，每天坐在最后一排看着他们。真想变得开朗，也想有很多朋友啊……,944,2015年9月7日
9309301,3690164,远山1031,前奏带我去了西天取经,861,2015年1月23日
45377174,18565274,MoonSilver,那些真正被冷落过的，经常站在角落里对着阳光有着向往的那些不受欢迎的孩子，才能理解这首歌吧。那种深深的无奈，那种自卑的感觉...... 因为我也曾经感受过。听着这首歌，直触人心。,844,2015年11月7日
68192616,50996535,toiletpaperman,作者以反讽的手法表达了自己不与世俗同流合污的高尚情操。,788,2016年2月5日
6489581,37302302,六花七实,送给自己和所有的家里蹲 “I wish that I could be like the cool kids/ 'cause all the cool kids they seem to fit in”,701,2014年11月30日
8666866,16612484,WilliamsChen,快点支持歌词滚动和翻译啊@云音乐小秘书 @网易云音乐,221,2015年1月13日
