640041979,409610323,帐号已注销,我又来强势安利P大了。舟渡甜死人不偿命，陆林让本恐婚症都想结婚了，远谦让我走上了兄弟年下这条不归路，长顾让我掉入了伪父子年下这个大坑，沉迷鸣潜不可自拔。我，为甜痴，为甜狂，为甜框框撞大墙。,15949,2017年12月13日
609942620,541976827,烧酒rinanee,没有了，怪物都清理干净了，我是最后一个。你可不可以，把我关在你家？,11390,2017年11月9日
631375481,420547424,是琛不是深,我心中有一簇迎着烈日而生的花，比一切美酒都要芬芳，滚烫的馨香淹没过稻草人的胸膛，草扎的精神，从此万寿无疆。——priest《默读》,9656,2017年12月3日
639795136,346780994,江远归,陶然：“这就走，我们这就走，他不放心，里面那个病人是……”骆闻舟：“是我爱人。”,8512,2017年12月12日
611832175,308176378,卡门0206,费渡久久沉默在那片杂草疯长 的荒原里，在无数次漫不经心的抬头仰望后，竟看到了光，那光势如破竹开天辟地，滚烫的温度猝不及防的将杂草燃烧殆尽。光那边有人信步走来，“我来晚了”“但好在没缺席”“和我回家”。,6771,2017年11月11日
626318138,557971463,沈兰舟吖,“除夕那天我带人去滨海，这辈子没那么害怕过，害怕到现在都不敢细想，一想起来手就哆嗦。我不是怕你斗不过什么……什么张春久、范思远之类的货色，他俩加在一起能让你一勺烩了，我是怕你不知道惜命，拿着我的心肝去喂狗！”,6271,2017年11月28日
642337946,97823742,PriestChuiiii,但凡肉体凡胎，一生有千百种遗憾，诸多种种，大抵都可归于这六个字。 对不起，我害怕。,5783,2017年12月15日
670882435,382155671,小馨宜哟,“费事儿。”“老大爷。”,5391,2018年1月13日
675709249,1329103049,啾汐与酒,“怎么今天这么好？是不是这几天干了什么对不起我的事了 嗯？”“有一件。”“什么。”“未经允许 擅自特别喜欢你 不好意思了。”,5121,2018年1月18日
672627183,440192652,骆家费爷,默读吸引我的不止是此般好吃的舟渡。它除了感情线之外的主题于正能也给我了非常大的震动。好像上升了一个高度。这也是它无比吸引我的原因。两个人，一本书。当时看完的第一感觉就是，一定是要好好拿在手里细细再读的。拍下了实体，万分期待。,4060,2018年1月15日
1059243959,66905780,Osakalover,三刷了默读，最打动我的还是骆闻舟的那一句“别人推进去的时候都有人在外面等，要是他没有，我怕他一伤心就不肯回来了”。舟渡能拥有彼此真是太好了。,3320,2018年3月19日
642351410,97823742,PriestChuiiii,骆闻舟双臂抱在胸前，注视着他的费爷和猫爷，直到这时，他自己落在布满冰霜的行政楼顶的心，才仿佛归了躯壳，缓缓沉入胸口，发出了一朵学名“静好”的花。,3126,2017年12月15日
626330773,135333719,命运的黑猫,我心里有一簇迎着烈日而生的花，比一切美酒都要芬芳，滚烫的馨香淹没过稻草人的胸膛，草扎的精神，从此万寿无疆。,3113,2017年11月28日
708439360,316467630,源七_,他生于黑暗，冷眼化作深渊，然后转身走向光明。pp笔下最温暖莫过于在所有泥泞不堪中依然升腾的爱的光辉。,2599,2018年2月17日
1103653344,517804682,布达佩索斯,骆闻舟和费渡，已经不仅仅是爱人的关系了吧。对费渡来说，骆闻舟就是那道在黑暗中穿透一切污秽邪恶，直刺他瞳孔、让灵魂都颤抖的光，就像《默读》的英文书名———The light in the night。,2241,2018年5月1日
