128344760,30679992,MademoiselleXie,朱祁钰弥留之际，完全失去了保护爱人的能力，面对母亲对允贤的谩骂，他能做的只是用双手捂住她的耳朵，这一温柔的动作还是戳中了我。,10059,2016年3月11日
6670248,33439889,弥漫的浮光,徐佳莹作为唱作型歌手可能更加能够赋予声音感情，声线很饱满,6743,2014年12月4日
123893762,20649356,志小豪,歌没毁剧，剧也没毁歌，谢谢！,6435,2016年2月26日
6729865,34193288,你如艳阳般美丽,一眼看到诗诗就点开了,4845,2014年12月5日
72751046,41412256,xiaxiaowa,喜欢黄轩与诗诗的感情戏，有话本小说里才子佳人花前月下的感觉。男的温润儒雅，女的人淡如菊，很久没有这么打动我的一对。“有匪君子，如切如磋，如琢如磨”，感谢黄轩，他塑造的公子歇与朱祁钰满足我对古代君子的想象。,4368,2016年2月21日
6723983,30962220,Myunggg,我对她一直停留在绿洲！身骑白马！！后期的专辑不能超越...,4052,2014年12月5日
127904393,98165697,Yukiko-,担心《女医明妃传》把这首歌毁了的那位，您放心，还真没毁。反而这剧把这首歌诠释得更加饱满。至少我在看最后一集，允贤和朱祁镇在雪中那段，感动得热泪盈眶。,3308,2016年3月10日
6726425,38305455,狼大静,歌很好听，越来越想看剧了，力挺徐佳莹和诗诗！,3133,2014年12月5日
6731165,35470877,Hazycrazy,拉拉本就是唱国风出道，这首歌不太一样的大概就是那句高音出了不一样的声音表情！但整体上的起承转合还是行云流水一气呵成，这不就是拉拉的特色嘛！还好不是拉拉写的，风格确实招架不住，这不也正好说明她除了创作，也独具声音魅力嘛！安啦！,3086,2014年12月5日
128395171,41252780,喜笑Thui喵喵,看到片头允贤的那个撕心裂肺的眼神，我就知道注定要被这剧捕获，然后一直追到剧终。从最开始喜欢祁钰，不希望祁镇插足，到最后讨厌祁钰这个人，人性弱点赤果果的暴露，竟又到后来觉得他可怜至极，心疼他死。就这样，黄轩用自己的演技撑起了这部剧，宝宝的观剧情感都在跟着他走。真心佩服,2768,2016年3月11日
6748147,31302909,维他命Ur,听了歌看了mv越发期待电视剧是怎么回事已经好久没有追过电视剧了啊！,1611,2014年12月6日
6727014,41414602,33宝赛高,感觉lala为了唱古风也改变了唱法…都听不出是她唱的了,1438,2014年12月5日
71311354,106526033,恋恋水影,用尽天下的药石，难解人间的相思,1304,2016年2月17日
1344366725,490659088,舍下对你的放纵,其实他好的时候也没见得对允贤有多好,1052,2019年1月1日
129192306,72830799,Galaxy_499,祁钰如同允贤的初恋，可是经历大起大落允贤才发现祁镇才是她心中守护她的骑士。祁钰死后，允贤不辞而别，村霞在民间偶遇允贤，便问到为什么不辞而别，允贤说既然束缚不在，我也能脱离出来了，过自己的生活。不过还好，钱皇后死后，祁镇也没有了束缚，终于能退位寻找允贤，最后相视一笑也算是结局圆满。,992,2016年3月13日
