29917270,48321949,Aynurrr,“ 以后再碰到喜欢的人，都摇着头说算了”,1648,2015年8月7日
30016464,39792553,CUDarling,想起了吸血鬼日记里Damon对Elena的表白“可我记得，不论我有多么想你，不论我多么痛苦，我都绝对不会抹去我们之间的一切，即使我当时深陷痛苦，我还是宁愿次次回忆起我抱着你的每一刻，你发出的每次笑声，我们在一起的每一丝幸福快乐，我宁愿每时每刻陷入悲痛，也不会抹去关于你的记忆。”,877,2015年8月7日
2646687,8035752,Chrysler_,听到这首歌想到这句话—我爱你是以悲剧形式肯定人生，一首很美的柔情女声…,454,2014年5月8日
292037430,368863571,帐号已注销,别睡太晚 / 别爱太满 / 每天都陪你聊天的人 / 也并不一定真的爱你,444,2017年1月21日
193955955,107057199,我在想你从哪颗星上来,How i want you， how i...love you,387,2016年8月5日
7126054,34935198,我从远方赶来,很早之前就听过这首歌。是偶然间看到的一个视频的背景音乐。怀旧的黑白，女主角深情且落寞。非常有感觉。只是后来怎么也找不到那个视频了，只凭记忆找到这首歌。有些东西可能就是这样吧，只给你惊鸿一瞥便匿迹。反而让你记得更久,346,2014年12月14日
1191399035,322903093,丶Lcoo,谈了好多次恋爱以后才明白，一个人爱你的最高形式是：接的住你所有的负面情绪。因为说我爱你很容易，买一次两次东西也很容易，接吻很容易，拥抱也很容易，但在面对你一次又一次的负面情绪的时候，不是不耐烦，也不是表面礼貌，是很难的。 就像你皱眉的时候，我只会觉得心疼，总觉得这个世界给你的不够,286,2018年7月25日
16916587,63939566,听歌会不自觉抖腿,为了这个软件，改名。以后好听的歌都会评论。软件很不错，很用心做的。用网易云音乐的人们智力情商都很高。晚安,266,2015年5月1日
16696721,16310389,CrystalWong-,耳朵很久没有这么悲伤过,219,2015年4月29日
30063350,83012753,偲思葸,好喜欢这种类型的歌曲，之前一直是钢琴和弦纯粹伤感，后来加入一点点大提琴缠绵低吟，最后鼓点和小提琴也加进来音乐就瞬间丰富立体，变得好优雅。这样结尾真是太赞了,212,2015年8月7日
1443652476,72672067,域中秋,水中的奥菲利亚。 纪录片过来的。,204,2019年4月6日
21971024,55666075,扎克拉文8,独自死去,147,2015年6月13日
16746369,40443855,乐野之风,双击点赞,87,2015年4月30日
2046722705,492188617,晨yu鸦,“她的衣服四散展开，使她暂时像人鱼一样漂浮在水上，她嘴里还断断续续地唱着古老的歌谣，好像一点不感觉到处境险恶，又好像她本来就是生长在水中一般。”从纪录片过来的。纪录片为奥菲利亚配上这一首歌，又美又悲,60,2019年12月12日
1289053477,451702552,Aryschien-,《指匠情挑》,40,2018年11月2日
