5155827,7486146,Wreckingball,翻译：逼格。,30121,2014年10月25日
10909087,35843378,_梦付千秋星垂野,付费后霉黑都不见了花的值,25698,2015年2月16日
58615023,85045332,T-c--,霉霉的歌可以让她的7个前男友组个乐队来唱，毕竟有切身体验会唱的更有真情实感，我想这个乐队应该会叫TF boys（Taylor's Former boyfriends).,12911,2016年1月3日
46468941,10114355,小牛不会飞,霉霉为了上海的巡演放弃了维密,11743,2015年11月13日
68004559,61131120,屁酱一行,每次听都觉得脑海里一群模特在走…,7445,2016年2月4日
26990086,644526,随几丫,8元路过，之前3元错过了,7303,2015年7月18日
142851737,54842076,YIP-YIP,什么时候出下一专啊 1989听到连我妈都会唱了,6649,2016年4月17日
6302279,20545188,温十八,这张专辑太给力，必买,5138,2014年11月25日
6344870,42861371,丰寻,看到评论没在八卦styles我就放心了,4226,2014年11月27日
10855730,48919343,甄爱music,买了基本都是粉 评论里黑子少了好多,4060,2015年2月16日
159832519,98270609,往事敬你一杯烈酒余生好好走,我妈问我，儿子家里的19块钱哪去了？我说买了一个乡村女歌手的歌，我妈说买乡村干嘛？怎么不买城市，我说城市女歌手现在太浮夸,3603,2016年5月25日
42734871,37162827,Jastmines,听完perfect再听style,3080,2015年10月25日
6264226,33267830,远方小镇丶,网易亲妈啊,2179,2014年11月25日
5173218,7224308,Enchanted___,这首歌和嘎嘎的Do what u want节奏感很像！！特别是前奏！！,2062,2014年10月26日
5194970,40277285,宥京,没你们那么多评头论足，我就是脑残粉，每一首都可以打单都很好听，才华爆棚,1934,2014年10月27日
