1672463647,1432670872,人非圣贤谁能不缺钱,当你放屁的时候一定要说声“什么东西糊了”？这样周围的人就会贪婪的吸你的屁,9893,2019年11月4日
1681337969,1324115714,狙维,如果是黄图请别发 如果是艺术请脱光,5726,2019年11月14日
2039780284,319947103,EA7-倪霸霸,所谓黄图出好歌。,5260,2019年12月6日
1609855642,94014607,DruGTRaffickerRs_c,来晚了抱歉,2657,2019年8月25日
1681608060,485548174,elmmhotdog,我是來聽歌的？！整這些花裡胡哨的封面有什麽用？我在乎的只有歌曲好不好聽！不得不說這歌真圓…不是不是，這歌真白，呸這歌真好聽！你那是聽人家的歌嗎？你那是饞人家身子，你下賤！,2446,2019年11月14日
1676777703,502066856,柯柯酱是也,人类返祖现象越来越明显了,1361,2019年11月9日
1673070966,325341691,请叫Wo脚脚,笑得我跟蛆似的 在床上乱拱[多多捂脸][多多捂脸],999,2019年11月4日
1672496251,68651373,Mr_D123456,你这个魔鬼👿,609,2019年11月4日
2063216789,1419477117,坏小孩艾克,凭什么人家从酒吧玩到开房？我就从大厅吐到走廊。,510,2019年12月27日
1678839221,565048657,网恋被骗五万八,初来东莞，在路边转角看见她，她站在路灯下，我对她一见钟情，我们很快在一起了，一个小时后，我感觉我不适应谈恋爱，便给了她两百块分手费，有些人注定是过客，爱不一定要厮守，所以警察同志，这一定有什么误会,309,2019年11月11日
