1286864416,511129151,biubirthday,网易终于在这个日子把版权买回来了！,46214,2018年10月31日
1292686201,113697835,程大小峰,这世界越来越配不上这些歌了,41293,2018年11月6日
1287017073,342461152,纫兰为佩v,金庸老师，一路走好！飞—《飞狐外传》雪—《雪山飞狐》连—《连城诀》天—《天龙八部》射—《射雕英雄传》白—《白马啸西风》鹿—《鹿鼎记》笑—《笑傲江湖》书—《书剑恩仇录》神—《神雕侠侣》侠—《侠客行》倚—《倚天屠龙记》碧—《碧血剑》鸳—《鸳鸯刀》武侠名家一路走好,26111,2018年10月31日
1291470556,336298328,TT是不是傻,这是个关于完美的故事，一开始，年少轻狂的杨过配不上惊为天人的小龙女，所以，小龙女必须失贞；失贞后的小龙女又似乎配不上越来越成熟的杨过，所以，杨过必须断臂；两个看似残缺的人终于在一起，却比那些世人的爱情更加完美，只因为他们更懂得珍惜彼,21702,2018年11月5日
1292813425,1313695173,大鹏老师的礼物,弟子曾问郭襄：是否已忘记杨过？她说：早已忘记。弟子又问：那为何，还隐居于此呢？郭二小姐回答：因为这峨眉山顶的云和霞，像极了十六岁生辰那天的烟花。,12950,2018年11月6日
1292562523,351279918,shiv_vet,我在想林夕要是在唐代是不是李白的存在。,8332,2018年11月6日
1295313117,116586015,-亞詶區百事巨星Leslie继續寵愛-,感觉合唱部分一直是女声掩盖男声，直到副歌时周华健才唱出气势，就像小说里，开始时是为师的小龙女武功高强，替杨过出气，后面则是杨过修成神功，做小龙女的护花使者,7817,2018年11月9日
1293455765,1343575195,陶朱公三聚三散,郭襄：倘若妈妈先生我，我学会了龙象般若功和无上瑜珈密乘，在全真教道观外住下来，自称大龙女，杨过在全真教中受欺侮，逃到我家里，我收留了他教他武功，他慢慢的自会跟我好了。他再遇到小龙女，最多不过拉住她手，说道：“小妹子，你很可爱，我心里也挺喜欢你不过我的心已属大龙女了，请你莫怪！”,7601,2018年11月7日
1295200604,412186649,3年2,古天乐之后再无杨过，李若彤之后再无小龙女。,6505,2018年11月9日
1333811412,393841129,Zero0512,，金老先生在明报连载这部小说的时候原名:天残地缺,4349,2018年12月21日
1308647422,255321692,Hangover_-__,以前我看到“所爱隔山海，山海不可平” 那时我觉得“海有舟可渡，山有路可行” 后来才发现“山海皆可平，难平是人心”,3264,2018年11月25日
1291464512,94070920,王公子爱你呦,金庸武侠剧最养眼男女主,3218,2018年11月5日
1296375813,510766687,爱嚎的小猪,经多方查资确认，歌词第二句后四字应为 乍惊乍喜 （望更改）,1915,2018年11月11日
1297886392,374754777,又何必介怀心上,古天乐就是杨过，李若彤就是小龙女,1904,2018年11月12日
1336840923,59821144,伊人入梦_,金庸：来来来，笔给你，你来写！,1812,2018年12月24日
