619681479,51785389,阿细-CHEUNG,戴着面具的天后。。喜欢这个名字。一直很喜欢这首歌，突然想来个国粤混唱版本，希望大家喜欢,24850,2017年11月20日
625955691,368994506,原谷绘_Y,你给妈妈发短信 妈妈不回你你一般不会心慌你给对象发短信 对象不回你你也许会心慌 为什么根本原因是 你确定你妈爱你 而不确定你对象爱不爱你只有不确定的东西才会让人患得患失,20072,2017年11月27日
656011199,373909260,-SHAO_,你推荐我来听这歌，于是我翻遍了5195多条评论只想看看你有没有什么话想对我说，但是很显然你只是单纯的觉得歌好听而已。,9266,2017年12月30日
1047147249,633777076,DJ-ARMY,给男生们的建议：追女生从来都是件简单的事情。如果你觉得你追得很艰难，多半是你追错人了。如果一个女生，你费尽力气才追上，那么还不如追不上。因为，这样艰辛才拥有 一个女朋友，你们的爱情从一开始就是不平等的，她之所以犹豫不决迟迟不答应你，原始意识里就是觉得你配不上她,6970,2018年3月8日
593789035,398849399,_跃千愁,陈势安给人一种撕心裂肺的感觉，而阿细是一种欲哭无泪，俩种不同的风格，却给人同一种感受。,5926,2017年10月23日
1074621899,497591085,JinHongChen,如果你丢了一部iPhone8 但是妈妈又给你买了一部iPhoneX 你还是会很高兴 如果你的对象跟你分手 但是爱慕已久的女神却主动跟你表白 你还是会很高兴 如果你考试没拿高分 但是去国外的机会刚刚到手 你还是会很高兴 所以你看 我们并不是真的怕失去 而是怕没有更好的代替,4979,2018年4月4日
641749692,549087187,超级大熊哥,恋爱七年，分手三年后，手机莫名接到短信，很熟悉的电话号码：明天我要嫁人了，谢谢你给过的青春，希望你一生平平安安。我缓缓将车停在路旁，放下车窗，望向她的城市，思绪万千，人生又有多少个十年呢？,4255,2017年12月15日
722606902,269105402,_彤可爱-,你根本不知道现在陪在你身边那个成熟懂事会照顾人的男孩 是我用多少眼泪 多少次争吵换来的。,4028,2018年3月1日
663198548,381652353,汕头陈奕迅_,世界上有13亿人 3亿人用网易云 如果你看到这条评论 说明有缘 陌生人我爱你 注意身体早点睡,3673,2018年1月6日
686146204,50004750,一路向星_,我真的好害怕，害怕很久很久以后，一个早已心平气和的时间点，我在找老照片的时候，偶然间翻到了你对我说喜欢时的截图，我怕忽然想起第一次和你约会的那个公园，摩天轮上是你的香味，很久以后，我把一切都推翻通通不作数的时候，忽然间意识到我们也是有过好时候的，我们也曾好到谁也不能把我们分开。,3566,2018年1月27日
1068922731,257374546,WeNGuangSky,我只有一百块钱了 可是还是愿意花20打车去见心爱的人 70买两张电影票 6块买两瓶可乐2块买两个棒棒糖 看完电影然后送她回家 之后掏掏口袋两个硬币自己坐公车回家 可是现在已经没有人值得我这么去做了 以前从来不相信什么现实不现实 因为我有一颗真心 付出总会有回报 但是爱会让人卑微到尘,2712,2018年3月30日
1090007086,1293848226,_TynoKa,你是长不大的张志明 我是没有安全感的余春娇,2649,2018年4月19日
1119238182,274151470,仗剑斩苍穹,我是直男，很讨厌Gay，所以......我希望我的另一半，也是个直男。,2333,2018年5月16日
1138561114,430817918,与晚归,如果有一天我的任性伤害了你你可不可以温柔提醒我怕因此会错过你,1758,2018年6月5日
1141347794,1436183369,晨晨超温柔___7pG5,记得刚在一起的时候所有人都觉得我们不会在一起很久还有人很多人等着我们分手看我们的笑话后来我们经历了很多很多多到所有人都觉得没有任何事情能够让我们分开了而后来我们却真的分开了。,1404,2018年6月7日
