45187374,102640411,小风度,那里听歌收费,51462,2015年11月6日
2087740,5776599,蟹粉蛋,坂本龙一的这首关于《雨》的主题曲源自于电影《末代皇帝》中文绣向溥仪提出离婚的一段配乐，当文绣把雨伞抛开并说出我“再也用不着它”的时候，雨中的她享受的是一份久违的自由。,36973,2014年2月18日
190792869,47130462,帐号已注销,不论是从哪种渠道了解音乐的人，只要是对这音乐本身喜爱，都不应该被讽刺和嘲笑。从韩剧来，从综艺来，从末代来，从私人FM来，最终要了解的都是音乐本身。至于有的人，对从韩剧和综艺中来的人充满鄙视，我也不知道这是怎样扭曲的一种心理了，大概是“我的逼格被毁了”这样吧。有格调的是这首歌，不是你,31422,2016年7月30日
207661780,116352416,芝士炸猪扒,麻痹都让开，老子找了这歌找了六年，百度贴吧，百度知道，音乐交流群，手机摇一摇，非诚勿扰官网，,21505,2016年8月30日
25229779,40312216,1个4円,活着真的是一件极其非常麻烦的事,16234,2015年7月6日
634803570,245919680,山田彦祖,文绣在离婚后所拿到的赡养费，支付了律师费用和种种支出之后，用所剩不多的钱办了一所小学并任教于该学校。于1947年夏季在北平与爱人结婚，婚后夫妻感情融洽，使文绣享受了完满的家庭生活。她是中国历史上唯一一位与皇帝离婚的皇妃，同时她也是中国历史上唯一一位担任过教职的皇妃。,15186,2017年12月7日
14450432,42158525,皆为画,为什么日本会出现这么多的音乐巨匠？,10628,2015年4月6日
28462118,9019245,平井一夫,末代皇帝怎么看怎么爽。。。有韵味，这种电影才是你一直百看不厌的经典。现在的电影人还有几个能放下"热血"，静静的拍一部好电影。,9463,2015年7月28日
300469111,60294632,我为明哥狂,我要和你离婚，我不愿意再做你的小老婆了。过去在皇宫里你是皇帝，我算是你的淑妃，可现在你是亨利溥仪，婉容是你的夫人伊丽莎白，我算什么呢？我什么也不是。我不知道你心里多么不情愿，在西洋你只能有一个夫人。我要和你离婚，我要离婚！,8240,2017年2月3日
70346735,41825548,Wulutear_14786,皇城的大雨下，文绣放下仆人递来的雨伞，I do not need it.脸上满是久违的笑容，那一刻，她不再是皇帝的No2，那一刻，她真正重获了自由。雨水冲刷了紫禁城的余味，愈发变得急骤。紫禁城的大门外，我仿佛看见一只在雨中翩翩起舞的鸟儿。,7761,2016年2月14日
1003906,2055494,kummel,来时大弦嘈嘈，去时小弦切切。今天的雨下得很有趣呢~,5363,2013年8月12日
29801518,1565192,变形钢筋,听过《末代皇帝》专辑后十多年才看了电影 看完后查了相关资料 知道是三个人分别作曲合成一张专辑 末了才发现 当年最喜欢的其中几首 作者是同一个人,4254,2015年8月6日
1337711961,5885765,飞向北方_,她跑了出去喊着我要跟你离婚，有人递给一把伞，她打开了，然后又扔了出去，享受被雨淋的感觉，就像在表达，和皇帝结婚为什么不能离婚，下雨为什么一定要打伞，这些根深蒂固的想法都是束缚，我渴望自由和自主。,4168,2018年12月25日
24479422,77393235,遠舟Jessie,我的男神坂本龙一，弹奏过他的曲子，都是刻入骨头的那种深刻,3649,2015年7月1日
