204741470,268690669,AvonFar,当年和你结婚，婚礼开始前两天，你愁眉苦脸不开心的样子，我知道你心里仍然是他，但是你却笑笑跟我说没事。可是我如此爱你，又怎忍心呢。两天后，婚礼没有如期举行，因为我取消了。我只想你安好，一切都好！,5967,2016年8月25日
16173788,14037880,At星囚,“情执是苦恼的原因，放下情执你才能得到真自在。”追了4年的女生一直到大学毕业大家四散扬镳，我也仅仅得到她施舍的一个拥抱。或许我曾经快乐过，那种甜蜜的痛苦现在却时时跑出来伤害我，也许我们都曾深爱过一个人，但是。。。。！来是偶然的，走是必然的，现在，是时候该放下了，你值得真正的快乐。,3677,2015年4月24日
138551343,104609970,斑驳的乌龟,比起五月天的歇斯底里，这首钢琴曲更纯净安宁，像是经历伤痛之后的释怀，哪怕还是放不下那个人，可是已经明白最好的距离就是远远守护却不惊扰。,2153,2016年4月6日
304907539,328595440,闪闪发光的查理,我把手机格式化了，设置完指纹密码，手机提示我设置一个备用的密码，习惯性点了数字密码，我准备输入你生日的时候，我犹豫了一下，最后返回选择了图案密码。你看这次我可以不用你生日做密码，下次我就可以删了你照片，再下次我就可以把你从我心里面放出去。爱是累积，不爱也是！,2087,2017年2月9日
26428636,42651392,切洋葱的大蒜,网易真是亲妈呀！以前在优酷上看赵海洋的夜色钢琴一直找不到音源，感动哭了！,1442,2015年7月15日
55693053,69307332,拿着望远镜看星星,为什么总会渣渣的响一下，这无疑是这曲子唯一不足的地方。,1049,2015年12月22日
324458521,403405604,我的昵称有十五个字不信你数数看,你跟我说，你喜欢用网易音乐，为了接近你，我也去用了，在你喜欢听的每一首歌留下痕迹……也许这样你就可以看到，就会想到我了吧…………尽管会被淹没……,948,2017年3月6日
345991219,438181521,我就是一个没用的小哭包,你要做一个不动声色的大人了。不准情绪化，不准偷偷想念，不准回头看。去过自己另外的生活。你要听话，不是所有的鱼都会生活在同一片海里。,812,2017年4月3日
63133149,40537610,liangbinhustc,漂泊他乡，人海茫茫，谁曾对说我一句，你不是真正的快乐。。,802,2016年1月19日
128211565,73328879,卡农朝,网易好多歌都没版权了,696,2016年3月10日
57069775,82997207,长桥归人,听久了，鼻子会酸，真的,610,2015年12月28日
512770153,484893279,贰仕贰,“放弃一个喜欢的人是什么感觉？”“就像一把火烧了你住了很久的房子，你看着那些残骸和土灰的绝望，你知道那是你的家，但是已经回不去了。,430,2017年8月16日
55362937,100399300,夏小凡jj,一直害怕点开，却是戒不了的隐！,429,2015年12月21日
1469826379,1395280774,喜欢音乐没有办法,꯭人꯭这꯭一꯭生꯭大꯭约꯭会꯭说꯭8꯭.꯭8꯭万꯭个꯭谎꯭꯭最꯭容꯭易꯭脱꯭口꯭而꯭出꯭的꯭就꯭是꯭꯭没꯭事꯭,147,2019年4月29日
1336580566,1395068864,善良男孩_18VC,第一次 ， 自己女朋友让别人拐跑了 说的 怎么漂亮 ！,125,2018年12月24日
