1267300789,467541587,再续你我,都他妈给我活的好好的 不要被感情所伤要是可以的话来遂宁找我喝酒 我听你慢慢摆你的故事 祝看到这条说说的 都能开心,4693,2018年10月8日
1300366757,1491429097,帐号已注销,如果不喜欢的 真是不好意思 打扰了,2542,2018年11月15日
1356981506,136409173,别气波波啦,中国有14亿人口，网易云音乐有2亿用户，而你偏偏在这首歌的评论里面看到了我，然后你花了15秒钟来读我这一段话，你好 陌生人，。 愿你卡里有钱。车里有油。心里有爱。脚底有风。有空来新疆找我喝酒管醉，吃肉管饱,1803,2019年1月14日
1264750197,449476267,lailai-s,总有一天，我会变得特别特别优秀不为钱烦恼不怕会无能无力不计较现在计较的得失不再一个人居无定所的流浪,1573,2018年10月5日
1544254818,1761006896,奇奇你好棒吖,她很文静， 高三时候我经常会摸她，夏天总觉得她的皮肤比我的凉，经常靠在她身上上课， 她也从来不说什么， 谢谢你，我的同桌， 墙。,674,2019年7月3日
1264128825,1496682381,低调不代表你惹得起我,为什么爱你珍惜你爱护你的我，却被你无情抛弃了呢，以前相信爱情的我，真的可以为了爱情不要命了，现在不相信爱情了，却是你让我看清，以前我多傻，我现在唯一的幸运就是我没因为爱没了生命，谢谢你，让我看清,623,2018年10月5日
1563422641,1663751314,冬日小宇qwq,刚才去吃火锅，看见火锅店的墙上提醒，羊🐑是自己养的，菜🌱是自己种的，油是自己榨的，提醒顾客放心使用。买单的时候我，悄悄告诉老板，钱💰是我自己印的，请放心使用，老板追了我好几条街没追上，真有意思，腿是我自己长的，想往哪里跑就往哪里跑，陌生人，如果你笑了，那我祝你2019年一切顺利,480,2019年7月21日
1555139023,1678162374,你有遺憾麻,我喜欢别人怀里的女人，这么说是不是觉得我很渣？那我换句话说，我喜欢的女人在别人的怀里，这样是不是才显得可怜？,423,2019年7月14日
1312410112,340662284,joker-lx,麻烦你改歌的时候把原曲的名字加上去,141,2018年11月29日
1529158695,137209084,清风清风等来安於喜歡,俄罗斯方块告诉了我们，成功会消失，错误会积累。贪吃蛇告诉了我们，越到后面越危险，最大的敌人是自己。愤怒的小鸟告诉了我们，当我们失败的时候，嘲笑我们的，都是猪！,98,2019年6月20日
1565910338,1903013102,养乐灬多,我家老鼠生病了，我给它喂了点老鼠药，希望他能快点好起来,83,2019年7月23日
1312554995,1491429097,帐号已注销,好的 👌,70,2018年11月29日
1316979651,312208417,爱尚肥蛋糕,还有1000首歌就9级了，从来没有超过10个赞。,56,2018年12月3日
