4810558,38121968,夜空下的小星星,我在这，我就在你身边 其实并没有走远。,1299,2014年10月10日
1962012,222067,夜遊人,张杰一直给我带来正能量,1001,2014年1月21日
13912511,675673,Louisa_玥,高中毕业后最好的三个朋友就这样分别地球上相隔最远的三个角落...离谱的时差让我们很难同时在线，却不约而同烦恼着同样的事情，抱着同样想念的心情。在国外想哭的时候就放这首，然后在群聊里说想她们了，算好时差等回复。“无论我们在哪 心意也能感应吧，寂寞也是好的 让人长大。”昨晚又哭了。,920,2015年3月31日
8554369,45329130,城中笃行,高考完打工结束的那个夜晚，第一次喝到一直吐还酒品不好。后来表姐跟我说在她车里就一直不安分，手机调到最大声一直单曲循环这首歌，直到被她拎上楼躺在床上也不让停，直到手机没有电。刚刚听到这首歌就在想当时的我，为什么？恐怕真的只有我自己知道。喝醉的我也依然怀着某份执念陷在自我情绪之中。,460,2015年1月11日
5759371,41940927,陈文英,好温暖的声线,409,2014年11月13日
16938405,44116298,vicky901109,某一个难以入睡的凌晨 第二天一早还要去赶飞机回法国 偶然发现了它 有种发现新大陆的惊奇 无论怎么反复听 还是觉得喜欢,362,2015年5月2日
8047331,38489070,Richael稚琦,你这边几点 我的月未圆,347,2015年1月2日
128878785,111226597,是泠不是冷,当你过了轰轰烈烈的年纪后，你才会明白真正想要的爱情是细水长流的陪伴，说一万句“我爱你”都不如一句“有我在”更安心。,273,2016年3月12日
128795915,73648963,你西我东的走,高三后期每天晚自习回家一个人走在路上必听的歌，谢谢你。,256,2016年3月12日
1538334012,535582043,娜满天星,为什么现在听杰哥过去的每一首歌，都好想哭,230,2019年6月28日
7028300,37796663,透过生活进入生命,经常在外奋斗的人，会很有感触，总之很温暖有家的感觉，爱，就在我们身边,208,2014年12月12日
129036970,134355704,七仔丶奇艺,无论我们在哪 心意也能感应吧,181,2016年3月13日
1591546553,443637131,星至Light,鸟巢再唱这首歌时，他说在美国的时候抬头看到月亮就在想国内的我们还好吗，说完他也泪光闪烁。13年一整个暑期的期盼定格在那张白衬衫少年的图片，那年央视中秋节目，你在电视上唱着歌，我在电视机前热泪盈眶，我思念着的人原来也会想念我！,172,2019年8月11日
1595342789,1673045696,-巡游星河-,“我在2013年在美国游学的时候那一年我几乎没有去上那些微博这些的只是在国外有一个自己私人注册的一个ins名字叫做justforstar。然后那时候没有调整好自己的状态有一天我走在回家的路上我看到天上的月亮突然我就觉得很想国内的你们还好吗？当时就想这里几点我今天的月亮格外圆，我想告诉大家我在这。”,144,2019年8月14日
