51652572,17686820,空谷足音听,弦子的乐队里面的吉他手 现在是我的体育老师 他说是最终是因为现实的种种原因他们解散了 录了最后一首歌 就是醉清风 在我们学校的晚会上他还和一位音乐老师合奏 哦对音乐老师弹得是钢琴他拉的是二胡 在课上没事的时候他会给我们弹吉他 给我们讲他们以前的事 无限感慨 真好,37101,2015年12月6日
24546958,18192672,无聊的Gala,当年简直是千千静听的天下,20523,2015年7月1日
139710683,56799176,洗染宁坡,1分20秒开始，我们感受一下高压锅炖排骨，然后上汽了，那个陀螺在转的感觉！！！,13179,2016年4月9日
11932189,50797788,神兽咪吱,在我心中，醉清风之于弦子就像夏天的风之于温岚，听到名字就联想到那首歌,10358,2015年3月5日
5191200,244603,落霜冰破,当年魅族MP3循环播放，音质甩其他国产一大截！,9549,2014年10月26日
143649332,74697181,Aknial_sour_candy,那个说旋律像高压锅炖排骨的出来 我保证不打死你,8747,2016年4月19日
136358961,81025360,温文尔雅genuine,“感情淡了怎么办”“分手 我重新追你”,6135,2016年4月1日
12138522,56990848,郑筐筐,莫名其妙听哭了，已经十年了，那时候我才初一初二，对歌词也是似懂非懂，但是这是一首在那时候风靡所有学生mp3的歌。,6017,2015年3月8日
233654196,54640937,安德烈-哈尔科夫,你们TM比安徒生还会讲故事,4885,2016年10月21日
61230318,122713909,只是春光如此_,当你认真谈过一段感情，最后却分手了，后来你会很难再去喜欢别人，你不想花时间也不想去了解。就好比你写一篇文章快写完了，但老师说你字潦草把作业撕了让你重新写一遍。虽然你记得开头和内容但你也懒得写了，因为一篇文章花光了你所有精力，只差一个结尾，你却要从头来过。,4795,2016年1月12日
642386702,370894699,唯梦想不能辜负,落榜复读，偶遇转校女孩，惊为天人，遂追求，历经半载，如愿。虽终日书信传情，夜半通幽，亦榜上有名。时值奥运之年，吾亲赴鸟巢行工瓦之事，两月酷暑搏伊人一笑，畅！其中种种，美不胜收。然事与愿违，伊人家境颇丰，狮城留学，至今未归。前日于旧友偶闻其已婚配，门当户对，落叶不归根。吾，百无一用,3570,2017年12月15日
9507040,130611,Allen-晴天,这版的好听!,3011,2015年1月27日
9443338,46445915,月满似时,感谢这首歌，无数个冷月如勾的夜里，伴我到天明,1865,2015年1月26日
6392851,6893237,--樱歌--,这首歌印象深刻，高一时听到的。在爬一座我们那很高的山，很累很，疲惫，同行的姐姐用手机在放这首歌，虽然一点都不符合场景。可是当凉凉的山风吹在发热的脸上，脑袋有些发蒙的情况下，真的有一些很奇妙的感觉，好听,1799,2014年11月27日
11143142,15233100,autoren,词，旋律，钢琴，还有那个女主角，完美搭配，妙哉~~个人认为这个版本比较符合意境~,1265,2015年2月21日
