6996246,41648036,假撕米,听成不孕不育快走开😂😂,82135,2014年12月12日
150205521,100683184,msnamic,我就想说我们大学的辅导员叫【吴云】，这首歌是我们班歌→_→,50854,2016年5月5日
17682187,16921783,爱啦付悠灬,乌云：不带伞怪我咯。,37982,2015年5月9日
13487571,2744275,sky_香香,中间那个喇叭吹得快要破音了还在使劲吹，哈哈,34066,2015年3月26日
206462927,96431131,机智的狍儿,那你最后…出柜了吗？,30607,2016年8月28日
11991760,48193897,一杯灼灼,哦哦姨妈姨妈快走开 我又要起不来床,17807,2015年3月6日
11992890,31711264,帐号已注销,我总觉得蔡健雅和没关系是爱情啊里面的女主角气质很像,17703,2015年3月6日
55526279,74971447,stone是我啊,我一大老爷们，在ktv唱了这首歌，朋友们都用异样的眼光看着我，好尴尬,16349,2015年12月22日
43052890,37097204,踏北,听这首歌感觉脑袋上方有人一直在用订书机,13313,2015年10月27日
13257077,54195773,--EM-------,自从用了网易云音乐，真的是除去巫山不是云，良心软件啊啊啊,10001,2015年3月22日
131350028,95350280,帐号已注销,抖腿是对一首歌最基本的尊重,9864,2016年3月19日
145224672,56922337,Flexible-wy,好吧我的确叫吴云。。。。。。,7408,2016年4月23日
9139848,46756999,我們都是天蝎女,随便听听听到这首歌就喜欢蔡健雅了。,6901,2015年1月20日
29736113,63013528,色叔,无论是在杨乃文还是阿肆还是谁的音乐评论下都能看到“好希望你能参加我是歌手” 我就奇了怪了 一个好歌手的价值非要上我是歌手才能证明？？,6856,2015年8月5日
8227809,40733430,the-passenger_,好希望蔡健雅参加我是歌手,5959,2015年1月5日
