1097501237,84762249,帐户已注销重置,女人错过了那个她最想嫁的男人，就会变得挑剔，男人错过了那个他最想娶的女人，就会变得随意。,34063,2018年4月25日
1101074382,508578075,铭人情坊,给男生们的建议：追女生从来都是件简单的事情。如果你觉得你追得很艰难，多半是你追错人了。如果一个女生，你费尽力气才追上，那么还不如追不上。因为，这样艰辛才拥有 一个女朋友，你们的爱情从一开始就是不平等的，她之所以犹豫不决迟迟不答应你，原始意识里就是觉得你配不上她,16671,2018年4月29日
1069180463,614440986,牵挂寄予i,有个姑娘说，你听的歌都太矫情，我说，你一定是爱情里被爱的那一个。,14119,2018年3月30日
2374504,9276287,subtlelord,春风再美也比不上你的笑...,8597,2014年4月3日
1085099101,619023222,none婉婉婉啊,我弟弟一个00后，天天听这首，我就过来专门听听，好了。这下子知道他在想啥了，好了，我要去跟我妈谈谈我弟的感情生活了。,8547,2018年4月14日
1087527140,358963828,Back冷瞳,年少不听李宗盛，听懂已是不惑年。人生未到不惑年，而立已是不惑心。初听不识曲终意，再听已是曲中人，曲中人知曲中意，曲中意送意中人。,6977,2018年4月16日
1070419503,354459032,大王阿祖,后来我才发现李宗盛那么动人，是因为他写的爱情里从不哭诉自己的付出，多的是对曾经的反思，和岁月流过的一声轻叹。年轻人爱听伤感的情歌，倾其所有依然得不到你，那么爱你你却抛弃了我和曾经，在李宗盛那里没有。他说旧爱的誓言像极了一个巴掌，每当你记起一句就挨一个耳光。是空空荡荡，却嗡嗡作响。,6039,2018年3月31日
1064047623,282369833,二两言橙子,“为什么喜欢李宗盛”“因为他的娓娓道来 他的深情款款 像极了你亲口夸她‘好美’时的语气” ——至一个自愿失眠的夜晚[玫瑰],6013,2018年3月25日
16088020,36262291,oriis,我是17岁在匪我思存写的那本千山暮雪里知道的这首歌，后来找出来听，我听不了如此沧桑的声音，甚至没有听完。21岁我上大学的时候又偶然听到，听的想哭，才不过四年的时间，也不过是四年。。我就知道我是鬼迷心窍了，因为春风再美也比不上你的笑。,3251,2015年4月23日
43374174,75427301,濯溪游,评论太少不科学啊,1137,2015年10月28日
1070009871,382307932,临崖观风,春风再美也比不上你的笑，没见过你的人自然不会明了。好久没有见到你了，这里三月春风依然在吹，却再也见不到你的笑。盼你，安好。,783,2018年3月31日
