13951368,61236232,无忧1993,为何选择流浪 因为灵魂早已无处安家...,42874,2015年3月31日
11977751,57138469,丑小爆,我决定了，为了这首歌，去买一架钢琴，哪怕此生只会弹这一首歌……,22386,2015年3月6日
130132009,1417981,邪恶的嗷嗷,这个人名叫Ryan Arcand，而不是Ryran Tomsom。Youtube上的原视频名叫Man on the street plays beautifully，今年四十三岁，三四岁的时候被寄养，八岁偶然间接触钢琴。未提及他是什么音乐学院教授，至于失去妻女的经历，则更是不知道从哪里来。我们没有权利去假装理解他，这对他而言，也是种极不尊重,20084,2016年3月16日
129931287,101578768,吃得多是我的错吗,人渣在流行，人才在流浪。,14521,2016年3月15日
21287728,65606776,懒猫_J,重弹虽然音质好了…却没了原版的沧桑感…一个人一首曲一段故事复制不来的。。。,11270,2015年6月8日
141554481,137649449,_____不明,一年过去了，钢琴买了吗,11072,2016年4月14日
14908570,63067743,春田花花幼儿园,为了这首钢琴曲才下的这个软件，抖落了满地的喧嚣，却又一身的悲凉,7153,2015年4月11日
152984273,254606315,阿七A7,本不愿选择流浪可我迷失在了回家的途中孤寂的灵魂便再也无处安放 那天偶遇一架钢琴忆起我们一家三口的快乐时光恍若隔世 抚摸钢琴黑白键跳跃起来我的灵魂飘向远方那是家的方向,5837,2016年5月11日
138366457,1090813,鹿诗郎,有的人浅薄，有的人金玉其表败絮其中。有一天，你会遇到一个彩虹般绚烂的人，当你遇到这个人后，会觉得其他人都只是浮云而已。——《怦然心动》,4205,2016年4月6日
11858801,18211751,影幽如夢,这首钢琴曲感觉一般，可是……看看人家的流浪汉…………再看看偶们这些穷屌丝,3624,2015年3月4日
124122835,101921162,Robinforhins,“陪我写开头的人，却无法陪着我写下结局了。”这大概就是我对这首曲子题目的理解吧。,3580,2016年2月27日
7063551,6026415,le3_f,这样好听的曲子居然都没有人评论？！我可是超感动的！,3030,2014年12月13日
222855078,63184040,薄暮消,@网易云音乐 可不可以在歌曲界面加一个歌曲介绍，特别是纯音乐的部分。考量到工作量太大，可以由上传者或听友添加。你们负责审核即可，这样我们可以了解到更多的音乐文化。网易云不只只是音乐软件，也可以是音乐文化的百科全书。,2824,2016年10月1日
128171604,41052136,邓无邪_,谁念西风独自凉，萧萧黄叶闭疏窗，沉思往事立残阳。被酒莫惊春睡重，赌书消得泼茶香，当时只道是寻常。,2579,2016年3月10日
2034870660,1596266225,一定会成功_,他来到了这个世界83天，花了我5783块钱。或许不满意这个世界吧，他就回去了,1308,2019年12月1日
