22714800,35533480,Hannah812,夜深人静单曲循环着，想家，想家里干净光滑的木地板，光脚踩过去会留下印子被爸爸骂，想吃绿豆糕，喝小黄茶。有时候觉得想家只是感觉能量很低的时候的一种逃避，有时候甚至不知道一切的意义是为何。,8218,2015年6月19日
139887724,245897829,网抑音乐人梵髙,小时候每早拉着我吃拉面的你，夜里给我端夜壶摔倒的你，长大后白发苍苍的你，帮我收集硬币的你，躺在病床上的你，被土掩埋的你，和我两个世界的你，我总是在晚上很矫情。我有很多话告诉你，我想让你看看我的对象，我想用我挣得钱带你吃一回拉面，我想你还在，爷爷👴。,6569,2016年4月10日
40246732,52079102,爱打滑的小企鹅,有多少人进来是只看评论而不说话，只是默默点赞。,5415,2015年10月11日
218621070,83931306,Marx-Engels,我爸爸是瓦匠七年前查出了癌症晚期，没办法干活的他每天在家的时候只要身体不是特别不舒服，他都会楼上楼下忙个不停，屋里屋外的打扫。我能感觉到他对这个家的那种无法言语的感情，因为这个家是他一个人，一砖一瓦盖起来的。在以前活忙得时候他从没有这么仔细的打量这座他亲手建成的房子。他去世六年了,4208,2016年9月23日
141855983,86346700,炫酷小狮,最怕一生碌碌无为，还安慰自己平凡可贵,3794,2016年4月15日
19154728,3559060,F-toy,听着听着胸口有点闷 突然间想起了一周前都没来得及说再见的那个谁 ， 毕业季的忧伤,3165,2015年5月22日
138810462,86127164,立志贫乏救星,有人说纯音有什么好的，歌词都没有，根本没法儿唱出来。我说：是啊，这些歌根本唱不出来，只能跟着哼哼调，可是呀就因为唱不出来更有哽咽的感觉，就因为唱不出来，只有自己知道心里想什么，有什么故事。可以不用看歌词，闭上眼睛，感受呼吸，感受心跳，沉在自己的世界里。,2207,2016年4月7日
17130299,40653946,carapxy,一路随着波浪在追寻着什么，又或许只是享受一次次拍击海岸礁石。潮涨潮落，在月光下安静地延展开的一片海。,1911,2015年5月4日
26377900,40751146,沧云流,【西门乐谈】琴键演绎出一片荒凉之海，是忧伤之海。但不要把眼泪流干，因为再多眼泪也不会让荒海重生。沧海桑田，时间终会抚平荒海的伤痛，它深处自有微小生命在苏醒。不用为它担心。那么，心的荒海也是如此。,1624,2015年7月14日
16440020,1708195,Gxray,听的是情感而不仅是简单的旋律,1299,2015年4月27日
164294540,131522938,洋葱是个控制狂,很想为这首歌写评论，但是又怕毁掉他。,1193,2016年6月3日
25054347,45788177,HaloErol,见你远方飘荡，我思念如荒海。寄系在你身上的线，我却是无奈拉扯不来。,1077,2015年7月5日
67374866,111163481,哑铃乐队,我不热爱生活 也很少有什么能感动我 我家人都认为我是个冷漠无情的人 我身边也没什么朋友 我甚至记不清什么样的感觉叫做喜欢 像我这样的人 永远不会感到生命的可贵 世界的精彩。我眼里的世界是黑白色的 不是生就是死 没有其他 如果有 那应该是生不如死 可悲？可怜？我只是觉得这就是生活。,595,2016年2月2日
1252612915,68262156,SHUOYANGSUN,人和人真是说不清的劫数，你为了一个人辗转反侧夜不能寐；那个人又为了别人，神魂颠倒食不知味。,474,2018年9月22日
1636243992,514169084,i_城南花已开,和朋友去吃小龙虾，隔壁桌-个小女孩问妈妈，“妈妈，小龙虾回不了家它妈妈会不会着急啊?"她妈妈愣那了，我剥虾的手停住了，这么善良的问题我怎么下得了口。这时老板来解围了:“不会的，他们全家都在这。,214,2019年9月24日
