201741416,130187466,反正微博不叫这个,《银仙》中有个短剧情，少女守着一棵四季常红的枫树上百年，成了地缚灵，因为恋人在这棵树下说过一定会来找她。恋人早已在战乱中死去并转世，却是属意转世成少女守着的那棵枫树。原来眷念的人早已守护自己上百年。恋人说过染红枫叶的是思念……为什么这棵枫树四季常红，是因为我对你的思念四季从未停息,13036,2016年8月19日
337123564,320334865,-一个人的狂欢-,日本神话中的伊邪那美生育火神时不小心被烫伤死后，她的夫君伊邪那支对她日思夜想，于是前往阴间去看他的妻子，当他看到伊邪那美身体已经腐烂后仓皇逃窜，伊邪那美恼羞成怒带着阴兵追了过去，最终在一个叫做黄泉比良坂的地方被一块大石头挡住去了去路。,7884,2017年3月23日
306009159,137151164,OnwaRding,上辈子拯救了宇宙才换来这幅嗓音吧🙉,3493,2017年2月10日
164905997,54290461,伊東歌词太郎的女友,对比近期太郎都是选择的快歌，还是喜欢他唱这类型的，抒情中带点古风，毕竟入坑就是因为那首东京泰迪熊，他的声线真的超级适合唱抒情的！！！！,2364,2016年6月5日
387800638,302253288,人可不可以吻烟花讲幼稚的话,停着这首歌莫名想着雪音一步一步走向黄泉的时候,2063,2017年5月20日
294942138,115750607,wdwulin,那句 “去吧”的拖长音好好听，告诉我，我不是一个人，好醉人,1873,2017年1月25日
602522784,434174568,YoakeNatsu,太郎用歌聲訴說著伊邪那美心中對伊邪納岐的情誼 不僅是兄妹 更是夫妻一場 如何能讓你陪著容貌已失的我 留在黃泉這種冷清而又不堪的地方呢？ 只有用腐爛的容顏將你嚇走 才不會於心有愧 將表現出的恨意延展成伊邪那美心中的最後柔情 斬斷二人情分,1659,2017年11月1日
1120063198,487374574,生而为鱼_,我觉得，能被日推到这首歌的人是上辈子拯救了整个银河系吧,1478,2018年5月17日
607189957,434174568,YoakeNatsu,我觉得伊邪那美应该还是知道的吧…对于伊邪纳岐的逃离 女性天性爱美 腐烂后的身体想必连自己都无法接受更何况伊邪纳岐呢？ 伊邪那美大概就是心中知道他会离去 但是还是会为此心痛吧 既为兄长又为夫君,1473,2017年11月6日
1173754979,601349566,帐号已注销,黄泉鬼女被阻止后，伊邪那美命亲自追来，伊邪那岐命用千引石堵住黄泉比良坂。他们隔着千引石面对面地站着，发出夫妻决绝的誓言。——《日本书纪》,1213,2018年7月8日
1241155816,255604776,巴啦啦万岁爷,也许她当初追出来的时候衣衫褴褛惊恐带泪，你却觉得她是面目狰狞恼羞成怒。,1161,2018年9月9日
1136068238,1467446078,--糸野--,神话中说诸神的父亲伊邪那岐，曾经沿着神秘的道路去往黄泉幽冥救他的妻子，那就是所谓黄泉之路。那是一条没有光的小径，蜿蜒入深山，羊肠般曲折，活人能够从那条路抵达幽冥……那是禁忌之路。――龙族,827,2018年6月2日
1177587522,529984030,-祗月-,君埋泉下泥销骨，我寄人间雪满头,667,2018年7月12日
1414832472,129451973,信叶桑,还有一个版本说法是:被夫君所见这副丑相，妾身已颜面尽失。是只愿意自己在夫君眼中永远美丽的骄傲女子而已。,662,2019年3月9日
1229555944,492950949,PunishmentDay,这歌我听的真的很感动......我命很硬，小时候算命先生说我活不久，我生来就带着罪，我尽量让自己温柔，至少不要让人讨厌是吧,492,2018年8月27日
