386720539,250425512,一束欢喜_2024,台湾两大乐坛奇葩:一个比女人还要懂女人的李宗盛，一个比男人还要懂男人的十一郎,5309,2017年5月19日
300815454,268708262,及時行嗨,月亮惹的祸 我却背的锅,3076,2017年2月4日
633072082,304511634,灬清叶,我是个外卖小哥，送外卖去KTV，那个点餐的，非要我唱首歌才给五星好评，我上去就是一个都是月亮惹的祸。😏😏😏,2434,2017年12月5日
1205629435,318093340,腿怎么抖断了,《他从火光中走来》的举个手。。。,941,2018年8月5日
1206131605,422294536,妙龄童-9,你守着国家，我守着你,789,2018年8月6日
617951830,101763770,月见草-Mtrla,情不知所起，一往而深而已。,583,2017年11月18日
1181005118,534618189,连同整个世界都想送给你,南初 林陆骁,404,2018年7月15日
1206527292,497860433,adcsmiling,在看了耳东大大的文后，就是写林陆骁和南初的那篇决定要加入歌单了其实歌词真的很美哒，就很想有一个兵哥哥也唱一次,384,2018年8月6日
1207590047,413031040,炸鸡超好吃_,他从火光里走来…,237,2018年8月7日
