14097156,47223437,咆哮的桃子,the one 到底是怎么打败这群妖魔鬼怪冲到第一的,1229,2015年4月2日
14004987,51729151,金东九,高音真的超赞而且不刺耳！同为b站来的，都想补韩版我是歌手了！,507,2015年4月1日
46054931,61581312,布兰特的狂欢夜,素香的版本就是对生者的激励，金镇浩版本是对死者的缅怀，两者都没有谁更胜谁一筹，有的都是对生命的呐喊，珍惜生命，珍惜身边的人,353,2015年11月11日
14369221,19888654,Kevinplain,theone应该算险胜，前面被这两个女的压着，最后发挥好，票数很接近,303,2015年4月5日
15142621,56004934,文鸯930607,这里都能撕起来？装什么高逼格，音乐无国界，看不起谁呢,243,2015年4月14日
13966648,58967761,崔菜菜,b站观光团，韩语一句听不懂，但是很感动,223,2015年3月31日
13907549,19888654,Kevinplain,这首还不是素香最强的。。。你们去听那就是我的世界和I have nothing。。。那才是人形外挂。。。,189,2015年3月31日
26325291,79725776,张啦啦的故事,天了噜，气息无敌了，在一连串的高音，转音，情感爆发之后！结尾还能这么稳，一点儿没有喘的感觉，不愧为S级！！！,177,2015年7月14日
36911425,54414383,R_eflection,单从技术和本钱上说，素香和十年前的黄妈还是不相上下的（毕竟黄妈现在都还能拿下灯塔），但是音色和美感上，黄妈就不只差素香一点点（爱乱吼）个人看法 勿喷😒,153,2015年9月20日
48072098,35953368,李尔杨Lion,别的歌手都是在唱高音，素香是在用高音唱歌,147,2015年11月20日
125158018,129421868,DarkFantasy007,写高数时我需要这首歌让我继续活下去,128,2016年3月1日
308700459,89903800,SddrSK,本期踢馆歌手：素香 本期淘汰歌手：迪马西,85,2017年2月13日
1409651784,1359090694,wp030201,虎牙尿王来了,1,2019年3月4日
1407759785,61868153,金金懵懵哒,08年就退出SM了,0,2019年3月2日
1400248549,111551120,EverythingForLy,你不是杠精吗？我喷的是那些懂点高音就喜欢指点江山 蔡徐坤教欧文运球的评论大神 你这么喜欢对号入座来评论我 这么急于表达你是一个KY？,0,2019年2月22日
1389388557,55819306,hhins_,你语文是体育老师教的？阅读理解不行就算了，上来就喷杠精，还禁止回复,1,2019年2月13日
1389196063,111551120,EverythingForLy,你的意思是素香的技术技巧不够好还是你比她唱得好？ 我觉得素香唱的这版是好歌让我共鸣就行了,0,2019年2月13日
1389164415,111551120,EverythingForLy,又一只萌豚？喜欢指点江山之前看看自己的实力好吗 喜欢杠请去工地发挥才能,0,2019年2月13日
1389161459,55819306,hhins_,没有技术技巧怎么唱的让你共鸣？同一首歌你让普通人来唱你看看能不能感动你？写作文还要用修辞手法呢,0,2019年2月13日
1386478008,471880521,KimTaegu,国家队的,0,2019年2月11日
1385848064,305519937,Neptune330,天惹 听了一查欧的版本找来这的 前辈太强悍了,0,2019年2月10日
1379814185,122218126,辣个蓝银毁赖疗,她说什么至于你这样吗😂,0,2019年2月4日
1373474064,254140511,无路可艾,深陷哭嗓，无法自拔,0,2019年1月30日
1346491328,55819306,hhins_,膜拜大神,2,2019年1月4日
1341476249,371712948,Shesaidbiu,我是神木的[多多调皮],0,2018年12月30日
1326829005,632586145,傻瓜爱你123,首先需要过硬的心理素质😂😂😂😂😂,4,2018年12月14日
1321629166,632586145,傻瓜爱你123,我个人感觉，素香机能是真的强悍，技术也很全面，但是不知道你们什么感觉，就我感觉她每首歌看似很尽力，给人一种感情充沛的错觉，我感觉纯属就是在拼机能，例如今年歌王婕西，高音并没有很拼机能，玩的是高级的乐感，这是素香没有的，素香只是把技术做的淋漓尽致，乐感确实欠缺,4,2018年12月8日
1321643764,632586145,傻瓜爱你123,机能很强悍，别的不评价,0,2018年12月8日
1310363245,120183010,啦啦啦4477,找到同城的，你是榆林哪里人，我是绥德的。,0,2018年11月27日
1286683532,1293282372,野生花树,皇后也是一个妖魔鬼怪，郑淳元具有极高的天赋但是本钱一般，所以……还是个怪物,5,2018年10月30日
1270410849,504072138,zoumaguanhua,半夜里收到你推的这首歌，我久久无法入睡……,0,2018年10月12日
1267839967,98269150,earth成,中间的吟唱真的就像是一棵小树在暴风雨中被随意摆弄的无奈被迫却又咬牙坚持,6,2018年10月9日
