6182492,28673235,风林倦鸟,小时候总觉得为什么越进化越不可爱 现在才发现人也是一样的,57200,2014年11月23日
5680023,30399688,奔跑的狗骑兔子,童年不是喜羊羊真是太好了！！！！！！！！！,29287,2014年11月11日
8286044,49294735,Summerset,把前奏设置了铃声，开会的时候忘了关，不巧女朋友来电话了。高潮来了，老板儿迟疑几s，来了句“靠！要进化了……”然后就没有然后了,28444,2015年1月6日
6927234,35425368,江户川成熙,有谁跟我一样看成滨崎步的,19855,2014年12月10日
5867032,23499159,回忆都是黑历史,数码宝贝永远只有一部。就是第一部。,18136,2014年11月16日
5989844,2143745,pencil-pen,当勇气 友谊 甚至光明都被击败时 只要你不放弃希望。 一切都能重新开始。 这是第一部数码宝贝教给我的。,11389,2014年11月19日
5385462,38021916,你说的情深不寿,坷垃兽进化～金！坷！垃！兽！,10313,2014年11月1日
146476523,79811633,履风之人F,宫崎骏（搞动漫的）+ 滨崎步（唱歌的）→【究极进化】→宫崎步（唱动漫歌的）,7803,2016年4月26日
5826356,20335992,HamsaHanding,起床铃声，每次感觉都要进化了！！！,6447,2014年11月15日
45968183,72235632,买雏菊的小男孩,难道我们是被网易选中的孩子？,4054,2015年11月10日
62299611,115596961,邱润发发,想起了当年逼我家狗进化的日子,3659,2016年1月16日
39402643,73277375,闲情都几许123,勇气、友谊、知识、爱心、纯真、诚实、光明、希望长大后，这8个徽章大家还剩下几个呢？,2537,2015年10月6日
134336661,86621852,登峰造极的yui酱,没有人能在这个BGM下打败我！,1188,2016年3月26日
154887714,121513015,野原-新一,单身狗进化！。。。孤狼！,922,2016年5月15日
1457982145,303128055,小小晴喵没有烦恼,知道为什么都是亚古兽第一个进化吗？那是为了告诉你，无论做什么事，先用勇气开道。知道为什么巴达兽总是最后一个进化吗？那是因为当你的友情，诚实，爱心，知识，纯真和光明都被现实无情的击碎后，仍要充满希望。,885,2019年4月20日
