1387567402,558787565,余生缺情,这首BGM从1:33处开始已被社会人发现,1639,2019年2月11日
1491582036,408745069,沈城鑫鑫,我发现我还挺能骗女孩子上床的，只要我一给她发消息，她就说她要睡觉了，我还真是个渣男。,1458,2019年5月17日
1508440273,433361645,黑椒柠檬,开着奔驰大G 抽着中华大烟，旁边坐着妹子 停车等红灯的时候摸摸妹子的腿，这生活，我坐在公交车上可是看得一清二楚的,788,2019年6月1日
1560382645,565927151,我就是大莎雕,上高中的时候，学校搞消防演习，我们两个同学在楼上假装被困者等待救援……此为背景……到消防警报响起的时候，他俩在楼上拿着两张纸巾一边挥舞，一边冲楼下大喊：大爷，上来玩玩儿啊！——我永远忘不了校长的眼神……,495,2019年7月18日
1508653869,1408310354,裙姖,你的嘴唇 是我最想吃的槟榔,488,2019年6月2日
1582245385,348209382,沉迷爱情的洪世贤,日推到这首歌的，恐怕在坐的各位都已在网易云混到了巅峰！,321,2019年8月4日
1624677283,1706838295,Shuche_Mesto,我一直以为聋哑人是不会吵架的，直到有一天去餐厅吃火锅，我看到了两个聋哑人吵架，那手语打的，比火影结印还快,319,2019年9月10日
1686948802,318009626,温柔且器,评论骚的很，私聊又说滚！,221,2019年11月21日
1665725115,609385759,叮咣一顿锤,我快十七岁了，还没来月经，我不敢告诉父母，自己一人偷偷的跑医院问了大夫，大夫说我是男的，不会来月经的。这下我放心了,170,2019年10月27日
1647179450,1874662036,她爱吃香菜也,昨天晚上我刚从网吧打完联盟叫了辆滴滴，是辆五菱宏光，我很嫌弃叫他走，我打算再叫一辆，师傅嘬了口烟，按下播放器就是放的这首歌，我当时二话没说就上车了，随着师傅加油门各种转方向盘我觉得师傅真是知己亲密无间的那种，是的亲密无间，医院病房我6号床，他7号床,141,2019年10月5日
1689844912,1331283227,人间四月晨,反正这首歌没人听我告诉你们个秘密，我那方面不行,118,2019年11月24日
1682396342,1764646612,此乃一座空城,日推这首歌的女孩子请主动联系我 咱们可能有故事,89,2019年11月15日
1597753531,530913837,i长终i,玩笑里透着扎心,66,2019年8月16日
1686518746,499860657,我跟亚索一样快乐,开着心爱的奔驰大G，旁边坐着刚把到的妹子准备带她去吃顿海鲜，停车等红灯的时候我的手控制不住摸了摸她的大腿，转眼一看，旁边公交车上有个小伙一直盯着我们,62,2019年11月20日
1571200688,500328891,Come-Ajisai,哈哈哈 你是要把我给笑断气还,62,2019年7月27日
