1071125456,321420135,余天易Yutiii_,好听,1712,2018年4月1日
1071156890,286952776,久处礽怦然,高产似那啥的七妹！,1426,2018年4月1日
1124931822,468610654,傲七爷Winn,一只乱入古风圈的电子唱见,670,2018年5月22日
1390869107,299269606,喜欢跟人脽觉,对喜欢的人忍不住凶巴巴又软趴趴,402,2019年2月14日
1071141396,357541099,零珑有华,天价1积分求歌词！,371,2018年4月1日
1071727678,127746777,绘师岸田L,各位请戴上耳机🎧,240,2018年4月1日
1600687281,1842073927,周远川a,“你的眼睛怎么会这么迷人？”“是我妈妈给我的”“她真是一个好人，不是吗？“答应我一件事 就算摔倒也不许愁眉苦脸”,164,2019年8月18日
1656090003,357541099,零珑有华,说好的闹铃可以毁掉一首歌，这歌都吵了我俩月了，咋还这么好听,65,2019年10月16日
1524552050,1817383910,我不会再爱你了Ling,你这说法让我想起我的宅猫。小小的一只。整天对所有人那奶凶奶凶的。一摸头，又乖得不得了。不开心的时候给一条小鱼干啥都忘了。,50,2019年6月15日
1071156777,554857244,帐号已注销,一眼看过 全是友军,28,2018年4月1日
