7438363,46926201,rockxi,这首歌很棒 这么多年后听 还是这么有感觉,55517,2014年12月21日
10209929,44466799,牧云丶,恍然回到了从前 我趴在桌子上听歌，抬起头看着前桌的你安静的写着笔记。初春的阳光晒到你的脸上，映在我的心上，暖暖的。 你像察觉到了什么回过头，我赶忙低头 而心却怦怦跳个不停。从高一到高三 循环往复 再后来一听这首歌就想起你 很享受这感觉但不敢单曲循环 怕听多了感觉会淡 怕再也找不到这感觉,33566,2015年2月6日
13709195,51161556,小泽又沐,第一次听这歌是在六年级，转眼间便已经高三，高考加油,27973,2015年3月28日
128611713,248041905,笙厘,老妈你把我两张明天过后扔了、你知道这首歌现下载是要收费的吗,16094,2016年3月12日
129113841,116718461,-_时光与你,初二没手机 用同桌的mp3 只有这一首歌 语文课听 数学课听 早自习听 晚自习听 听着听着已经二十了,9469,2016年3月13日
129376199,102918830,牛宝宝是迷妹,突然想起来这首歌，我还记得我抄过的歌词～声线太干净！！！,7846,2016年3月14日
690524325,101763770,月见草-Mtrla,情不知所起，一往情深而已，钱怎知哪去，天天一贫如洗，爱因何而来，只因初次见面，你独自美丽，之后念念不忘，便朝思暮想，幻想一生有你。——失眠的陈先生,5259,2018年1月31日
31242192,63432871,行走的青轶,轻轻浅浅的情歌最是动人，不需要和声，一束光一个话筒还有一个你倾慕的对象，足够打动心，薄荷清凉盈润，愿我爱的少年平安到老,3430,2015年8月15日
129044878,108563092,蟹黄馄饨,想当年喜欢杰娜喜欢不得了……这首歌mv当时反反复复看了好几遍😂,2962,2016年3月13日
129307324,121895677,想去你的世界一起浪漫,我是为听歌来的.就算是街头卖艺的,1768,2016年3月14日
1332888145,541341556,她说夜很美丶,兄弟，现在大三了吧，怎么样？在哪个大学？,1218,2018年12月21日
