48292204,71175488,别来无恙an你在心上,张杰的声音真是上天赐的。辨识度超级高，超级好听,1349,2015年11月21日
23191617,38945243,是静雯啊,今天逛超市听到了这首歌感觉如此好听,784,2015年6月22日
1273159811,260388935,LOVEheyJAY,谢娜在杰哥演唱会上面跳舞的这一段，真心被爱情打动了。,741,2018年10月15日
32335017,2714634,茶杯里的咖啡-,爱死了的一首歌，福州站清唱的时候简直要炸,613,2015年8月22日
1213150439,493461793,傻大然子,昨天在鸟巢真的感受超深，杰哥现场跟棚里录的真的没有什么区别，是真的，杰哥跟星星们说话真的很温柔，能现场听到他的声音觉得很幸福，他说真的很爱很爱很爱我们爱他，无悔,607,2018年8月12日
1213014624,1295938731,枕边猫Mint,待我脱去校服 必赴星海之约,483,2018年8月12日
1273285061,479795945,番茄酱xii,成都站 你的家 她的家 你的舞伴是她 你的老婆是她 你宝贝的麻麻是她 相依相偎 幸福 蓝色星海之约,350,2018年10月15日
124158521,130972869,大萌萌是只好萌萌,好久好久没听过这首歌了。 居然是李荣浩的编曲。,300,2016年2月27日
6399202,27947408,SilenTanyx,时光十年。出道十年。,287,2014年11月28日
1213258977,256539415,WhyBlue-cC,迈着他的小舞步晃着 脸上一直挂着笑 再加上这声音 没有比他更温柔的人了,273,2018年8月12日
1212953537,115717096,牛不喝水,昨天鸟巢演唱会上，这首歌一唱，瞬间泪如雨下，这首歌承载了我初中太多故事；关键接着就是秋天的童话，那是我高中比较难的那段时候，然后泪如倾盆大雨。整个青春，都是杰哥歌曲的回忆。加油，杰哥！,190,2018年8月12日
1273037804,448115991,北岛Naomi,成都收官之战，他和谢娜让人哭的不行不行的！超甜超喜欢💕,186,2018年10月15日
1272955117,255239333,Promise泳儿,演唱会收官 你看谢娜的眼神都是爱、眼睛在发光,149,2018年10月15日
1213156102,1499019741,_Akumu,爱你七年啦 杰哥 昨天鸟巢这首歌很好听哇 张杰勇敢飞 星星永相随！,111,2018年8月12日
1273997479,1612516833,兴崽的Xback,昨晚和今天刷了好多遍他俩在成都站跳舞的视频，甜爆，，来听听这首甜甜的歌,73,2018年10月16日
