12700124,42504182,bluessoul416,听多了石进的曲子，一遍又一遍，先开始总是伴着音符想起那些人那些事，听着多了就会慢慢地欣赏那些美丽的律动，幻想自己用十指演奏这动心的旋律，作为一个理工男，我决定从现在开始自学钢琴，希望有一天自己能来演奏自己的故事,560,2015年3月16日
35781682,55329506,一朵金达莱,有人说，在中国说起钢琴所有人都立刻想起郎朗、李云笛，现在我觉得到多数人立刻想到的应该也有石进先生吧！,528,2015年9月13日
10379182,38330626,BloodyLoli,远水长空，逝波流转，韶光憔悴，暮雨生寒。孤鸿影落，琴箫声断，红笺无色，史书朽残。飞云过尽，低吟浅叹，恩怨几许，身在忘川。,347,2015年2月9日
16916808,62565332,牛奶ren,夜的钢琴曲不管哪一首都好像诗一样,301,2015年5月1日
28907450,79690870,35-4度的乙醚和100度的水,爱上一首歌可能不是因为旋律多动听，嗓音多感人，而是因为，你恰好也有个故事,216,2015年7月31日
10352238,8986887,炽白幻影狼,夜深了 你还在为明天做准备么？早些休息吧,202,2015年2月8日
20086652,50402739,天耀辉,这不是曲子，不是诗，而是灵魂的演奏，一次心灵的释放,159,2015年5月30日
12887727,17557737,桥城往事,我总是躲在梦与季节的深处，听花与黑夜唱尽梦魇，唱尽繁华，唱断所有记忆的来路。,132,2015年3月18日
154354495,135892733,昔时晨光,告诉我31首全收藏的不止我一个,92,2016年5月14日
38960317,43053088,一个人会比较酷,说不尽 道不完的故事 适合一个人静静的听,85,2015年10月4日
11094905,55100577,甜果1314,歌声直入心灵，很好听,65,2015年2月20日
188758759,303618393,南徵北羽,总有一天，你会明白：你的委屈要自己消化，你的故事不用逢人就讲，你能做的就是-把秘密藏起来，然后一步一步变得越来越强大！,41,2016年7月26日
166895288,92891194,温茶Cc,反正我觉得用网易云音乐的都是有素质有品味的人！同意点赞！,38,2016年6月9日
273896884,387219687,安静听风说,听着他的钢琴曲，不由得想以前的一些人或一些事，为什么他的曲子能引出这些真实的感情，不知不觉十多年就这么过去了，你们又还好吗？,32,2016年12月27日
252981016,255185747,叁伍伍伍伍伍伍伍伍,那年我打工送你的第一部手机，价格除以十告诉你很便宜，你天真的信了，我开心的瞒着，你知道我在骗你，我也知道你并不傻，最后一封信我留到现在，有好多错别字你知道么，笨蛋....,31,2016年11月24日
273896884,387219687,安静听风说,听着他的钢琴曲，不由得想以前的一些人或一些事，为什么他的曲子能引出这些真实的感情，不知不觉十多年就这么过去了，你们又还好吗？,32,2016年12月27日
273027910,310220444,小命啊,从一听到三十一 孤独,25,2016年12月25日
272843634,265060762,Ivo-Pogorelich,她说他像树袋熊。,10,2016年12月25日
272404134,100148741,wgwgmhmwkpuzdgfmwmpdmwfsaqmwqw,你爱上了谁,6,2016年12月24日
271317937,112202762,嗨你的蟹黄堡,每次听到这个旋律响起 就忍不住的想哭！,8,2016年12月23日
270916249,262942431,仪式感__,今年22岁，东北辽宁人，家乡的企业腐败令人发指， 北漂做IT2年了，我一个人什么事儿都可以承受来，横冲直撞从不缴械。计划在沈阳买房，我要亲手把父母攒了半辈子的钱送给喝人血的房地产。中国用100年的时间发展别人的300年，老百姓就要用一辈子干三辈子的事儿，这样是对的吗？我不否认，也不确认,19,2016年12月22日
270285728,275825792,翠西-麦,加油兄弟！,5,2016年12月21日
270236638,365137443,青空之蓝33,Tell me，I m the one in ur fate，Benz,2,2016年12月21日
269483533,278562529,帐号已注销,陪着我的她,1,2016年12月20日
267797346,271996985,天路寻梦人,一是作曲一是演奏，各有所长,1,2016年12月18日
267764793,380606170,青春还剩多少了,总能给人带来心灵的安静，很喜欢石进的曲子,2,2016年12月18日
267158269,312945085,帐号已注销,从一到三十一都整理好了呢，戳我头像，收藏歌单，我们都是同道中人，缘分的事可不好说呢,2,2016年12月17日
266483221,253558288,踏哥欠行,12.25郑州有人约吗,0,2016年12月16日
266299332,249784150,不属于这个世界的单纯,突然发现3是那么的好听。不行了，我太喜欢了，要是有无损的资源就好了！,2,2016年12月15日
265787054,91030116,沈春遊-,想去一场你的演唱会,1,2016年12月15日
264785686,333870374,长乐sama,四八一无言。,1,2016年12月13日
264743478,100680069,Strayer_Peanut,每一首都不错，所以就按顺序谈下去咯,1,2016年12月13日
264707613,100680069,Strayer_Peanut,从第一首开始吧，我就是这样,2,2016年12月13日
264378988,297751024,物价稳稳稳,12.25南京有人约么？,1,2016年12月13日
263307420,273987885,曼珠挲华,祝好运！,3,2016年12月11日
