425903343,105753794,Oh任然,早安 午安 晚安,35645,2017年6月2日
425888356,58777669,powerfulname,世界上除了相互喜欢其他的喜欢都是伤害 愿余下岁月燃梦祝歌愿所有伤痛焚诗祭酒,31579,2017年6月2日
426767619,398731294,成全今天与明天,还记得第一次和男朋友出去约会时，那时候大一，室友们都不会化妆，但她们说我需要精心打扮一番。于是，她们用不成熟的技术在我脸上涂涂抹抹，在见到男友的那一刻，我不敢抬头，然而他温柔的抬起我的脸，说怎么像个小花猫一样，我委屈的很，他紧紧的抱着我说，无论怎样，我都喜欢你，满满的爱❤❤❤,28539,2017年6月3日
426503695,391096006,小全纯一郞,只有四天高考了，希望能看穿出题人的套路 加油 高三党,11299,2017年6月2日
425834701,362745947,少女和她的AK-74,别近前，在你面前我犹如衣不蔽体，你眼里，有我支离破碎的灵魂飘摇，别近前，在你面前我犹如衣不蔽体，你眼里，我看见我残损灵魂的镜像。,9718,2017年6月2日
427005892,355581642,章竞竟,两人的感情 怎么可以 一人追赶我累了再见了,8959,2017年6月3日
425871099,361558354,AtaraxiaPetrichor,又想起那句：我欲斩断烦恼丝，终生伴佛点青灯。,6394,2017年6月2日
426699571,16873023,曾忘情,在你不喜欢你自己的时候，让我喜欢你吧。,5357,2017年6月3日
453496337,273183616,Miraimagine,“八”字，一撇才写了一半；“爱”字，你一瞥就写完了。,4889,2017年6月28日
430391466,305602247,故此无别,一杯热水，你没在前十分钟喝掉，它就冷凉；一份热爱，你没有在期望的时间内回应，它就冷了。我可以为你变得出类拔萃，看你喜欢的电影，听你偏爱的歌曲；我可以跨过千山万水去找你，也愿意在原地为你画地成牢。但我心里有个付出的期限，一旦到达时间，我就必须得走。,4289,2017年6月6日
435096087,396921399,逆-时流,我故意突然不找你，看看你会不会发现缺少了我而主动找我，却每次都是我发现自己不能缺了你。,2095,2017年6月10日
426148383,421102308,帐号已注销,世人笑我太疯癫，我笑他人看不穿。这个世界上没有什么事是放不下的，痛了，你自然就会放下，一念放下，万般自在……,1923,2017年6月2日
425967115,329668472,凉cool葭,你的声音一直都是那么的好听，我想说感谢有你,1716,2017年6月2日
425875373,330419225,北方女老汉,我所要不多 ， 也不求你能爱我有多深 ， 只要每日喜欢我那么一点点 ， 日日复月月 ， 月月复年年 ， 年年复此生。,1111,2017年6月2日
1347072681,435223401,啊妍djg,他不喜欢我涂口红我们分开了……直到有一天他喊我名字我急忙的擦掉口红跑到他跟前说句好久不见。,895,2019年1月4日
