1676195399,580170429,WXK0711,“我与那雀仙情非泛泛”“你与那万妖女王不得善终”,15662,2019年11月8日
1676313240,347513960,kakaroti,话分两头，八戒这边可就惨咯,14507,2019年11月8日
1676733934,253821583,金鱼饲养家,个人遗憾TVB西游记2没有让DK继续演孙悟空可惜了，小时候甚至没发现换人演了（不是黑陈版，陈浩民的哪吒真的很好看，可能不适合吧）但是长大再翻出来看，发现张卫健真的是天才，灵气四溢。有人记得在天宫张和二郎神对峙时那一笑吗？表情和动作丰富细腻，气质性格鲜明，表演非常有层次和变化，非常自然,4932,2019年11月9日
1678832739,401742329,此後錦書休寄丶,世人皆知至尊宝 无人识我通臂猿❤️,4100,2019年11月11日
1676506680,481336063,为我失神,任生关死劫轻轻送，千百色相便看重！ 他的内心波澜不惊，只为取得真经❤️,2085,2019年11月8日
1677683967,474436885,顾南方小姐,我不再装模作样的拥有很多朋友，你品，你细品。人生长路漫漫，有的人日渐平庸，有的人小有所成，但偶尔就会遇到一个特别的人。静静地守候着你手里头的最后一根稻草，可别弄丢了，这丢了，可就没有人帮你找回来了……,1801,2019年11月9日
1680219315,325107484,夏洛不明__,我就说这个歌词写的真好，一看作词：林夕,1632,2019年11月13日
1684601392,401742329,此後錦書休寄丶,这部江华版的唐僧是我最喜欢的唐僧 演出了圣僧的感觉 普度众生 知世故而不世故 律已但不强求他人 肉体凡胎却有大智慧 只差一步就取到大乘佛法 却毅然回头要把悟空找回来 我记得他对孙悟空说过：“悟空，为师有两个心愿 一是取得真经，二就是帮你拿掉金箍”❤️,1455,2019年11月18日
1676227394,577318703,不二家的短腿,终是庄周梦了蝶，你是恩赐也是劫,1430,2019年11月8日
1686105174,1303413335,该账号已被强制注销了,好有道理的一番话：”两个人能否走在一起，时机很重要。你出现在他想要安定的时候...那么你就胜算很大。你出现在他对这个世界充满了好奇的时候...那么就算你多美多优秀都是徒劳无用。爱得深，爱得早，都不如爱的时候刚刚好。如果可以， 就让我们，晚点在一起，然后一辈子。,1250,2019年11月20日
1676627513,368465983,吾有尔,所谓自古多情空余恨，此恨绵绵无绝期,1012,2019年11月9日
1676279486,563787379,丶我本善良却无心,话分两头 八戒那边可惨了,908,2019年11月8日
2037140532,471142177,-野蛮水蜜桃-,前世你是神猴大将 我是小雀仙今生你是通臂猿猴 我是万妖女王你是弥勒佛弟子 我们仙妖殊途直到你堕入妖道 我们终成眷属 你要复仇我给你万年妖丹 你若为妖我要万妖于你臣服你你若成佛我便落发皈依长伴燃灯,867,2019年12月4日
1676773508,253821583,金鱼饲养家,顺便说明一下，换人因为片酬的问题。96西游记打破收视记录，光广告就赚了2个亿，但dk片酬只有七八万港币，算下来不如的士司机的月薪高，续集他要求加薪，tvb不同意，后来他说不加薪也可以演，但tvb不让他演了，为了西游记2他还推了红楼梦，结果不让他演了，之后还雪藏了好久，总之一个可惜,854,2019年11月9日
