124263509,44551284,ShaWnin,作者长相怎么了，我觉得很帅啊，我相信键盘前他可以是位优雅的绅士，也可以释放激情，因为他掌握音乐，拥有音乐，享受音乐，最值得庆幸的是，他的音乐让千千万万人感动。,72047,2016年2月27日
15799700,45889955,一个橘子去打仗,这首歌的旋律在诉说着一个平凡的男孩子，追求着根本自己配不上的女神。一直非常的辛苦，女神被男孩的真情实意感动，可惜毕业了，双方因为距离的原因，各自在犹豫着要不要继续，来自父母反对，现实的压力，最后也只能分开。多年以后，大家重聚，可是大家心里对待那段感情都已淡然！[,66834,2015年4月21日
134507755,254123422,富江的戏言,大一的时候，我们班一个女生暗恋我，后来居然写小纸条让她闺蜜递给我，我开始还在想是哪个美女，后来知道是她，觉得她不漂亮，我就拒绝了她，理由也很可笑：我喜欢单身。然而某天她看到我跟一个漂亮的女孩子一起买水果，第一次看到女孩子瞬间哭出来，那伤心的表情让我很难受，对不起！真的对不起！,51712,2016年3月27日
50326747,55262093,藍原橘子-,第一次是在非诚勿扰VCR里听到的，就记住一句，不懂音乐的我硬是把简谱摸了出来，把几个数字敲进百度居然找到了，鸡冻得从椅子上跳起来，我想创业成功大概就是那种感觉。,44837,2015年11月30日
69028585,57900116,微妙的怪兽猫,作者怎么了？这么有才华就不喜欢他？怎么老是有人觉得自己很帅很漂亮就开始装逼？你长得在帅一点价值都没有。以美貌来看价值都不会有幸福,30203,2016年2月9日
4250463,5775781,瞬间SunJian,指尖流沙，刹那芳华。回眸一笑，岁月静好。你看到luv letter的心了吗？,27883,2014年9月12日
135235277,137655261,_Megalomania,你们说别看歌手简介，我忍不住看了，然后他成了我收藏的第二个歌手,22452,2016年3月28日
35523953,60186979,mylittleyoung,怎么说呢，看了歌手的照片反而更佩服他了，做出这么美的旋律，内心也一定是个十分美好的人吧。,16332,2015年9月11日
72860249,69304754,叫我神田空大,讲道理，说别看歌手资料的，你们心里已经有偏见了,12845,2016年2月21日
59872025,35813906,查无此人信息,最好不相见，如此便可不相恋。最好不相知，如此便可不相思。最好不相伴，如此便可不相欠。最好不相惜，如此便可不相忆。最好不相爱，如此便可不相弃。最好不相对，如此便可不相会。最好不相误，如此便可不相负。最好不相许，如此便可不相续。,12145,2016年1月7日
618176256,304532422,轨迹_____,你是深山的游客 边走边爱四海为家 生性多情 我是集市里的养猫者 不看路人 不换爱人,6510,2017年11月18日
1281035029,408408853,轻挽青丝暮斜阳,“为什么喜欢听纯音乐”“因为没有歌词”“为什么不听歌词”“因为歌词写的都是别人的故事”,4589,2018年10月24日
1116783428,90717112,帐号已注销,“对哥哥来说 我是什么呢”“反转”。好了 你们不要废话了 马上结婚OK！？,4108,2018年5月14日
1117972127,122048071,眼泪是最小的海,“你说让你有那种感觉的无法抹去的人”“那个人就是你”我哭了……男四女一结婚吧,3384,2018年5月15日
1334255261,449575486,波波乌拉,你知道错了，可是却永远给那个女孩留下了心伤,3367,2018年12月22日
1551425012,431375929,Hina天野陽菜,flower dance怎么没了,1461,2019年7月10日
1551448663,1832010310,银粒儿,我觉得层主没错啊，生活就是这样，别人没理由去迁就你,39,2019年7月10日
1551383465,384009833,TAK无眠,阿萨法鲍威尔 b战魔术师王立新过来的,140,2019年7月10日
1551374302,537917033,vae许嵩vaewww,第一次听是初中，地理老师放给我们听的。大家都在感叹好听的时候我在看着你，现在这么多年了。还是很有感觉，你走不出我的心，我想那时班上每一个可爱的同学，也想你。,242,2019年7月10日
1551410598,1496213135,無遺憾_-,！原来他开挂........,12,2019年7月10日
1551353277,1480016592,一隻想飛的魚兒,人得学会竭尽全力，但也得接受无能力。 ——《少年的你，如此美丽》,228,2019年7月10日
1551336243,440981094,-Omiga-,网易云差不多也可以卸载掉了,638,2019年7月10日
1551314447,287277029,you--and-me,生活明朗，万物可爱人间值得，未来可期,103,2019年7月10日
1551363572,292975398,化学酱azumi,网易云到底有多少没有版权的歌...,465,2019年7月10日
1551331077,1404902311,南城玄关,还回来,202,2019年7月10日
1551359651,1404902311,南城玄关,把我的flower dance还回来！,260,2019年7月10日
1551313775,1776255403,博美是酸奶味de,太真实隔壁flower我今早才听完的你跟我说没版权了,169,2019年7月10日
1551278441,384521689,再也不睡懒觉,一个人的相貌从来不重要，这可能是他误解我的原因。自大自狂的人永远不会知道自己有多恶臭,6,2019年7月10日
1551279349,384521689,再也不睡懒觉,现在偶然听到了，翻了翻评论，发现我懂了很多，也了解了他的心境。虽然不喜欢就是不喜欢，但在这个时候突然体会到了他当时的绝望吧。但不喜欢并不只是因为这些，还有一个人的品行。我虽然母胎，也虽然愚钝，但从不会让自己将就,55,2019年7月10日
1551292150,384521689,再也不睡懒觉,一个喜欢我的男生给我分享过这首歌，我当时并没有打开,62,2019年7月10日
1551277971,1358605679,我很想在每個朦朧的夜幕下拥抱你,不问年龄不问姓名不问长相。陌生人来找我吧 难熬的夜里我是你的树洞.,33,2019年7月10日
1551245177,1676239699,但你留得住我啊,我也感觉挺好看的,5,2019年7月10日
1551258650,1408272131,帐号已注销,啧啧啧╮(￣▽￣)╭,7,2019年7月10日
1551235988,261384460,Lucc_i,别下架了,173,2019年7月10日
1551235922,1719861592,刹那芳华何为永恒,其实也不一定，歌词有时候写的就是自己。,1,2019年7月10日
