1071270475,321686826,Judex_,每天晚上回家，第一件事是开灯，第二件事是开音响。光和声音都是好东西，他们可以一下子灌满整个房间。,7359,2018年4月1日
682485142,93149557,alanro_o,边放FM边看小说。前奏响起正读到「当一个人死去，他曾经使用的物件…某种程度上失去颜色，就像树叶从树上被扯了下来，然后这个脱离树木的植物生命所特有的那种翠绿的、水彩画的颜色立刻变得苍白黯淡…看起来人的内心也有一条洪流，这条洪流传送所有属于我们的东西，就像阳光…」没有关联，只是经过。,3594,2018年1月23日
1154533442,380111616,冷虚弱,end of the world 唱着never ending world，仿佛再说，只要你们能够心存希望，我便可以不复存在。,1889,2018年6月20日
389166661,6706852,Euphoriaaaa,高三备考前每天晚自习回家路上都要听好几遍，真的越来越喜欢慧慧了啊ww现在大二快结束了，也不小心错过了去年魔都的live，不过终于在寒假的时候去霓虹买了他们的碟，现场效果真的太棒了呜呜呜,1207,2017年5月21日
1285627573,267904952,小三村上春树,主唱的声音就像是穿越山谷的透明的风，掠过屋顶和森林，像年少时消失在天际的气球，渐行渐远，直到无法看见，但是你知道正因为它存在你的生活，所以才会快乐，并且不惧怕世界的终结，它赋予的是希望和纯净的空气，是属于年少时的。,994,2018年10月29日
1251176143,1310277643,Nineko,歌声真的可以赐予人力量,671,2018年9月21日
1347527515,135594894,关耳丶K,光不能灌满房间但是声音可以，以至于这个社会有一些边边角角有黑暗的可悲。也有人捂着耳朵不想听这个世界的声音。这就是 光为什么是希望而声音确实美好。你注销了网易云是在拒绝美好，你看不到我的评论是你放弃了在这个圈子里的希望。祝好运,547,2019年1月5日
1403932521,51999524,昵称少于两个汉子,有的歌都不用听懂就泪流满面,517,2019年2月26日
1310018401,320918943,Mc-刘备,充满绝望的前奏之后带来了苦涩的光明 就像是战争结束带来悲痛的所谓的胜利,446,2018年11月26日
1339465348,594432693,昔日叶浮林易时,然后楼下大爷来了,394,2018年12月27日
1351066084,121200998,LOVERonee,然后你邻居来找你谈心了,131,2019年1月8日
