1360146287,1297336557,HeRo_H超级英雄,可那么久了，我还是孤身一人。,11871,2019年1月17日
1364984688,380062994,iamdxx7,你要换过很多的手机壳 才会觉得最完美的就是裸机 你要喝过很多的碳酸饮料 才会回归白开水的平淡健康 你要看过很多各异的风景 才会清楚心之所向 你要错过很多人 才会在某一刻一把抓住对的那一个 人不都这样吗 你见得多了就知道怎么选了 对的人晚一点再遇吧 这样等我们足够成熟 就再也别分开,11371,2019年1月22日
1360205544,382355925,REmizzz__,歌曲版梗概了感情 说唱版陈述了经过,5976,2019年1月17日
1517779086,570684930,追梦得小孩,有人赞我一次我就回来听一次，说到做到,4443,2019年6月10日
1376428685,1413853131,所谓爱人180604,躺在我身边这个人，与别的女人在床上翻云覆雨过，丢下过我，曾凶过我，只要我想，我现在就能掐断他的脖子，他醒了朦胧的眼睛半眯着，沙哑的喉咙说着过来抱抱，我还是钻进他怀里乖巧的任他抱着,3881,2019年2月1日
1530801517,255747580,白色橄榄树li,万物不等人 爱是和你并肩的那一个,3542,2019年6月21日
1360191536,500559321,八月差,不妨不妨，来日方长,2285,2019年1月17日
1520389002,569284580,无惬意,此时，一位四年后的总裁赞了我,2143,2019年6月12日
1396991831,629011502,自愈我,我见过你最爱我的样子，所以我知道你现在并不爱我,2038,2019年2月19日
1453143296,631227245,生为冰,那个费尽心思逗你笑的人 终究比不过你见一面就笑的人,1872,2019年4月15日
1475040434,1696170625,Love橘桑,如果你不爱我那我翻山越岭也没有意义,1422,2019年5月2日
1433126209,588080182,__睡不醒的猪,我以前经常用拉黑来结束一段感情 但拉黑过后的每一刻心都会像被蚂蚁啃食一样难熬 翻遍各种社交软件偷看对方动态 忍住每隔一段时间就想要加回好友的念头 就这样反反复复 永远也不可能忘掉的 所以现在反倒觉得 放下一个人的最好方式就是什么也不做.,1325,2019年3月28日
1360163387,247095882,Maxone老虎,寂寞的夜 谁落在谁的身旁,930,2019年1月17日
