1432787685,1474480105,爱恋易瞳,扬扬是不是盯黄师傅这首歌好久了？？,12312,2019年3月27日
1432534208,1290958994,相見宜晚,眼里藏着十年春秋与西北荒漠,4901,2019年3月27日
1432570980,407590689,我已经很乖了TAT,喜欢你以后，我感觉整个人都轻松多了。我那么阴郁孤僻的一个小孩儿，就好像一盏坏掉了的灰扑扑的灯，突然被拉闸了，整个人都火花带闪电的，温柔地亮了一会儿。,4105,2019年3月27日
1432731647,1287053678,沈知年-,你是眉间朱砂痣 亦是心头白月光,2947,2019年3月27日
1433306987,1335177996,_Ghost-Bride,黄黄: ？小犊子想干啥,2642,2019年3月28日
1432827362,1542367194,建宁刑侦队支队长严峫,这所谓的世间，不就是你吗？《人间失格》,2615,2019年3月27日
1433269741,280588786,大梦如诗,有种预感，以后哼这首歌的时候会一句黄仙女的调一句妖杨的调，最后。。惨不忍睹？？,2594,2019年3月28日
1432911272,456274006,伦桑大宝贝,“你得牟足了劲儿往外逃，就算他把你的名字喊的温柔荡漾也捂紧了耳朵快跑。当时你踏着最清的溪，现在就得跨最汹的河，当时你迎着最暖的风，如今就得挨最冷的雪。不许回头，不许哭。来有多愉快，去就有翻倍的痛苦。”,2370,2019年3月27日
1434249152,427617860,所有老公都爱我,今天自己用手掐住脖子，慢慢使劲，让自己呼吸不了，然后突然松开手，又拼命大口吸气，我也不知道自己怎么想的，或许就想感受一下什么是失而复得。我生甚难，失者未回。,1516,2019年3月29日
1436420955,577660468,萧萧是只小仙猪,扬扬觊觎大黄这首歌不止一天了吧,1297,2019年3月31日
1435568135,540462438,白露晞晞,一个上不去，一个下不来……,1294,2019年3月30日
1433728357,1400968380,少年人心气白日也是火焰,遇见你的眉眼如清风明月 在似曾相识的凡世间,1179,2019年3月28日
1500048291,333844562,薛洋的迷妹,听了好多版本最喜欢这个了，其他版本像是正在经历这个故事的人，妖扬的像是走出了故事的人用平淡的语气去跟旁人诉说曾经那段炽热的爱恋。不是说感情不浓烈，而是浓烈了不得不深埋起来。其他人是“少年热诚孑然一身爱一个人”这个版本是“岁月无声百年之后合于一坟” 很好听！！,1088,2019年5月25日
1450741595,103751299,上得厅堂下得厨房的许夫人,毕竟他曾经爱过这样一个男人,841,2019年4月13日
