1103909734,1355814035,送你病,杰哥最骄傲的恐怕就是家里有三位公主了,4928,2018年5月1日
1105015399,288494644,只伴于你,选择复读，是我骄傲的选择，不去在乎别人怎么说。杰哥在高考前出这首歌，正好鼓舞我，谢谢你，希望你和哪姐好好的还有自己高考能够正常发挥,1622,2018年5月2日
1104585882,134915532,啊吖啦la,骄傲的喜欢了杰哥介么久,1147,2018年5月2日
1107696674,319728632,吃遍上海每一家面,高考倒计时33天。这是爱你的第十年，我终于能够去见你了，愿我高考顺利，不留遗憾的去见你。张杰先生，我们鸟巢见♡,973,2018年5月5日
1263770603,1326770599,陌家星星吖,当初并非因你盛名而来 今后也不会因诋毁离开不在巅峰慕名而来 不在低谷离你而去我不是路人 我是一路陪你走到底的人你若一直是那个爱唱歌的男孩.我便愿意一直做你的星星💓,158,2018年10月4日
1322505463,1506527916,止苒秫,爱杰哥爱了五年❤被人嘲笑了三年，说张杰是什么垃圾玩意，但现在我爱的这个男孩做到了，现在他是张主席，现在他是华语live王，他一直是我们眼中最可爱的张杰❤星星不做流星雨 要陪张杰亮到底💙期待2062年💙💙💙加油 张杰 加油 自己💙💙💙这就是爱❤💙骄傲的选择,116,2018年12月9日
1567401945,1817607274,破梦拂晓,终是琳琅解了散，飞车再无廉价车。终是手游上了线，飞车再无主流派。终是天美后了悔，连送3辆免费A（手游）。终是天美挨了骂，出了三辆金子车。终是天美虚了肾，出风灵转向以破纪录。天美啊，你提莫能不能再出100个地图，20辆免费A？@#天美又亏了#,114,2019年7月24日
1336762057,322325842,98_子木,张杰和谢娜的双胞胎宝宝出生的那天蓝血月出现了,71,2018年12月24日
2064839197,1373427016,cn凛二本人-苏子柒本人,许嵩，张杰，罗志祥，汪苏泷，都是飞车干不起于是飞车为他们出了车，他们为飞车写了歌[多多捂脸][多多捂脸][多多捂脸][多多捂脸],66,2019年12月29日
1377189270,1686957661,祁善-_,哈哈哈飞车过来的,56,2019年2月2日
1366749890,269631591,AryaStevans,我在学车的时候听这个是不是有点不太好（毕竟这是飞车里的歌emmm）,53,2019年1月24日
