5268761,15128864,luozilongtiger,这首作品本身太出色，怎么改都好听,658,2014年10月29日
10654599,37382928,飏_HeartBleed,个人感觉改编比原唱好听,393,2015年2月13日
18571816,18501318,用户18501318,邓的边弹边唱太帅了 怎么会这么有才,313,2015年5月17日
196509570,3685245,狂鹏怒鲲,邓紫棋的音色好特殊，华语乐坛女歌手几乎没有这种性感朦胧又有力量的音色,222,2016年8月10日
38879913,92605457,HIX许放,我可以不看，但请你不要说让她吐，你可以说她唱歌像含口香糖，或者不好听，我没有意见，我又不是没有见过怎么说的人，只是请不要说让她怎么样再出来唱，这样的话，如果是你也会伤心，既然你已经知道了她天生这样的这件事，我觉得你应该会理解一些了，我也没有什么说的了，不要在我身上浪费时间了，谢谢,195,2015年10月3日
4188115,3610656,芥川禾子,GEM的歌看live很激动人心，但光听就觉得不如，有点失望，她舞台上的天赋是很好的。,148,2014年9月8日
61848077,98855680,榴本莲,看live真的超级有感染力啊啊啊!! 表示同一首歌表达的意思毕竟不一样嘛!! 范晓萱倾向那种淡淡的爵士的忧伤感，邓紫棋想表达的是那种希望在一起的强烈的感情，钢琴伴奏也是偏古典的，给人感受各不相同。,127,2016年1月14日
1417685192,498861615,渴望被救赎的救世主_,你知道那种感觉吗？刚才坐在凳子上很久猛的突然间站起来 看什么都很晕上头的感觉 有一点窒息就像 你不要我的时候,34,2019年3月12日
1580504849,280980796,阿澈42,中国有14亿人口，网易云有2亿用户，而你偏偏在这里的评论里面看到了我，然后你花了15秒钟来读我这一段话，你好 陌生人. 愿你心里有爱.脚底有风，有空来南昌带你吃大餐！,24,2019年8月3日
1517921926,120220822,Think丶Smarter,承认别人优秀这么难🐴？,19,2019年6月10日
1357379087,1677894878,奶味高三,“老板能不能给我调五杯和昨晚一样的酒。” “是因为今晚的心情和昨晚一样吗？” “不是，是因为昨晚的醉意刚好可以梦到她。”,11,2019年1月14日
1230928940,408282211,傻大弌不能慌,这一年，我究竟是活了365天，还是活了1天重复了364遍？,10,2018年8月28日
