1628457057,1298031667,桃先生的纲丝叫伊雪,周先生，谢谢您教我活着！您教我“衣在洁，不贵华。”教我“知世故而不世故”，教我“非不能也，实不为也。”教我“在自己擅长的领域里做到最好”，我都记着，我会好好活下去的，并且会活得很好！我永远是您和孟哥的观众，永远是德云社的观众，和您一起热爱相声，热爱中国传统艺术！,216,2019年9月14日
1630593553,1715413447,你想要的偏偏得不到,周九良 众生哀苦中 你就是那一星半点的可爱 何其所幸 见此良人,116,2019年9月17日
1617330915,308246130,乔慕-,感谢邀我唱这首歌~很美的歌词，很美的祝愿。,92,2019年9月1日
1678013557,445374064,淮初i,我活在冰冷炽烈寸土，但我最向往你在的远方。一袭长衫撩袍回身，愿你不减少年心气，永远深情。如此我便满心欢喜满怀你的少年赤忱去闯我的人生，在你的梦里躲雨，也在你身后陪你。 表白词作小姐姐啊，超级棒！唱的也好好听啊！！,88,2019年11月10日
1624200831,1821995403,九良今天剪眉毛了吗,超级棒！这是我发现的第一首周哥单人同人曲，爱死了，也爱死大大了！,62,2019年9月9日
1667179188,568535292,舟雅茗,感谢小姐妹邀请参与制作，不是第一次做美工但这次真的有被感动真的是很用心的作品祝九良生日快乐永远快乐好好活着,21,2019年10月28日
