7982746,2192235,Nideoooo,去不了的地方都叫远方，回不到的地方都叫家乡。,23834,2015年1月1日
8249616,40249609,似是而非或是世事可畏,自从上了大学，发现我的故乡从此只剩下冬夏再无春秋。 自打外出工作，发现我的故乡从此只剩下寒冷的冬天和温暖的亲情。,15089,2015年1月6日
12892148,6709051,轻舟已过,网易云搞错了，原曲是 SophieZelmani，赵雷也不是抄袭。赵雷的专辑歌词封面写着这样一句话，愿SophieZelmani知道，我一直爱着她和她的音乐,7510,2015年3月18日
6864671,36113427,nostalgicoo,那年，我回到离别一年多的家乡，我拉着行李箱，回到自己生活了二十多年的院子。我推开门，房子空无一人。顿时眼泪充满了我的眼眶。以前欢声笑语的情景瞬间在我的脑海里回荡。。如今伴随着奶奶的离去，才知道家人已搬到楼房里。但你可知道直到我死去，在我心里只有一个家，那就是你。,5290,2014年12月9日
295192674,31256712,帐号已注销,重庆-菏泽，开了20个小时车，离家还有100公里，我回来了妈妈。,5255,2017年1月26日
122936600,127512867,摇滚书生-宇,赵雷最牛b的地方，就是你听他的歌是那么舒服，他的音乐并不炫技，你听他唱歌，就像是听邻居家的大哥在讲故事，当你听得津津有味是，总会有那么一句话戳中你的泪腺，让你瞬间泪如雨下，好像他看见了我们如何在生活中挣扎，我们倔强的反抗着命运，而命运并不会因为我们的汗水而有一丝丝同情。,4742,2016年2月23日
5598044,19190975,VtimeCoffeeMusicBar,为什么欢快的节奏却听的满是忧伤？,3377,2014年11月8日
152115456,265736718,野馬Lolita-,从小努力学习，经历无数考试，没想到最后是为了远离家乡,2814,2016年5月9日
6078042,39445571,李呆伟,从许巍以后最爱的歌着,2423,2014年11月20日
129306132,250164624,--达摩流浪者,你若要问我最孤独的时候是什么时候，我会告诉你 大概是千里迢迢背井离乡，下了火车正是夜晚。看着万家灯火的瞬间！,2287,2016年3月13日
154403286,64114525,有点理想的小医生,我觉得喜欢民谣的人的性格都应该是那种很宽容，很善良的，是相信这世上有很美好的情感存在的，亲爱的不管你是否爱这首歌，不要为此争执可能你不知道，她恰巧触动了谁的心,2100,2016年5月14日
7496931,31824244,帐号已注销,那个小山村，现在有了路灯，可我却开始想念那几年只有月光却每晚出去压马路抽烟谈天说地的时光。,1893,2014年12月23日
16801922,11140034,生活有苟且也有诗和远方,前天大伯走了，心里难受的无以言表，今天把他老人家送下地，这两天我强忍着泪水，我一个人躲着家人看着小弟空间相册里大伯的照片，一个人默默的抽泣起来，他辛苦了一辈子，无儿无女，省吃节用，走完了几十年的人生，岁月无情，一个人心里难受，无法述说，打扰各位兄弟姐妹们了！谢谢！,1798,2015年4月30日
6311467,6486352,野枕头,“我多想回到家乡”“我最终会陪在你的身旁”。可惜只有漫漫离乡路。也许这就是欢快的节奏听起来如此悲伤的原因,1061,2014年11月26日
12512271,2486119,听歌也要有态度,那些说抄袭breeze的，只能说旋律是都有点像，但是这个更棒，这个是改良升级版，不喜欢听的别听，别以为就你一个人听过breeze,754,2015年3月13日
1652877530,350783223,锟昆坤,越听越有味道阿,75,2019年10月12日
1410947708,1400933561,谈起李逼总被禁,那万一有灯呢，不是又透明了，我是杠精[多多比耶],7,2019年3月5日
1410757541,451236610,唐小小l,看了大冰的书，里面的赵雷是这个吗,166,2019年3月5日
1410416608,1727163496,清风浪影1901,大爱民谣,4,2019年3月4日
1410284611,325265286,赵雷V,你们的家乡在哪儿？,83,2019年3月4日
1410145622,355933104,影杀狂影不行我还有暗器解体,他乡容纳不了灵魂，家乡安置不了肉身！,52,2019年3月4日
1410127643,1560831570,和别人一样-,孤独？可能是每逢佳节万家灯火，却没有一盏灯火是为你而亮；然而，你可以换种方式考虑，那便是万家灯火齐聚，皆为我点亮光明……,25,2019年3月4日
1409786947,475209289,是丸子姐姐鸭,明天回家乡啦 可是心情复杂 妈妈想离婚 唉 ,18,2019年3月4日
1409770776,544056018,寒William,都忘了咱俩多久没说话了，也快忘了 当初为什么有那么多话跟你说,16,2019年3月4日
1409746129,116541686,ooh_pony,认真点好，花粥出事了，专门过来看的，以前作曲写的赵雷…,24,2019年3月4日
1409469431,1288434202,帐号已注销,明天走，下次回家又是什么时候。,12,2019年3月3日
1409334845,545733531,亦是疯癫少年,从此故乡无春夏，只有寒冷的冬天。小时候盼望着长大，盼望着离开熟悉的故乡，那时候就像一场梦，长大后，梦醒了，却发现再也回不去了,18,2019年3月3日
1409241941,1403630210,逃离世间这疾苦,20岁 自己给自己压力 要努力挣钱 下班回家路上 骑着电瓶车淋着雨一路走一路哭 在村口努力了很久平复自己的心情 不想带给家人 王奥宇你一定要有钱！！,24,2019年3月3日
1409136065,1359214158,珞子L,我是修高速公路的，一年到头唯一的假期就是过年那几天，才毕业一年，感觉离家越来越遥远了,16,2019年3月3日
1408887083,618420884,恬恬心头肉,有工作的地方没有家，有家的地方却没有工作。他乡容纳不下灵魂，故乡安置不了肉身。一个叫家的地方找不到养家糊口的路，找到了养家糊口的地方却安不了家。从此便有了漂泊，有了远方，有了思念。,20,2019年3月3日
1408424652,1464143749,海狸先生和玫瑰,太认真真的好吗,3,2019年3月2日
1408247307,445619009,天空奔跑累的迷鹿,家,3,2019年3月2日
1408131246,568248059,左边的云朵,手风琴,0,2019年3月2日
1408023414,30879957,令人沮丧的现实主义,赵雷的歌就是酒啊。。。,11,2019年3月2日
