11189412,48106453,台灣之光,又没有哭你。你紧张什么？,319,2015年2月22日
40066451,96298710,帐号已注销,曾经不懂事，经常惹妈妈生气。吵过无数次，却依然我行我素。多年之后，听到一句话：别和父母吵架，不管谁赢，其实他们都是输的。,156,2015年10月10日
9316674,19005952,橙光的海角,坚强的妈妈看着歌词真的哭了,98,2015年1月24日
7817257,20644067,林择栖,听哭妈妈我爱你,63,2014年12月28日
43678503,3660950,nickoren,真的挺深有感触的，妈妈都希望我们过得比她们好，可是我们想做的却是像妈妈那么善良的人…,49,2015年10月30日
5832396,32666786,粥公子啊,表示被前奏所吸引,49,2014年11月15日
2040217218,469978407,我不允许我-,远离家乡，在生日快到的时候，更想她了。你慢点走,0,2019年12月7日
1649117501,1371246227,你画了妆没他化成灰好看Riels,因为。。因为。。。。。呜呜呜我。。我在看火影忍者的父与子(滑稽),0,2019年10月7日
1635471577,516584553,信念复兴,好,0,2019年9月23日
1619059392,125544103,-鹤姬,这首也很棒哈～,0,2019年9月3日
1587472621,131461362,我骨子里的疯狂,两男一女，纽约地下说唱重要人物、西班牙饶舌、爆发力雷鬼公主强强组合，网谈黑眼豆豆的接班人，干练利索的节奏，漂亮的旋律，赞个。,2,2019年8月8日
1577152239,275150334,失了爱意,第一次听是在劲舞团 那时候就爱上了,2,2019年7月31日
1577180621,275150334,失了爱意,emmm,1,2019年7月31日
1574642295,1619878095,危險ww,这首歌是宝藏~,1,2019年7月29日
