25551122,59386607,YouAreTheMoonlc,高二有个对我好到骨子里的男孩子给我推荐过这首歌，第一次听的时候是他刚刚考完试出来耳机分我一半。如今我的大二要结束了，他有了女朋友，我们却连朋友也做不成。早知道结局如此悲凉，我宁愿你从未爱过我。,9704,2015年7月8日
7768875,47555633,无知道人,前奏怀孕,4408,2014年12月28日
25656025,17691798,看似星辰又若风,有时候你想约个炮，却不小心谈了场恋爱；有时候你想好好谈个恋爱，却发现只是约了个炮。世界那么大，床却那么小，床上的两个人曾经那么好，却不能一起携手到老。我喜欢牵了手就能成婚的故事，却活在了一个上了床也没有结果的时代。,3098,2015年7月9日
14825408,19817752,这只猫咪不太冷,我相信这世界上，有些人有些事有些爱，在见到的第一次，就注定要羁绊一生，就注定像一棵树一样，生长在心里，生生世世,2879,2015年4月10日
150366944,103464752,霍独,这首歌总让我想起拜伦的诗If I should see you， after long years.How should I greet，with tears， with silence.若我会见到你。事隔经年。我将如何贺你，以沉默，以眼泪。 还有两首《钗头凤》 一生忘不了挚爱的痛苦 在这样冰冷的夜晚 晕眩的感受别人的痛苦 只愿世人皆得所爱  祝福,2292,2016年5月6日
146605996,107130968,-PIGALLE,我们用初中三年去盼望高中三年，我们用高中三年去憧憬大学四年，而用大学四年去怀念中学六年，最终用我们的一生去祭奠我们的青春。,1775,2016年4月27日
5287606,37433689,淦呆瓜,这首歌真的很好听，觉得和暮光之城系列的小说挺配的，本人表示边看书边听这歌很有感觉，经常感动,1468,2014年10月29日
60868322,105615848,Sadrose,弥天大谎为了撩妹不择手段,1281,2016年1月11日
12333080,41454779,小偷和大兵,第一句就进入下载状态了,1106,2015年3月10日
127534934,104680590,域覍妳,即将30岁一事无成，拿着几千块钱的工资供着房子养着孩子，干着随时可能离职的工作，外账欠了好几万。看着熟睡的孩子，一个人在电脑前迷茫着听着这首歌。我不知道明天会怎样，我只知道压力压得我喘不过气，我只知道我会坚持活着，因为我有了责任，这段话是我自己写的，不要说抄袭，不想多解释个人感悟。,945,2016年3月9日
140677200,113274914,特拉福-俱乐部,我喜欢网易云音乐，喜欢这里的每一个听众，他们明明没什么文字功底，读书写作文都不能拿满分，但在这里，他们居然能瞎扯淡地写出这么多有水准的话。,891,2016年4月11日
13632288,31319950,Dazen然一,【阿西听歌No.827】：这首歌是我网易博客的空间音乐，打开尘封的博客，发现原来我是 2007-12-20的时候注册的，最后一次登录是2015-03-27，不知不觉，掠过8年光景...,636,2015年3月27日
126926038,2820002,cansnow,没想到我们在网易遇到，往事不提，不堪回首……,532,2016年3月7日
295791272,76806713,安安喵i,打了辆出租车，中途发现司机绕路了，顿时眼睛就红了，也许他是世界上唯一想跟我多呆一会的人吧。,438,2017年1月27日
141473517,253721048,飞翔的心QX,以后听到好听的歌尽量留评论，为了防止有一天把喜欢的歌删掉遗忘时还能有人点赞帮我想起来我曾经喜欢过这这首歌,327,2016年4月13日
