49313897,63404862,黛墨子,相对而言 纯音版比人声版更有味道♡,14562,2015年11月26日
141201111,8976195,F_cb,喜欢电音澎湃的听《fade》喜欢电音动感&女声附和的听《faded》喜欢电音动感的听《faded（instrumental）》喜欢电音缓和&女声附和的就听《faded（restrung）》喜欢电音怪异的听《fade（mich remix）》喜欢电音寂静的听《fade（two ways remix）》喜欢电音动感&rap的听《fade（marvin）》,12462,2016年4月13日
49433426,57408421,青峰明日,算是今天一个比较大的惊喜了，Aw继fade后再次改编出faded，第一眼看到这名字，首先纠结的是该如何翻译更好呢，听着听着，却听出了故事结束的味道，结合封面的Aw拎着包转身离开的背影，不免感叹，由fade开始，由faded结束，是一个经典的结束，还是另一个经典的开始？,6635,2015年11月26日
71410662,7045359,Cibeles,父母离异，一个年要两头过，现在在赶去见妈妈的路上。平常听起来很激昂的歌此刻却觉得尽是孤独。我不会去埋怨谁，我只是暗暗发誓不让这样的事情发生在我的孩子身上。,3865,2016年2月17日
49381637,44679786,海绵波子汽水,怎么没人求封面同款？！(˶‾᷄ ⁻̫ ‾᷅˵),2500,2015年11月26日
55444905,30340024,喵喵默,听中文歌我听了太多浮夸，虚伪，无病呻吟的歌词。这么多年喜欢欧美音乐除了超有感觉的旋律，节奏外，还有很大的原因是我不懂外语所以不用知道歌词唱了什么。只是觉得好听有感觉，听着过瘾，就想一遍遍的听…或许还有些莫名的小感触…,1741,2015年12月21日
49303739,62950210,Lissomonline,这次我不会轻易的卡带,1585,2015年11月26日
49326503,15582255,放浪于形骸外,钢琴版的 有点大气,1549,2015年11月26日
71342033,59643474,-_最初呢,一入网易深似海，从此耳机不好买,1449,2016年2月17日
49319552,63795641,鲸丶,我告诉你们，毫不夸张，我这几天在写论文，我是学国际政治的，然后我的论文主要写日本对待中国主导下的“亚洲基础设施投资银行”持什么样的态度？起初，我坚持中日两国会合作，可我在写论文时一致听着这曲子，于是现在写完了，结论是：中日将会陷入更为剧烈的对抗！不说了！交完论文我要上前线。,1040,2015年11月26日
141845509,117359639,Torizwzw,我今年高三 今天作为科比的收官之战，作为一个喜欢了他七年的迷妹想把这首电音送给我科，下一个20年希望他还是那个从14岁就坚定篮球信念的不老少年！  同样也送给还有54天就要高考的我希望能考上理想的大学！,882,2016年4月14日
55132200,64562570,Ivor_Young,钢琴好评，女生版更好评，为了这两首吃土少年忍痛花了8块钱,549,2015年12月20日
71356480,54995169,心无忌,坐在车上一边听着这首歌一边感悟着TM的生活，这一程不知道走到了哪，不知道要去哪，从放弃学业跟随所爱到放弃工作放弃亲情情分放弃一切到今天一无所有，也不知道还能说什么，放弃一段路程踏上新的路程，满怀信心以为新生，怎料命运多坎，但仍然等待绝处逢生。,491,2016年2月17日
1144639707,1436103999,柠玖是抹茶味的吖,喜欢听faded的所有，但是最喜欢的是这个版本，没有为什么，就是心灵的触动，每一次游戏，每一次比赛，只要在现场，一听到faded，就会觉得电音的力量，游戏的震撼。不会不喜欢游戏，在游戏迷失自我。最开始喜欢上游戏，最开始喜欢上电音，这首歌带来的感触很深很深，游戏一直在，感情一直在❤,396,2018年6月10日
70321876,134252758,专抢小孩bb糖,这音乐魔性太大了，吓得我赶紧充了个会员下载无损版,295,2016年2月14日
