13264881,33202117,Abby酱__,不知道为什么感觉日本人的声音跟中国人不太一样似的，但我又形容不出来,28271,2015年3月23日
16641434,61098410,樱井翼,日本的男声各种被秒，可能跟语种发音有关吧，特别亲切温柔就像男友在耳边向你轻语一点都不炫技就是这么慢慢渐渐打开你的心门走进你的心里温温润润的。,19843,2015年4月29日
27602495,52341736,艾比QAQ,是我臆想出来的么还是真的有这种发音特点？特别喜欢这种「元音发的特别饱满，发音位置靠后」的男声，这首，秦基博，486，伊东歌词太郎，RAD等等都给我这种感觉？还是这就是传说中的少！年！音！？,13585,2015年7月23日
208032448,314200548,落花白雪,评论吹八爷的好少…大家多夸夸他好吗 这个男人哪都好啊 作曲编曲作词唱歌都好而且还长得好 八爷大法好,11746,2016年8月31日
16782492,43905538,hahahqiekenao,岛国的歌真是好听啊 日本男声 普遍一发声就满满希望啊 每次听到好听的日语歌 本来迷茫的不行 都感觉眼前有一对天使的翅膀 张开 要飞了 已经飞了 发光的,7888,2015年4月30日
20970227,32672251,夏芝居,我好像很容易喜欢上几乎没有前奏的歌 大概是这类歌经常“开口跪”吧……,7006,2015年6月5日
29808667,32792807,HM773,感觉米津的名字，长相，画画，音乐，都是暖的一丝不苟,6707,2015年8月6日
194690695,132709254,髒侍,日方男声偏向纯净干脆，唱歌亦是如此，很少用绵长颤抖的吐息和上滑下滑音去装饰，就是简简单单唱出来的感觉，但绝不是没有唱功在里面，因为纯粹的发音对气息控制很严苛，不然就会出现低音部虚弱，高音部刺耳的状态。所以，唱歌风格什么的，这也可以算是国籍的优越？【什么鬼_(:з」∠)_】,5976,2016年8月6日
34414619,51643594,末末andN,一想到米津玄师要和RAD同台 我整个人都(๑•́₃ •̀๑)了,4301,2015年9月3日
1427127317,357771038,__离心率__,其实是八爷的声音独特鸭!,4080,2019年3月22日
1445388810,48019385,Je_Moi,再发一遍：发声位置不一样。日本多用真声唱歌，费嗓子但是声音很实，中国习惯用气唱歌（所谓丹田发声），颅内共鸣，所以高音会比低音轻。此外中日咬字也不一样。中国咬字颗粒感很强，日本强调粘黏性。再者发音导致的咬肌发育也不一样。所以会有发声的区别,3682,2019年4月8日
688608599,544107076,-_MANIA_-,我真的觉得米津玄师是这世界上最霸气的真名，听起来跟高僧的法号似的……,3317,2018年1月29日
1427325155,110973820,InariMiko,是发声位置不同而已啦。,2500,2019年3月22日
371048380,410515629,帐号已注销,歌名來源是莫扎特13號小夜曲Eine kleine，不過並沒有全部寫出來，有些翻译直接译成小夜曲。八爺有解释说，「這個标题如果是德語很好的人會觉得违和吧，想這個曲子title的時候，是不断迷茫之后最后触礁的結果。就是根据读音啊、字的排列啊最后決定成這样了。算是個稍微有點辩解一樣的注释吧。」,2459,2017年5月1日
1428315611,404798389,李仙鸣,语调不一样，你用日语的语调也可好听,1972,2019年3月23日
