1208564694,427585133,賬號己註肖,喜欢一个人的第一感觉居然是自卑,30642,2018年8月8日
1181860775,292827806,廿七mu,今天下午男票眨着大大的卡姿兰大眼睛给唱了这首歌，民谣，真香,29872,2018年7月16日
1184879194,1355593319,TONG_1016,我喜欢那个穿绿鳄鱼皮的菠萝头❤️,16672,2018年7月19日
1184161442,396951361,木未乐,看了老版流星花园才发现，我欠了言承旭和仔仔十八年的喜欢！,7502,2018年7月18日
1184796525,93757027,上树精灵,喜欢那个抱着吉他唱这首歌的男孩,6568,2018年7月19日
1186616746,496261497,尝一口阿尔卑斯的甜,遇到可爱的人生活一下子不艰难了街道也好 晚风也罢 都很甜,6384,2018年7月20日
1193086589,414297946,巍巍是我心上人,当那个腼腆的大男孩抱着吉他弹唱这首歌嘴角微微扬起的那一刻，我就知道自己沦陷了。愿你一直走花路，未来可期。一直做自己喜欢的事情 ❤,4679,2018年7月26日
1217637433,334868706,我想找你-却没了借口,明天我要弹唱这首歌表白，希望能成功。加油,3155,2018年8月16日
1186072632,599093781,kanou_s,我也是。。。。因为看了这个人的直播。。。冒发出一定要学吉他的想法,2809,2018年7月20日
1196152442,630825267,隙中驹石中火梦中身,看到你弹吉他，就萌生了一种学吉他的冲动。看到你腼腆的笑，就知道了什么叫心动，看到你好，感觉自己每天都好(✪▽✪)。谢谢你让我觉得还有这么好的一个人值得我去关注，支持，并沉迷。我对你的喜欢始于颜值，忠于人品，陷于才华。,2517,2018年7月28日
1222519603,1459753571,刘哈哈hiahiahia-,我们都太胆小了 民国时不敢做军阀 乱世里不敢去起义 太平盛世不敢说我爱你,2327,2018年8月20日
1201217085,445097368,Kuzzz7,第一次给我唱歌然后唱的这个嗯 那个 ❤gyang,1824,2018年8月2日
