275028558,49836203,人不贪和咸鱼有什么区别,很难想象这是我高中同学,60298,2016年12月28日
171205394,84708840,追星的烤土司,如果没有苏菲应该会走得更远吧……,16606,2016年6月19日
366305909,116291077,Helen-AO,妈的 我们宿舍有个大佬爷们天天唱这个歌 而且还是娃娃音翻唱版的,14325,2017年4月26日
167850707,75007978,xxFanCyLee,加油美少女过来的，坐上TOP one位置的女生还真是不简单啊,12407,2016年6月12日
348355721,399055581,iam-我已成年,有时候，你选择与某人保持距离，不是因为不在乎，而是因为你清楚的知道，她不属于你。人生遇到的每个人，出场顺序真的很重要，很多人如果换一个时间认识，就会有不同的结局。或许、有些爱，只能止于唇齿，掩于岁月,6409,2017年4月5日
346337494,308898522,要一杯摩卡加糖少冰,我女朋友给我放这首歌？？WTF？满脸问号？，，,5181,2017年4月3日
455459937,116069867,淳渊喜欢猫,网易已经推荐我这首歌已经十七次了！我收藏！我收藏还不行吗！,4548,2017年6月29日
58247650,52432598,得起个积极向上的名字,喻不吝Gemini ♊,3890,2016年1月2日
422006844,118476939,痴m__y1n乐丶,但是很多人都忽略了，作词曲人是谁，颜小健，很多好听的歌《解药》《朱丽叶的秋天》等（一开始听他的歌，看歌手信息很洗剪吹非主流）,3359,2017年5月29日
420745201,288111659,a王蠢蠢,日推 第一是生日快乐 第二是蠢货 扎心了,3311,2017年5月27日
429181011,362578231,想与神明比肩,在寝室听这首歌，室友问我歌名是什么？我说:蠢货，然后，，，，，我们打起来了！😂,2880,2017年6月5日
