21138219,47221363,吹喇叭的小喇嘛,其实他也可以去我是歌手,1915,2015年6月7日
18911120,42404137,蔡科俊,李圣杰做为一个歌手，具备好声音，好歌曲。却遇不到真正懂得欣赏他的人。,941,2015年5月20日
562543776,364111228,听说曾经沧海难为水,为什么好女孩总是便宜渣男？因为渣男和好男人的区别就是、渣男是见到漂亮妹子就直接上、也不打算负责任、就想上人家、而好男人还在想、自己能不能给她幸福啊！正在犹豫的时候、妹子都已经在渣男床上了……,593,2017年9月20日
128396776,133219,用户133219,只有备胎才能心心相惜的感觉，估计评论里80%有过备胎经历吧？,522,2016年3月11日
1022268,58156,PP小姐,“要擦过多少肩，才冒出三丈粉红火焰？科学家说“物理距离决定心理距离”，那些擦肩而过的美好，就让它过去，台风过后就是久久大晴天~~,378,2013年8月14日
62950831,104377601,kniveser,以前他们听李圣杰的歌，就是痴心绝对、你那么爱他，只有我觉得这首才是最好听的！,314,2016年1月18日
27715002,15333743,何以爱你,他不会是个好男人、你知道吗,235,2015年7月23日
71887369,114121205,最强_废铁,听李圣杰的歌，必须要在晚上一个人安安静静的听，这样才能听出他的细腻与柔情。可能其中的一句话，一段旋律引起你的共鸣，从此便记住了有一位好歌手，叫李圣杰！,211,2016年2月18日
26246071,64410312,Fish疾风战士,无意中听到的。。。旋律太好听了。。。,191,2015年7月13日
23486252,2476983,尤文广智,我爱着谁 爱得我有点醉 有点累,121,2015年6月24日
39656581,2160449,花沁悠Evelyn,看透了你的所有虚伪和漫不经心，可是，我还是爱你。,87,2015年10月8日
1445937876,1312953338,卖鞋小伙关注有礼,中午去吃火锅，看见火锅店的墙上提醒，羊是自己养的，🐑菜是自己种的🌱油是自己榨的，提醒顾客放心使用。买单的时候我，悄悄告诉老板，钱是我自己印的，请放心使用🌚，老板追了我好几条街没追上，真有意思，腿是我自己长的，想往哪里跑就往哪里跑，🙈陌生人，如果你笑了，那我祝你2019年一切顺利,78,2019年4月8日
1100973918,480638646,Peachach,他的歌声很有感情，很容易代入感。,49,2018年4月29日
1485092821,355883046,爱吃面食的鱼,渣男是索取型人格，好男人是付出型的，付出的越多越被动,35,2019年5月10日
1424343073,556880448,绮雯ham,他唱功很好，声线温暖，我觉得他和品冠都是那种听了悲伤又温暖人心的情歌，不过他们俩都是很快淘汰了，高音才在《我是歌手》占优势，哎，可惜了。,31,2019年3月19日
