7410788,47036302,帐号已注销,这么好的一个乐队就因为是韩国的 就有一些秀优越的评论出现了,25522,2014年12月21日
7405000,47036302,帐号已注销,CNBLUE当年出道的时候 8天就获得第一位 这是创纪录的 第一个,19498,2014年12月21日
19543484,36411087,Mercaptohexyl,明明可以靠颜非要靠实力。,14202,2015年5月25日
10569152,50395648,shirley--杨,喜欢的韩国歌曲不多，这首我就是喜欢，第一次听就喜欢，旋律喜欢，看了歌词更喜欢。不是脑残粉，不是哈韩，更不是外貌协会，只是刚好我喜欢的这首歌，主唱是一位帅哥，仅此而已,10743,2015年2月11日
7379702,41359100,雪天出生的孩纸不怕冷,现在评论里面开始出现一些优越的人了,6227,2014年12月20日
159631281,280295532,Yong_江江,容和的声音是宝物,4963,2016年5月25日
159679159,260474969,陌小墨的芒果,保保的出道曲～那时候紧张的满头大汗弹吉他的容宝现在已经可以在舞台上蹦来蹦去了郑容和一直在以光速成长,4852,2016年5月25日
159691203,282012129,晴天和雨天89,郑容和一开始就那么有魅力,4190,2016年5月25日
159645238,282051131,fdvdv,郑容和的声音太有魅力了，每次听他唱歌都会陷进去,3473,2016年5月25日
159747019,259856031,Yongforever89,即使听过上万遍，每一遍也是不一样的感觉，live简直了，不仅会作词作曲，编曲也是高水准的artist容,2657,2016年5月25日
159699185,282058144,pengpeng89,容和唱得好好听,1857,2016年5月25日
159723047,259856031,Yongforever89,出道到现在尝试过无数种可能，从来不拘泥于一种风格并且真的都做得很好，郑容和已经成长为很优秀的音乐人了,1690,2016年5月25日
159786044,83245000,魔法少女biu_,我们宝宝真是多面手，声音的可塑性太强了,1478,2016年5月25日
159681182,282011136,Justforjyhforever,期待未来更油菜花的郑容和,1298,2016年5月25日
