207304527,85414186,恋恋风尘602,这他吗不是捣乱吗？一个四国混血唱着英语歌，起个日语歌名，我他妈归到哪个歌单里？,74859,2016年8月30日
208700062,121861161,尹梓毅,说出来你可能不信，我归到了粤语,22211,2016年9月1日
29307092,62099043,Desperado1112,亚洲人的声线欧美人的标准发音，简直完美了，个人认为总体来说亚洲人声线更细腻，好听,21881,2015年8月2日
12184044,30764522,prestisssimo,入情深的，刚分手的，懂英文的，千万别点这首歌，会崩溃的。3'40''内心独白是泪点。,9389,2015年3月8日
20237515,32837980,今年善良又纯洁,在我第一次听的时候，觉得如果有人如此悔过请求重新开始，想必曾经爱过的男生一定会愿意接受吧。直到自己被劈腿，被隐瞒，被嫌弃被耍了分手半年后，送给想复合的她一个滚字，回过头来看着歌词，想说一句，早干嘛去了。看来旁观者有时候真的不懂当事人的感受,7207,2015年5月31日
158529941,264319250,樊YiY-,明明是你先追的我 到最后舍不得却是我,6117,2016年5月23日
29945592,59678197,帐号已注销,翻唱胜过原版系列 虽然Che'Nelle在国内好像没有很红 但是唱功绝对不容小觑..,3349,2015年8月7日
1137015614,113672397,殷源,这么巧的吗？,2997,2018年6月3日
38621689,34388721,宇文浅,这首歌固然好听 但是歌词并不可取 因为爱情可以缺 尊严不可丢,2568,2015年10月1日
72593454,114761268,泡面撒了一地,不知不觉六天没找你了，算了反正你也不找我...,2409,2016年2月21日
725749878,387116693,帐号已注销,还是决定离开网易云了，因为你，我用了网易云，也因为你我选择离开，自从我们分开后，我们断了所有联系，唯有在网易云我们还算有一丝丝联系，那就是你在我认识的人的列表里，在那段煎熬的日子里，我总是忍不住点开你的账号，看看你最近听了什么歌，却从不敢给你私信，爱你，从不是说说而已，再见，殷源,1593,2018年3月4日
138109164,114871566,铭清不清明,卧槽 网易推荐这个给我是觉得我单身太寂寞 让我感受一下情侣们的恶意吗？,1406,2016年4月5日
1204878062,450545657,杰尼龟超话主持人,有些人一开口就是付费的味道,1082,2018年8月5日
46526707,44323001,balabalacq_,在云音乐评论栏里的一群人总是做作到可以把无病呻吟这个成语阐释地淋漓尽致,1035,2015年11月13日
326098903,80782604,uedpeap,菜市场偶遇以前教病理的老头，读书时一帮女学生嫌他口无遮拦略显三俗。他见我只问两句话：“还爱看书吗？”“爱。”“还在写作吗？”“在。”他便心满意足，提着白菜扬长而去。怪哉，熟人重逢竟不问“恋否婚否薪资几何”？认得他十年，方知其名士风采。,1025,2017年3月9日
