161102138,108885018,射杀恋人那日,这位小哥是怎样做到把英文歌唱出韩语流行的感觉的==,12494,2016年5月28日
66109971,126550558,卿卿银萝-,美国流行男歌手 曾在美国海军服役 精通阿拉伯语 西班牙语 韩语 俄语 据说还会日语 加州克利分校阿拉伯语学位 会吉他 钢琴 大提琴 小提琴 小号 还会跳舞 生日1989.9.1,10171,2016年1月29日
61739379,76145775,-豆芽x,我要上天了那声笑真的色气,7718,2016年1月14日
61776684,110711834,indealista,只有我是被网易推荐的吗。。网易觉得我很污吗,5647,2016年1月14日
60310332,66574438,Winslock,副歌部分总觉得他在唱【萌萌哒~呀萌萌哒~萌萌哒】,3926,2016年1月9日
61565959,102643464,逍遥散人的的丈母娘,炸了 那个笑声受不了,3794,2016年1月14日
124090572,100888426,RainyBlue-,自从收了一首色气满满的歌之后每天推荐的都是小黄歌🙈🙈🙈,3140,2016年2月27日
61809145,58528057,切一半西瓜的夏天,微博观光团！这个笑声我能舔一年！！！,2348,2016年1月14日
64896070,39760804,离瞳,那句“鸡动”翻译菌你够了。,2164,2016年1月25日
66582776,66290258,TYOTYAN,我发现一般小黄歌都莫名的好听且中毒,1874,2016年1月31日
126473363,100400544,鬼抽茶基,笑声又色气又天真怎么回事⊙_⊙！！！！！！！天真的色气，色气的天真。,1446,2016年3月5日
61450976,72110870,丫丫小公举,从微博的安利君过来。。。,1439,2016年1月13日
60051943,73065347,kpsizsan,你应该说一下副歌是哪个😭,1154,2016年1月8日
123326355,93260609,极夜尽头的星光,怎么感觉翻译比原歌词还污,1143,2016年2月24日
70236287,120045340,一片片一画画,网易云昨天推荐小黄歌I'm not gay，今天又推荐给我这么一首小黄歌，我脸都红了,1038,2016年2月13日
