1650791932,376257530,深邃于大海,内心大有深情的人，往往表面平静如水。她把一份孤意与深情简简单单的交给时光，日子久了，变活成了一副繁华不惊的模样。这样的人即使老去，也会特别美丽、特别温柔、苍老而天真。,200,2019年10月9日
1077957159,51954079,隔墙秋千,突然串调。。你总是心太软～心太软～所有困难都自己扛～,61,2018年4月7日
1390337441,325522976,想一想2016,凤箫声动阑珊处雪落枝头鸟鸣春我问君心何所似一芽一啜一神仙,47,2019年2月14日
1641350781,600543493,瑞雪花轻舞,飘逸柔美🌿🐦🍃日推重温,22,2019年9月30日
1232236521,314576879,娘口三__叁,把悲伤烂在心底，只让快乐面朝阳光。我们所看到的，往往不是真相。只是被扭曲了的假象而已。没有人会知道自己的悲伤在何处慢慢地溃烂。而那么多的人有那么多的无奈。,18,2018年8月29日
1672154989,1607237795,手拿酒瓶朝天笑,历史课本太小了，小到容不下一个人的传奇。写给老辛。南宋那么璀璨的词文化长河中，我最爱您。❤,12,2019年11月3日
