146600576,42553317,帐号已注销,然后你们没羞没臊的睡在了一起,5374,2016年4月27日
130812202,762671,假电台,虽然旋律有些老套，但……蛮好听！,1952,2016年3月17日
138930274,53468964,乄墨兔,第一次知道哦漏原来可以唱的这么色气,1762,2016年4月7日
141430076,16553521,叫我黄大爷丶,第一次听人把oh no 读的这么骚。,1614,2016年4月13日
137664734,83841382,叶黛盈,🍒🍃。“无所畏惧的爱”。好听诺。,539,2016年4月4日
140881458,50096605,大黄蜂09,从日推开始，见证这首歌从没有歌词到只有英文歌词再到有翻译有幸看到这首歌让很多的人喜欢。其实我也是日推第一就惊艳了，当日最佳,478,2016年4月12日
139065728,51737998,Sanguinelament,怎么感觉像一首歌的曲调,300,2016年4月8日
160120393,99669624,夕世宁人,喜欢。❤️,214,2016年5月26日
202451564,44292263,同95_汝何秀,低音炮太强~听的耳出血~,195,2016年8月21日
1238646436,1514043771,Bielemeng,喜欢这首歌的人一定超级好看！,72,2018年9月6日
1461087004,275660677,笑只是嗰表情与态度无关,“你是经历了多少委屈，才有了那一身好脾气”,11,2019年4月22日
