1201864502,332227541,可乐过期了C-3,Сука Блядь！,545,2018年8月2日
1364647570,479599577,秦羽彡,科普一下，这句话是俄语，你好的意思这个是个口语化的短句。如果你遇到俄罗斯人，尤其是壮年大汉喝过伏特加，一定要说一句，这是最基本的礼节。记住 这个词叫 苏卡不列,435,2019年1月22日
1260242179,1377789979,YE某人_,同志双持波波莎，一路横推汉斯家。干了这瓶伏特加，去解放阿拉斯加。苏联航空欢迎您，骑上导弹飞巴黎。外星文明是辣鸡，图九五炸三体星。同志戴上避孕套，明天登陆北海道。阿迪达斯三叶草，从此蹦迪不崴脚。搬上一五二神教，对准白宫来一炮。穿上海魂上飞机，今晚空降洛杉矶！,326,2018年10月1日
1365717644,1292140117,AgNO3-硝酸银,你这是谋杀！,220,2019年1月23日
1309314693,434443356,噩梦先生,斯大林打赏了一颗大伊万,198,2018年11月25日
1354894761,350313578,妈m再打我一次,记住，我们是反恐的，不是救人质的，救人质留给医疗兵就可以，同志，苏卡不列特,179,2019年1月12日
1307658303,629287758,敢不敢跟我比划比划-,你来错地方了，这是斯拉夫迪厅,138,2018年11月24日
1200049057,279873416,两米摔死的杰洛特,穿上海魂上飞机，今晚直降洛杉矶,92,2018年8月1日
1384729320,1334454685,LiebeLjutin,【赫鲁晓夫】打赏了十个【玉米】,63,2019年2月9日
1256211949,58130649,多逻傩,身穿海魂上苏七，今晚轰炸洛杉矶。穿上海魂上飞机，今晚空降洛杉矶。实弹挂上苏三五，今晚活捉特朗普。端起 A K 伏特加，今天白宫是我家。镰刀锤子身上帖，赤化这条华尔街。铁骨铮铮斯拉夫，打死不看好莱坞。阿迪达斯三叶草，跳舞从来不崴脚。阿迪达斯耍流氓，美国倒了我称王。,51,2018年9月26日
1476886840,1740001508,肥宅穷开心,苏卡布列是俄罗斯国骂，千万别听他乱讲,43,2019年5月4日
1390197135,475018162,KILLLAKILLlllllll,叶利钦送出十个“核弹协议书”,35,2019年2月14日
1364925115,495789461,Realms_,一瓶一栋楼两瓶灭地球三瓶银河系四瓶创世纪,34,2019年1月22日
1390191166,475018162,KILLLAKILLlllllll,SCP-096抬起了头，并看了看你！,32,2019年2月14日
1405192788,319526745,ThomasJunker,吃我一剑，华夏第一剑！御剑伴我！,27,2019年2月27日
