12270407,49810003,银弹GCell,看见果体我就点进来了😉,1333,2015年3月9日
9631346,37522052,目隐子行,当2：39秒二胡一响起我就跪了。,940,2015年1月28日
28548486,59463386,ZF2020,想到了MC........一个人孤独的坐在电脑旁，建造着自己梦中的城堡,916,2015年7月29日
712918068,1327569526,浪生i,真羡慕你们耳朵里有子宫的人,856,2018年2月21日
13616365,44682411,帐号已注销,#MelodyEveryday#相比原版，马克西姆的编排更奇彩，当中的提琴是神来之笔。而原版独赋把时间拉得悠长的魔力，也许那才是萨蒂作这首曲子的本意,648,2015年3月27日
13602068,34330865,原子力战舰长门,我大凉宫春日的消失,416,2015年3月27日
22459897,59195546,月刊少女胡小喵,凉宫春日的消失……似乎又回到了那个飘着漫天雪花的日子，你呵出的白雾慢慢消失在了寒冬中,365,2015年6月17日
1375806667,71915895,NEXTSTARRY,这是这的一个梗，拉得好的小提琴叫二胡,226,2019年2月1日
16172200,62032318,薛定谔的猫已死,这首歌凉宫春日里面有插曲,194,2015年4月24日
6882613,6015455,爱尼狂乐,犹如一出水芙蓉，手执绣花香绢，轻轻拭去发髻水珠，望着窗外丝丝绵绵得细雨，思君不见，不禁泪落。可谁知。那擦拭得是泪似水……,186,2014年12月9日
8145886,39640859,southerndog,下午的阳光慵懒地照在脸上，听上一曲马克的曲子，太阳都笑了。,152,2015年1月4日
6347064,6080917,感觉老了-想不出新鲜的昵称,戴上一个好的耳机听这首曲，耳朵怀了一百次孕,141,2014年11月27日
593056667,46454835,西瓜要移动,对呀！微博上看的,139,2017年10月22日
