66938130,54514322,利贺佃,听这里我突然发现了一个令人惊愕事实:我在家里用流量听了一中午的歌,60911,2016年2月1日
187655038,284331641,可以赢但没必要___,你以为哈士奇听了不想骑着你上战场嘛？,47135,2016年7月24日
4690169,10291344,帐号已注销,当小提琴跨越了古典的界限，真正展现它激情四射的时候，这才是小提琴灵魂完美的升华。感受到小提琴带来无与伦比的轻快激昂啦,38577,2014年10月4日
5933538,41019587,Sekirooo,太难了，表示真的太难了！把位跨度大，跨弦频率高，节奏还很快，简直丧心。。。,33105,2014年11月17日
5322197,19930116,茶荔斯,直接变成闹铃了！一大早我就要住命运的喉咙,26622,2014年10月30日
68010143,43579218,FortheWayILive_,不能听这歌做作业！速度是有了！但我不知道我都填了啥！,21465,2016年2月4日
133112104,252045751,重庆市最后的好男人,下班路上听，中毒了，10分钟连闯8红灯，现在第9个被交警拦停了，目前正在侯拖车，顺便发个评论,14481,2016年3月23日
134203531,36644423,涂太阳,一个人带着耳机沉浸在自己的世界里，跟着节奏全身都在抖动。突然下铺的哥们就默默的丢上来一包纸巾。。。。,11772,2016年3月26日
5022717,9344842,Ad-ima,忧伤的日子里会过得好一点。,8351,2014年10月20日
73210280,50441217,无感体质,刚开始学钢琴的时候 特别喜欢这首 天天听 天天练 功夫不负有心人 今天的我终于也没学会,5678,2016年2月22日
133061527,250409786,沉默寡言101,如果评论不是为了装逼，那就毫无意义,5284,2016年3月23日
49874377,105187059,郑电荷V,我妈听到这首歌居然唱了起来：啊朋友再见，啊朋友再见吧再见吧再见吧,4871,2015年11月28日
21626831,3056372,_AcciopaCus,我发现了，每首日本曲子下面必有民族争端每首小提琴曲下面必有人提二胡,3072,2015年6月11日
10576757,18414626,血色加冕礼,世上的音乐，大部分人听到的都是带有歌词的，其实，没有歌词的音乐对情感的表达更为淋漓尽致，人们听惯了热歌榜，或许就认为好听的音乐也就是如此了。其实，音乐的世界很广，最震撼人心的音乐，可能在你从未触及过的深处。,2621,2015年2月12日
1332673381,497948796,天被地床泗海為傢,现在流量不值钱了,2450,2018年12月20日
