1411052532,50398611,真-泠鸢yousa,第一次唱 ilem的歌，本家av43426592 --这歌太治愈了！唱完很开心！恋爱光是想想就很美好！,63050,2019年3月5日
1411164654,1353077626,帐号已注销,“对你的心意就像暖冬贪眠或风吟鸟唱 星星暖阳”,18011,2019年3月5日
1411613571,349945552,凌越ly,昨晚正在给朋友录这首歌，然后就看到了yousa的私信OwO！！一激动…把最后一句唱劈了…现在在思考还要不要发给朋友听…【嘤！当然是先来听yousa唱的了！我爱这个仙女er~（被吞了一晚上的评论…哭泣,16069,2019年3月6日
1415449349,481336063,为我失神,万丈深渊越靠近越沦陷 我想，我爱那个拉勾勾的少年。,7083,2019年3月10日
1419805817,341119573,梨子不熬汤鸭,或许勾指起誓的对象不止是喜欢的人吧ww我觉得朋友也不错！！✨✨，因为其实在好友圈里我是唯一一个没有对象的（？）虽然大家都有甜甜的对象但是都对我特别好，当初就有人和我说过一句话:你是被喜欢着的。是啊ww我是被喜欢着的！✨,6902,2019年3月14日
1418484918,581699590,往往lh,你知道吗？并不是每棵树都长得一样。有的开花，有的结果，有的可以长得很高很高……他们都不一样，就好像我们。“我们也都不一样。”你也许跑不快，长得不高，也许不聪明……但你是你，你有你独一无二的地方。 你不完美的样子也很好。因为这是你之所以是你的理由——,5223,2019年3月13日
1412117753,287225105,反正我不是我,女孩子好麻烦啊，还是找个男孩子一起吧。（滑稽）,5206,2019年3月6日
1434754985,1714519633,庸败亦残缺,我们的婚戒是同一款，却不是同一对！,5200,2019年3月29日
1442279502,516712784,於安歌,初三，那天晚自习停电，在教室外面做题，做到天黑，老师让我们进班，然后让我们唱歌，唱着唱着就点到我了，我唱了这首歌，安利给了我班好多人，那可能是我第一次当着这么多人唱歌吧，然后被夸了，让我自卑的心得到了最想得到的夸奖，捡回了我丢失已久的自信,4436,2019年4月5日
1462786853,369732833,癫狂痴疯,我：妈我想结婚妈：你结个鸟婚我：Σ( ﾟωﾟ；你咋知道我想娶个鸟,4157,2019年4月24日
1570489259,1741391479,我是混子din,信的开头:你悔改吧――鲁迅《藤野先生》,1309,2019年7月26日
1411055558,359204346,和风disco,冷鸟球(*/ω＼*),1264,2019年3月5日
