5210405,3119544,思恋是一种饼,那些年老子一点钱都用在路上了…结果尼玛…对方出轨…每每听这首歌我都超揪心。,14558,2014年10月27日
5021420,9126029,布鲁斯特应届生,由“漫天风沙里”这句可以推断出在北京！,9037,2014年10月20日
6174227,17880113,福瑞德姆,歌手金智娟，曾经因为结婚走入家庭，离开演艺圈多年。她个人独唱的歌曲，最红的要算是《飘洋过海来看你》，这首歌就是描写她近20年前，爱上一名北京男子的苦恋故事，娃娃录唱这首歌时，几乎哭到录不下去。不过，这么动人的词曲，竟是唱片制作人李宗盛一边在店里吃牛肉面，一边在餐垫纸上写出的！,5930,2014年11月23日
19039032,61277536,RichChiggs,每次要跟他见面，我都会多垫两块胸垫,4750,2015年5月21日
6102578,2985267,皓_皓,是我老了，还是现在的音乐人真的写不出这样的好歌了。,4296,2014年11月21日
8961805,1561344,着调不着边,昨天 她结婚了 主角不是我 消息祝她幸福 她说 别把她妆弄花了 以后再也没人漂洋过海来看我了 向来缘浅 奈何情深,2940,2015年1月18日
8436536,30066535,sunnyface,哎，说多了都是泪，当年工资1500，几乎全拿来电话粥，直到有一天接电话的是一个男生，从此看就见那部索爱k700c就有一种难受的感觉,2809,2015年1月9日
4941869,3701104,scaa,这种歌好像一听就很有故事，不是无病呻吟，就算没有经历，谈不上感同身受，隔靴搔痒总也是骚痒啊。。。,1796,2014年10月17日
31386658,52203884,Villa221,4年前的圣诞节，从武汉到哈尔滨，2600公里，28个小时的火车，重复听着这首歌十几小时。我一直在想啊，该以什么方式见你，虽没有漂洋过海，但却穿过了半个中国。到锦州的时候，看到你发的收到的99朵玫瑰，我没选择回去，也没去找你，只是到了你的学校，看了你生活的地方，现在毕业了，我还是想你。,1404,2015年8月17日
37900948,49041752,你不是真正的快乐-1,男人最没用的东西就是一无所有时候的温柔,1333,2015年9月26日
43985271,72323983,朱美玲是个大美铝,是的，异地恋是不会有结局的。,951,2015年10月31日
5298267,40242240,噜杰,唉，自己爱的深沉的人说走就走了…,675,2014年10月30日
728930721,268107232,calmpursue,2月28号晚上和前男友吃完晚饭手拉手一起压马路，路边放了这首歌，他说“陌生的城市啊，熟悉的角落里”这句很应景，然后就给我唱这首歌，唱到一生(和你相依)这两个字就突然停顿了。其实我觉得最应景的一句应该是:也曾彼此安慰，也曾相拥叹息，不管将会面对什么样的结局。把最后的温柔留给对方，祝君好。,550,2018年3月8日
728497123,50004750,一路向星_,愿你听见我的名字时 眉眼带笑，愿你在见到我时不管不顾给我个拥抱。,496,2018年3月7日
44031018,37988182,-林西瓜-,若是相互羁绊 不如各奔天涯,402,2015年10月31日
1066450266,1299504180,曾经的梦想呢68,因为一无所有，所以给不了什么，只有怎么去讨对方高兴，被你说成没用，，，，,119,2018年3月27日
1066440795,57673497,黄粱一梦罢,还好现在被我收下啦……,32,2018年3月27日
1066399573,324918674,霓虹_swag,年少爱听李宗盛，求接下一句😏,30,2018年3月27日
1066383858,333906528,帐号已注销,一样,17,2018年3月27日
1066364167,113185247,未醒R,你走的再远，也走不出我思念,26,2018年3月27日
1066352499,268373066,在你耳边求救,哈哈叫我不用垫的,13,2018年3月27日
1066340323,247918055,youngdddddddd,曾有个女孩 不远千里来找我 可我却骗了她 连朋友的做不成,19,2018年3月27日
1066361625,333906528,帐号已注销,也有幸福美满的。,13,2018年3月27日
1066333854,324906285,二二师姐,因为春至了,6,2018年3月27日
1066334836,577195278,六乘二,天南地北 海角天涯 可思不可追 路长路短 缘生缘浅 看见就好,9,2018年3月27日
1066298980,509742165,廾匸十囍,还好没有漂洋过海，要不然现在我会伤心成河,6,2018年3月27日
1066296870,127846897,雪豹说,唉，为啥现在再也没有这么经典的音乐了呢，现在的歌曲只能传唱一阵就在无人提及了……可悲,15,2018年3月27日
1066283623,1408771030,Iron_wu,陌生的城市啊，熟悉的角落里。哎,8,2018年3月27日
1066263918,562371218,我很酷但我也需要男朋友,谢啦，上午刚考过,8,2018年3月27日
1066280534,1381265447,也许还有一个十年,不知道为什么，这几天特别想你，虽然已经放你在心里这么多年。初心未变。,3,2018年3月27日
1066250243,1316892813,为茶而来,心动原来真的存在，重庆出发的火车，我遇见了一个女孩，还没看见她的脸，我却感觉自己喜欢上她了，她声音不好听，我却不觉得烦，心里一直很着急的想去看她的脸，各种找机会，还好在下车前看见了，很平凡，但我却觉得自己很想和她一起，可直到下车也没能鼓起勇气问她要微信，心里好后悔，还有机会见面吗,11,2018年3月27日
1066216424,387114846,沈小梨,哈哈，年少时有个少年和我说过一样的话,2,2018年3月27日
1066229158,256026192,一个喜欢看韩剧的男孩纸,看评论看到这里突然觉得在爱情面前都是一群傻子，我亦不是一个旁观者。,6,2018年3月27日
1066213024,82690818,废铁V,哇，版权拿到了吗？可以听了呢,5,2018年3月27日
