1430380230,128066179,潮鳴丿汐灬奏丶,得过且过的教主教主打着饱嗝离开哔哩楼今天也到音乐区转一转不缺乏才华或者是正义感但是我有点懒听说B站出现一群催更妖怪我以身作则率领大家不去B站霸道的天依每天都欺负言和她们的事情不方便管我的声库十年来未尝一败就是太久没用电脑无法加载我愿随时为传说献出生命不过也不是非要今天,11164,2019年3月25日
1430384122,359461726,嗄奰,道理我都懂，但为什么无赖都能有老婆。,8724,2019年3月25日
1430407203,252718549,狐日和HARE,达拉崩吧：别的村的勇者得过且过的勇者：我们村的勇者,7460,2019年3月25日
1430450104,476064606,桐谷5,原版是一唱一和，逗比本色，三无唱出来就是一种“我懒我自豪，我得过且过十分潇洒”的感觉,6608,2019年3月25日
1430415237,333549556,走之折233,这段评论就写一半吧，明天写也……,3624,2019年3月25日
1431024030,1372380913,钦割割,学生伸个懒腰，到处挠一挠今天班里也死气沉沉不怕背单词，也不怕记公式但就怕写作文 我要将我的信念贯彻到底永不放弃我劳逸结合的勇敢我们向美好大学执着前进明天复习也为时不晚 我的钢笔十年来未尝一败就是太久没用有点写不出来我愿随时为刷题献出生命不过也不是非要今天,3260,2019年3月25日
1430384271,64340217,一隻想變成橘子的蘋果,听说达拉崩吧班得贝迪卜多比鲁翁为了救出米娅莫拉苏娜丹妮谢莉红离开蒙达鲁克硫斯古比奇巴勒城去迎战昆图库塔卡提考特苏瓦西拉松了。邻村的事情与我无关,2767,2019年3月25日
1432652508,1460930843,G-nomeshgh,这是我见过的三观最正的勇者了 “谁说勇者一定要付出生命”,2687,2019年3月27日
1431316502,1291884597,臭熊猫耍菜刀,低音有点拿不准，唱歌中间的节拍掌握的不怎么好，五音不全，鬼哭狼嚎，听得直叫人要吐，以上都是我唱歌的缺点，三月月唱的非常完美！,2330,2019年3月26日
1431208721,314093125,完螚,给大家科普一下Funk骤停打击乐（Funky Breaks），放克（魂克）是一种美国的音乐类型。骤停打击乐因其为90年代后期想要给流行乐坛和商业广告一些噪音干扰的人们提供了一种声音从而成为电子音乐中最流行的乐曲。由非裔美国人音乐家把灵魂乐、灵魂爵士乐和节奏蓝调融合成一种有节奏的、适合跳舞的音乐。,1960,2019年3月26日
1435328052,533897720,弦鱼亚,给跪了，原曲是嘲讽拆台，怎么到了三无女神这里就一副理所应当的样子😂😂😂,1788,2019年3月30日
1430277856,494536681,子荼荼荼荼荼,大家好我叫大喇叭额买个吧是隔壁村的英雄,1339,2019年3月25日
1432834176,1690985472,方舟的骑士-Dr简,今天的我：哎呀！七点三十七分了，玩到八点就写作业！嗯！哎呀！八点十一分了，凑个整数，八点半就写作业！九点二十七：不能再玩了，十点就停手，不然写不玩作业了。十点：……十一点仍在补作业的我：明天一定要早点写完作业再玩手机！明天：这手机真好玩呵呵呵～,796,2019年3月27日
1430534467,496581014,烈父托儿四胎,有了妻子才开始无赖，为了妻子，选择无赖,765,2019年3月25日
1430506678,276001932,奈何凉笙叹,他的妻子。。。家事。。。肯定是无赖的老婆啊,721,2019年3月25日
