383365200,337802756,Mc_Zeus,一名中国数学家去了国外和另一位学者交流，他说他的一天中的24小时，百分之六十都在睡觉，百分之二十在学习，百分之十五在修生养性，还有百分之九十在听音乐，外国学者说：“你不懂数学”，那名中国数学家回答说：“你不懂中国网易云。”,57417,2017年5月15日
332627077,116889427,我才没抖断腿,如果你看到面前的阴影，别怕，那是因为你的背后有阳光,32536,2017年3月17日
631158022,597188539,DALforever555,由于国内的错误认识，DJ长期以来被当作一种音乐曲风，但事实上，DJ并不是音乐风格，许多人会把电音错误叫成DJ，DJ只是职业，是职业名词，工作主要是打碟，DJ指夜店(club)、酒吧(bar)、Live House、仓库派对、音乐节等场所的打碟工作者。我知道我的评论会沉下去，但我不想Dj再被人误解,21880,2017年12月3日
359394784,258492777,圣爵菲斯,你们是看努巴尼来的，我是听私人FM。更巧的是我还玩了3个赛季的守望先锋,18988,2017年4月18日
431378329,121006894,爱予被暧,下午高考数学了！一个中午没睡觉，听着自己喜欢的电音，很开心我需要你们的力量,14530,2017年6月7日
336156614,11019741,绿洲城老司机,努巴尼真正的粉丝，看完国服精彩集锦后就会直奔云音乐听背景电音,8473,2017年3月22日
294902321,71293834,HandsUPower,前10留名 记得杯子以前说他注销后还希望继续有人更新他的歌 K叔棒棒哒,4512,2017年1月25日
625323897,252354206,听惯了风的温柔,玩了两年的网易云，为了给你们点赞，手都要断了，更何况还听电音，全身都有伤，你们就不能体会体会？也给我点一次赞？,3750,2017年11月27日
338119893,95978754,电音收藏大师,我承认这节奏听的很多，但是真的好听哈,3120,2017年3月24日
335450463,317809152,语沁UraniumChan,努巴尼来的抱紧我哟~(/≧▽≦)/~┴┴,2815,2017年3月21日
698949363,535175875,网鬄芸罯乐,没限制了你的复制力,2117,2018年2月8日
306604817,90229118,Elecprok,这制作人这三首都下载了,1832,2017年2月10日
1344223504,455114386,等多久烦恼,陈独秀请坐下别急,1696,2019年1月1日
1394520370,1601495332,故人已故_,男生亲吻未满16岁的女生是犯法的，即使女方自愿，但在法律上不给予同意，男方随时触犯《刑事罪行条例》第122条猥亵侵犯罪 最高可判监禁10年，那些在我面前秀恩爱的你们注意点，我看见了就报警🌚🌚🌚,1496,2019年2月17日
1353434949,291025948,guitarbyc,还有百分百在抖腿,1352,2019年1月10日
