7407685,33934932,本质狸屎,预测！！！预测！！！一个月后跟泡沫一样火！,61201,2014年12月21日
5652595,3104715,很可可爱,失恋不要听alin 觉得活不下去了,39941,2014年11月10日
10408381,19667022,加厚高压锅,有那么一个人，闯进你的生活，让你成为最伟大的冒险家，明知没有结果却一直给自己打气。直到有一天，你幡然醒悟，命运这个东西太奇妙，不是你的终究不会是你的，只能独自含着泪往前奔跑，不让眼泪落下。但你终究会懂，这只是命运开的玩笑，最终你会祝福，记得那些美好的东西，调整，然后迎接新生。,32091,2015年2月9日
14389972,19817752,这只猫咪不太冷,每天认真洗脸，多读书，按时睡，少食多餐。变得温柔，大度，继续善良，保持爱心。不在人前矫情，四处诉说以求宽慰，而是学会一个人静静面对，自己把道理想通。这样的你，单身也所谓啊，你在那么虔诚地做更好的自己，一定会遇到最好的，而那个人也一定值得你所有等待。,28689,2015年4月5日
7380781,5506155,月落空山溪,难道不是已经烂大街过一次了吗？,14525,2014年12月20日
128996392,249717820,天涯不远呀,你终于打了个电话给我，哽咽着问我到底闹够了没有。我眼泪立马就掉下来了，嘴里一直说着不闹了不闹了，我要回去你身边，然后就猛的惊醒了。大概这也只能是个梦了。,13827,2016年3月13日
603980078,598806378,JYeeChow,愿你是渣的一方背负所有骂名愉快生活而不是在深夜痛哭辗转反侧茶饭不思做一个痛苦的好人,12427,2017年11月3日
6385537,9575948,Wen_en,曾经我们一起听哭的歌，如今只剩我自己偷偷掉眼泪。或许就是这样，曾天天联系到今天的再也没联系。而我还是那么想你。只是放在了心底。,11003,2014年11月27日
63306604,84667184,是锡锡锡的喵喵喵,《东邪西毒》里有段台词：“以前我认为那句话很重要，因为我相信有些事说出来就是一生一世。现在想想，说不说也没有什么区别。有些事情是会变的，我一直以为自己赢了，直到有一天我看着镜子才知道我输了。在我最美好的时间里，我最喜欢的人不在我身边，如果能重新开始该有多好。”,10996,2016年1月20日
187715014,113280618,时光记忆不微伤啊,初恋今天结婚了，我去了，没有尴尬，没有扭捏，大大方方的就去了，她还是和当年我看上她时一样漂亮有气质，一样那么温柔 那么可爱。但是好奇怪我没有妒忌和不愉快，那一刻终于发现，曾经爱她是真的，现在的祝福也是真的。原来真的有由衷的祝福，感谢她那么优秀，我的青春没白过,8425,2016年7月24日
7479837,32048372,coco_橙子,2015年的又一泡沫烂街神曲,5661,2014年12月22日
5603518,35509465,果儿2,我们要诚实的面对自己 时刻保持对事物原本的认知 去发现它 去感受它 用一颗善良的心去理解它 、我们已经偏离到人性的另一个轨迹 太多的自以为是 太多的虚伪 太多 太多…其实 生命的本质是要我们归于本质 我们欲望不断膨胀 内在那些肮脏的东西最终会把你病后污染，做一个真正来到这世上的人 ,5164,2014年11月9日
60508197,118218893,南瘦香菇,每次失望一次，我就少做一件爱你的事，直到最后备注改成全名、取消特别关注、上线不主动找你、收起你送的东西、删掉你所有的照片、再也不偷偷看你的时候，就是该说再见的时候了。多年后你会不会记得，曾经有一个人很努力的珍惜过你。——失望是一天天积累的，离开是很长的决定……对不起,3960,2016年1月10日
7402716,34506388,寒逝,就是从寂寞不痛这张专辑开始听A-Lin的，之后每张专辑都入手了。我歌三加油,3045,2014年12月21日
1332571183,300577914,gvzalayyyy,你这个评论已经四年了 陌生人 祝你幸福,2581,2018年12月20日
