9060217,49962090,左左左左吃这个,在广东和香港他红得像个鬼。。。,51053,2015年1月19日
149391665,64358653,繁忙的日子,作为广东人就是好，既能听懂粤语歌，又能听懂普通话,26328,2016年5月3日
124656497,115991530,萝卜胡须,可惜得到只有劣评 没有半粒星.........淘宝店主的怨念吗,22763,2016年2月29日
15855526,48651961,卧槽起个名儿不容易啊,虽然整首歌都好听，但个人认为1分29秒女声‘得不到掌声得到温馨我爱这种清静“是最好听的，每次我都故意跳到那里听着一句。。。,10595,2015年4月21日
9589285,39141371,多啦夜梦,感谢当年这首歌，让我明白自己需要的就是郑融这样能给人鼓励与力量的女人，直到前年遇到我现在的老婆，懂得珍惜她，得到她，也是我人生的一项“成就”呀！,8448,2015年1月28日
13310105,45467822,飞到荼靡,好吧。这歌明显女生唱的部分好听。,6775,2015年3月23日
56601892,61717472,FLASH-2,昨晚去KTV听妹子唱了觉得好听，今天就在私人FM里听到了……简直怀疑网易云是不是给我装了监视器什么的啊2333333,5245,2015年12月26日
8544752,49074784,不用不用这个账号了,找一个男孩子一起唱吧,3529,2015年1月10日
123497279,108182375,爱吃牛扎饼的Ziv,我就喜欢那句 得不到掌声得到温馨我爱这种清净 真好听,2765,2016年2月25日
58179289,51576637,恶毒的听众,刚才放这首歌，室友听着很嗨跟着摇摆然后问我什么歌，我歌名是一事无成，他说怪不得听着好听，原来有共鸣,2618,2016年1月1日
70826029,42476870,咏枫forever,“得不到掌声得到温馨我爱这种清静...”这段女声简直太赞！,2437,2016年2月15日
7532344,7239268,echo様,周柏豪声音好好听。为什么不红啊。。,2114,2014年12月23日
1341735608,383491660,我叫阿生呀,红的像个鬼是什么形容啊哈哈哈,1267,2018年12月30日
217346815,326949748,小聪神,每次通知栏显示赞了我评论我都要重温一遍这首歌。。,641,2016年9月20日
1673362717,328404288,残桥饮雪,今日辞职，网易云给我推这首歌？,476,2019年11月5日
1673362717,328404288,残桥饮雪,今日辞职，网易云给我推这首歌？,476,2019年11月5日
1673066342,357724270,沐紫嘉,听唔明仲由歌词啊嘛,12,2019年11月4日
1672816369,322916047,双子星雨--云,我的想像中，有一位少年，安靜在放羊，突然羊抽风，满山瞎逼跑，那位小少年，跟着瞎逼跑。那个抽风的，没错就是我！！！！！,52,2019年11月4日
1672719315,544803057,这个名字没人取吧真6还真有,看看赞的数量，就知道谁是少数谁是多数了。,5,2019年11月4日
1672694117,473985295,CK威威,会听不会说,0,2019年11月4日
1672206440,334004045,没冲你笑别闹,11.17就25岁了 作为一个大龄单身女青年 一事无成 17成都飞稻城 想去思考一下人生 太难了 每每想起工作的事就心慌 不想以后做黄脸婆看脸色吃饭 不想家里有事伸手像对象要钱 保守的爱情观让我难遇他 加上还一事无成 哎,114,2019年11月3日
1672197659,133218677,一个文-,愿喜欢和合适撞个满怀,72,2019年11月3日
1672069814,68926459,invisiblecc523,歌词扎心了,16,2019年11月3日
1672005476,258380615,小份心碎c,+1,0,2019年11月3日
1671946091,378661232,看到我_請叫我去學習,21岁的我 一事无成 希望31岁的我，事业有成,79,2019年11月3日
1671352914,1443602436,最酸的橘子x,岁月易逝，年华虚度，空有一身疲倦，已经忘了自己好久没有开怀大笑了,29,2019年11月3日
1670588029,85352349,anson与海豚,应该讲，广府人懂粤语和普通话,2,2019年11月2日
1670556314,394954065,陪星星闪耀和黑夜一起寂寞的孩子,“好久不…”“借过”,51,2019年11月2日
1670516632,1374994378,眼前都是黑-,早安2019年11月2日🐒 星期六天气晴🌤 温度20～32℃ 昼夜温差大，但是比起前几天没那么冷了距离🧧 过年还有 83 天距离🎉 2019结束还有 59 天,23,2019年11月2日
1670480333,18365411,小猫炖土豆,周绰华的儿子同名,11,2019年11月2日
1670332348,390733761,白熊很生气,我不信你初恋...,2,2019年11月1日
1669847710,1976918174,零九_uYil,二十二了一事无成全是负累,32,2019年11月1日
1669734031,598860113,火车叨位去_z,巧了,1,2019年11月1日
1547448761,391198356,nino桑的花嫁,师兄好,7,2019年7月6日
1547262227,570265084,狗语十六级,对的,0,2019年7月6日
