270256500,382637645,VK克-官方号,自己支持自己的歌,22308,2016年12月21日
9703292,51873424,超远距连接,因为deemo爱上了这首歌,5398,2015年1月30日
8486449,49650697,TheRealHildegard,上帝视角逐渐退化然后彻底退出，我还以为我从未说过少年愁、并且沾沾自喜，后来，我发现，我就是那群人里最愁的少年，写过的伤春悲秋和想过的铁马冰河入梦来加起来可以印成一本牛津高阶。,4909,2015年1月9日
131943073,253372408,哇哈哈哈哈11,给宿舍的人放纯音乐，五个人都说放的是什么啊，赶紧把手机扔下去吧，这里是大学宿舍唉，就喜欢华语么，唉，我也真是，为什么要放给不懂的人听呢，也许是好音乐要分享的心情吧，还是说为了装逼？,3592,2016年3月20日
68313683,65492015,Tegernear,哈哈，嫂子在婚礼上弹奏了这曲钢琴曲，震撼全场!😃😃,3510,2016年2月6日
253678769,103456379,aomiya,我发誓这辈子一定要学来钢琴，哪怕现在已经比别人晚太多太多。,3012,2016年11月26日
11242680,53957536,Cao_OLe,第一画面感，小树林里，安静的夜晚，湖面倒映着天空中的月亮，deemo弹着这首曲子，小女孩静静的靠在树边听着。,2820,2015年2月23日
9931484,52195650,肖二千,琴之翼和这首已经听了好多年了,2047,2015年2月3日
29522611,3014572,尘心海角,我不懂文学和音乐，但我觉得V.Kloud的风格跟文学里面的“意识流”很像，肆意烂漫，就像春柳那般肆意舒展触手。,1694,2015年8月4日
17000724,65235158,汪苏泷的小号,最开始的旋律，慢慢地幸福，回味。中间，旋律陡然一边，还是这风格，就像嬉戏的恋人一样调皮。再缓缓进行，无缝衔接，爱在进行，星晴，心情，多好。其实，想要的爱，就是这么简简单单。每一天醒来的清晨，你和阳光都在,1250,2015年5月2日
6659541,40516646,北斗儿123456,我一直想找只配拥有它的人,1105,2014年12月4日
11238667,47632120,秋锋客,神秘、未来、创造、新世界、重生。脑海里浮现出这几个画面,844,2015年2月23日
217721595,252404335,蜗曼,如果世界上每一个人都能被音乐感动，那就再没有什么纷争了吧，再没有不安了吧，再没有孤独再没有冷漠了吧。会有这样的一天实现的，你说对吧？,826,2016年9月21日
15280775,49993636,西喷撒浪,聆听细微之处 好像呼吸都是美好的,668,2015年4月15日
13887958,58659783,煙埖嬑唥,99大工告成,509,2015年3月30日
