7346661,8933421,藤井便利店_,哎，电音听多了就没让人惊艳的感觉了，再找当初那种一见钟情的感觉好难,76908,2014年12月19日
127087239,247850391,莫箫z,告诉你们，不要听多了电音，要不然每次每日推荐20首全都是电音😂,44954,2016年3月7日
132565442,84856900,亚达-,万一有一天网易云音乐停止运营了，我这么多收藏的好歌可怎么办，为这个问题已经好几天晚上没睡好觉了，到底该怎么办才好！,38688,2016年3月22日
132391792,64961827,生雄絵梨花和緒儿,纯洁的笨笨傻傻的小妹妹会去网吧？你在逗我笑→_→,30591,2016年3月22日
49612588,19670190,Non-recoverable,为做好事不留名的Maxkim刷一发,20365,2015年11月27日
122913906,69664285,OriharaKururi,我就说开头BGM好熟悉。。。 原来是maxkim大佬片头,16930,2016年2月23日
8654378,39432059,骑士的比赛还用醒来看,所以我机智地开始蓄发,7273,2015年1月12日
1448367982,493490082,风潍,身法猴来的有吗,3298,2019年4月11日
1333826253,570565733,没啦没啦全没啦,同感，感觉现在听什么电音都没有第一次的感觉了。,2799,2018年12月21日
272972239,89795107,狸可_official,【带感炉石】我的魔法会把你撕成抱歉@伊丽莎白鼠----av7663983,2345,2016年12月25日
1396430124,401665704,我世界第一喜欢璇璇,打得不错 我认输（狗打得不错 我认输（古尔丹打得不错 我认输（玛法里奥打得不错 我认输（雷克萨打得不错 我认输（瓦莉拉打得不错 我认输（萨尔打得不错 我认输（加尔鲁什打得不错 我的魔法会把你撕成抱歉抱歉抱歉抱抱抱歉把你撕成抱歉抱歉抱歉抱歉抱歉抱抱歉你的对手离开了游戏。,1918,2019年2月19日
1393378807,307407811,Recollectionxx,补作业听电音我相信不只我一个,1751,2019年2月16日
1333364251,103427182,AsGhost_t,哇，兄弟，你好过分，你不说我都不知道这个问题，被你一说我也开始纠结这个问题了。,1725,2018年12月21日
1338784090,1461981986,常文珂,确实但是听到这个歌的前奏，我感觉又找到了之前第一次触电的感觉，我知道不久后这个歌我可能也会听腻，所以我都不敢多听 所以现在从来不循环播放,1340,2018年12月26日
1332443995,310294604,蚊子一样的自恋,开会员，下载保存到u盘,1330,2018年12月20日
