5559753,3808757,喵可可的清新柠檬茶,什么时候等到你，转眼已是冬季，永远也忘不了有一年的初夏，有一个你，温暖了我的整个世界,208,2014年11月7日
30759086,50739243,宝珠爸爸,我要让我的小公主学钢琴！如果她喜欢的话。,124,2015年8月12日
12897360,17557737,桥城往事,我总是躲在梦与季节的深处，听花与黑夜唱尽梦魇，唱尽繁华，唱断所有记忆的来路。,117,2015年3月18日
38432838,76883195,柒月oyyl,越来越喜欢这种感觉，在深夜一个人默默的听石进的钢琴曲，默默的听他述说，好像在述说着我的生活和心情，好像在暗恋一个人，好痛苦，想和她诉说却又有很多羁绊，好像好多东西抓住了又偷偷的溜走了。曾经的千言万语，一颦一笑，在风中永远的飘荡。。,115,2015年9月30日
16050700,258410,向日翾,花曾开过，我也曾有过你,106,2015年4月23日
18520156,41225348,蝶澈冰蓝,“你记得初初报到的白日，楼宇之外，筼筜湖水阳光涌动，白鹭翔空，树影婆娑，那郁郁葱葱的岛屿，如同碧青的琉璃，光彩夺目，粼光斑斓。”,84,2015年5月16日
55597329,56773980,小巷炒面,我也有那么美好的高中，我还记得那个爱笑的你，即使是在寒冷的冬天，看到你上扬的嘴角和弯弯的眼睛，我的世界也温暖了。现在，你还好吗,60,2015年12月22日
18531292,45880985,支枕听河,知道曾那么喜欢过也就够了，但我这么说 只是想自我欺骗,55,2015年5月16日
27362463,61263800,藤原奈,等你的十年，你回来了，可你告诉我：你不爱我了，你等的不是我…,47,2015年7月21日
274080563,249825418,帐号已注销,我喜欢你7个月了，你知道吗？也许你永远都不会知道。,31,2016年12月27日
273649323,351805027,苏梨衣,虽然评论很少，但是我很喜欢❤️,11,2016年12月26日
274080563,249825418,帐号已注销,我喜欢你7个月了，你知道吗？也许你永远都不会知道。,31,2016年12月27日
273860730,297596521,很狗的少年,终于看到一首评论没有999+,8,2016年12月27日
273665399,43853802,杯酒旧梦,大家好，欢迎来到网易故事会,6,2016年12月26日
273649323,351805027,苏梨衣,虽然评论很少，但是我很喜欢❤️,11,2016年12月26日
273574905,322688213,Alexand3r,網易雲音樂是個有感情的player，日推很有愛，沒想到最後是你更懂我。你把我引向更孤單的路，而我卻心甘情願。一入網易深似海，從此歌詞是路人。,6,2016年12月26日
272948871,108531200,渔鱼z,后来你终于不在是我的软肋，也不在是我的盔甲。,5,2016年12月25日
267442404,269346983,风居住的街道Il,超级好听,2,2016年12月17日
267126267,312945085,帐号已注销,从一到三十一都整理好了呢，戳我头像，收藏歌单，我们都是同道中人，缘分的事可不好说呢,2,2016年12月17日
265675572,302486695,-乘醉听萧鼓-,晚安咯各位,1,2016年12月14日
265620256,375850749,开着火车倒追驴,深情中藏着那一抹忧伤，我好喜欢你，只不过或许我们没有结局，往日的回忆终究成了过去，我们渐渐渐行渐远，你问我为什么，我也不知道，我怕我真的怕我的世界突然没有你的消息，对不起我爱你,4,2016年12月14日
265530830,302911833,hcdssrgjkknvcdd,,0,2016年12月14日
265203398,113892222,-----July,深情,1,2016年12月14日
264029101,337495594,帐号已注销,还有好多的～,0,2016年12月12日
263925478,114018391,他说年少如歌,直到31。石进说:一个月有三十一天，我一天写一首便能听一个月。,3,2016年12月12日
263776110,59427742,豪元,怎么还有十七啊，我一直以为只到12,1,2016年12月11日
260239800,288371016,甲大丙,有的，石进另几首,1,2016年12月6日
260297482,288371016,甲大丙,才20岁。却想和你过一辈子。,3,2016年12月6日
259974833,127833789,Lies_An,总会有人欣赏的！,0,2016年12月6日
259877114,3303992,帐号已注销,晚安曲。,0,2016年12月5日
257252334,344668984,Shaquila16138,是啊，我第一次听后去看评论以为评论是999+，没想到这么点儿……,0,2016年12月1日
