15198459,30071957,你咋不上天咩,感觉国家有任务派给我了,28279,2015年4月14日
20206265,16918492,击石,昨晚看完宝强在真正男子汉里做腹饶杠，好多人都是看了士兵突击之后去当兵的，宝强说他是来还债的，忽然就又想看三多做腹饶杠了，一看就是一夜，从第一集到第十六集，钢七连只剩下了许三多一个人，却不不愿意再往下看了，多么希望钢七连一直存在下去，对于宝强个人来说，男子汉的意义真的比跑男更重要,20242,2015年5月31日
15189405,30074727,AaiYan,湖南卫视综艺节目的主题曲都没得说，爸爸去哪儿，花儿与少年，变形计…现在又多一个真正男子汉！,13697,2015年4月14日
20076715,69301289,锐多多丶,本来就想去当兵，看了这个节目更坚定的去当兵的想法。。看完节目已经报2015征兵了。,12748,2015年5月30日
182044332,59230571,左岸花不开HC,杨根思连战斗英雄杨树朋壮烈牺牲，真的汉子。他不应该被以参加过《真正男子汉》而被记住，他应该被以中国人民解放军的身份记住，永垂不朽。,12127,2016年7月12日
22844549,56368292,星星殿下哟,在微博上听了文海地指导员版本的 看了简介觉得他真是个大神 放弃了高薪工作选择了当兵为国家做贡献 而且成绩非常优秀 国家有这么多为国家为大家努力奋斗的人 突然觉得好安心 请给这个国家一些温柔 少一些片面的批判 它会越来越好 因为有这么多默默奉献的英雄们 不是吗？,8875,2015年6月20日
62842174,109396050,賓賓Q,虽然我是女生，但我也有个军人梦。,8759,2016年1月18日
39854102,91197001,桃桃今天想吃桃,有女生喜欢这个歌么？我自从运动会上听到这个歌简直热血沸腾,8350,2015年10月9日
190065100,308846120,妍知,2016年7月11日，遇袭受伤的中国维和战士，四级军士长杨树朋，经抢救无效不幸牺牲。杨树朋曾作为《真正男子汉》的一名指导班长，愿天堂走好，真正男子汉。,8083,2016年7月28日
64154567,68352518,等我回家拿鱼竿,这个节目湖南卫视和我们20集团军联合拍摄 大家所看到的是我们的最经典的5个旅团 其中 沙家浜部队 60旅 就是我的老连队 想我班长啦 退伍啦 现在只能在电视上看到我的老连队 满满都是回忆,7475,2016年1月23日
52155228,7232575,EnFoire,永远忘不了八年没回家的姜伟喊出的那句话:我们一家不圆万家圆！短短一句话喊出了多少子弟兵对家的思念和对祖国的责任,3904,2015年12月8日
15531304,16395861,嘤嘤王,越听越好听 是怎么了呢,3493,2015年4月18日
15388387,34514432,-水行记-,好好听，斗志昂扬！,3359,2015年4月16日
15182449,39489758,青春2020_,过阵子又会成为神曲。,2480,2015年4月14日
15237419,9540141,Barryman,为了俺家少平，也许会考虑看这节目的～～,2012,2015年4月15日
