127542616,96877407,金小米Mena,别的歌不想评论，这歌一定要评论一下，08年玩梦幻西游，认识一个女孩，长得很美，我们做了伴侣，后来越聊越深，再知道她是东北而我却是安徽的。不知道那时怎么回事，被爱冲昏了头脑竟然拼命赚钱买了辆车，留了女孩喜欢的长发，一年后我们在一起了。现在有一个女儿,14.4万,2016年3月9日
188121771,46566061,E瑞c,感谢大家的祝福！我是来还愿的！我考上了中国政法大学法学专业！😇！我心满意足啦！！谢谢大家给我的点赞！！每天看到都让我力量倍增！！也祝学弟学妹们在明年的高考取得好成绩！！！😌😌😌,65042,2016年7月25日
5943846,3601033,路遥-M,成功是件困难的事儿，这谁都懂，但也别太绷着，你得有自己的生活。有想要的梦就去做，哪怕最后一场空。失败没什么，谁都有被嫌弃的时候，可命运就是这样一个积累的过程。有一天你突然美梦成真，你以为是撞了大运，其实不是，那是一份迟到的礼物。,47805,2014年11月18日
8667410,8653193,乃果酱,《此情可待》为了追孩子她妈，这歌我练了3个月的指弹，昨天她还要听呢～,34203,2015年1月13日
53565197,50813975,依然是小紫,这歌出现在1988里时突然觉得好暖,25222,2015年12月13日
6576646,808018,zc4ever,打这么多字不累啊？不过说的有道理！,14181,2014年12月2日
54633680,66449219,-知更,曼玉打开信封发现是宇宙通行卡的时候 我全身的鸡皮都起来了 跟我去看看外面的世界吧 wuli正锋Oppa是个浪漫温柔的人,13231,2015年12月19日
55210858,12736074,我多喜欢看着你像看自己,正峰和曼玉专属BGM万万没想到竟然会被这对CP虐到 对 就是曼玉坐在出租车上因为自己误会正峰让他等而自责着急的哭的时候 本来应该挺搞笑的 却在一瞬间觉得 哇 这就是爱情啊,11075,2015年12月20日
6393492,20360173,Rudderless_t,阿杜的即视感,9345,2014年11月27日
6350220,2103460,ForestSong,此情可待成追忆， 只是当时已惘然... 只是当时已惘然...,8495,2014年11月27日
129589012,63395137,消得泼茶香X,谁想到了乌龙闯情关。,5905,2016年3月14日
6397173,42153717,Gyming85,你是我爱着的，至少现在是.,4998,2014年11月27日
6390923,120292,帐号已注销,还记得吗，我们一起唱过的这首歌，可惜现在的我们就像这首歌一样，oceans apart散落在天涯。,3864,2014年11月27日
54831792,53844063,裤少女,曼玉和正峰boy的爱情简直是典范 没有手机的时候人们怎么谈恋爱呢，靠写信吧，尽管不方便需要长时间的等待，但就连等待的日子也觉得是甜的 因为我知道，你也在等我啊,3369,2015年12月20日
56527973,70937525,dalianmatutu,有人是因为看了请回答1988来听这首的吗？正峰撩妹达人,3136,2015年12月26日
