9402771,41016741,云岭烟尘,谁说这是贝多芬病毒的……明明是悲怆第三乐章,1109,2015年1月25日
211205935,1778066,我怎么舍得_添一笔凄凉_,《信条》是后弦向贝多芬致敬的一首歌曲。歌曲中后弦大胆地引用了“贝多芬”最经典的《悲怆奏鸣曲》第三乐章的主旋律作为音乐的发想点，而歌曲本身的精神主旨中就充满了对逆境的不妥协和斗争的坚持。《信条》无论是朗朗上口的旋律还是在填词上的独特味道，音乐中弥漫的那种豪气入云天的气概都让人折服。,897,2016年9月7日
145552605,35928932,shealeo,后弦现在在干什么？可愿意出来给华语歌坛投个深水炸弹,867,2016年4月24日
39857250,72227620,过路歌一曲,许嵩如今算是如日中天了，弦哥怕是被人们遗忘了。同是才气十足，发展也隔太多了。,523,2015年10月9日
21379428,56382688,嘟嘟听音,信条这种曲风独特、节奏感强的好歌，居然只有这点儿评论！,476,2015年6月9日
17639216,51997519,蓝吉朵尔,你们真是够了，我特地去查了下悲怆第三章 节奏大师中的是贝多芬病毒Beethoven Virus所以说贝多芬病毒的肯定是节奏大师玩多了 也没错,320,2015年5月8日
13540304,56021412,WhiteLiar-,少个刺客,183,2015年3月26日
6806773,41797736,-Magari,艺术家也有爱嘛,116,2014年12月7日
1689156514,289252640,PoseidonAche,你们可能不知道 刚开始后弦和柳岩是同时出现的，还记得娃娃脸的mv吗 那个拿着手机等信号的女孩子不就是柳岩吗 柳岩的《孙尚香》也有后弦的和声哦 他俩是好朋友,51,2019年11月23日
1684340051,1562412008,Eve在在,听后弦的声音，一直觉得他是个小伙子，但实际上他已经四十多岁了。但是声音真的一直很年轻，羡慕,37,2019年11月17日
1352064668,514062340,怪盗基德14121706,后弦rap这么强吗，以前知道你会rap，一般般吧，这段rap真的惊艳我了,30,2019年1月9日
1256049373,1530940923,又双马叒叕,没想到他都39岁了,30,2018年9月26日
1249781302,415856909,AAAAAABAAALLL,现在歌曲有这种高度的凤毛麟角,20,2018年9月19日
