1400264106,321826039,你有你的故事我有我的网易云,真羡慕那些能够把悲伤写下来的人…,44181,2019年2月22日
1399218473,336566963,津街城北,曾经也好意外也罢随风而逝的悲伤可能会迟到但不会缺席Fjy我就是你的男孩,40681,2019年2月21日
1396868302,129415080,我从未成为过你对的人吗,可惜同龄女孩总比男孩早熟,37593,2019年2月19日
1576566439,352863309,青春渲染了谁的岁玥,因为王一博所以来听这首歌，为了他我想去北京，想去一个更好的明天，但我害怕对王一博的喜欢不能一直支持我走下去，毕竟这种喜欢没有结果。但是，这是我目前唯一的念想了，加油吧，希望这个少年越来越好，希望今后可以见到你，离你更近一点，但现在能做的就是好好学习珍惜这几年短暂又宝贵的时光......,21161,2019年7月31日
1421787895,338059256,面包橘子你没有,《男孩》是我的入坑曲，梁博唱出了我所有的情怀，唱出了他眼中的人生，在我看来，梁博是一个习惯把悲伤写下来的人，他的内心强大到似乎能装下所有悲伤，他坚定的眼神和对音乐的偏执让我喜欢上这个男孩，我是唱作人的播出，期待遇见一个更惊喜的梁博。,22625,2019年3月16日
1433942809,1498023875,0o夜听风oO,不要在喝醉时联系任何人不要在深夜做任何决定矫情的话要尽量憋在心里天亮了 你会庆幸当时没有说出口,12171,2019年3月29日
1454203659,1457913329,沈夫君,女孩子那么厉害 分得清迪奥 圣罗兰 纪梵希 香奈儿各种口红的色号 怎么就分不清 一个男孩子是不是真的喜欢你,11086,2019年4月16日
1399564461,486541772,安图西,我想着这首歌出来，我一定要以最快的速度去评论，我想肯定有好多和我拥有同样想法的人。说实话，第一次听这首歌，并不太感兴趣，过了几天，脑海里浮现这个旋律，就打算去听一下，听听看看是怎么回事，,10774,2019年2月22日
1399282413,1328500776,灵魂歌手梁博,昨天，在你出发前半个小时跑到了火车站，我想多见你一眼哪怕匆匆就别离，我希望你过的好，还希望你能记得曾经遇到的我。你说我没有什么变化，当我们再一次面对面站在一起的时候，两年半的时间仿佛都没有过去，还是以前的我们。你留起了长发，笑起来还是那么好看。--留念AH,8557,2019年2月21日
1402831414,305061555,我了个大擦-,所以男人都喜欢年轻的，女人都喜欢岁数大的,7730,2019年2月25日
1399164041,321567026,曾大爷嘿,很久以前，我想过很多次以后的情景，我想过有一天我终于放弃你时候的样子。我以为我会在某个晴朗的早晨，醒过来的刹那发现我不再喜欢你了，然后开始我的新生活。然而我发现我错了。其实是我开始了新生活之后，在潜移默化里，会在某一个平凡的时刻里，我乍然发现，我竟然已经忘记你很久了。,7257,2019年2月21日
1398844287,346291220,-synr-,梁博身上有这个时代缺失的摇滚精神，好声音之后一直关注他，创作歌手不易，这首却非常动人，低音自带忧伤，处在爆破边缘的高音又充满力量，不够嚣张，但却有种禁欲系的sexy。,5374,2019年2月21日
1403154547,290926071,余龙鑫-,青春里最难过的事就是女孩永远要比男孩先成熟,4814,2019年2月25日
1399591923,486541772,安图西,结果一听就爱上了，把家里音响里所有的歌都删完了，就放了一首《男孩》进去，然后就单曲循环，天天听，感觉再听就不腻，直到现在我还是很喜欢，在宿舍放了好多遍，还经常会在宿舍边弹边唱这首歌，身边的人，朋友舍友，有时偶尔都会哼唱一下副歌的旋律，即使有些人都不知道这首歌，,4403,2019年2月22日
1529642282,530887035,霏霏没脾气,高中的时候，他说：“你玩，老公给你买皮肤”可现在我连入门都还没有，他就跑走去教别人了。,4061,2019年6月20日
