307433206,288689275,P丸樣,今天学妹让我帮她拧一下饮料盖，帮她拧了瓶盖，我满面春光地把饮料递给她：“嘿嘿嘿，给你”，学妹脸都红了，用细若蚊足的声音说：“帮我拧瓶盖还傻乐，真傻”，然后就立马羞答答地跑开了，看着她远去的身影，我缓缓掏出藏在裤兜里写着“再来一瓶”的瓶盖，“哈哈哈哈哈哈，现在是谁傻啊？”,31406,2017年2月11日
318674485,277372203,下界的蟠桃,今天我找了学校公认的傻学长帮我拧瓶盖，没想到他拧开之后还傻乐，唉！真的很傻，那瓶水是学校超市压了三年的，那个再来一瓶是过期的。远远看着他拿起瓶盖的傻笑样子，希望以后他傻人有傻福吧！,17737,2017年2月26日
307520949,301073346,景随风,刚好玉见李，才如此美丽。,7234,2017年2月12日
307848798,103183979,C大调澄子,这首歌让大家重新认识了一个不一样的李玉刚，其实他一直都勇于挑战尝试不同的东西，在戏剧、小品、书画、文学中发掘传统的东方美学，致力于传统文化的当代表达。君子如玉，刚柔并济，舞台上一袭水墨中国风白衣自带仙气。经过十年的沉淀，他已完成了明星到艺术家的蜕变，儒雅翩翩公子当如玉先生。,5627,2017年2月12日
321927672,261168611,心事述与山鬼听,室友说不好听，我立即把他床板都掀了，妈的不懂音乐,5614,2017年3月3日
1316143391,128701031,Stella-Lucky-Lee,欢迎收看网易大型剧≪一瓶饮料背后的秘密≫。,5101,2018年12月2日
325739876,95275907,Morer_v,昨天去KTV，刚好遇到一个小卖铺老板，听他讲前几天有个小伙子屁颠屁颠的拿着一个再买一瓶的瓶盖但他店里换饮料，结果又多花5毛钱买一瓶，作为饮料厂老板，我想说饮料都是接的自家水龙头的水，兑了点糖精，虽然成本小利润大，但是看到顾客满意我也很开心,4764,2017年3月8日
1375939743,592687354,我就是流苏呀,老弟醒醒，别睡了,3958,2019年2月1日
1400531563,134198662,没错我就是你们的强哥,如果你们在山东遇见一个叫王艺颖的女生，请告诉她，我还在为她奋斗，现在我已经有六块腹肌了，还有一年我就可以去美国留学了，到时我一定还会去找她，如果评论被人海淹没，就当我从来没有来过,3521,2019年2月22日
1160717658,436447442,凌濑枫,大家好我是卫生局的，听说有小卖部老板用垃圾桶瓶子装自来水卖，我们绝不姑息这种危害健康的事，知情的请联系我，另外，隔壁疾病防控中心托我们留意有没有很傻的人，他们会采用电疗好好治疗的。拜托大家了。,2997,2018年6月26日
1682033284,297080013,走吃牛肉面,14岁，“妈我有女朋友了。”“太小，分了” 16岁，“妈我有女朋友了。”“不行，分了。” 18岁，“妈我有女朋友了。”“高考，分了。” 24岁，“妈我有女朋友了。” “在一起多久了？”“十年”,2636,2019年11月15日
1376441303,1751625456,寻找真正,凭实力单身，我没资格评价大神。[多多耍酷],1969,2019年2月1日
315476639,364892703,-孤独的诗人-,刚（刚）好 遇（玉）见 你（李）,1872,2017年2月22日
318587541,269796919,语言匮乏的_,网易云音乐六大未解之谜:1:他和她到底有没有在一起？2:中考高考研考的到底考上没有？3:评论已经顶上去了，ta到底看到没有？4:到底有多少809000的人听这歌？5:听民谣的最后到底去没去大理和西藏？6:为什么你们听个歌都那么多故事，我怎么没有？,1760,2017年2月26日
365219104,473405814,靑瞳映白衣,记得那是一个上午，我们正在上语文课，窗户在教室的左边，窗外的阳光照进来，热且刺眼，我看着她极力用本子当着阳光，我就站了起来。 老师问我怎么了？我说有点困，站着听课好一点，那可是上午第二节课，怎么会困呢。。 。只不过想用自己的身体挡住阳光，让她在我的影子里能够舒服一些。,1665,2017年4月25日
