1688647639,1494517529,给予灵魂的爱O,日推来的，举起你们的小爪爪,9412,2019年11月23日
2057695520,262411213,2019全球花式抖腿大赛总决赛冠军,做一个妹妹的备胎是备胎做九十九个妹妹的备胎，妹妹就是备胎这就是量变引起的质变,4433,2019年12月22日
1514385377,605077813,AlokMusic,Hope you guys like my version of "Piece Of Your Heart"! ,3740,2019年6月7日
2047688374,286853782,悲喜隐痛-,那天晚上我刚从网吧打完联盟叫了辆滴滴，是辆五菱宏光，我很嫌弃叫他走，我打算再叫一辆，师傅嘬了口烟，按下播放器就是放的这首歌，我当时二话没说就上车了，随着师傅加油门各种转方向盘我觉得师傅真是知己亲密无间的那种，是的亲密无间，医院病房我6号床，他7号床,1803,2019年12月13日
2041583738,75907858,我不叫张驰,给年轻人八条建议：1.谈恋爱首先要找你爱的，结婚就要找爱你的。2.千万别输在"等"这个字身上3.永远留住30％的神秘4.不要低估任何一个人5.别把没教养当做有气场6.谈恋爱可以穷，结婚不可以7.谈恋爱一定要找我8.牢记第七条，前六条没什么卵用,1358,2019年12月8日
1514494417,127112786,爱Trance的AZ,Alok你要知道只有Brazilian bass才深得听众喜欢,1262,2019年6月7日
2043231590,594554212,说唱暑假工,最终我还是被学校广播开除了,1018,2019年12月9日
2042622948,1711378580,Ariana1997,老夫掐指一算，你现在应该一边听歌一边翻看评论，搞不好还在充电，或者还戴着耳机，被我猜中的可能还会笑一下,817,2019年12月9日
2065892287,416261747,涛粑哔,反正这首歌没人听 我就告诉你们个秘密 我那方面不行,677,2019年12月30日
