5429722,35400441,justbigface,宋胖子的现场很有趣，每唱完一首歌，就要擦一脸汗。但是声音很好听，大家都听的很入神。蔡康永后来说他就混在观众之中听这首歌，但是没有一个人注意到他。好的东西就是这样，当你注视着它的时候，无暇他顾。,63924,2014年11月3日
127167460,70943623,静心明镜流,如果马頔小时候不认识舒傲寒 董小姐也没牵宋冬野的手 赵雷没去过南方 尧十三错过了他的北方女王 祝星一开始就很爱陈粒 民谣还只是小众音乐 你还是面不改色 生活没有因此变一丝一毫,59224,2016年3月7日
134480778,79973466,戴尔家用,我老婆姓董，每次唱歌都要给她唱这个，她不会唱歌，就静静的听我给她唱。现在她怀孕五个月了，我在北京不能陪她。等宝宝生了，就去把她俩的样子纹在身上,40878,2016年3月27日
5439814,1172434,回不去的CHESTER,每次前奏响起都会想起2013的夏天，毕业失恋，失去了室友失去了爱人，一无所有的躺在出租屋里忽然听到这首歌时的自己。,18707,2014年11月4日
65904085,37645501,猜迷藏,你喜歡Bigbang 我喜歡民謠 你追求物質真實 我追求內心丰满 本就是兩個世界的人 卻相遇了 很抱歉 還是沒能走進你的心 我也很快就要離開北方去南邊了 帶著我的吉他 之後路漫漫 望你好。,17675,2016年1月28日
5360628,32836998,Xiaoyuxuann,去年第一次听到的时候在美国。今天是来到英国之后第一个万圣节，我想我在这边可能还有2.3个万圣节可以过。昨天和朋友玩嗨了，所以今天一点不想出去。我今天突然很清楚地看到了自己这一个月来的isolation，忽然明白长了二十岁每个人背后都有多多少少的故事。在外流浪的人其实是在找一个回家的答案。,14262,2014年11月1日
7009603,46065873,小洒飘过,这首歌红不红，大众有没有听过，其他歌手翻唱得好不好。无论这些答案是什么，董小姐永远是那首董小姐。,13102,2014年12月12日
71783971,45155002,望珍摄,胖子放下了董小姐，迎来了他生命中的赵小姐。可能谁都会经历这么一天，你终会放下你曾经耿耿于怀的一切，然后在不经意的另一天，迎来生命中的的晨曦。,11699,2016年2月18日
128886727,90654154,左岸HiFiMan,09年冬，年末的时候，失去了工作也身无分文，别人都忙着回家过年，一个人流浪在千里异乡街头，除夕大雪，躲在别人回家过年关闭的店铺卷帘门前。 接到妈妈的电话，骗她说车票难买，在公司里过年，和同事正吃火锅包饺子。 挂了电话，看着空荡荡的街道，远处的鞭炮，清冷的雪，听这首歌，泪水慢慢出来。,8916,2016年3月12日
639723081,636114781,fx勿念勿念,我是一个销售，为了钱我兼职过酒吧传单服务员等，他只知道我爱钱，他不知道我曾经中考的钱都是我爸攒了两百多个一块钱，我很爱他，但我从来没有跟他确定过关系，可能是我穷怕了，我要没有任何牵绊的去闯我的人生，他说我是野马的时候我很难过，但我接受了，我大概就是一匹野马吧，毕竟才19岁,8384,2017年12月12日
266474401,79973466,戴尔家用,孩子已经生了，母女都很健康,6402,2016年12月16日
1186455333,382293579,adswodl,........你是我的可遇不可求，可遇不可留，可遇不可有。《李宫俊的诗》........,5127,2018年7月20日
1241864753,312485653,耳东的故事,南方12月的晚上还是很冷的 我和老丁依偎着在学校湖边抽烟 戴着连衣的棉帽 是那么的舒服和惬意 我从不喜欢女生抽烟 但看着老丁从我手中接过黑兰州 我满眼都是幸福的模样 喜欢了她四年 但在一起却只有两个多月 转眼我也要毕业了 五年的大学 我只记得和她在一起的快乐 感谢她接受过我 哪怕只是两个月,2404,2018年9月9日
170792341,280292571,Mr_54,喜欢就去表白呀，like拼出来不就是立刻吗,2267,2016年6月18日
139898588,74276047,病树逢春,没事啊，千万别听民谣。会想关灯，会想点烟，会想写墓志铭。,1755,2016年4月10日
1241864753,312485653,耳东的故事,南方12月的晚上还是很冷的 我和老丁依偎着在学校湖边抽烟 戴着连衣的棉帽 是那么的舒服和惬意 我从不喜欢女生抽烟 但看着老丁从我手中接过黑兰州 我满眼都是幸福的模样 喜欢了她四年 但在一起却只有两个多月 转眼我也要毕业了 五年的大学 我只记得和她在一起的快乐 感谢她接受过我 哪怕只是两个月,2404,2018年9月9日
1241829372,285055076,番茄有颗薄荷心,会动心的,831,2018年9月9日
1241825187,1385298409,伟大的思想是你上吊的绳-,对吧，有故事,477,2018年9月9日
1241836805,1484990876,伊人指痕,好喜欢伴唱那个小姐姐干净的声音,690,2018年9月9日
1241846533,1419413444,zwzwzjk,我心里的那个她，姓董。不知道为什么，第一次见到她就觉得，她会是我最爱的人。,352,2018年9月9日
1241821885,420999296,沈东东东东东东,你抬手推眼镜的时候很美就像石牌桥站芬芳的香水,425,2018年9月9日
1241822501,335728828,静静听音乐听你,我爱上一匹野马，可我的家里没有草原～听着宋先生唱给董小姐的歌，我，张先生却失去了宋小姐。张先生应该是还没有长大，也还没有够好，但是他已经把全部最好的给了宋小姐，未来规划里都是宋小姐，那时候应该会有草原了吧，可是野马等不及了，就这样去追随了她的喜欢，结果张先生还是张先生，孤独着！,397,2018年9月9日
1241768033,1454227876,又是夏天y,今天看到一个女生 和她长的很像很像 我居然莫名其妙的心动了....,368,2018年9月9日
1241692435,423058239,是ccccccc啊,陌生的你还会跟我走吗。,185,2018年9月9日
1241652740,1513528118,hearMyLove,你说你最爱听我唱董小姐，你走了之后，我就再也不唱呢，是不是很懂事。我的董小姐啊，你终于要结婚了，我也终于可以放弃了，祝你良辰佳婿，祝你母凭子贵。余生我，不奉陪了。,247,2018年9月9日
1241631653,558546734,月安雅,曲未念的是什么意思？,115,2018年9月9日
1241537098,591650378,这里南之,真好，我姓董，，喜欢听董小姐， 祝福你们,192,2018年9月9日
1241536704,267570554,看你的眼睛有光,你熄灭烟说起从前，以后不要抽烟了，马小姐，我爱你再见。,148,2018年9月9日
1241527921,325702960,听民谣的人不应该流泪,有一个姓李的姑娘掏走了一个西北汉子的心看了一眼，一万万年。没有对象，坚强无比退伍想去她的城市开个店，给李小姐想做的饭。还是想再见一面，你好，再见。,219,2018年9月9日
1241525832,515199406,白小七柒,认识就够了 何必谈余生,315,2018年9月9日
1241499088,1404395034,你不快乐_,可又会从好友列表搜出来这个人,146,2018年9月9日
1241481245,554108413,苏争ge,加油,54,2018年9月9日
1241476646,257909744,2017年9月17,现在才知道，兰州并不好抽,230,2018年9月9日
1241467534,550101983,一路同行m,加油加油加油,43,2018年9月9日
1241443020,299143294,我睡个屁,董小姐，你嘴角向下的样子很美～～,84,2018年9月9日
