163799686,95211008,L0SER0426,现在没点文化都不敢评论了,10633,2016年6月2日
47153754,78788194,帐号已注销,当你认真谈过一段感情，最后却分手了，后来你会很难再去喜欢别人，你不想花时间也不想去了解。就好比你写一篇文章快写完了，但老师说你字潦草把作业撕了让你重新写一遍。虽然你记得开头和内容但你也懒得写了，因为一篇文章花光了你所有精力，只差一个结尾，你却要从头来过。,6596,2015年11月16日
13733662,5772791,龙从东方而来,＜文艺版＞:你说烟雨微芒，兰亭远望；后来轻揽婆娑，深遮霓裳。你说春光烂漫，绿袖红香；后来内掩西楼，静立卿旁。你说软风轻拂，醉卧思量；后来紧掩门窗，漫帐成殇。你说情丝柔肠，如何相忘；我却眼波微转，兀自成霜。,3804,2015年3月28日
13733655,5772791,龙从东方而来,＜诗经版＞：子言慕雨，启伞避之。子言好阳，寻荫拒之。子言喜风，阖户离之。子言偕老，吾所畏之。＜离骚版＞：君乐雨兮启伞枝，君乐昼兮林蔽日，君乐风兮栏帐起，君乐吾兮吾心噬。,3075,2015年3月28日
162876075,122219153,我就是我呀我会是好人真的不骗你,距离高考还有9天，我想去浙大,2475,2016年5月31日
199689719,299339387,藤左,21岁，还在啃老。拥有远大的抱负，却知道自己没能力。背不起自己的梦想，也辜负了所有的苦难。大话连篇，却没有真才实学。没能足够珍惜朋友，也没有一个可以牵手的人。现在，我坐在天台上，看着夜空，思绪万千。,2253,2016年8月15日
190705877,78693927,采姑凉的小蘑菇--,真正喜欢上一个人，应该是害羞的不敢表白，会总感觉配不上，可却渴望追到你;发信息时连绵不绝，见面后却欲言又止;沉默地微笑离开，而心却有万语千言在翻滚!喜欢一个人，宁愿被对方误认为是木头，也会本能地少动几下，少说几句，只因怕最丑的样子被看到，最没品味的话被听到。,1802,2016年7月30日
13708794,5772791,龙从东方而来,都说韶光如梦，看惯了秋月春风，人生故事本相同，可终究，无法割舍一段美丽的相逢。往事就像一场无言的秋红，流水光阴也不过是梅花三弄。纵算水尽山穷，叶落成空，那老去的年华依旧可以风姿万种。纵算岁月朦胧，天涯西东，依然可以觅寻当年遗落的影踪。,1541,2015年3月28日
334741050,272972964,听风音乐i,据说有强迫症的人听歌有两种方式 一是一首单曲不断循环放 直到听得想吐 二是随机播放 但是会不断地切歌,1414,2017年3月20日
488875831,86513855,守护者小米,能给我100个赞么？我这几天好伤心，感觉都快没有办法在继续下去了，偶尔听到这首音乐,1154,2017年7月29日
11004264,2755480,孔二蕊,有些音乐是要让人自私珍藏到舍不得分享…,983,2015年2月18日
261569486,113528321,XyanC,刚毕业工作几个月，前几天离开了北京，陪伴父亲度过晚期的最后时光，以前他常笑话我作的曲子难听，说咋不弄几首人声唱的呢，我总是说他俗，后来听母亲说他想我时就会听我唱的歌，听儿子的声音。每想到这里，就忍不住流泪.,864,2016年12月8日
348485781,304656103,吹米啊,今天我生日，生日快乐。,858,2017年4月5日
16218887,30892055,钻石土豪,一次上山玩，途中遇一只火红色狐狸，远远冲它大喝一声：“孽畜！还不快快现出原形！”狐狸楞了一下，突然开口说话了：“这本来就是原形啊！”我惊道：“妈呀有妖怪！”大叫一声撒丫子跑了，狐狸嗷地一声紧跟着在我屁股后面跑，边跑边叫：“哪儿哪儿有妖怪啊！别丢下我呀！吓死我了…”,804,2015年4月25日
22597067,48456647,布尔什维克近卫军,蒙着眼睛.我被纳粹党卫队带到了奥斯维辛...睁开眼我看到的是是一个身材高挑的雅利安白种姑娘.高鼻梁.深蓝色的瞳孔犹如深海里夺人魂魄的蓝宝石. 我的嘴唇被她柔若无骨的手指慢慢划开.淡淡的体香在我鼻孔里缭绕...我想说些什么.然而等待我的却是滚烫的热铝......,782,2015年6月18日
