11546692,49868129,jesscia岚莓酱,朋友都说我无药可救了，喜欢的全是这种类型的老歌。我说不觉得很有味道么,21828,2015年2月27日
15786781,35734312,小十同学,我是湖南一个小县城的人，我们那儿有一条河，我儿时河边有吃龙虾的船，我妈妈总会唱邓丽君的歌，那时候吃着龙虾吹着风，听着妈妈唱歌，是我最快乐的事情。,10331,2015年4月20日
30930629,21693209,永远的亚洲歌姬,全世界共有七个国家出过邓女神的正式邮票！,8858,2015年8月13日
324779420,425743591,随便起个名都不行真是服了,听这歌的有男士吗？不会是只有我吧,7354,2017年3月7日
388102111,319425808,方清昶,这里有没有00后跟我一样爱挺听邓丽君 我觉得我听的歌融入各个时代 很多民族,5242,2017年5月20日
3864796,3405735,帐号已注销,自从无意中听到了周璇后，就无法自拔了，这种老歌的确是有种醉人的魅力，嗲嗲的嗓音，听着实在是酥软。但昨天试着唱唱，完全着不着调啊后发现丽君女神翻唱了周璇的歌，都是经过改编的，相对比较现代化，实在是听的爱死了！！！,3276,2014年8月17日
367564359,395748529,丁晓橙,就因为这首歌，当时作为留守儿童的我在自己院子里撒了半院子的夜来香种子，没想到开了半个院子，可乐坏了我,2676,2017年4月27日
13558429,59463572,LV白白,《夜來香》有黎錦光作詞作曲，原唱為李香蘭，但由於當時被認為是日本侵略者麻醉佔領區國民之一，而被禁唱。然而，在上個世紀80年代初被鄧麗君翻唱再次風靡。鄧麗君用乾淨、甜美的聲音把這首歌賦予了另一種生命。沉浸在那時而飄來花香的明月清風的夜晚中，感受心靈的放鬆，冥想那刻的生命的美好！,2554,2015年3月26日
1336494802,629599279,孤灯挑客,肯德基吃多的人怎么可能知道开水白菜的美味呢？,2129,2018年12月24日
52744762,101398606,致命笑巫,哈哈哈今天看了评论发现都好有意思！我听邓丽君的歌应该是从妈妈肚子里就开始了吧！后来长大点儿了，我妈天天拿着录音机，放邓丽君的磁带，小时候不太懂，好多歌都不喜欢。慢慢长大了，发现老歌的优雅和迷人，真是现在的流行歌曲不能比的！现在怀孕5个月了，放音乐的时候还是会放邓丽君的歌，哈哈！,1724,2015年12月10日
379839363,423635114,甜小花儿,我敷着面膜听着夜来香，我觉得自己现在很香。🌸,1438,2017年5月11日
31197262,41605603,调调_,只要一唱这首歌 就会不自觉就会翘起兰花指,1244,2015年8月15日
2051474733,1815840550,since0710,接下来我唱的这首歌呢您要是喜欢您就鼓鼓掌您要是不喜欢那您自己上来唱好了omg邓丽君也太可爱了,918,2019年12月16日
17168847,9004382,小伙子你那什么车吖,耶！蓝翔！,844,2015年5月4日
