7660796,38735287,伯颜信音,听说是写给方文山的,84766,2014年12月26日
13913624,55589779,吃不饱又睡不着,周杰伦老是骗人，歌看起来好像没什么难度很容易唱的样子，结果我一开口，调之都跑到伊斯坦堡去了,70859,2015年3月31日
134658374,93769454,Don-Charles,初中时周杰伦是我的偶像，当时我每本课本都写满了周杰伦的名字，当时我家还蛮穷的，有一次我爸翻了我的那些课本，然后眼角闪着泪光，语气深沉地对我说：“儿啊，如果是跟学习有关的书，爸给你买，不用每本都去向周杰伦借……”,53573,2016年3月27日
16218496,65181156,管他荒唐不荒唐,小学刚开始喜欢杰伦的时候，别人提到周杰伦三个字我会脸红，就像真的是暗恋一个人，那种感觉太远，4.11成都演唱会刚进场坐下就哭得不行，十多年了，我终于离你那么近。,37440,2015年4月25日
14869492,53176114,JCHOUN,总感觉杰伦是和魔鬼签订了某个协议，然后创作出了别的歌手十辈子也创作不出的作品,32630,2015年4月11日
68311406,106998156,看不见的瞌睡,可能是我太封建，没有勇气跟你走，怕被笑倒插门，一年后接到陌生电话，一听哭声我就知道是你，听你哭泣的半个小时我连站都没有力气，想要对你说:等我，却没有勇气，如今五年已过，我小有成就，物质不再成为我们的阻碍，却怎么也打探不出你的消息，突然不知道我奋斗的意义在哪,30319,2016年2月6日
142082211,102183479,huang_c0,90岁的周杰伦卧病在床，刘畊宏说“杰伦，吃东西吗？”周杰伦说“没胃口”刘畊宏说“要不去篮球场来一发”周杰伦说“老了，跑不动了”刘畊宏说“听说棒子有个明星在中国的唱片销量第一”周杰伦说，快扶我起来，和文山说点事”,28665,2016年4月15日
136132334,130595733,Crooedjoy,永远不要相信女追男，隔层纱，这种鬼话，他要是不爱你，那隔的都是带电的铁丝…真的，宝贝们，老娘这几年差点没被“电”死…,18683,2016年3月31日
46795777,65175373,泡泡糖超人丶,“她的手只有我的四分之三那么大，我却没有抓住。”,14802,2015年11月14日
61483197,64835490,月光洲,自从老婆听完这首歌后，我和她一吵架，她也不还嘴，，一直在唱这首歌,13337,2016年1月13日
7629977,2891499,饭饭嘚吧嘚,台版已预订，为杰伦结婚凑份子了,9637,2014年12月25日
154267427,86505223,马可波罗的海岸,北京时间11：44，隔壁房间传来奇怪的声音。11:47声音结束，我想把这首歌送给隔壁房间的兄弟。🙄,7161,2016年5月13日
602341371,263394016,竹上一朵肥芽,这首歌j老师也唱过，感觉出来杰伦翻唱就属全民直播J老师唱的像了，关键他俩还同过台，长得特像。,6659,2017年11月1日
599006497,257363281,kexiaoshazi,其实这个女生做得挺到位了。她既没说自己名字也没说前男友名字，任何信息都没有，她前男友如果不戳穿，他的现女友也不会懂。最难受的其实是她自己，换个角度想想你们就能知道她的心酸了。,3958,2017年10月29日
135102438,35695953,徽子启,小时候刮奖刮出“谢”字还不扔，非要把“谢谢惠顾”都刮的干干净净才舍得放手，和后来太多的事一模一样。,2893,2016年3月28日
2068021684,127942231,倾间皙,圣诞快乐去年的今天我分手了，今年的我和她还在一起,39,2019年12月31日
2060113876,343135482,跟我去南方吧hi,圣诞快乐 男女老少们🤣,74,2019年12月25日
2037830282,343135482,跟我去南方吧hi,19的最后一个月 全力以赴做好所有事情！,120,2019年12月4日
1688262388,127942231,倾间皙,你和我踏过雪了吗,34,2019年11月22日
1682445108,396493590,Mrd丶勋,快两年了,28,2019年11月15日
1682442110,396493590,Mrd丶勋,楼下那么闲么,32,2019年11月15日
