5623966,3694852,Foryounger,喜欢老李，都不知道自己是不是90后了,9798,2014年11月9日
8626969,45240959,抹茶微苦XI,我才不相信两个文艺青年能忘得掉彼此呢！,9149,2015年1月12日
28163874,82265046,山羊先生,1月17日晚上，我坐在北京工人体育馆。李宗盛在我前面二百米左右的舞台上唱着这首歌。他静静地唱，旁边屏幕投影上林忆莲附和着。老头子唱到副歌时哽咽。我眼泪也就这么不知不觉流了下来。,5205,2015年7月26日
39402075,81661363,Night-丶,我发现网易音乐点赞很难啊，因为太小了,4423,2015年10月6日
43954715,76796019,紫清鎏沁,李、林，惺惺相惜走到了一起，然后最终两个人的感情还是敌不过匆匆岁月、敌不过人间烟火，总觉得他们做知己胜过做夫妻！,3800,2015年10月31日
43807185,1417851,謝耳朵和他的小伙伴们,关于想你这件事，躲得过对酒当歌的夜，躲不过四下无人的街。,2636,2015年10月30日
6727773,42882935,房间里的阿扣,忘了你也没有用，干了半瓶Whisky，可以好好睡觉了,1522,2014年12月5日
43553111,69492942,Edda夏,这首歌就想起林和李的爱情，固执地相信他们两个还有爱，戏里的人无力，看戏的人却还有心,1361,2015年10月29日
14957531,9426875,goletit,比起梁静茹，林忆莲的较好一些。我是先听梁的，后听林的。不是说梁唱的不好，只是感觉梁和李宗盛衔接的地方，有些突兀。个人感觉，梁粉不要骂我！,1221,2015年4月12日
1395780130,249683466,快乐辣么短,麻烦把标点符号吐出来，谢谢,938,2019年2月18日
1348256364,1726135174,固态的冰,00后也喜欢,853,2019年1月5日
1369900572,304683634,Gloven文,我也不信有些人分开了这辈子就算忘了相逢也还是记得名字,741,2019年1月27日
43515256,68847892,谁摸了你的pp,那次和一个女老师深情对唱 ！今生永远不会忘记那次合唱 所有人都起立鼓掌 我和她都不好意思了 面红耳赤了！,653,2015年10月29日
1615529663,479993514,黑凤梨Mary,那时候小李还不老，他和林忆莲之间有绯闻，可李宗盛已经有妻子而且有两个女儿了。林忆莲为了不让别人说她是小三，把所有的东西都卖了移民去加拿大。然后小李停止创作开始认真思考今后的人生该和谁一起，不久后他就去了加拿大。可林不见他，他就在外边现在冷风中等了一夜。这首歌唱的也是我们对吗？,546,2019年8月30日
