13375727,41691698,JK____________________________,这首歌是高二同宿舍的一个兄弟给我听的，一下子就开始跟他一起听枪花的每首歌。那时候还是随身听和卡带，我俩一人一个耳塞在宿舍听枪花的歌。 后来他在大学期间出了车祸，去了天堂。 每当耳边响起枪花、beyond的歌曲，脑海里都是他的身影。愿你在那边一切安好，兄弟！,8907,2015年3月24日
50231739,86711098,Kt-GreGORY_JC,【All wars are civil wars， because all men are brothers. ——Francois Fenelon】所有的战争都是内战，因为所有的人类都是同胞。——弗朗索瓦•费奈隆,6844,2015年11月30日
231674466,336224665,下路一直叫我去7,作为一个10后的女生，幼儿园默默喜欢三年，而且周围没有任何人知道枪花……,5217,2016年10月18日
123983397,19827092,透支混蛋,才发现这首歌前面的口哨是《Johnny， I Hardly Knew Ya》-一首经典的爱尔兰反战歌曲，在战时传唱度很广，歌词节选改编自爱尔兰诗人Padraic Colum（1881－1972）1922年编选的一本爱尔兰诗集里的一首诗。,2518,2016年2月27日
6051571,7180798,留给中国队的时间不多啦,沙哑尖锐的嗓音一开口便是对这个世界莫大的嘲讽,2059,2014年11月20日
5264668,6900967,goodiooxioo,光听前面的独白就喜欢上了一听十几年,1394,2014年10月28日
68900442,57871313,远坂凛的男友,独白是保罗纽曼《铁窗喋血》里狱监对众服刑人的一席话,1250,2016年2月8日
61051493,122121123,英雄啊你就当我是个屁把我放了吧,我擦 你们高中都他妹的外国上的吧,961,2016年1月12日
4416205,9129108,周公好兄弟,我也这么认为。,871,2014年9月21日
128238243,1176807,Overture1812,这首歌前奏里的录音 "What we've got here.. " 正是取自1967年的电影《铁窗喋血》里的原声音轨。作为垮掉的一代时期代表作，电影被赋予了「反抗意识形态国家机器」的意义，这段录音也正是警官在解决反抗者时对主人公所说的。而枪花的Madagascar也采用了它。,801,2016年3月10日
54905581,56544697,鞭挞金属之父薛之谦,从来没感觉这歌有七分多钟,777,2015年12月19日
357493611,109266071,JeanSev,Civil War死了75万美国人，直到现在还是美国历次战争里死亡人数最多的一场战争。当林肯说出所有人生而平等的时背后所牺牲的无数生命是对这句话最好也是最讽刺的诠释。这首歌的副歌部分的歌词简直唱出了精髓：human rights背后是被洗脑的士兵和洗不掉的鲜血。,745,2017年4月15日
482210515,274588905,裴礼文开门大弟子,我是14年的，周围的同龄人没一个听枪花的。当他们叼着奶瓶四处爬的时候，我会偷偷拿手机放这首歌，体会着无人理解的孤独。,645,2017年7月23日
6134378,11592024,炫音醉,我买的这张打口带，第一首就是这首，那是我才觉得这才是真正的摇滚,637,2014年11月22日
176336597,76083374,尋找神奇,我的初衷是想表达，摇滚乐会吸引越来越多的年轻人。摇滚的精神永远不会过时，哪怕在颠覆荒唐如今日的年代，也会有更多的滚迷出现。音乐确实无关年龄，但精神的传承会延续一代又一代。,534,2016年6月30日
