11448981,50805103,韶古,烟恋上了手指，手指却把香烟给了嘴唇，香烟亲吻着嘴唇，内心却给了肺，肺以为得到了香烟的真心，却不知伤害了自己！是手指的背叛成就了烟的多情，还是嘴唇的贪婪促成了肺的伤心……人生如烟，岁月无痕，烟自多情，却把自己烧的只剩下灰……….,31589,2015年2月26日
33112777,73932181,悲怆恸哭0,这个时候就该放出鲁迅老师的名言了。。。。 一见短袖子，立刻想到白臂膊，立刻想到全裸体，立刻想到生殖器，立刻想到性交，立刻想到杂交，立刻想到私生子。 中国人的想像惟在这一层能够如此跃进 。 ------《小杂感》鲁迅,23829,2015年8月26日
13772135,50399044,Sora_subbass,在中国就这样，稍微特别一点就会被旁人所另眼相待，这跟丁克、同性恋在国内外的待遇一个道理。说要换封面的仔细想想，难道别人加上这个封面的目的仅仅只是那样低俗，我不相信。就如一片文章里说到的，我们要做的是一个尊重的榴莲，给自己和他人的个性一些尊重的空间,10898,2015年3月29日
11411664,41719126,打尖和住店不可兼得,说换封面的，不觉得封面很nice么？,6719,2015年2月25日
12238105,9222953,木达瓦二世,网易云音乐真的促进了许多日语爱好者学习的兴趣,5009,2015年3月9日
131752697,128002082,帐号已注销,声音痛到不行，虽然听不懂日语，但压抑，悲伤，绝望，不知所措确实一遍一遍地穿透着耳朵和心灵。还有，不觉得这个封面很美吗？？不正是被一次次伤害的孤独绝望的女人吗？？,4882,2016年3月20日
59339478,45700125,大米饼熊,只记得这是清水玲子《秘密》动画版ED，近年《秘密》要拍真人版。动画内容也不太记得，当时我不懂日文成绩也不好，却把这首歌背得滚瓜烂熟，深夜独自挑灯赶作业，每天接受大人们的白眼和责难，真不知道是这么寂寞的一首歌，年少时一遍遍反复背诵着仿佛向整个世界挑战，多年后再听，依然忍不住泪流满面。,4074,2016年1月6日
50219376,56332045,薯片真好吃吧,鲁迅说过，一见短袖子，立刻想到白臂膊，立刻想到全裸体，立刻想到生殖器，立刻想到性交。然而，现在，趋势似乎变得反了过来，这种明显带有性暗示和歧视女性的封面反而是叫好声一片，我们可以不保守，可以活出自己的个性，也请好好的掌握好度，一群矫枉过正的人不过是又成为了他们厌恶的人,3000,2015年11月30日
30259013,59573618,妖子_,动画《秘密》的片尾曲 漫画作者是清水玲子 小学生们别争了了,2183,2015年8月9日
8014095,10783130,jonx,封面好棒好棒的,1987,2015年1月1日
207634387,290188310,是谁用了Maruuuu这个昵称,“你让我变得脆弱”，因为爱你便暴露给你我所有的弱点与软肋，反铐双手正面向你任凭处置，这么悲伤的歌，爱你爱得毫无反手之力，斗胆猜测封面的含义，反正我在看了歌词之后再看封面真的觉得歌里唱的这份感情太过悲哀。,1567,2016年8月30日
1335583694,620395058,VnkioT,我他妈第一次看见抽个烟都这么有文化，佩服，告辞,1553,2018年12月23日
661050070,51564903,黑岩柳泪香,在烟的封面没有回来之前，我都不会换头像，如果你看到我的头像已经换了。不再是烟的封面，但烟的封面还没有回来的话，那一定是我的头像被和谐了,1434,2018年1月4日
1335538807,515265651,鸿影丶尘修,这就是你又点了一根烟的原因？！！！！,1364,2018年12月23日
1357449948,1474212985,学E不能救中国,鲁迅虽然身死却不断说出各种名言——鲁迅,1201,2019年1月14日
