192365304,136830222,戒不掉de香烟,每次路过网吧，看到那些沉迷于网络的青少年，我就感觉阵阵痛心，本想凭我一己之力来唤醒他们心中的斗志，可奈何 力不从心……所以我只能默默的刷了身份证，占一台机子，能挽回一人算一人……,3823,2016年8月2日
177344524,290147595,JJJJJXXX,建议喜欢听电音的朋友去买一台缝纫机，一边抖腿一边织布，分分钟走上致富路，不用谢我，我已经踩坏两台了,2308,2016年7月2日
424195469,384438372,脸红个泡泡茶壶__,有一次玩LOL，蛮王上单，狐狸中单，下路是猴子和艾希，我盲僧打野。刚进入游戏，蛮王说:“老婆，下路不行了叫我，我传送。”，猴子说:“媳妇，中路打不过了叫一声，我支援。”我当时就尴尬了，我说:“我是不是当你们电灯泡了？”蛮王说:“没事，你是瞎子，你看不见。”从此我就成为了万年野。,2038,2017年5月31日
52879429,16848643,岁楽如歌,心疼马蜂窝，招谁惹谁了,1806,2015年12月11日
423520961,283175098,赵兄托我帮你伴点事,记得上大学那会跟前女友分手，她报复我到处说我是gay，后来很狗血的就传开了，同寝室的三个室友，俩都搬到了校外，只有一个室友坚持陪着我，后来我TM也搬到了校外。。。,1558,2017年5月30日
58105387,118996243,ISi4,批发零售蜂窝，蜂箱。,1071,2016年1月1日
425431558,327281022,程野三生,人҉҉要҉҉是҉҉电҉҉音҉҉听҉҉多҉҉了҉҉连҉҉看҉҉东҉҉西҉҉眼҉҉都҉҉是҉҉花҉҉的҉҉,940,2017年6月1日
41174643,64009551,yoki_candy,大半夜听了这音乐我也是醉了，睡不着了,900,2015年10月17日
48417157,97328191,爱音乐的MangoC,怪就怪版本，不怪这首歌～一楼大兄弟,767,2015年11月21日
518799256,382456815,-久凉,我的评论从来不会火，就像她从来都没有爱过我。,677,2017年8月21日
137785666,248491731,迷路的清泉流响,批发强力电风扇，电锯，硫酸，动物园门票加钥匙（干嘛的你懂的），马蜂窝（野生，剧毒），外加高清直播设备，统统只要9.8！！！,449,2016年4月4日
52972296,93248853,6亿少女的梦,不破万，直播日仙人球！,403,2015年12月11日
558713775,380119878,Suguru_Osako,我的评论从来不会火，就像她从来都没有爱过我。,373,2017年9月17日
637453461,484631852,四神诛杀,有谁是因为原版付费来的吗？,317,2017年12月10日
654763873,281319773,雲端梦i,一首你觉得好听的歌为什么会那么少评论呢？原因有三，一：你逼格太高 二：你逼格太低 三：此歌还有另外一个版本。,272,2017年12月29日
