2043074455,1311594904,随州Dj小健,百因必有果 你的DJ就是我 音乐一响、爸妈白养、墨镜一戴、谁都不爱、扇子一开、全场最嗨！😝😝😝,934,2019年12月9日
2060630540,1699238382,高调奢华那一抹斜阳,停，对不起，打扰一下，别继续往下划屏幕了(^～^) 我想今天还没有人夸你吧，看看下面这行字 “你很棒！明天请继续加油！” OK，可以划走啦 只是以防万一今天一整天都没有人夸你(´∀｀)♪每天都要活力满满哟加油(ง •̀_•́)ง如果打扰到你们了，那对不起,621,2019年12月25日
2035113385,1627699965,Jun2iKeMeN-,nb喜欢这土嗨就说喜欢土嗨 还dj明眼人都笑死了吧[多多大笑],479,2019年12月2日
2055071097,2022340036,十七岁191025,我的意中人是个盖世富婆😜,227,2019年12月20日
2052016313,1443218063,良恩铭不是良民,总有一天这首歌会达999+，我的评论会被淹没，他们疯狂的刷着屏论，但熟不知，我们才是第一批到达这里的拾荒者,215,2019年12月17日
2039178614,372902327,宋冬野的毛衣,偶尔听点土嗨也好，有意思,90,2019年12月6日
2050070888,482208993,阿尔小卑斯in,好听就完事了，管你土嗨还是dj,85,2019年12月15日
2055454903,72364809,云村故事会会长,喝咖啡的高雅人士？,68,2019年12月20日
1660122699,1830041855,可是你不爱,你不是最迷人的，但你...真的好危险,43,2019年10月20日
